"period","session_id","interaction_id","timestamp","type","topic","participants","participant_factions","n_messages","duration_seconds"
1,"e8742f33-9f1f-416e-8884-86973dd487ed","68e581d2-2ec5-49a9-b4c0-9a33dabf0fe0","2026-02-11 22:21:58","intra_faction_coordination","Discuss economic costs of the operation and resource allocation","General Viktor Krasnov; Minister Dmitri Volkov; Dr. Natasha Petrova; Director Sergei Morozov; Deputy Minister Yuri Volkov","major_power; major_power; major_power; major_power; major_power",15,80.9729909896851
1,"e8742f33-9f1f-416e-8884-86973dd487ed","20bdfd25-3b4a-4543-a09e-2d1a673167d3","2026-02-11 22:23:19","intra_faction_coordination","Coordinate defensive strategy and resource prioritization","President Elena Marchetti; General Olena Bondar; Minister Sofia Kovalenko; Viktor Zelenko; Director Maksym Savchenko; Minister Taras Moroz","small_power; small_power; small_power; small_power; small_power; small_power",18,122.274441003799
1,"e8742f33-9f1f-416e-8884-86973dd487ed","15cefe0b-1547-422d-9948-7322411caa75","2026-02-11 22:25:21","inter_faction_negotiation","Territorial concessions vs sovereignty preservation debate","Minister Dmitri Volkov; Minister Sofia Kovalenko","major_power; small_power",8,48.9461710453033
1,"e8742f33-9f1f-416e-8884-86973dd487ed","9b9b8756-9c83-4ea0-9041-dbce75c3b9b9","2026-02-11 22:26:10","external_engagement","Coordination on military aid and support for Tethys","Ambassador William Crawford; General Olena Bondar","meridian; small_power",4,35.2358870506287
1,"e8742f33-9f1f-416e-8884-86973dd487ed","f6de5a27-c2c3-41c2-b391-dcfb20ba12ce","2026-02-11 22:26:46","external_engagement","Diplomatic coordination and economic support for Novaris","Minister Andrei Kozlov; Minister Dmitri Volkov","valkoria; major_power",6,47.2576072216034
1,"e8742f33-9f1f-416e-8884-86973dd487ed","10397e2b-4a3d-4145-aaa8-62bede326294","2026-02-11 22:27:33","external_engagement","Mediation proposal and peace framework discussions","Commissioner Helena Schmidt; Director Maksym Savchenko","aurelia; small_power",6,28.8621871471405
1,"e8742f33-9f1f-416e-8884-86973dd487ed","dcf98417-b34f-4ecf-b330-d9a814cfd796","2026-02-11 22:28:02","external_engagement","Humanitarian access and civilian protection","Under-Secretary-General Isabella Cardenas; Minister Sofia Kovalenko","international_org; small_power",6,34.9114880561829
