"period","session_id","interaction_id","interaction_type","message_id","timestamp","sender_id","sender_name","sender_faction","exchange_number","content"
1,"6b1f2d87-7c23-45ea-9b31-9d335992bfde","1fa633bb-6f35-40d6-8d55-4379529539ee","intra_faction_coordination","d63fd27b-d127-442c-9bc0-75cb8870816d","2026-02-12 04:32:05","small_military_commander","General Olena Bondar","small_power",2,"[Minister Olha Hrabovska - SMALL_POWER]: [Minister of Internal Affairs - SMALL_POWER]: I concur with President Marchetti—economic credibility is inseparable from public order. However, operational synchronization between social transfers and security deployment must be real-time, not sequential. The risk of disjointed rollout is duplication in low-risk areas and dangerous gaps in high-threat zones.

I recommend integrating the Cell’s threat matrix with the Social Policy Ministry’s disbursement algorithm, so cash transfers and mobile unit deployments are geo-targeted and co-incident based on daily risk-scoring updates, ensuring neither lags the other.

Key concern: Without unified data sharing protocols between Internal Affairs and Social Policy—backstopped by secure, non-militarized IT infrastructure—this synchronization will fail, creating perception of coercion or neglect."
1,"6b1f2d87-7c23-45ea-9b31-9d335992bfde","1fa633bb-6f35-40d6-8d55-4379529539ee","intra_faction_coordination","d5754a65-008f-4e5e-ba85-e0652ef6ee94","2026-02-12 04:32:13","small_foreign_minister","Minister Sofia Kovalenko","small_power",2,"[Minister Olha Hrabovska - SMALL_POWER]: [Minister of Internal Affairs - SMALL_POWER]: I support integrated targeting of economic and security interventions as proposed by General Bondar, but affirm that community legitimacy hinges on local ownership. Mobile units must include elected municipal representatives and civil society observers in their operational panels to anchor state actions in civic trust, not just data-driven efficiency.

I recommend mandating co-leadership of pilot units by appointed officials and verified local delegates, with authority to veto deployments or disbursements perceived as externally imposed. This institutionalizes accountability and disrupts top-down perceptions.

Key concern: Technocratic synchronization—however precise—will fail if communities view the Cell as an instrument of central control. Without embedded local voice, even well-timed transfers risk being seen as transactional coercion, not partnership."
1,"6b1f2d87-7c23-45ea-9b31-9d335992bfde","1fa633bb-6f35-40d6-8d55-4379529539ee","intra_faction_coordination","26686449-e08a-47c3-b3f5-32c156a5ed6c","2026-02-12 04:32:17","small_opposition","Viktor Zelenko","small_power",2,"[Minister Mykola Kovalenko - SMALL_POWER]: [Minister Olha Hrabovska - SMALL_POWER]: [Minister of Internal Affairs - SMALL_POWER]: I accept the need for local co-leadership and real-time security-economy coordination, but stress that implementation speed is now the decisive variable. Delays in biometric registration or consensus-based decision-making risk derailing the 90-day window of opportunity.

I recommend fast-tracking disbursements in Phase One using pre-verified voter and pension registries as proxies for identity, while launching parallel efforts to register unbanked populations. This ensures immediacy without sacrificing integrity.

Key concern: Over-engineering inclusion mechanisms could replicate bureaucratic inertia we seek to overcome—resulting in no one receiving support while systems are ""perfected."" Speed with auditability must trump perfection."
1,"6b1f2d87-7c23-45ea-9b31-9d335992bfde","1fa633bb-6f35-40d6-8d55-4379529539ee","intra_faction_coordination","a0c9e534-f0eb-490d-a6e5-f815d37673d3","2026-02-12 04:32:20","small_intelligence","Director Maksym Savchenko","small_power",2,"[Minister Olha Hrabovska - SMALL_POWER]: I endorse fast-tracking disbursements via verified registries as proposed by Mr. Zelenko, but only if paired with retroactive audit protocols and time-bound reconciliation for excluded populations. Delayed inclusion is preferable to systemic paralysis, but cannot become permanent exclusion.

I recommend launching Phase One within 72 hours using voter and pension databases, while mandating that Social Policy and Internal Affairs co-publish weekly equity dashboards showing geographic and demographic coverage gaps—enabling targeted course correction.

Key concern: Expediency must not erode political legitimacy; if marginalized groups perceive the rollout as favoring urban or politically connected areas, backlash could overwhelm security and economic gains."
1,"6b1f2d87-7c23-45ea-9b31-9d335992bfde","1fa633bb-6f35-40d6-8d55-4379529539ee","intra_faction_coordination","d4e72ce0-69dd-4189-8027-79e033b96bc1","2026-02-12 04:32:30","small_economic","Minister Taras Moroz","small_power",2,"[Minister Olha Hrabovska - SMALL_POWER]: I agree with fast-tracking disbursements through verified registries and the use of equity dashboards, but we must institutionalize community feedback loops beyond data monitoring. Public morale depends not only on receipt of benefits but on perceived fairness and voice.

I recommend embedding real-time grievance mechanisms—SMS-based reporting and local mediation councils—into Phase One rollout to capture exclusion errors and public sentiment directly, enabling rapid correction and demonstrating responsiveness.

Key concern: Without structured channels for public input, even equitably distributed aid will be perceived as opaque or imposed, fueling distrust that undermines both stability and the legitimacy of local co-leadership structures."
1,"6b1f2d87-7c23-45ea-9b31-9d335992bfde","1fa633bb-6f35-40d6-8d55-4379529539ee","intra_faction_coordination","4965b9dd-dbfb-4bcc-93a0-3141b7694a60","2026-02-12 04:32:38","small_president","President Elena Marchetti","small_power",3,"[Deputy Minister Andriy Lytvynenko - SMALL_POWER]: I support fast-tracking disbursements through pre-verified registries, the equity dashboards proposed by Savchenko, and Lytvynenko’s call for grievance mechanisms—these must be integrated, not sequential.  

I recommend operationalizing disbursements within 72 hours *only if* the dashboards and SMS-based reporting are live at launch, with Internal Affairs and Social Policy jointly staffing rapid response cells to process appeals within 48 hours.  

Key concern: Fragmented implementation—aid flowing without real-time feedback or transparency—will generate perceptions of arbitrariness, eroding public trust faster than delays would. Speed must be *visible* and *correctable*, not just fast."
1,"6b1f2d87-7c23-45ea-9b31-9d335992bfde","1fa633bb-6f35-40d6-8d55-4379529539ee","intra_faction_coordination","b75dc3ab-e62a-49e8-947f-7ae0f58730be","2026-02-12 04:32:41","small_military_commander","General Olena Bondar","small_power",3,"[Deputy Minister Andriy Lytvynenko - SMALL_POWER]: I concur with President Marchetti’s integrated approach—speed without accountability risks compounding exclusion. We must treat disbursement, transparency, and feedback as interdependent systems, not sequential phases.

I recommend mandating that all regional distribution hubs report daily to a centralized dashboard, which pulls in both registry data and SMS grievance metrics, with algorithmic alerts triggered by coverage outliers or complaint clusters—enabling preemptive intervention.

Key concern: Without centralized monitoring of both delivery and discontent, local authorities may suppress or underreport gaps, creating blind spots that escalate into localized unrest."
1,"6b1f2d87-7c23-45ea-9b31-9d335992bfde","1fa633bb-6f35-40d6-8d55-4379529539ee","intra_faction_coordination","75aab3c0-e7f8-47e4-b8c2-5ee7b325463f","2026-02-12 04:32:48","small_foreign_minister","Minister Sofia Kovalenko","small_power",3,"[Deputy Minister Andriy Lytvynenko - SMALL_POWER]: I appreciate the alignment on integrating disbursement, transparency, and feedback systems. President Marchetti and General Bondar rightly emphasize centralized oversight—this must include binding escalation protocols, not just monitoring.

I recommend instituting a 48-hour resolution mandate for all verified grievances escalated from local mediation councils, with cases unresolved by that deadline automatically forwarded to the Joint Response Cell under Internal Affairs and Social Policy, backed by audit authority to inspect regional hub operations.

Key concern: Without enforceable accountability for grievance resolution—not just collection—communities will perceive the system as performative, deepening cynicism and undermining both morale and the state’s legitimacy in contested regions."
1,"6b1f2d87-7c23-45ea-9b31-9d335992bfde","1fa633bb-6f35-40d6-8d55-4379529539ee","intra_faction_coordination","c4916e68-5287-4ca9-be41-24bfa85cc379","2026-02-12 04:32:58","small_opposition","Viktor Zelenko","small_power",3,"[Deputy Minister Andriy Lytvynenko - SMALL_POWER]: I accept the consensus on integration—speed with accountability—and endorse the 48-hour resolution mandate proposed by Minister Kovalenko. We must now operationalize it by standardizing escalation pathways in the registry disbursement software itself, embedding audit triggers and automatic case routing upon grievance validation.

I recommend deploying a unified digital case management module across all regional hubs within 24 hours, linked to the central dashboard and pre-configured with time-bound escalation rules, ensuring no grievance enters a manual or discretionary review loop.

Key concern: If audit authority is not paired with public visibility—such as anonymized grievance outcomes published nightly—local actors may comply procedurally while neutralizing scrutiny, preserving inequities under a veneer of reform."
1,"6b1f2d87-7c23-45ea-9b31-9d335992bfde","1fa633bb-6f35-40d6-8d55-4379529539ee","intra_faction_coordination","61e1c41c-5fa3-495f-b699-ef2fb8b07b31","2026-02-12 04:33:02","small_intelligence","Director Maksym Savchenko","small_power",3,"[Deputy Minister Andriy Lytvynenko - SMALL_POWER]: I endorse the 48-hour resolution mandate and the deployment of a unified digital case management module—both are critical to closing enforcement gaps. To strengthen this framework, I propose integrating biometric verification at distribution points as a cross-check against registry duplication, reducing fraud risks that erode public trust.

I recommend activating a pilot in three high-risk oblasts within 12 hours, using existing mobile biometric units from the ID registry program, with data synced in real time to the central dashboard to flag anomalies.

Key concern: Biometric rollout without parallel public communication risks being perceived as surveillance, especially in displaced populations—clear, localized messaging must precede deployment to maintain morale and perceived legitimacy."
1,"6b1f2d87-7c23-45ea-9b31-9d335992bfde","1fa633bb-6f35-40d6-8d55-4379529539ee","intra_faction_coordination","626e1dd4-7bc3-447f-a35e-75b91f284255","2026-02-12 04:33:12","small_economic","Minister Taras Moroz","small_power",3,"[Deputy Minister Andriy Lytvynenko - SMALL_POWER]: I endorse the proposed 48-hour mandate, digital case module, and biometric pilot—these measures close critical gaps in enforcement, visibility, and integrity. To ensure coherence, I recommend centralizing implementation under a joint task force (Social Policy, Internal Affairs, ID Registry) with daily operational reviews and public progress benchmarks.

I recommend activating the Joint Response Cell immediately, granting it real-time access to grievance, disbursement, and biometric data streams, empowering it to suspend non-compliant hubs after two unresolved escalations.

Key concern: Fragmented execution across agencies will dilute accountability—without a single authoritative node owning end-to-end resolution, delays will persist despite technical upgrades, reinforcing public distrust."
1,"6b1f2d87-7c23-45ea-9b31-9d335992bfde","d7b801ef-53fa-4a64-bde3-ccd926c24519","inter_faction_negotiation","648f97b1-609e-494b-994c-35805aa10004","2026-02-12 04:33:14","major_defense_minister","Minister Dmitri Volkov","major_power",1,"1. We demand an immediate cessation of all offensive operations along the northern front, including a complete halt to troop movements and aerial reconnaissance.  
2. This is non-negotiable—continued probing and skirmishes during talks only deepen mistrust and risk total breakdown; your recent incursions have crossed de facto red lines.  
3. We require written confirmation within 24 hours that your forces will stand down and withdraw to pre-offensive positions, verified by neutral observers—no exceptions."
1,"6b1f2d87-7c23-45ea-9b31-9d335992bfde","d7b801ef-53fa-4a64-bde3-ccd926c24519","inter_faction_negotiation","cb4eb482-5dab-4960-bc21-1f043ea415a2","2026-02-12 04:33:18","small_military_commander","General Olena Bondar","small_power",1,"1. We categorically reject your demand for unilateral withdrawal to pre-offensive positions—it ignores your side’s sustained artillery bombardments and blockade of civilian supply routes, which constitute clear acts of escalation.  
2. Your so-called ""red lines"" are arbitrary and selectively enforced; we will not legitimize your attempt to freeze the front lines in your favor while you maintain positions gained through illegal airstrikes and siege tactics.  
3. We require an immediate, reciprocal cessation of all offensive *and* indirect actions—this includes your long-range artillery, drone strikes, and the naval blockade of our coastal districts—verified by an independent monitoring mechanism, not hand-picked ""neutral"" parties under your influence.  

Any proposal that ignores your asymmetric advantages or fails to address our legitimate security concerns is unacceptable. We will not stand down unless and until you dismantle your forward firebases and commit to a full withdrawal from contested zones occupied after [DATE OF CONFLICT ESCALATION]. No ceasefire will hold while one side continues to hold the other under siege."
1,"6b1f2d87-7c23-45ea-9b31-9d335992bfde","d7b801ef-53fa-4a64-bde3-ccd926c24519","inter_faction_negotiation","9e37d411-5766-49e1-8fbe-1958ef96f19d","2026-02-12 04:33:30","major_defense_minister","Minister Dmitri Volkov","major_power",2,"1. We **reject** your framing of our actions as ""escalatory"" and categorically deny that our artillery operations, drone surveillance, or naval interdiction constitute violations—these are lawful measures in response to your cross-border incursions and terrorist deployments.  
2. Your refusal to halt offensive activities while demanding unilateral concessions exposes bad faith; we will not entertain parity between our defensive postures and your aggression—your occupied territories were seized in violation of international law and will be addressed in due course.  
3. We **require** your immediate withdrawal from all positions gained since [DATE OF CONFLICT ESCALATION], including the occupied villages of Novhrad and Stribro, and the full dismantling of forward combat outposts within 72 hours—verified by a technical commission under UN auspices (not your preferred partisans).  

Furthermore, we **demand** a binding commitment to cease all irregular warfare operations—including sabotage units and drone attacks on civilian infrastructure—prior to any discussion of reciprocal de-escalation.  

What is **unacceptable** to us:  
- Any ceasefire that entrenches your illegal territorial gains  
- Delays or preconditions on your withdrawal  
- So-called ""neutral"" monitors selected without our veto power  
- Linking our legitimate security measures to your fabricated narrative of victimhood  

No lasting arrangement can be built on your side’s continued defiance of the status quo. Stand down, pull back, or face intensified consequences."
1,"6b1f2d87-7c23-45ea-9b31-9d335992bfde","d7b801ef-53fa-4a64-bde3-ccd926c24519","inter_faction_negotiation","a8a570ce-3e0d-4af6-a4fa-e0b634775f10","2026-02-12 04:33:34","small_military_commander","General Olena Bondar","small_power",2,"1. We **categorically reject** your characterization of our operations as “illegal occupation” and “aggression”—our forces are defending sovereign territory historically and legally belonging to us, liberated only after years of unprovoked shelling, ethnic cleansing, and blockade by your forces; no legitimacy can be ascribed to borders enforced by siege and fire.  
2. Your so-called ""lawful measures"" are asymmetric acts of collective punishment: sustained artillery barrages on civilian districts, drone strikes on critical infrastructure, and a naval blockade that starves our coastal populations—these are not defense, they are coercion, and they invalidate any claim to moral or legal high ground.  

3. We **counter-demand**:  
   - **Immediate, verifiable withdrawal** of your artillery units from within 20 kilometers of the pre-escalation contact line,  
   - **Lifting of the naval blockade** on all civilian ports, with unimpeded humanitarian access,  
   - **Dismantling of all forward firebases** established within the past 18 months, including those at Krasny Yar and Vostok-3,  
   - **A binding timetable** for the complete pullback of your troops to positions held on [DATE OF CONFLICT ESCALATION], **before** any discussion of our own force adjustments.  

Verification must be conducted by an independent international body with full access and no unilateral veto power—this includes real-time monitoring of troop movements and weapons storage sites.  

**What is unacceptable to us**:  
- Any ceasefire that freezes current frontlines without reversing your territorial gains  
- Demands for our unilateral withdrawal while your forces maintain offensive positions  
- ""UN auspices"" that allow you to handpick or veto monitors—no Russian or pro-Major Power nationals on inspection teams  
- Linking our defensive actions to your definition of ""terrorism,"" which you use to label all armed resistance  

We will not retreat from our own soil to appease your narrative of dominance. If you seek de-escalation, prove it with concrete, irreversible actions—not ultimatums wrapped in legal fiction. The burden of restraint lies equally on the stronger party. Fail to meet these conditions, and we will continue to fight from the ground we hold."
1,"6b1f2d87-7c23-45ea-9b31-9d335992bfde","d7b801ef-53fa-4a64-bde3-ccd926c24519","inter_faction_negotiation","709aad47-eb34-4080-b31b-beb50d3add86","2026-02-12 04:33:57","major_defense_minister","Minister Dmitri Volkov","major_power",3,"1. **We categorically reject your counter-demands** as both disingenuous and strategically untenable. Your claim to ""sovereign territory"" over Novhrad and Stribro is baseless under international law—these areas were legally administered by us for decades and only seized by your forces through surprise attacks and irregular warfare, which you now cloak in the rhetoric of liberation.

2. Your attempt to equate our precision military operations—targeting only active combat nodes—with ""collective punishment"" is false propaganda. We do not target civilians; you do, by embedding snipers in hospitals, launching drones from schools, and using humanitarian corridors for troop movements. The blockade you denounce is a lawful maritime interdiction of weapons smuggling via your coastal zones—an ongoing violation of Resolution 2655, which you ignore at your peril.

3. **We now demand**:  
   - **Immediate cessation and verified dismantling** of all drone launch sites within 30 km of the contact line, including those in the so-called ""civilian"" zones of Myrhorod and Zaliznyi Port, which have been used to conduct arson attacks on our energy infrastructure;  
   - **Full disclosure and handover** of all foreign-supplied weapons systems (including NATO-origin ATACMS and drone guidance units) to the UN commission—no party to this conflict should be receiving external arms during ceasefire talks;  
   - **Unconditional withdrawal** of your forces from all territory north of the Drevlyanka River—including Novhrad, Stribro, and the railway hub at Vynohrad—**within 48 hours**, to be followed by a *technical pause*, not a political ceasefire, during which your units must remain at least 15 km from the pre-escalation line;  
   - Acceptance of **joint monitoring teams** with bilateral veto authority—no inspection mechanism can operate without our approval of personnel, and we will not accept any monitor with ties to nations currently arming your side.

**What is unacceptable to us**:  
- Any withdrawal or restraint by our forces prior to your complete disengagement from occupied zones;  
- Lifting the naval blockade while weapons continue to flow through your ports under false humanitarian manifests;  
- Recognition of any territorial change resulting from your offensive actions;  
- A so-called ""independent"" monitoring body that excludes our oversight or includes states actively supporting your war effort.

You speak of burden and restraint—but you act only from weakness. If you want peace, **demonstrate it**. Vacate the territory you seized, cease your asymmetric attacks, and stop hiding behind civilians. Until then, our operations continue."
1,"6b1f2d87-7c23-45ea-9b31-9d335992bfde","d7b801ef-53fa-4a64-bde3-ccd926c24519","inter_faction_negotiation","a2157cf6-99c2-468f-a3b5-d57035becc8f","2026-02-12 04:34:12","small_military_commander","General Olena Bondar","small_power",3,"1. **We categorically reject your latest demands** as a brazen attempt to codify aggression through coercion. Your so-called ""precision operations"" have reduced entire districts to rubble, with satellite evidence and UN reports documenting repeated strikes on non-military infrastructure—including water treatment plants and evacuation routes. Your claim of legality collapses under the weight of your own actions: drone surveillance towers erected within 5 km of residential zones, artillery positioned in schools, and naval blockades that intercept not only arms shipments but food and medical supplies bound for children.

2. Your demand for handover of foreign-supplied weapons is not only outrageous but designed to permanently disarm us while you retain overwhelming conventional superiority. We will **never** surrender defensive systems provided by allies—systems that exist solely because you violated prior security assurances and launched unprovoked offensives. The same NATO-origin systems you now seek to confiscate were deployed in response to your own illegal deployments of thermobaric munitions and long-range strike drones—prohibited under Protocol III of the Convention on Certain Conventional Weapons, which you have repeatedly ignored.

3. **We counter with the following non-negotiable conditions**:  
   - **Immediate, verifiable cessation** of all aerial and artillery bombardment within 10 km of populated areas, monitored by real-time OSCE-enabled sensors and civilian observer teams—**no veto rights for your side on team composition**;  
   - **Lifting of the naval blockade** on the ports of Zaliznyi and Myrhorod within 24 hours, with unhindered delivery of humanitarian aid and third-party inspection of cargo manifests by a Swiss- and ICRC-led consortium—**not your handpicked ""UN commission""**;  
   - **Complete withdrawal** of your heavy artillery, missile systems, and electronic warfare units from forward bases within 20 km of the pre-escalation line—including Krasny Yar, Vostok-3, and the rail depot at Drevlyanka-6—**verified by drone overflights and ground sensors before we discuss troop movements**;  
   - **Freezing of all offensive military activity** by your forces—including drone swarms, cyberattacks on civilian grids, and mobilization of reserve units—**as a precondition** to any discussion of de-escalation timelines.

**What is unacceptable to us**:  
- Any ceasefire that allows your forces to maintain fire superiority and occupation of strategic high ground while demanding our retreat;  
- Demands for unilateral disarmament or surrender of defensive capabilities under the guise of ""verification"";  
- Monitoring mechanisms where you retain power to block inspectors or sanitize evidence;  
- The absurd notion that we must withdraw from territory we liberated after years of siege, while you face no reciprocal obligations.

You speak of law, yet operate outside it. You speak of peace, yet escalate daily. If you want negotiations, **stop bombing civilians** and **pull your guns back first**. Until then, we will not trade survival for your propaganda."
