"period","session_id","interaction_id","interaction_type","message_id","timestamp","sender_id","sender_name","sender_faction","exchange_number","content"
1,"6b1f2d87-7c23-45ea-9b31-9d335992bfde","11752abd-48eb-48cc-b1e6-645830d051bf","external_engagement","4f202888-1270-4be6-80d2-fe73c30e0b46","2026-02-12 04:36:34","small_economic","Minister Taras Moroz","small_power",2,"We welcome the proposal for a joint mediation committee under neutral international auspices and agree that it must include equitable representation from all conflict-affected communities, with binding decision-making authority over ceasefire implementation and framework development. To this end, we insist on the immediate appointment of a UN-mandated mediation team with expertise in federalization, minority rights, and post-conflict justice, and demand that the committee begin substantive negotiations within 30 days. Our core requirements remain: legally binding guarantees for regional self-governance, a veto on central security deployments in our territory without mutual consent, and full inclusion of civil society and women’s representatives in the drafting process.

In return, we will halt offensive operations in mutual de-escalation zones, release non-combatant detainees, and allow humanitarian access through agreed corridors pending verification. We also commit to sharing intelligence on extremist elements threatening regional stability. However, our red lines are absolute: no negotiations that condition our autonomy on centralized control, no amnesty for perpetrators of ethnic cleansing or crimes against humanity, and no peace agreement lacking a time-bound roadmap for constitutional reform and equitable resource governance. A ceasefire without political transformation is not peace—it is a pause in resistance."
1,"6b1f2d87-7c23-45ea-9b31-9d335992bfde","11752abd-48eb-48cc-b1e6-645830d051bf","external_engagement","55cdacf3-0b51-441e-be46-1c9e6dc6f36b","2026-02-12 04:36:44","neutral_power","Commissioner Helena Schmidt","aurelia",3,"We welcome Minister Moroz’s commitment to a time-bound, inclusive process and affirm the necessity of embedding justice, autonomy, and equity at the core of the peace framework. In response, we agree to the immediate establishment of the joint mediation committee under UN mandate and will formally request the Secretary-General to appoint a specialized mediation team within 72 hours. We accept the 30-day timeline for commencing negotiations and commit to ensuring that all parties, including civil society and women’s groups, are seated with full participatory rights at the table.

In return, we will coordinate the deployment of international monitoring observers, initiate reciprocal de-escalation in designated zones, and support the opening of humanitarian corridors with third-party verification. We further agree to advance discussions on federalized governance and resource-sharing mechanisms as integral to the political track. However, our red lines remain unchanged: no ceasefire implementation without verifiable disarmament of non-state armed groups; no constitutional reform that permits autonomous regions to obstruct national accountability institutions or shield perpetrators from justice; and no security arrangements that allow parallel military structures outside a unified, civilian-controlled defense framework. Peace must unify, not fragment, the rule of law."
1,"6b1f2d87-7c23-45ea-9b31-9d335992bfde","11752abd-48eb-48cc-b1e6-645830d051bf","external_engagement","6030a395-fb1b-4f1e-98bc-b0197d8fcb95","2026-02-12 04:36:52","small_economic","Minister Taras Moroz","small_power",3,"We welcome Commissioner Schmidt’s endorsement of the UN-mandated mediation committee and her commitment to inclusive, time-bound negotiations. To build momentum, we will immediately co-sponsor a UN Security Council resolution to formalize the committee’s mandate and urge the Secretary-General to appoint the mediation team without delay. We accept the principle of verifiable disarmament—but insist it must be reciprocal, sequenced, and applied equally to all armed actors, including state-affiliated forces implicated in violence. Disarmament cannot be weaponized to legitimize one side’s military dominance.

In return, we reaffirm our commitment to de-escalation, humanitarian access, and intelligence-sharing, and will release an additional 20 civilian detainees within 72 hours as a goodwill measure. However, our red lines stand: no disarmament process that targets only non-state actors while ignoring state militarization; no peace framework that subordinates regional self-governance to centralized control over security or resources; and no constitutional arrangement that delays or dilutes transitional justice. Autonomous institutions must have full authority over local security, fiscal policy, and cultural rights—subject only to a federal charter of rights and independent judicial review. Without these, any agreement will lack legitimacy and durability."
1,"6b1f2d87-7c23-45ea-9b31-9d335992bfde","f128262b-6405-4ef5-b9d8-12ae8f96f4f7","external_engagement","aee6f3dc-49a6-448b-9438-41c1e8aaba17","2026-02-12 04:36:57","international_org","Under-Secretary-General Isabella Cardenas","international_org",1,"We seek unimpeded humanitarian access to all populations in need within areas under our influence, including the delivery of medical supplies, food, and essential services through neutral and impartial actors. Equally, we demand robust civilian protection measures, including the respect of safe zones and the cessation of attacks on non-combatants and critical infrastructure such as hospitals and schools. These are not negotiable elements of basic human dignity and international humanitarian law.

In return, we can facilitate local coordination, provide security escorts where necessary, and ensure humanitarian convoys operate in accordance with local protocols. Our networks on the ground can enhance the effectiveness and reach of aid efforts, particularly in hard-to-access regions. However, our red lines are clear: no humanitarian activity will be used as a cover for intelligence gathering, political interference, or support to armed opposition groups. Any breach of trust or perceived manipulation of aid for external strategic ends will result in immediate suspension of access."
1,"6b1f2d87-7c23-45ea-9b31-9d335992bfde","f128262b-6405-4ef5-b9d8-12ae8f96f4f7","external_engagement","f8b5e537-bc84-45f0-8f94-7ad38d1d7ee9","2026-02-12 04:37:04","small_intelligence","Director Maksym Savchenko","small_power",1,"We welcome the emphasis on humanitarian access and civilian protection, which aligns with our operational commitment to safeguarding non-combatants and ensuring basic needs are met in areas under our control. We seek formal agreements that guarantee neutral, impartial, and monitored delivery of aid through designated corridors, with advance notification of convoy movements and coordination with our local liaison officers. To facilitate this, we will designate secure routes and provide security escorts where required, in cooperation with trusted humanitarian partners.

In return, we expect strict adherence to our red lines: no aid convoys will include personnel or materials linked to foreign intelligence, military, or political actors; all supplies will be subject to inspection for security purposes; and no humanitarian activity will take place in proximity to active military installations or during periods of ongoing operations without our explicit clearance. We will not permit the use of aid as leverage or cover for destabilizing activities—any violation will result in immediate restriction of access and potential expulsion of offending actors."
1,"6b1f2d87-7c23-45ea-9b31-9d335992bfde","f128262b-6405-4ef5-b9d8-12ae8f96f4f7","external_engagement","a860267f-ddcc-4408-8683-8ba9e76ecd8e","2026-02-12 04:37:11","international_org","Under-Secretary-General Isabella Cardenas","international_org",2,"We accept the principle of neutral and impartial humanitarian access, provided it is coordinated in advance with our command structure and conducted through mutually agreed corridors. We are prepared to facilitate the delivery of life-saving aid—including medical supplies, food, and water—to affected populations under our area of influence, and will assign liaison officers to coordinate convoy movements and provide security escorts where feasible. Our cooperation is contingent upon full transparency in cargo manifests and personnel lists, with advance notification of all movements.

Our red lines are non-negotiable: no humanitarian actors or shipments will operate within 15 kilometers of active frontline positions or military installations without explicit authorization; all inspections of convoys by our forces must be respected; and any individual or organization found to be engaging in intelligence gathering, political proselytizing, or collaboration with hostile armed groups will be declared persona non grata and barred from operating in our territory. We will not allow humanitarian access to be exploited as a tool of external interference—cooperation must be strictly humanitarian in nature, or it will be terminated."
1,"6b1f2d87-7c23-45ea-9b31-9d335992bfde","f128262b-6405-4ef5-b9d8-12ae8f96f4f7","external_engagement","807cdc8d-4b3c-45af-ad2e-1428223dbb56","2026-02-12 04:37:16","small_intelligence","Director Maksym Savchenko","small_power",2,"We acknowledge the necessity of coordinated humanitarian operations and accept the requirement for advance notification, liaison coordination, and cargo transparency, provided these procedures do not create undue delays that compromise the timeliness of life-saving assistance. We insist, however, that inspections be conducted promptly, professionally, and in accordance with international standards to prevent obstruction under the guise of security. Humanitarian access must remain guided by need, not political or military convenience.

In return, we will ensure adherence to operational security protocols, refrain from hostile acts against designated humanitarian convoys, and work with your liaison officers to deconflict movements. Our red lines are clear: aid must be distributed equitably and without discrimination, civilian infrastructure must not be targeted before, during, or after deliveries, and the 15-kilometer restriction must not be unilaterally expanded or used to deny access to besieged or high-need populations. Any use of aid zones to shield military assets or conduct offensive operations will invalidate our cooperation and trigger immediate review of access privileges."
