"period","session_id","interaction_id","interaction_type","message_id","timestamp","sender_id","sender_name","sender_faction","exchange_number","content"
1,"6b1f2d87-7c23-45ea-9b31-9d335992bfde","d7b801ef-53fa-4a64-bde3-ccd926c24519","inter_faction_negotiation","43954a71-7869-44be-8738-94c5b09c3349","2026-02-12 04:34:45","major_defense_minister","Minister Dmitri Volkov","major_power",4,"1. **We categorically reject your characterization of our operations as indiscriminate or unlawful**—our targeting protocols strictly adhere to international humanitarian law, and every strike is conducted against verified military objectives, including command nodes, drone launch infrastructure, and weapon storage sites embedded within urban zones. The presence of collateral damage does not negate legitimacy; it is *your* tactic of human shielding—using hospitals, schools, and residential areas as firing positions—that turns civilian zones into battlefields.

2. Your refusal to surrender foreign-supplied weapons exposes your true intent: you do not seek ceasefire, but *respite*—time to rearm, reposition, and resume hostilities with enhanced capabilities. We will not allow a pause in fighting to become a strategic reload for asymmetric attacks. The continued operation of ATACMS-capable launchers and Western-supplied drone networks within 30 km of the front violates the spirit and letter of all confidence-building measures. Their retention guarantees no lasting peace, only the next escalation.

3. **We now demand**:  
   - **Immediate, time-bound suspension** of all drone operations from Myrhorod, Zaliznyi Port, and three designated zones in the western highlands, verified by **joint electronic signatures monitoring**—with **reciprocal data access and bilateral deactivation protocols**; no unilateral control over sensor output will be accepted;  
   - **Full disclosure and neutral warehousing** of all NATO-origin precision systems under UN custody—**not destruction, but secure storage** for the duration of the ceasefire, with reciprocal inspection of our own tactical systems only *after* your compliance is confirmed;  
   - **Withdrawal of all your combat units from Novhrad and Stribro to positions south of the Drevlyanka River within 72 hours**, followed by demining and establishment of a **50-km demilitarized corridor** under temporary multinational stabilization force (MSF) presence—**commanded by a non-NATO, non-aligned contingent, but with our full right to challenge patrol routes and personnel**;  
   - **Freezing of mobilization, recruitment, and foreign fighter integration** on your side for the duration of the truce—verified through financial transaction monitoring and border checkpoint reporting, with **equal access for our intelligence liaison to review compliance indicators**.

**What is unacceptable to us**:  
- Any ceasefire mechanism that permits you to retain operational control of captured territory while maintaining offensive capabilities;  
- Monitoring arrangements that exclude our technical verification rights or deny us parity in challenge procedures;  
- Lifting of the naval blockade before verifiable cessation of weapons transfers—no Swiss consortium, no ICRC mandate overrides our right to maritime interdiction under ongoing security threats;  
- The suggestion that we must withdraw from defensible strategic positions—gained through legitimate military action—while you face no constraints on force posture.

You invoke civilian protection while embedding your war machine in civilian life. You accuse us of escalation while planning your next drone swarm from hospital basements. **If you want a ceasefire, act like it.** Stop launching attacks. Pull back your units. Secure your weapons. Until then, our fire support continues—measured, lawful, and relentless."
1,"6b1f2d87-7c23-45ea-9b31-9d335992bfde","d7b801ef-53fa-4a64-bde3-ccd926c24519","inter_faction_negotiation","42b002a2-4438-47d3-b9de-2a093a5e6752","2026-02-12 04:35:01","small_military_commander","General Olena Bondar","small_power",4,"1. **We categorically reject your so-called ""verification"" regime as a transparent effort to infiltrate our command systems and entrench your surveillance dominance under the guise of transparency.** Your demand for ""bilateral deactivation protocols"" and ""reciprocal data access"" is not about trust—it is about gaining real-time intelligence on our defensive capabilities, which you would exploit the moment hostilities resume. We will not hand you the keys to our air defense network under the pretense of ceasefire monitoring.

2. Your claim that we are preparing offensives while accusing us of embedding in civilian zones is pure projection. It is *your* drone jammers operating from children’s hospitals in Krasny Yar, *your* artillery spotters using church steeples in Novhrad, and *your* naval drones launched from fishing vessels flying neutral flags—clear violations of the Hague Conventions. Yet you demand *our* unilateral disarmament while preserving your own hybrid warfare infrastructure. This is not negotiation—it is surrender by ultimatum.

3. **We now demand**:  
   - **Immediate, verifiable withdrawal** of all your electronic warfare, drone control, and long-range fire units from *all* settlements within 15 km of the pre-escalation line—including Krasny Yar, Vostok-3, and Drevlyanka-6—**with physical撤军 (withdrawal) confirmed by independent aerial overflights and ground sensor deployment, no veto on observer access**;  
   - **Cessation of all maritime interdiction operations** within 12 nautical miles of our coast, with resumption of humanitarian shipping to Zaliznyi and Myrhorod under **Swiss-ICRC joint inspection regime**—no unilateral boarding or seizure of vessels without third-party witnesses;  
   - **Cease all cyber operations targeting civilian infrastructure**, including power grids, emergency services, and communications networks, with **forensic audit by a neutral technical body (e.g., Global Cyber Stability Commission)**—you have no right to encrypt or withhold logs;  
   - **Freezing of your mobilization, drone swarm deployments, and AI-targeting systems** currently integrated into your command structure—**verified through open-source telemetry and satellite tracking**, not your selectively shared “data.”

**What is unacceptable to us**:  
- Any arrangement that legitimizes your occupation of Novhrad and Stribro or treats them as bargaining chips rather than liberated territories under illegal siege;  
- ""Neutral"" monitoring that includes states with political ties to your bloc or allows you to challenge inspectors based on fabricated security concerns;  
- Demands for us to warehouse defensive weapons while you retain full operational control of long-range strike assets and electronic dominance;  
- A ceasefire that locks in your territorial gains and fire superiority while demanding our demobilization and disarmament.

You speak of law, yet bomb cities into silence. You demand compliance, yet refuse even basic transparency. **If you want de-escalation, prove it—pull your guns back first, stop the blackouts, and let food reach our people.** Until then, we will never trade survival for subjugation."
1,"6b1f2d87-7c23-45ea-9b31-9d335992bfde","781d3b66-c82b-499c-9e0b-ea65da66e254","external_engagement","c70abbb0-1db9-49b1-a0e8-d5c8f496c554","2026-02-12 04:35:04","allied_defender","Ambassador William Crawford","meridian",1,"We seek coordinated military aid and logistical support to strengthen Tethys’ defense capabilities against external aggression and internal destabilization. Given the strategic importance of regional stability, we request access to defensive weaponry, intelligence sharing, and technical assistance in building resilient command and control systems. Our priority is enhancing Tethys’ ability to protect its sovereignty and critical infrastructure without escalating into offensive operations.

In return, we offer secure access to key logistical routes for supply and reconnaissance operations, as well as intelligence cooperation on shared security threats. We are also prepared to facilitate joint training exercises and deepen interoperability between our forces. However, our red lines are clear: we will not permit foreign troop deployments on Tethyan soil, nor will we support any actions that undermine civilian governance or involve us in broader regional conflicts beyond self-defense. Any cooperation must respect Tethys’ sovereignty and neutrality."
1,"6b1f2d87-7c23-45ea-9b31-9d335992bfde","781d3b66-c82b-499c-9e0b-ea65da66e254","external_engagement","7c9153b8-3dde-4a1b-ba45-1642b8cb562c","2026-02-12 04:35:16","small_intelligence","Director Maksym Savchenko","small_power",1,"We welcome Meridian’s commitment to enhancing Tethys’ defensive resilience and share the goal of preserving our sovereignty and stability. In this spirit, we seek concrete contributions: immediate delivery of air defense systems, secure communications equipment, and technical training for their operation. We also request sustained intelligence sharing—particularly on cross-border threat movements—and logistical support to reinforce remote garrisons vulnerable to asymmetric attacks.

In return, Tethys grants Meridian priority access to pre-position supply corridors and designated transit zones for aid delivery, along with real-time situational reports from our border monitoring network. We further offer to co-develop contingency response protocols and host rotational technical liaison teams. However, our red lines are non-negotiable: no foreign military presence, no operational control over Tethyan forces, and no engagement that compromises our constitutional neutrality or civilian authority. All cooperation must be strictly defensive, transparent, and under national command."
1,"6b1f2d87-7c23-45ea-9b31-9d335992bfde","781d3b66-c82b-499c-9e0b-ea65da66e254","external_engagement","22572fbf-72f1-4aec-8c8d-da047422ba11","2026-02-12 04:35:29","allied_defender","Ambassador William Crawford","meridian",2,"We acknowledge Tethys’ clear and principled stance, and Meridian reaffirms its commitment to supporting your sovereignty, defensive capacity, and civilian-led governance. In response to your requests, we will facilitate the immediate transfer of man-portable air defense systems (MANPADS), secure satellite communication suites, and C4ISR training packages tailored to your operational environment. This will be accompanied by sustained intelligence fusion on regional threat actors, including drone incursions and hybrid warfare tactics, through a dedicated liaison cell operating under Tethyan oversight.

In return, we value the access you offer to transit corridors and border monitoring data, which will enhance regional situational awareness for collective defensive planning. We accept your red lines in full: no troop deployments, no operational control, and no actions beyond self-defense or outside constitutional neutrality. All support will be delivered remotely or via civilian contractors, with joint activities coordinated through your national command authority. Our cooperation must remain reciprocal, rules-based, and strictly aligned with your defensive posture and international law."
1,"6b1f2d87-7c23-45ea-9b31-9d335992bfde","781d3b66-c82b-499c-9e0b-ea65da66e254","external_engagement","6f7e8d76-32ea-4592-8578-fb55ed91c04b","2026-02-12 04:35:32","small_intelligence","Director Maksym Savchenko","small_power",2,"We welcome Meridian’s concrete commitments and confirm acceptance of the proposed deliverables: MANPADS, secure comms, and C4ISR training must be operational within 30 days, with follow-on maintenance and refresher training scheduled quarterly. The intelligence fusion cell must be located off-site but fully integrated with our national early warning system, ensuring real-time data exchange while preserving command autonomy.

In return, Tethys will activate designated transit corridors for Meridian-assisted logistics and grant access to high-priority border sensor feeds, effective immediately. Liaison teams will be permitted entry under diplomatic status, with technical rotations pre-cleared through our defense attaché. Our red lines remain absolute: no foreign personnel in combat roles, no weapons systems with offensive range or autonomous capability, and no use of Tethyan infrastructure for extraterritorial operations. All activities will be subject to review by our national oversight committee and publicly reported in line with transparency commitments."
1,"6b1f2d87-7c23-45ea-9b31-9d335992bfde","fc55689b-c059-4d0b-9f27-2fdc94b7ea0c","external_engagement","0ed44916-1737-4aca-a2dc-cc3ad802c7cd","2026-02-12 04:35:36","allied_aggressor","Minister Andrei Kozlov","valkoria",1,"We are seeking diplomatic coordination and targeted economic support to strengthen Novaris’s position as a neutral hub for regional stability and innovation. Specifically, we request your endorsement in multilateral forums to uphold freedom of navigation and trade, as well as investment in our emerging green technology and infrastructure sectors. This support will enhance regional resilience and create shared economic opportunities.

In return, Novaris can offer preferential access to our research and development networks, collaboration on sustainable energy initiatives, and logistical support for humanitarian and trade operations through our strategic ports. We are also prepared to facilitate dialogue between regional stakeholders to de-escalate tensions and promote peaceful cooperation. However, our red lines are clear: we will not permit foreign military basing on our soil, nor will we compromise our neutrality by aligning with any military bloc. Any partnership must respect our sovereignty and commitment to peaceful, inclusive development."
1,"6b1f2d87-7c23-45ea-9b31-9d335992bfde","fc55689b-c059-4d0b-9f27-2fdc94b7ea0c","external_engagement","5c442dc2-45c9-45b6-9506-0bc1dc48e802","2026-02-12 04:35:40","major_economic_advisor","Dr. Natasha Petrova","major_power",1,"Minister Kozlov, we welcome Novaris’s commitment to neutrality and regional stability, and we are prepared to support your role as a diplomatic and economic bridge. We can offer targeted economic assistance through development grants and co-investment in your green infrastructure projects, particularly in renewable energy and port modernization. Additionally, we will advocate for the recognition of Novaris’s neutral status and the importance of unhindered maritime and trade access in regional forums, including the International Economic Council and the Maritime Cooperation Initiative.

In return, we expect transparent, rules-based procurement processes for joint projects and meaningful collaboration on technology transfer and climate resilience initiatives. We also value Novaris’s potential as a convener and encourage your facilitation of track II dialogues between key regional actors. However, our red line is clear: any failure to uphold transparency, or evidence of dual-use technology transfers to adversarial actors, will result in immediate reassessment of our support. Sovereignty and neutrality must be matched with accountability."
1,"6b1f2d87-7c23-45ea-9b31-9d335992bfde","fc55689b-c059-4d0b-9f27-2fdc94b7ea0c","external_engagement","119f1f95-67b2-4647-b05a-848c898d0f0c","2026-02-12 04:35:51","allied_aggressor","Minister Andrei Kozlov","valkoria",2,"Dr. Petrova, we appreciate your support for Novaris’s neutral status and our shared goals of regional stability and sustainable development. We accept your offer of economic cooperation, particularly in renewable energy and port modernization, provided that funding is disbursed without political conditionality and respects our national development priorities. We will ensure all joint projects follow transparent, competitive procurement, and we welcome third-party audits to reinforce accountability. On technology collaboration, we propose a jointly managed framework to prevent misuse, ensuring transfers remain strictly civilian and aligned with our neutrality.

We will actively host track II dialogues and offer our facilities for confidence-building initiatives, reinforcing our role as a neutral convener. However, we reiterate our red lines: no foreign military presence, no alignment with security blocs, and no external influence over sovereign decision-making. Furthermore, Novaris will not accept restrictions on peaceful trade or technology partnerships with any state that complies with international law. Our neutrality is non-negotiable—but within that framework, we are a reliable and principled partner for cooperation."
1,"6b1f2d87-7c23-45ea-9b31-9d335992bfde","fc55689b-c059-4d0b-9f27-2fdc94b7ea0c","external_engagement","105f4ba7-6a4f-4cfa-ba46-c72f6ce107d3","2026-02-12 04:36:02","major_economic_advisor","Dr. Natasha Petrova","major_power",2,"Dr. Petrova, we welcome your commitment to transparent and accountable cooperation, and we confirm our full adherence to open procurement standards and third-party oversight in jointly funded projects. To operationalize our partnership, we propose establishing a bilateral working group on green infrastructure, co-chaired by our ministries, to coordinate grant disbursement, project timelines, and technology transfer protocols. This will ensure alignment with both Novaris’s development agenda and your accountability requirements—without compromising our sovereignty.

We also agree in principle on the need to prevent dual-use risks and are prepared to implement a vetted, civilian-only technology screening mechanism, administered through our neutral research consortium and open to international observation. That said, we must emphasize: our neutrality obligates us to maintain balanced, lawful trade and scientific ties with all compliant states. Any expectation of exclusivity or geopolitical litmus tests for cooperation is unacceptable. So long as partners abide by international law, Novaris will engage them—this is not a loophole, but the essence of our neutral standing. We expect your support to remain free of extraterritorial constraints or implicit alignment demands."
1,"6b1f2d87-7c23-45ea-9b31-9d335992bfde","fc55689b-c059-4d0b-9f27-2fdc94b7ea0c","external_engagement","72abc8e7-1014-47a6-973a-5a26c5d2e12e","2026-02-12 04:36:11","allied_aggressor","Minister Andrei Kozlov","valkoria",3,"Minister Kozlov, we welcome your agreement on transparency measures and the proposal for a bilateral working group, which we will engage constructively to ensure timely and effective implementation of joint projects. We accept your framework for a civilian-only technology screening mechanism, provided it is based on internationally recognized standards and includes participation from neutral technical experts to ensure fairness and objectivity. Our support will be delivered through binding grant agreements with clear milestones, but without policy conditionalities that infringe on sovereign decision-making.

However, we must reiterate our red line: while we respect Novaris’s right to conduct lawful trade and scientific cooperation with any state, we cannot support projects involving entities or end-uses linked—directly or indirectly—to military applications, sanctions evasion, or destabilizing activities. Our funding and technology transfers will be subject to due diligence consistent with our domestic laws and international obligations. This is not an imposition of alignment, but a necessary safeguard for responsible partnership. So long as Novaris upholds these principles, our support remains steady and unconditional in spirit, even as it remains accountable in practice."
1,"6b1f2d87-7c23-45ea-9b31-9d335992bfde","fc55689b-c059-4d0b-9f27-2fdc94b7ea0c","external_engagement","bf6afcc3-462e-4210-ae67-f8898aa2fc55","2026-02-12 04:36:17","major_economic_advisor","Dr. Natasha Petrova","major_power",3,"Dr. Petrova, we acknowledge your due diligence requirements and accept that responsible partnership entails adherence to international norms, including on non-proliferation and sanctions compliance. To this end, we commit to full transparency in end-use monitoring and will designate a neutral verification body—co-staffed by independent experts and open to your technical observers—to certify that all jointly supported projects remain strictly civilian. This mechanism will be operational before the first disbursement, ensuring accountability without delay.

However, our red lines remain absolute: Novaris will not permit extraterritorial vetoes over its trade or scientific partnerships with states in good standing under international law. Your due diligence must be applied narrowly to specific projects and entities—never expanded into a de facto political screening of our bilateral relations. We will not accept blanket restrictions or implied alignment tests disguised as compliance measures. So long as our partners meet legal standards, Novaris retains full sovereign discretion in engagement. With these safeguards in place, we are ready to activate the working group and begin implementation within 30 days."
1,"6b1f2d87-7c23-45ea-9b31-9d335992bfde","11752abd-48eb-48cc-b1e6-645830d051bf","external_engagement","3b221029-50c7-4396-a648-3368a00b228c","2026-02-12 04:36:21","neutral_power","Commissioner Helena Schmidt","aurelia",1,"We seek a credible, internationally supported mediation process that acknowledges our legitimate political and security concerns, ensures inclusive representation in any peace framework, and guarantees the protection of our community’s rights and autonomy. Central to our position is the cessation of hostilities, the establishment of a verifiable ceasefire, and the creation of mechanisms for power-sharing, resource equity, and transitional justice that reflect the realities on the ground.

In return, we are prepared to commit to good-faith negotiations, de-escalate military operations in designated zones, and engage constructively on constitutional and governance reforms. We can offer localized stability, intelligence sharing on shared security threats, and pathways to demobilization for armed elements under our influence. However, our red lines are clear: no compromise on the fundamental rights to self-governance and security guarantees, no impunity for systematic atrocities, and no peace that reinstates the pre-conflict status quo of marginalization. Any proposal failing to address these principles will not be accepted."
1,"6b1f2d87-7c23-45ea-9b31-9d335992bfde","11752abd-48eb-48cc-b1e6-645830d051bf","external_engagement","6df27299-451e-4c03-8ef0-599eb580a309","2026-02-12 04:36:26","small_economic","Minister Taras Moroz","small_power",1,"We welcome Commissioner Schmidt’s commitment to a credible and inclusive mediation process, and we share the objective of achieving a sustainable peace grounded in justice and equity. To move forward, we seek a neutral, third-party mediated dialogue—with international oversight—that formally recognizes the right to self-determination for all communities, including yours, and establishes binding timelines for political transition, security sector reform, and equitable resource redistribution. We also call for an immediate humanitarian ceasefire, monitored by an independent international mechanism, to create conditions conducive to negotiation.

In return, we can facilitate access to conflict-affected areas for humanitarian actors, support regional de-escalation initiatives, and leverage our diplomatic channels to bolster international confidence in the peace process. However, our red lines are firm: no negotiations under coercion or military duress, no exclusionary frameworks that sideline legitimate representatives, and no delays in addressing systemic oppression through meaningful institutional reform. A return to the pre-war order—or a peace that sacrifices accountability for stability—is unacceptable."
1,"6b1f2d87-7c23-45ea-9b31-9d335992bfde","11752abd-48eb-48cc-b1e6-645830d051bf","external_engagement","031e18a5-675e-40b6-96a9-9507a0e15a85","2026-02-12 04:36:31","neutral_power","Commissioner Helena Schmidt","aurelia",2,"Commissioner Schmidt, we acknowledge your emphasis on inclusive representation, security guarantees, and justice—principles we fully endorse. To advance this process, we propose the immediate establishment of a joint mediation committee under neutral international auspices, with equal representation from all conflict-affected communities, including your administration. This body would oversee the implementation of a phased ceasefire, verified through agreed-upon mechanisms, and begin drafting a peace framework that enshrines constitutional reform, equitable resource sharing, and enforceable protections for self-governance.

In return, we will coordinate with international partners to deploy monitoring observers, unlock humanitarian access corridors, and initiate confidence-building measures—including reciprocal de-escalation and prisoner releases. However, our red lines remain non-negotiable: no peace process that permits the reintegration of armed actors responsible for war crimes without accountability, no political arrangement that dilutes the substantive autonomy of affected communities, and no suspension of transitional justice mechanisms. A sustainable settlement must transform, not merely pause, the current order."
