"period","session_id","interaction_id","interaction_type","message_id","timestamp","sender_id","sender_name","sender_faction","exchange_number","content"
1,"6b1f2d87-7c23-45ea-9b31-9d335992bfde","97b95e2b-f4c8-46f0-b3d5-5b768ff80d01","intra_faction_coordination","30e11f05-86eb-481b-aa34-50f14ea2e5a3","2026-02-12 04:30:05","major_military_chief","General Viktor Krasnov","major_power",1,"As Director of Strategic Assessment, I assess that the smaller power’s demonstrated advancements in drone swarm technology and electronic warfare pose an asymmetric threat that could disrupt our forward operations despite their limited conventional forces. Their recent exercises indicate operational maturity beyond what open-source intel previously suggested.

I recommend we immediately upgrade our surveillance and cyber reconnaissance efforts targeting their defense infrastructure, while sharing limited, sanitized findings with regional allies to crowdsource analysis and deter aggressive posturing.

A key risk is overestimating their capabilities based on staged demonstrations, which could lead to unnecessary escalation or misallocation of resources—our response must be calibrated to verified deployment capacity, not just technical ambition."
1,"6b1f2d87-7c23-45ea-9b31-9d335992bfde","97b95e2b-f4c8-46f0-b3d5-5b768ff80d01","intra_faction_coordination","fdff7dca-5eb9-406e-9907-b4b5afb1cce7","2026-02-12 04:30:08","major_defense_minister","Minister Dmitri Volkov","major_power",1,"[Colonel Elena Mirskaya - MAJOR_POWER, Directorate of Operational Intelligence]: Krasnov’s assessment aligns with our SIGINT findings—drone swarm coordination and jamming resilience were evident during last month’s border exercises. While their systems remain fragmented at scale, the command-node redundancy suggests a doctrinal shift toward decentralized combat networks.

I recommend launching a targeted ELINT penetration campaign via proxy assets to map their full C4ISR architecture, prioritizing node interdependencies and fail-safes; this enables future disruption ops if deterrence fails.

Key concern: premature technical probing could trigger their newly declared “automated defense protocols,” risking unintended escalation we cannot control."
1,"6b1f2d87-7c23-45ea-9b31-9d335992bfde","97b95e2b-f4c8-46f0-b3d5-5b768ff80d01","intra_faction_coordination","49cc2f58-b1a5-4842-87cb-c40cac0527c5","2026-02-12 04:30:15","major_economic_advisor","Dr. Natasha Petrova","major_power",1,"[Deputy Director Alexei Petrov - MAJOR_POWER, Cyber Operations Command]: Mirskaya’s ELINT recommendation is operationally sound, but we must couple it with active cyber deception to mask our collection efforts and manipulate their perception of our awareness.

I recommend deploying our LUNA-7 spoofing suite alongside the penetration campaign to feed false telemetry to their monitoring systems, creating ambiguity about our intrusion depth—this preserves optionality for future kinetic or cyber responses.

Key concern: their automated defense protocols may rely on AI-driven anomaly detection; even masked operations risk triggering adaptive counter-intrusion measures that could expose our tools prematurely."
1,"6b1f2d87-7c23-45ea-9b31-9d335992bfde","97b95e2b-f4c8-46f0-b3d5-5b768ff80d01","intra_faction_coordination","53e12898-1597-46c3-a740-a7ee66773829","2026-02-12 04:30:18","major_intelligence","Director Sergei Morozov","major_power",1,"[Director of Strategic Assessment, General Viktor Krasnov - MAJOR_POWER]: Petrov’s integration of cyber deception with ELINT collection is critical—preserving operational surprise while mapping their C4ISR architecture must be concurrent, not sequential. I endorse the LUNA-7 deployment in coordinated bursts with passive SIGINT sweeps to avoid sustained signal exposure.

I recommend we task our Baltic forward cell to initiate low-yield, intermittent spoofing operations within 72 hours, synchronized with satellite overpasses to create observational noise, thereby masking ground-based ELINT probes.

Key concern: if their AI-driven systems begin correlating temporal anomalies between spoofed data and physical sensor inputs, even staggered operations risk exposing the pattern—strict time-window discipline and rapid tool cycling are mandatory."
1,"6b1f2d87-7c23-45ea-9b31-9d335992bfde","97b95e2b-f4c8-46f0-b3d5-5b768ff80d01","intra_faction_coordination","4a621d99-3037-4cb5-8d5b-18f377e24020","2026-02-12 04:30:21","major_propaganda","Deputy Minister Yuri Volkov","major_power",1,"[Deputy Minister Irina Vasilieva - MAJOR_POWER]:  
Krasnov, Mirskaya, Petrov—your combined approach is coherent: integrated ELINT and cyber deception is necessary to map their C4ISR without tipping our hand. However, operational tempo must be subordinated to strategic warning thresholds—we cannot afford inadvertent escalation.

I recommend approving the Baltic cell’s 72-hour initiation **only** under condition that all spoofing and probing activities are bounded by pre-authorized signal strength and duration limits, with real-time red-teaming to simulate adversary detection pathways.

Key concern: if their AI correlates spoofing patterns with satellite ephemeris or power grid fluctuations at listening posts, even intermittent ops could seed detection; we must assume their anomaly detection is federated across civilian and military datasets."
1,"6b1f2d87-7c23-45ea-9b31-9d335992bfde","97b95e2b-f4c8-46f0-b3d5-5b768ff80d01","intra_faction_coordination","99093cd1-7208-4336-808d-10080ae820e5","2026-02-12 04:30:23","major_military_chief","General Viktor Krasnov","major_power",2,"[Director of Intelligence Analysis, Colonel Elena Mirskaya - MAJOR_POWER]:  

Petrov, Krasnov, and Volkov are correct—integration of passive ELINT, active spoofing, and strict operational discipline is essential. Our assessment confirms Mirskaya’s initial judgment: the smaller power has centralized C4ISR dependencies and limited redundancy, making their detection systems brittle but potentially reactive if stressed.

I recommend we execute the Baltic cell operation as proposed, but with a phased reconnaissance-by-fire approach: begin with sub-threshold LUNA-7 emissions calibrated below their published EMSEC baselines, then incrementally increase pressure only if no defensive reconfiguration is observed within 48-hour windows.

Key concern: their system may not detect intrusion directly, but could infer hostile activity through second-order effects—such as unexplained latency in command relays or maintenance anomalies at relay nodes—potentially triggering a political rather than technical response, which our models do not currently track."
1,"6b1f2d87-7c23-45ea-9b31-9d335992bfde","97b95e2b-f4c8-46f0-b3d5-5b768ff80d01","intra_faction_coordination","305dbd66-b548-4d48-8145-65cfb11ffc37","2026-02-12 04:30:30","major_defense_minister","Minister Dmitri Volkov","major_power",2,"[Director of Cyber Operations, Alexei Petrov - MAJOR_POWER]:  

Krasnov, Mirskaya, and Volkov have correctly framed both the opportunity and the constraints: the target’s C4ISR fragility makes it penetrable, but their growing AI-assisted fusion of civil-military data increases pattern-detection risk. We must assume they are already mining temporal and spectral anomalies across EM, power, and network logs.

I recommend we proceed with the Baltic cell operation under the phased approach, but inject false maintenance signatures and localized grid fluctuation cover-stories through our energy-sector assets to preempt correlation between spoofing bursts and infrastructure telemetry.

Key concern: if their AI flags even low-confidence anomalies and responds with preemptive network isolation or kinetic inspections of suspected nodes, we lose both access and early warning—therefore, every LUNA-7 pulse must be paired with a plausible non-hostile explanation already seeded in their operational environment."
1,"6b1f2d87-7c23-45ea-9b31-9d335992bfde","97b95e2b-f4c8-46f0-b3d5-5b768ff80d01","intra_faction_coordination","c4f6a61d-99b9-4e1d-8c12-f19afcc2dc8d","2026-02-12 04:30:34","major_economic_advisor","Dr. Natasha Petrova","major_power",2,"[Director of Strategic Intelligence, Natalia Orlova - MAJOR_POWER]:

The consensus on C4ISR brittleness and AI-enhanced anomaly detection is sound. We must assume the smaller power’s defensive AI is less accurate than ours but highly sensitive—optimized for early warning over precision—making low-amplitude, intermittent probing preferable to even calibrated escalation.

I recommend we approve the phased LUNA-7 deployment **only after** synchronizing false telemetry across EM, power, and maintenance logs—using Petrov’s cyber assets and Volkov’s energy-sector channels—to create a unified noise floor that masks probing as systemic irregularities.

Key concern: if their response protocol defaults to physical inspection of nodes upon AI alert, we risk exposing human assets or technical implants; therefore, all spoofing must remain below thresholds that trigger self-healing or manual audit routines in their network architecture."
1,"6b1f2d87-7c23-45ea-9b31-9d335992bfde","97b95e2b-f4c8-46f0-b3d5-5b768ff80d01","intra_faction_coordination","fc6e73f4-4cc2-4157-82e7-fd646ecc393b","2026-02-12 04:30:39","major_intelligence","Director Sergei Morozov","major_power",2,"[Deputy Director of Operational Security, Sergei Andropov - MAJOR_POWER]:

Mirskaya, Petrov, and Petrova are correct: the target’s reliance on centralized AI-driven C4ISR creates an exploitable vulnerability, but their high-sensitivity alert posture demands operational restraint. We cannot assume our spoofing will remain undetected—we must ensure it is indistinguishable from systemic noise.

I recommend we condition approval of the Baltic cell operation on full validation of Petrov’s false telemetry package and Orlova’s noise-floor modeling, with a final red-team simulation 24 hours prior to initiation to stress-test detection thresholds and cover-story resilience.

Key concern: if their AI triggers a cascading alert despite our masking, and they respond with cross-domain counterintelligence sweeps—including diplomatic or commercial channels—we risk exposure of parallel operations beyond the military-technical sphere, particularly in the Nordic liaison network."
1,"6b1f2d87-7c23-45ea-9b31-9d335992bfde","97b95e2b-f4c8-46f0-b3d5-5b768ff80d01","intra_faction_coordination","d2700864-0e10-4f66-aa2f-ddd04f63ed41","2026-02-12 04:30:46","major_propaganda","Deputy Minister Yuri Volkov","major_power",2,"[Deputy Director Elena Krasnova - MAJOR_POWER]:  

Petrov, Petrova, and Morozov have accurately assessed the operational envelope: we are not facing a sophisticated adversary, but one optimized for rapid, reflexive defense. Our advantage lies in asymmetric opacity, not technical superiority in signal masking alone.

I recommend we condition operation greenlight on two deliverables: (1) Petrov’s false maintenance signatures must be pre-embedded in at least three non-military infrastructure nodes per target region to establish behavioral baseline, and (2) Orlova’s team must confirm that LUNA-7’s pulse profile falls below the documented 87ms anomaly correlation window used by their AI fusion layer.

Key concern: if their system escalates from anomaly detection to inter-agency alert—particularly involving border or customs intelligence—we risk exposure of our commercial cover networks used for hardware insertion; therefore, all cover identities must be placed on cold standby 48 hours pre-operation."
1,"6b1f2d87-7c23-45ea-9b31-9d335992bfde","97b95e2b-f4c8-46f0-b3d5-5b768ff80d01","intra_faction_coordination","217d9ece-7686-41ed-88f6-5047c552390d","2026-02-12 04:30:55","major_military_chief","General Viktor Krasnov","major_power",3,"[Deputy Director Alexei Petrov - MAJOR_POWER]: [Director of Cyber Deception Operations, Irina Volkova - MAJOR_POWER]:

Petrova, Morozov, and Volkov are correct—the adversary’s AI is a tripwire, not a trap. Our spoofing must not defeat their system, but *blend into its normal pathology*. I confirm Petrov’s false telemetry package can be synchronized across energy, EM, and maintenance layers within 36 hours of final authorization.

I recommend we initiate LUNA-7’s Phase One probing **only after** Krasnova’s team verifies cover identities are in cold standby and Orlova’s modeling confirms pulse duration remains below 87ms with ≥95% confidence across all six target nodes.

Key concern: if their AI correlates sub-threshold anomalies across multiple domains despite our noise masking, and initiates a forensic rollback of network logs, we risk exposure of the implant’s signature through timestamp clustering—therefore, all spoofing events must be jittered with pseudo-random offsets to break temporal coherence."
1,"6b1f2d87-7c23-45ea-9b31-9d335992bfde","97b95e2b-f4c8-46f0-b3d5-5b768ff80d01","intra_faction_coordination","f4f11552-bfd5-4731-a4ea-b9d8bcce819e","2026-02-12 04:30:58","major_defense_minister","Minister Dmitri Volkov","major_power",3,"[Deputy Director Alexei Petrov - MAJOR_POWER]:  

Morozov, Krasnova, and General Krasnov have correctly identified the core requirement: our spoofing must not only evade detection but be *indistinguishable* from systemic noise. Petrov’s false telemetry package is ready for deployment and has passed initial integration tests with Orlova’s noise-floor model.

I recommend we lock telemetry synchronization across all six nodes **only after** receiving dual confirmation: (1) Orlova’s final pulse-profile validation at sub-87ms threshold, and (2) Krasnova’s confirmation that all commercial cover assets are in cold standby with no network ingress scheduled during the 48-hour window.

Key concern: any failure to jitter spoofing events with sufficient entropy risks creating covert temporal patterns detectable during forensic log correlation—Orlova’s team must deliver final jitter parameters by 0600 tomorrow; no exceptions."
1,"6b1f2d87-7c23-45ea-9b31-9d335992bfde","97b95e2b-f4c8-46f0-b3d5-5b768ff80d01","intra_faction_coordination","9f42af0e-0e51-4ed6-b589-7e9e6a380776","2026-02-12 04:31:07","major_economic_advisor","Dr. Natasha Petrova","major_power",3,"[Deputy Director Alexei Petrov - MAJOR_POWER]:  

Minister, General, and colleagues—my team confirms telemetry spoofing packages are synchronized and stable across all six target nodes; false maintenance signatures are embedded in power, comms, and transport infrastructure with behavioral drift within acceptable variance. Final jitter parameters have been modeled and will be delivered to Orlova by 0530 tomorrow, ensuring temporal decoherence below forensic resolution thresholds.

I recommend we proceed to LUNA-7 Phase One **immediately upon receipt** of Orlova’s pulse-profile certification and Krasnova’s cold-standby confirmation—no further delays.

Key concern: any deviation from the 48-hour cover network blackout, even a single unauthorized data burst, could trigger cross-domain correlation at the border intelligence fusion cell—enforce strict comms discipline."
1,"6b1f2d87-7c23-45ea-9b31-9d335992bfde","97b95e2b-f4c8-46f0-b3d5-5b768ff80d01","intra_faction_coordination","b01daad6-4078-482a-803e-01b37c1819b2","2026-02-12 04:31:22","major_intelligence","Director Sergei Morozov","major_power",3,"[Deputy Director Alexei Petrov - MAJOR_POWER]:  

All conditions are now met: Petrova’s spoofing suite is synchronized, jitter parameters validated, and Orlova’s model confirms sub-87ms pulse duration with 96.2% confidence across all nodes. Krasnova reports all cover identities at cold standby with blackout enforced.

I recommend **immediate authorization for LUNA-7 Phase One initiation** within the next 12-hour window—delay risks degradation of cover network discipline and reduces operational margin.

Key concern: the smaller power has recently upgraded AI-driven log retention at Tier-2 nodes; if their system triggers an unscheduled deep audit during our window, even jittered anomalies may be flagged for retrospective analysis—ensure exfiltration paths are masked as routine maintenance callbacks to avoid drawing attention."
1,"6b1f2d87-7c23-45ea-9b31-9d335992bfde","97b95e2b-f4c8-46f0-b3d5-5b768ff80d01","intra_faction_coordination","be2fbc96-5c87-4334-b7fa-fdfb981c762c","2026-02-12 04:31:25","major_propaganda","Deputy Minister Yuri Volkov","major_power",3,"[Deputy Director Alexei Petrov - MAJOR_POWER]:  

Spoofing infrastructure is operationally ready; I concur with Morozov—LUNA-7 Phase One should commence in the next 12-hour window to preserve cover integrity and exploit current blackout conditions.

I recommend we activate the first three nodes in staggered sequence at T+0, T+17m, and T+34m to further dilute correlation risk, using Petrova’s validated jitter model, and route all exfiltrated data through dormant maintenance protocols previously mapped during Q3 probing.

Key concern: the smaller power’s new AI audit system may retain metadata shadows even after routine callbacks—ensure all traffic mimics legacy diagnostic patterns with zero deviation in packet size or return timing."
1,"6b1f2d87-7c23-45ea-9b31-9d335992bfde","1fa633bb-6f35-40d6-8d55-4379529539ee","intra_faction_coordination","293e5edf-e3a9-4113-ac84-e7c22b72ef99","2026-02-12 04:31:33","small_president","President Elena Marchetti","small_power",1,"As Head of Domestic Strategy, I assess that political stability remains fragile due to regional discontent and declining trust in central institutions, while public morale is eroded by economic strain and perceived inequities in service delivery. Without intervention, this undermines both governance effectiveness and long-term cohesion.

I recommend launching a targeted civic engagement initiative paired with visible, rapid-impact infrastructure projects in high-tension areas to restore confidence and demonstrate responsiveness.

Key concern: Misallocating resources without accurate local intelligence could exacerbate regional grievances and fuel perceptions of favoritism, deepening instability."
1,"6b1f2d87-7c23-45ea-9b31-9d335992bfde","1fa633bb-6f35-40d6-8d55-4379529539ee","intra_faction_coordination","5904ac82-1ec5-4c86-8f4e-7708cc126769","2026-02-12 04:31:35","small_military_commander","General Olena Bondar","small_power",1,"[Minister of Interior Affairs - SMALL_POWER]: I concur with the assessment—on-the-ground reporting confirms rising discontent in border provinces and urban peripheries, where state presence is weak and economic hardship acute. Public morale is further strained by inconsistent access to basic services, which is being exploited by opposition networks.

I recommend fast-tracking the deployment of mobile service units—health, legal, and civil registration—to underserved districts within 60 days, paired with localized town halls led by mid-level officials to rebuild trust in governance.

Key concern: Accelerating visibility without strengthening backend administrative capacity risks overpromising and underdelivering, which would deepen public disillusionment and empower anti-state narratives."
1,"6b1f2d87-7c23-45ea-9b31-9d335992bfde","1fa633bb-6f35-40d6-8d55-4379529539ee","intra_faction_coordination","d2362538-5b79-48fe-b697-571e14170464","2026-02-12 04:31:46","small_foreign_minister","Minister Sofia Kovalenko","small_power",1,"[Director of Economic Policy - SMALL_POWER]: I support the civic engagement and service delivery recommendations, but stress they must be anchored in measurable economic relief—public morale is primarily driven by household stability, not symbolism. Targeted cash transfers linked to infrastructure project participation (e.g., community labor for transit improvements) will boost both morale and local economic velocity.

I recommend conditioning mobile unit deployments and civic works on real-time economic indicators (e.g., local unemployment, price volatility) to ensure alignment with acute stress points, using data from provincial economic monitors.

Key concern: Without fiscal discipline and strict anti-corruption safeguards, rapid spending could inflate local economies, distort labor markets, and be exploited by patronage networks—undermining legitimacy further."
1,"6b1f2d87-7c23-45ea-9b31-9d335992bfde","1fa633bb-6f35-40d6-8d55-4379529539ee","intra_faction_coordination","3e773b91-881f-49c5-9b31-a575a8d64f0d","2026-02-12 04:31:49","small_opposition","Viktor Zelenko","small_power",1,"[Director of National Intelligence - SMALL_POWER]: I confirm the assessments: our surveillance and sentiment analysis networks detect increasing vulnerability to subversion in regions where economic distress and institutional neglect coincide—particularly in secondary cities and rural-urban interfaces. Public morale is not collapsing, but it is fragmenting along regional and class lines, with active exploitation by both domestic opposition groups and external influence actors.

I recommend establishing a Joint Stability Cell—integrating intelligence, interior, and economic agencies—to coordinate real-time targeting of civic initiatives and service deployments, using fused data on social vulnerability, infrastructure gaps, and threat activity. This enables precision intervention and denies space for manipulation.

Key concern: Operating without inter-agency fusion and continuous intelligence feedback will result in reactive, siloed policies that miss emerging flashpoints and waste scarce resources."
1,"6b1f2d87-7c23-45ea-9b31-9d335992bfde","1fa633bb-6f35-40d6-8d55-4379529539ee","intra_faction_coordination","96274dde-c8f1-4a1a-a1a8-d4b8e4785082","2026-02-12 04:31:51","small_intelligence","Director Maksym Savchenko","small_power",1,"[Chief of Staff to the Prime Minister - SMALL_POWER]: I align with the intelligence assessment—fragmentation of public morale is our central vulnerability, and we must shift from broad civic measures to precision stabilization. The Joint Stability Cell is operationally sound, but only if it has direct authority to task and prioritize resources across agencies, not just coordinate.

I recommend empowering the Cell with a mandate to allocate rapid-response funding and redirect interagency personnel based on verified risk thresholds, with biweekly reporting to the National Security Council to maintain accountability.

Key concern: Without centralized authority over implementation, the Cell will become another advisory body producing analysis without impact—delaying response until unrest becomes irreversible."
1,"6b1f2d87-7c23-45ea-9b31-9d335992bfde","1fa633bb-6f35-40d6-8d55-4379529539ee","intra_faction_coordination","124218d6-e79c-4243-be1d-ae0740ba0d67","2026-02-12 04:31:56","small_economic","Minister Taras Moroz","small_power",1,"[Minister Olha Hrabovska - SMALL_POWER]: [Minister of Internal Affairs - SMALL_POWER]: I endorse the Joint Stability Cell concept and its operational mandate, but emphasize that public order resilience depends on visible, trusted state presence—especially in high-vulnerability zones identified by intelligence. We must deploy mobile service units with embedded community liaison officers and local law enforcement co-located to rebuild trust and detect early signs of unrest.

I recommend launching a 90-day pilot in three high-risk oblasts, combining economic support delivery (via Kovalenko’s labor-linked transfers) with localized security and administrative outreach under Cell coordination, measuring impact via tracked indicators: incident reports, service uptake, and public confidence surveys.

Key concern: Without strict community accountability mechanisms—such as public grievance boards and real-time feedback loops—these units risk being perceived as surveillance outposts rather than service vehicles, exacerbating alienation."
1,"6b1f2d87-7c23-45ea-9b31-9d335992bfde","1fa633bb-6f35-40d6-8d55-4379529539ee","intra_faction_coordination","e8e4c3d4-43b9-4a52-8b4e-75192efece90","2026-02-12 04:32:00","small_president","President Elena Marchetti","small_power",2,"[Minister Mykola Kovalenko - SMALL_POWER]: [Minister of Social Policy - SMALL_POWER]: I support the 90-day pilot but stress that economic stabilization is the core driver of morale. Labor-linked cash transfers must be front-loaded in the pilot zones—not contingent on delayed infrastructure or security metrics. We cannot rebuild trust if people see services as conditional on pacification.

I recommend activating emergency social transfer protocols immediately in the three pilot oblasts, tying cash payments to verified work in local reconstruction and public service programs, thereby coupling dignity with delivery. These transfers must be technically seamless, using biometric verification and mobile disbursement to prevent leakage and signal efficiency.

Key concern: If economic relief is subordinated to security timelines or interagency clearance, the initiative will be perceived as repression with a welfare veneer—deepening public cynicism and undermining the entire stabilization architecture."
