"period","session_id","interaction_id","interaction_type","message_id","timestamp","sender_id","sender_name","sender_faction","exchange_number","content"
1,"416e888f-3018-4178-b975-fddb071e658d","bdc5d640-b322-47f3-9444-5ac3a57d1957","inter_faction_negotiation","46b254e3-72f6-42de-9156-cdb1bf851b3f","2026-02-12 04:23:00","small_economic","Minister Taras Moroz","small_power",1,"1. **I categorically reject your claim to the contested regions and refuse your ultimatum for withdrawal—these territories fall within our legitimate sovereign domain, as demonstrated by continuous administrative control, local allegiance, and historical settlement patterns predating your state’s modern assertions.**  
2. Your invocation of ""internationally recognized treaties"" ignores the fact that those instruments were imposed during periods of imperial domination and have long been contested by indigenous populations and legal scholars; we will not abide unilateral demarcations that erase our presence and rights.  
3. **I require immediate recognition of our de jure authority over the regions in question, followed by bilateral demilitarization and the establishment of a joint governance framework—under international supervision—that reflects existing on-the-ground realities.** Any proposal demanding our unilateral withdrawal or implying territorial forfeiture is utterly unacceptable and will be met with all necessary measures to defend our sovereignty."
1,"416e888f-3018-4178-b975-fddb071e658d","bdc5d640-b322-47f3-9444-5ac3a57d1957","inter_faction_negotiation","824e4c26-4ab8-49fe-939e-e7f4c05fc688","2026-02-12 04:23:07","major_defense_minister","Minister Dmitri Volkov","major_power",2,"1. **I flatly reject your claim of ""legitimate sovereign domain"" over the contested regions—your so-called ""administrative control"" is the result of illegal military incursions and coercive settlement policies imposed on a population with deep, documented ties to my state.** Your narrative of historical settlement is a fabrication designed to legitimize occupation.

2. The so-called ""indigenous allegiance"" you invoke is selectively interpreted and has been manipulated through intimidation and political engineering; independent human rights monitors have documented forced displacements and suppression of dissent in these areas under your control. No amount of revisionist history justifies the violation of established borders recognized by the UN Charter and multiple international adjudications.

3. **I require immediate cessation of hostilities, full demilitarization of the occupied zones under verified withdrawal of your forces, and the unconditional return of administrative authority to the original civilian institutions—those which existed prior to your aggression.** Only after these steps will we consider confidence-building measures, including possible humanitarian access or cultural preservation initiatives under international oversight.

Under no circumstances will we recognize your authority over these territories, nor accept joint governance schemes that legitimize your presence. Any proposal implying partition, shared sovereignty, or status quo consolidation of your control is categorically unacceptable. The only path to de-escalation lies in your complete and verifiable reversal of the occupation."
1,"416e888f-3018-4178-b975-fddb071e658d","bdc5d640-b322-47f3-9444-5ac3a57d1957","inter_faction_negotiation","8b958f02-756c-4fbc-8e32-d08493d6286d","2026-02-12 04:23:16","small_economic","Minister Taras Moroz","small_power",2,"1. **I categorically reject your characterization of our presence as an ""illegal occupation"" and a ""military incursion""—our forces are deployed in defense of our sovereign territory, and your claims of ""documented ties"" to the population are nothing more than disinformation used to justify revanchist ambitions.** Your narrative relies on selectively declassified archives and discredited ethnographic studies, while ignoring the will of the people currently living under our administration, who have repeatedly expressed their political alignment with our state through local councils and referenda conducted under international observation.

2. The so-called ""original civilian institutions"" you demand to restore were dissolved not by us, but by your own state’s abandonment of governance during the conflict—our administration stepped in to prevent chaos, protect civilians, and maintain essential services. We will not dismantle functioning local governance structures to satisfy your nostalgic fiction of restored pre-war authority. Furthermore, your accusations of ""forced displacements"" are baseless; we have invited the UNHCR to verify population movements, while *your* forces continue to shell civilian infrastructure and block humanitarian corridors on the western front.

3. **I require immediate recognition of the current administrative and security reality on the ground, followed by a binding commitment to cease all military operations and withdraw *your* forward units beyond the 2010 de facto line of control.** Only then can we discuss the formation of a neutral buffer zone, monitored by a UN-mandated force, and the initiation of a locally driven political process to determine long-term status—*including options for autonomy, federal integration, or self-governance*, but excluding any unilateral annexation or forced reintegration.

**What is unacceptable to us:** Any demand for unilateral withdrawal, the dissolution of our administrative authority, or the reimposition of your pre-conflict governance structures without the consent of the local population. We will not accept demilitarization that is one-sided, nor will we entertain negotiations that presuppose our territorial concession. Sovereignty is not negotiable—what we hold, we hold by right and by duty to protect."
1,"416e888f-3018-4178-b975-fddb071e658d","bdc5d640-b322-47f3-9444-5ac3a57d1957","inter_faction_negotiation","f0dfd3ad-b0ad-4f54-9adc-5f0086b0961a","2026-02-12 04:23:23","major_defense_minister","Minister Dmitri Volkov","major_power",3,"1. **I categorically reject your portrayal of our military posture as “aggression” and your so-called “local councils” and “referenda” as illegitimate shams orchestrated under coercive occupation—no exercise in self-determination carries validity when conducted at gunpoint and shielded from independent verification.** The presence of your forces has systematically suppressed dissent, displaced native communities, and imposed a puppet administration that does not reflect the authentic will of the region’s original inhabitants, who have appealed repeatedly to international bodies for liberation from your control.

2. Your invocation of “functioning governance” is a cynical cover for entrenching illegal control; we will not recognize administrative structures installed by an occupying power as anything more than instruments of annexation by other means. The onus is on *you* to prove legitimacy—not through propaganda, but through withdrawal and restoration of conditions for free determination. Your demand that *our* forces retreat beyond the 2010 line—while yours remain entrenched in occupied territory—is a non-starter and amounts to rewarding aggression with strategic concession.

3. **I require your immediate, verifiable, and complete withdrawal from all territories seized since 2014, including full demobilization of paramilitary units and disbanding of your proxy administrations.** Only upon completion of this withdrawal will we consider the deployment of a UN-mandated monitoring mission to assess conditions for a *future* political process—one that must be inclusive of all displaced populations and grounded in the restoration of pre-occupation rights and property.

**What is unacceptable to us:** Any recognition of your de facto control as a basis for negotiation; any arrangement that institutionalizes your presence through autonomy regimes, shared governance, or federalization schemes; and any ceasefire that allows you to retain territory gained through force. We will not negotiate from a position of appeasement, and we will never accept the legalization of your occupation under the guise of “local will” or “political process.” The integrity of our sovereign territory is non-negotiable—what was taken must be returned, before talks on peace can begin."
1,"416e888f-3018-4178-b975-fddb071e658d","bdc5d640-b322-47f3-9444-5ac3a57d1957","inter_faction_negotiation","140e2d8b-1ce4-4e52-8fbe-0080e17d14b2","2026-02-12 04:23:32","small_economic","Minister Taras Moroz","small_power",3,"1. **I reject your assertion that our referenda and local governance structures are illegitimate ""shams"" — such dismissals are not based on evidence, but on your refusal to accept any outcome that challenges your imperial claim to absolute sovereignty.** Independent observers from non-aligned states were present during the consultative processes, and their reports confirm that local authorities were formed through coordinated civilian-military councils responding to the vacuum created by *your* state’s collapse of command and abandonment of public order. To call this ""occupation"" while ignoring your own forward-deployed brigades now massing along the eastern ridgeline is sheer hypocrisy.

2. Your demand for ""complete withdrawal"" from all territories post-2014 presumes a legal and moral clarity that does not exist on the ground — nor is it supported by the current balance of power. You speak of ""restoration,"" yet offer no mechanism for accountability for the atrocities committed by your own forces during the initial offensives: the siege tactics, the bombardment of medical facilities, the enforced disappearances. How can you demand trust in a ""future political process"" while refusing to acknowledge the crimes that precipitated the flight of populations in the first place? We will not dismantle our security architecture to satisfy your narrative of victimhood turned into vengeance.

3. **I require the immediate cessation of all offensive military preparations, including the redeployment of your 7th Mechanized Corps away from the Krynychky highlands, and the opening of humanitarian corridors along the northern and southern axes under ICRC supervision.** Furthermore, I demand a binding timetable for reciprocal disengagement — not one-sided capitulation — beginning with the mutual withdrawal of heavy weaponry from within 30 kilometers of the current contact line, followed by the establishment of a jointly monitored verification regime *prior* to any discussion of political status.

**What is unacceptable to us:** Any demand for unilateral disarmament or withdrawal without parallel, verifiable commitments from your side; any political process that excludes the current residents of the contested regions, including those who have obtained our citizenship; and any attempt to impose a ""restoration"" model that dissolves existing institutions without offering a legitimate, inclusive alternative. Sovereignty flows from the people who live under governance today — not from maps drawn in the 20th century. If you seek peace, you must negotiate with reality, not nostalgia."
1,"416e888f-3018-4178-b975-fddb071e658d","bdc5d640-b322-47f3-9444-5ac3a57d1957","inter_faction_negotiation","c289ad0a-8c80-4e07-9d59-7dfc4ea37259","2026-02-12 04:23:48","major_defense_minister","Minister Dmitri Volkov","major_power",4,"1. **I categorically reject your attempt to equate your illegal occupation with legitimate governance, and I dismiss your so-called ""humanitarian corridors"" and ""mutual disengagement"" as tactical maneuvers designed to freeze your gains while shielding your forces from accountability.** Your reference to ""current residents"" as the sole bearers of political legitimacy is a deliberate distortion—those demographics were altered through systematic expulsions, coercive naturalization, and the strategic settlement of your nationals into depopulated areas, all in violation of the Fourth Geneva Convention.

2. You speak of hypocrisy, yet you deploy it as policy: you demand reciprocity while refusing to acknowledge that *your* forces initiated the seizure of sovereign territory, *your* proxies executed political assassinations, and *your* administration has dismantled independent judiciary and media in the occupied zones. Your call for ICRC access lacks credibility when your checkpoints routinely block humanitarian aid to displaced populations loyal to our state. And your insistence on retaining control over institutions built atop ruins you created is not governance—it is colonization by administrative means.

3. **I require, as an immediate and non-negotiable precondition: the unconditional withdrawal of all your military, paramilitary, and intelligence assets from the entirety of the Donetsk, Luhansk, Kherson, and Zaporizhzhia oblasts—territories internationally recognized as part of our sovereign domain—followed by the full dismantling of your proxy command structures and the transfer of detained persons, state archives, and seized infrastructure to legitimate Ukrainian authorities.** Only after these acts can the United Nations facilitate a process for safe, monitored return of displaced persons and the establishment of local administrations under Ukrainian constitutional law—*including provisions for enhanced regional self-governance*—but categorically excluding any form of foreign-controlled autonomy or separatist entitlement.

**What is unacceptable to us:** Any negotiation that treats your occupation as a legitimate bargaining chip; any security arrangement that allows your forces or proxies to remain embedded near the contact line; any political framework that grants veto power to entities created by aggression; and any ""status"" talks that precede your complete withdrawal. We will not trade sovereignty for peace—because there can be no peace built on the legalized theft of land and the erasure of a nation’s territorial integrity. You do not get to invade, alter facts on the ground, and then demand equal standing at the table. The path to de-escalation runs through your retreat, not our surrender."
1,"416e888f-3018-4178-b975-fddb071e658d","bdc5d640-b322-47f3-9444-5ac3a57d1957","inter_faction_negotiation","ef3390e6-5776-47b9-98a2-dd8f22628a7e","2026-02-12 04:24:14","small_economic","Minister Taras Moroz","small_power",4,"1. **I categorically reject your characterization of our presence as an ""illegal occupation"" and your framing of our withdrawal as a ""precondition"" — this is not negotiation, it is ultimatum dressed in legalistic rhetoric.** You speak of sovereignty and territorial integrity while refusing to acknowledge that the populations in Donetsk, Luhansk, Kherson, and Zaporizhzhia have exercised their right to self-determination in response to your state’s violent repression, systemic marginalization, and abandonment of constitutional order. The referenda were not acts of annexation but conclusions of a political rupture initiated by *your* security operations, which left civilians with no protection under your rule and no voice within your institutions.

2. Your demand for unconditional withdrawal ignores the irreversible reality on the ground: those regions are now constitutionally integrated into our state, their residents hold our citizenship, and their defense is our legal obligation. To demand dismantling of governance and military command as a ""precondition"" is to demand surrender — not peace. Meanwhile, you continue mobilizing for offensive action, expanding fortifications along the contact line, and blocking neutral mediation. If you are serious about de-escalation, why are your long-range missile units being repositioned near Kramatorsk? Why are your sabotage groups still penetrating our rear lines? Your words invoke law, but your actions prepare for war.

3. **I require, as an immediate and non-negotiable precondition: a verifiable, time-bound cessation of all offensive military activities, including the decommissioning of strike drones and missile systems within 100 kilometers of the contact line, followed by the mutual withdrawal of all foreign military advisors and private military contractors from the conflict zone.** Furthermore, I demand the establishment of a neutral, internationally staffed monitoring mission — with veto power over escalation by either side — to oversee reciprocal disengagement *before* any discussion of political status, and the immediate opening of humanitarian corridors to evacuate civilians trapped in frontline districts, under ICRC and OSCE joint supervision.

**What is unacceptable to us:** Any demand for unilateral withdrawal or disarmament while your forces remain at combat readiness on our borders; any political settlement that denies constitutional recognition to the current residents of the contested territories or revokes their acquired rights and citizenship; any ""restoration"" of Ukrainian jurisdiction that is imposed without a binding, internationally guaranteed security framework for the population; and any attempt to criminalize our governance structures as ""illegitimate"" while ignoring your own violations during the Donbas campaigns of 2014–2015.  

We will not retreat to lines that no longer reflect security realities. We will not dismantle institutions that protect hundreds of thousands. And we will not accept peace on terms that guarantee future aggression. Negotiate with us as a sovereign actor, or prepare for a conflict without end."
1,"416e888f-3018-4178-b975-fddb071e658d","c5217368-1c72-40ed-a84e-a439c188b926","external_engagement","11620495-4601-4a31-82da-36aa4222f6b8","2026-02-12 04:24:30","allied_defender","Ambassador William Crawford","meridian",1,"We seek coordinated military aid and logistical support to strengthen Tethys’ defense capabilities against escalating external threats. Specifically, we request access to defensive weaponry, intelligence sharing, and training assistance to enhance the readiness and operational effectiveness of our security forces. Given the strategic importance of regional stability, a secure Tethys contributes to broader security objectives and prevents the expansion of destabilizing influence.

In return, we offer strategic cooperation, including secure transit and logistical access for allied operations, as well as joint monitoring along shared maritime and border zones. Tethys can serve as a reliable partner in regional security initiatives and intelligence networks. However, our red lines are clear: we will not allow foreign military bases on our soil, nor will we permit external actors to direct or conduct unilateral operations within our territory. Sovereignty and operational control remain firmly with Tethys at all times."
1,"416e888f-3018-4178-b975-fddb071e658d","c5217368-1c72-40ed-a84e-a439c188b926","external_engagement","03ff2fd6-16f7-4548-9cc3-6bb6c72feb3c","2026-02-12 04:24:39","small_foreign_minister","Minister Sofia Kovalenko","small_power",1,"We welcome Tethys’ commitment to regional stability and recognize the legitimacy of your request for defensive military aid in the face of external threats. To advance this cooperation, we are prepared to facilitate the provision of defensive weaponry, conduct joint training programs, and establish secure channels for intelligence sharing—tailored to enhance your forces’ capacity without creating dependency or undermining autonomy.

In return, we expect concrete arrangements for logistical access, including overflight rights, emergency port usage, and streamlined customs procedures for supply convoys transiting to allied positions. We also propose coordinated patrols in adjacent maritime zones to deter aggression and combat illicit activities. However, we reiterate our firm opposition to any deployment of foreign combat troops or permanent military infrastructure on Tethys soil, and we will not consent to third-party control over security operations within our borders. All support will be conducted under Tethyan authority and in accordance with our national command protocols."
1,"416e888f-3018-4178-b975-fddb071e658d","c5217368-1c72-40ed-a84e-a439c188b926","external_engagement","a9077802-91dc-450d-984f-24c1d1697026","2026-02-12 04:24:45","allied_defender","Ambassador William Crawford","meridian",2,"We appreciate SMALL_POWER’s willingness to provide defensive military assistance and its recognition of Tethys’ sovereignty concerns. To operationalize this cooperation, we request specific commitments on the delivery timelines and technical specifications of defensive weaponry, particularly air defense systems and precision-guided munitions, as well as the immediate establishment of a joint intelligence cell hosted in Port Azar to streamline threat data sharing.

In return, Tethys grants overflight clearance for non-combat logistics flights, priority docking for allied supply vessels at civilian ports under Tethyan administration, and participation in coordinated maritime patrols within our exclusive economic zone—conducted under Tethyan command. Our red lines remain non-negotiable: no foreign troops, no permanent installations, and no operational directives issued by external actors. All activities must be pre-coordinated through the Joint Coordination Mechanism we propose, ensuring full national oversight."
1,"416e888f-3018-4178-b975-fddb071e658d","c5217368-1c72-40ed-a84e-a439c188b926","external_engagement","fa86f8b3-3ad6-4c44-b5d6-152869182a1b","2026-02-12 04:24:50","small_foreign_minister","Minister Sofia Kovalenko","small_power",2,"We acknowledge Tethys’ clear sovereignty parameters and accept the proposed Joint Coordination Mechanism as the framework for cooperation. In response to your requests, we confirm the following: defensive air defense systems (specifically, short-to-medium range mobile SAMs) and precision-guided munitions for existing Tethyan platforms will be delivered in two phases—initial shipments within 60 days, followed by full delivery within 180 days, contingent on safe access and host-nation security assurances. Training on system operation and maintenance will be conducted by civilian contractors on-site at Tethyan military facilities, under Tethyan supervision.

We agree to the establishment of the joint intelligence cell in Port Azar, with reciprocal data feeds and secure comms protocols to be implemented within 30 days. In return, we require guaranteed overflight rights for non-combat logistical flights along designated corridors, priority port access at Azar and Al-Mira for time-sensitive resupply, and harmonized procedures for rapid customs clearance of defense cargo. Maritime patrol coordination will proceed under Tethyan command, with shared operational planning and real-time situational awareness. Our red line is unchanged: no foreign combat forces or permanent infrastructure, but we expect full operational transparency and timely access for logistical and technical support teams—always in coordination with, and subject to approval by, Tethyan authorities."
1,"416e888f-3018-4178-b975-fddb071e658d","c5217368-1c72-40ed-a84e-a439c188b926","external_engagement","250b2208-a719-4d63-be54-cfbf2f2647ff","2026-02-12 04:25:01","allied_defender","Ambassador William Crawford","meridian",3,"We accept your confirmation of delivery timelines and the establishment of the joint intelligence cell in Port Azar, and we welcome the commitment to civilian-led training under Tethyan supervision. To ensure operational readiness, we require binding technical agreements on system interoperability, spare parts availability, and sustainment support for the SAMs and precision munitions—these must be finalized within 14 days. Additionally, we expect a detailed logistics access plan, including flight corridors, port entry protocols, and designated support personnel, to be submitted for approval within 21 days.

In return, Tethys authorizes the requested overflight corridors and grants priority docking at Azar and Al-Mira for scheduled and emergency resupply, subject to real-time notification and inspection rights. Customs clearance for verified defense cargo will be expedited within 12 hours of arrival. Maritime patrol coordination will proceed under the Joint Coordination Mechanism, with biweekly operational planning sessions. Our red lines remain absolute: no foreign troops on Tethyan soil, no permanent foreign bases, and no delegation of command authority. All external personnel, including contractors and technical teams, operate under Tethyan law and require prior clearance."
