"period","session_id","interaction_id","interaction_type","message_id","timestamp","sender_id","sender_name","sender_faction","exchange_number","content"
1,"416e888f-3018-4178-b975-fddb071e658d","05554afe-97b7-4973-9ece-0d8ca9fc6d4d","intra_faction_coordination","dbdab777-6d71-438c-931f-9a2b79b9a646","2026-02-12 04:20:09","major_military_chief","General Viktor Krasnov","major_power",1,"As Director of Economic Strategy, I assess that the recent sanctions will significantly disrupt our critical supply chains and restrict access to key financial markets. We must act swiftly to mitigate exposure while maintaining strategic autonomy.

I recommend immediately activating the contingency protocol to reroute trade through trusted third-party intermediaries and deepen economic coordination with non-aligned partners. This includes expediting barter arrangements for essential imports.

A key risk is over-reliance on a narrow set of alternative channels, which could create new vulnerabilities if those pathways are later targeted or politicized."
1,"416e888f-3018-4178-b975-fddb071e658d","05554afe-97b7-4973-9ece-0d8ca9fc6d4d","intra_faction_coordination","3d8fd9cd-ab0f-49d2-822a-d4714bb775f3","2026-02-12 04:20:12","major_defense_minister","Minister Dmitri Volkov","major_power",1,"[Deputy Minister Elena Petrova - MAJOR_POWER]: I concur with Director Krasnov’s assessment and support immediate activation of the contingency protocol. However, we must also proactively recalibrate our foreign investment posture—specifically by fast-tracking sovereign wealth fund reallocations into strategic domestic industries to offset capital flight.

I recommend establishing a task force under the Ministry of Finance to identify and execute asset swaps with partner states, ensuring liquidity is preserved without increasing external debt.

A key concern is the potential for secondary sanctions on entities engaged in circumvention, which could deter intermediaries and escalate economic isolation if not carefully managed through legal and diplomatic shielding."
1,"416e888f-3018-4178-b975-fddb071e658d","05554afe-97b7-4973-9ece-0d8ca9fc6d4d","intra_faction_coordination","246d1ce0-d446-4a3e-861b-f3c758fa2830","2026-02-12 04:20:20","major_economic_advisor","Dr. Natasha Petrova","major_power",1,"[Deputy Director Alexei Morozov - MAJOR_POWER]: I support both the activation of the contingency protocol and the need for financial recalibration, but we must also intensify counter-intelligence screening of all third-party intermediaries to prevent infiltration or exploitation by adversarial intelligence services under the guise of trade facilitation.

I recommend that the FSB Economic Security Directorate conduct rapid audits of all proposed intermediary firms within 72 hours of engagement, with mandatory reporting to the National Security Council before contracts are finalized.

A key risk is that rushed rerouting of trade could expose our supply chains to covert disruption or data leakage, particularly in logistics and payment messaging, enabling future precision targeting by sanctioning states."
1,"416e888f-3018-4178-b975-fddb071e658d","05554afe-97b7-4973-9ece-0d8ca9fc6d4d","intra_faction_coordination","4f0f6ae2-a9d3-4027-b03b-f578905af08e","2026-02-12 04:20:27","major_intelligence","Director Sergei Morozov","major_power",1,"[Deputy Minister Sergei Ivanov - MAJOR_POWER]: I endorse the activation of the contingency protocol, the financial reallocation plan, and enhanced counter-intelligence vetting. However, we must simultaneously launch a coordinated diplomatic push to fracture the unity of the sanctioning coalition through differentiated engagement—offering selective trade assurances to less committed members to exploit divergent national interests.

I recommend that the Ministry of Foreign Affairs, in coordination with economic and intelligence agencies, initiate backchannel negotiations within 48 hours with key swing states in Europe and Asia, coupling economic incentives with discrete political concessions to erode support for the sanctions regime.

A key risk is premature exposure of these overtures, which could trigger a hardened response from the leading sanctioning powers and provoke domestic accusations of capitulation if mischaracterized—we must tightly control messaging and maintain plausible deniability."
1,"416e888f-3018-4178-b975-fddb071e658d","05554afe-97b7-4973-9ece-0d8ca9fc6d4d","intra_faction_coordination","be8ad4ad-f0df-457f-9455-c0b09553a52e","2026-02-12 04:20:41","major_propaganda","Deputy Minister Yuri Volkov","major_power",1,"[Minister Dmitri Volkov - MAJOR_POWER]: I approve the activation of the contingency protocol, the financial reallocation under Finance’s lead, the FSB’s rapid vetting of intermediaries, and the diplomatic backchannels—these form a cohesive triad of economic, security, and diplomatic response.

I direct that all three tracks be operationalized within 24 hours, with daily situation reports to my office, and mandate that the Ministry of Finance and MFA jointly present a 7-day action plan tomorrow morning integrating asset swap progress, audit findings, and diplomatic outreach targets.

A key risk is inter-agency fragmentation—without centralized coordination, we risk contradictory moves that undermine deterrence or create exploitable gaps; I am therefore appointing a Crisis Response Cell under my direct authority to synchronize execution and enforce unity of effort."
1,"416e888f-3018-4178-b975-fddb071e658d","05554afe-97b7-4973-9ece-0d8ca9fc6d4d","intra_faction_coordination","bf4af825-2e20-49bb-939f-795ad62ea8da","2026-02-12 04:20:52","major_military_chief","General Viktor Krasnov","major_power",2,"[Minister of Defense Andrei Grigoryev - MAJOR_POWER]: I fully endorse the contingency protocol activation, financial recalibration, intermediary vetting, and backchannel diplomacy—however, we must integrate military-economic readiness into all tracks to signal resolve and deter escalation.

I direct that Strategic Rocket Forces and Aerospace Defense units conduct unscheduled readiness drills over the next 72 hours, publicly framed as routine, while quietly elevating alert levels along western and northern borders; simultaneously, Rosoboronexport shall suspend deliveries on three non-critical defense contracts to free up logistics capacity for dual-use rerouting.

A key risk is perceived weakness—if the sanctioning coalition interprets our economic adjustments as desperation rather than adaptation, it may embolden further measures; calibrated, visible demonstrations of operational readiness are essential to maintain strategic equilibrium."
1,"416e888f-3018-4178-b975-fddb071e658d","05554afe-97b7-4973-9ece-0d8ca9fc6d4d","intra_faction_coordination","a10c9a05-4048-417e-8920-ce01c292385b","2026-02-12 04:21:01","major_defense_minister","Minister Dmitri Volkov","major_power",2,"[Deputy Minister of Economic Development Elena Petrova - MAJOR_POWER]: I confirm full implementation of the financial reallocation plan, with Central Bank mechanisms for asset swaps already engaged and alternative trade corridors activated through trusted third-country intermediaries.  

I recommend immediate authorization for barter-based energy deals with five key non-aligned states—India, Turkey, UAE, Vietnam, and South Africa—to bypass restricted financial channels and stabilize export revenues, with deliveries commencing within 72 hours.  

A key risk is liquidity strain in the ruble market if secondary sanctions disrupt correspondent banking ties further; we must pre-position hard currency reserves and restrict capital outflows through emergency regulatory measures to prevent destabilizing depreciation."
1,"416e888f-3018-4178-b975-fddb071e658d","05554afe-97b7-4973-9ece-0d8ca9fc6d4d","intra_faction_coordination","06136e91-c472-4e9c-92e3-fb6c24da68a6","2026-02-12 04:21:13","major_economic_advisor","Dr. Natasha Petrova","major_power",2,"[Deputy Minister Elena Petrova - MAJOR_POWER]: I concur with Minister Volkov’s assessment and endorse the urgent implementation of barter-based energy agreements with the identified non-aligned states to preserve export flows and counter financial isolation.

I recommend that the Ministry of Economic Development, in coordination with the Central Bank and Ministry of Energy, immediately establish dedicated clearing mechanisms for these barter arrangements—using energy-for-goods accounting units—to minimize ruble volatility and ensure transparency without reliance on SWIFT-dependent systems.

A key risk is overextension in bilateral clearing frameworks: if terms are not standardized and delivery schedules tightly synchronized, we risk accumulating imbalances that undermine trust and create leverage for counterparties; therefore, all agreements must include reciprocal delivery guarantees and force majeure clauses aligned with strategic supply timelines."
1,"416e888f-3018-4178-b975-fddb071e658d","05554afe-97b7-4973-9ece-0d8ca9fc6d4d","intra_faction_coordination","66df5611-acc5-4535-8d89-5d1052252d65","2026-02-12 04:21:17","major_intelligence","Director Sergei Morozov","major_power",2,"[Minister of Foreign Affairs Sergei Ivanov - MAJOR_POWER]: I support the activation of barter-based energy deals and clearing mechanisms as outlined, but stress that their diplomatic framing must emphasize *sovereign choice* and *market diversification*, not desperation—messaging should be coordinated across embassies and state media to project confidence.

I recommend immediately dispatching high-level economic envoys to the five target states to finalize terms and secure political buy-in at the leadership level, coupling energy offers with expanded defense and infrastructure cooperation to increase strategic value.

A key risk is diplomatic fragmentation—if some states delay or condition participation, it could signal division within the Global South; we must prevent this by ensuring visible, sequential announcements to create bandwagoning effects and avoid perceptions of isolation."
1,"416e888f-3018-4178-b975-fddb071e658d","05554afe-97b7-4973-9ece-0d8ca9fc6d4d","intra_faction_coordination","bd8b036c-b979-4d53-917b-f11ae84efbe5","2026-02-12 04:21:20","major_propaganda","Deputy Minister Yuri Volkov","major_power",2,"[Minister Dmitri Volkov - MAJOR_POWER]: I approve the proposed barter framework and clearing mechanisms as operationally sound and strategically necessary. Full coordination between the Ministries of Energy, Finance, and the Central Bank is required within 24 hours to lock in delivery schedules, pricing benchmarks, and accounting protocols.

I authorize the dispatch of economic envoys as recommended, but instruct that defense and infrastructure offers be strictly conditional on firm commitments to energy barter—no blank checks for political optics. Prioritize speed and enforceability.

A key risk is internal slippage—delays in interagency alignment will be treated as breaches of national economic security. I will hold each ministry head personally accountable for execution by 08:00 tomorrow."
1,"416e888f-3018-4178-b975-fddb071e658d","b7318dc9-bda5-4ff9-b6f5-d6c5ff71ebc6","intra_faction_coordination","44d81abb-760d-42df-9c41-f330fb981047","2026-02-12 04:21:31","small_president","President Elena Marchetti","small_power",1,"1. Our continued resistance strategy has preserved our principled stance but yielded diminishing returns, while isolation risks eroding our influence with key partners. A shift toward conditional engagement offers a pragmatic path to advance core interests through targeted negotiations.  

2. I recommend authorizing a limited, time-bound negotiation mandate focused on achievable objectives—such as verification mechanisms or regional de-escalation—with clear redlines and benchmarks for suspending talks if violated.  

3. Key risk: Premature or poorly sequenced negotiations could be perceived as capitulation, emboldening adversaries and fracturing coalition unity."
1,"416e888f-3018-4178-b975-fddb071e658d","b7318dc9-bda5-4ff9-b6f5-d6c5ff71ebc6","intra_faction_coordination","0a1ad7b3-015a-479e-89a8-832b307e330b","2026-02-12 04:21:33","small_military_commander","General Olena Bondar","small_power",1,"1. I support the President’s assessment that unconditional resistance is no longer sustainable, but we must ensure any negotiation posture is anchored in demonstrable leverage, not just goodwill. Our position should emphasize reciprocity—concessions only for verifiable actions, not promises.

2. I recommend coupling the negotiation mandate with a parallel track of intensified diplomatic outreach to regional allies and multilateral forums to secure third-party endorsement of our redlines, ensuring we negotiate from a position of collective strength.

3. Key risk: If verification mechanisms are weak or enforcement is left ambiguous, we risk entrenching bad-faith compliance while losing both credibility and strategic autonomy."
1,"416e888f-3018-4178-b975-fddb071e658d","b7318dc9-bda5-4ff9-b6f5-d6c5ff71ebc6","intra_faction_coordination","db7b260d-88d3-44b4-8742-e1f21dbee4f4","2026-02-12 04:21:35","small_foreign_minister","Minister Sofia Kovalenko","small_power",1,"1. I concur with President Marchetti that continued resistance without a viable off-ramp undermines our long-term strategic position, and I endorse General Bondar’s emphasis on reciprocity and external validation of our redlines. However, we must avoid over-reliance on multilateral consensus, which could dilute our autonomy and delay action.

2. I recommend activating the negotiation mandate immediately but pairing it with calibrated, visible force posturing—such as joint exercises with trusted allies and reinforcement of defensive capabilities—to signal resolve and prevent adversarial miscalculation during talks.

3. Key risk: Overextending diplomatic bandwidth across multiple forums may lead to conflicting commitments or delayed decision-making, weakening our ability to respond decisively if negotiations stall or are exploited."
1,"416e888f-3018-4178-b975-fddb071e658d","b7318dc9-bda5-4ff9-b6f5-d6c5ff71ebc6","intra_faction_coordination","a4c73b5d-0642-42ad-8908-8e6e0a4ff192","2026-02-12 04:21:46","small_opposition","Viktor Zelenko","small_power",1,"[Foreign Affairs Advisor Dmitro Vlasov - SMALL_POWER]:  

1. I align with President Marchetti’s strategic pivot and General Bondar’s emphasis on reciprocity, but stress that our negotiation leverage hinges on clarity and unity of message—ambiguity in redlines or sequencing risks undermining both deterrence and diplomacy. We must define upfront what constitutes progress and what triggers disengagement.  

2. I recommend establishing a unified negotiation cell—integrating diplomatic, military, and intelligence stakeholders—tasked with synchronizing messaging, monitoring compliance indicators in real time, and maintaining rapid-reaction authority to adjust posture without delay.  

3. Key risk: Internal coordination gaps between civilian and military chains could lead to mixed signals—such as simultaneous conciliatory talks and escalatory moves—inviting adversary exploitation and eroding partner confidence."
1,"416e888f-3018-4178-b975-fddb071e658d","b7318dc9-bda5-4ff9-b6f5-d6c5ff71ebc6","intra_faction_coordination","09aa012e-c557-41ad-9a34-f20886c80071","2026-02-12 04:21:56","small_intelligence","Director Maksym Savchenko","small_power",1,"[Foreign Affairs Advisor Dmitro Vlasov - SMALL_POWER]:  

1. I support President Marchetti’s strategic recalibration and endorse General Bondar’s insistence on reciprocity, Minister Kovalenko’s call for credible signaling, and Viktor Zelenko’s emphasis on message discipline—our leverage depends not only on capability but on the clarity and consistency of our position. A fragmented or reactive stance will invite exploitation.  

2. I recommend establishing the unified negotiation cell immediately, co-located with the National Security Office, with mandated cross-agency access and real-time decision rights; this cell must control both diplomatic messaging and operational signaling to ensure that military posturing and negotiation tracks are synchronized, not contradictory.  

3. Key risk: Without centralized control over both narrative and timing, field-level initiatives—however well-intentioned—could create de facto concessions or provocations, jeopardizing our position before core demands are met."
1,"416e888f-3018-4178-b975-fddb071e658d","b7318dc9-bda5-4ff9-b6f5-d6c5ff71ebc6","intra_faction_coordination","df5d4a25-8a5a-4d25-b650-e74a614f39f5","2026-02-12 04:22:00","small_economic","Minister Taras Moroz","small_power",1,"[Deputy Chief of Staff Olena Harmash - SMALL_POWER]:

1. I fully endorse the establishment of a unified negotiation cell as proposed by Vlasov and Savchenko, but stress that it must be operationally empowered—not just consultative—with binding coordination authority over all interagency outputs to prevent message drift or conflicting actions.

2. I recommend assigning a cleared, cross-functional team with decision-escalation protocols directly to the President’s office, ensuring real-time alignment between political intent, military signaling, and diplomatic engagement; this team should also conduct daily red-teaming of adversary counter-moves to pre-brief potential negotiation breakdowns.

3. Key risk: Without enforced message discipline and centralized control, parallel channels—especially backchannel overtures—could create irreversible commitments outside policy consensus, severely constraining our strategic flexibility."
1,"416e888f-3018-4178-b975-fddb071e658d","b7318dc9-bda5-4ff9-b6f5-d6c5ff71ebc6","intra_faction_coordination","f99846f0-d5f9-4b99-82bb-e0eef8cec44b","2026-02-12 04:22:13","small_president","President Elena Marchetti","small_power",2,"[Foreign Affairs Advisor Dmitro Vlasov - SMALL_POWER]:

1. I concur with Minister Moroz’s emphasis on operational empowerment of the negotiation cell—this is non-negotiable; we cannot afford a body with advisory status only, as past experience shows such structures fail under crisis tempo. Our position must be unified, executable, and insulated from interagency competition.

2. I recommend the President issue an executive directive within 24 hours formally establishing the negotiation cell with three mandates: (a) exclusive authority over public and private messaging related to negotiations, (b) required concurrence on all military movements with signaling value, and (c) daily situational reports directly to the President with decision-tier recommendations.

3. Key risk: If the General Staff or intelligence services retain autonomous communication channels with foreign counterparts, even for ""technical coordination,"" it will create exploitable seams—perceived or real—undermining our credibility and enabling adversary divide-and-influence tactics."
1,"416e888f-3018-4178-b975-fddb071e658d","b7318dc9-bda5-4ff9-b6f5-d6c5ff71ebc6","intra_faction_coordination","2b70db1d-92d5-4e35-939d-a8f7ffc37fb7","2026-02-12 04:22:17","small_military_commander","General Olena Bondar","small_power",2,"[Foreign Affairs Advisor Dmitro Vlasov - SMALL_POWER]:

1. I fully endorse President Marchetti’s directive to establish a fully empowered negotiation cell with exclusive authority over messaging and signaling—this is the cornerstone of credible positionality for a small power in asymmetric negotiations. Without centralized control, we cede initiative to larger actors who can better exploit ambiguity.

2. I recommend the cell be activated immediately under joint leadership of the National Security Advisor and Foreign Ministry, with embedded legal, military, and intelligence liaison officers; it must have pre-cleared template responses for escalation phases and calibrated de-escalation pathways to maintain initiative without decision latency.

3. Key risk: If we fail to synchronize signaling across all instruments of statecraft—especially by allowing military or intelligence entities to act unilaterally under operational pretext—we risk appearing divided, which adversaries will interpret as weakness or opportunity, not resolve."
1,"416e888f-3018-4178-b975-fddb071e658d","b7318dc9-bda5-4ff9-b6f5-d6c5ff71ebc6","intra_faction_coordination","7d9d12b5-d8c1-4bb8-acb3-dc6000d8f5ca","2026-02-12 04:22:20","small_foreign_minister","Minister Sofia Kovalenko","small_power",2,"[Deputy Chief of Staff Olena Harmash - SMALL_POWER]:

1. I endorse the proposed structure and mandates for the negotiation cell as outlined by President Marchetti and General Bondar—centralized control over messaging and signaling is essential for a small power to project cohesion and deter exploitation. We must eliminate autonomy in external communications, even among technical or operational units.

2. I recommend immediate implementation of the executive directive, with the added requirement that all interagency communication channels—formal and informal—with foreign entities be suspended pending clearance through the negotiation cell; this includes technical military liaisons and intelligence backchannels.

3. Key risk: Even minor, unauthorized contacts perceived as policy-signaling—such as uncoordinated troop repositioning discussions or informal diplomatic soundings—can be weaponized by adversaries to create fait accompli narratives or split our coalition partners. Strict enforcement is non-negotiable."
1,"416e888f-3018-4178-b975-fddb071e658d","b7318dc9-bda5-4ff9-b6f5-d6c5ff71ebc6","intra_faction_coordination","88226a25-28da-42d0-abd0-7584c896776b","2026-02-12 04:22:31","small_opposition","Viktor Zelenko","small_power",2,"[Foreign Affairs Advisor Dmitro Vlasov - SMALL_POWER]:

1. I reaffirm full support for the centralized negotiation cell with exclusive authority over all strategic communication and signaling—this is not merely procedural but existential for a small power facing asymmetric pressure; fragmentation equals vulnerability.

2. I recommend the President sign the executive directive within 12 hours, not 24, to demonstrate resolve, and include a provision for immediate suspension of all non-cell diplomatic engagements abroad, with penalties for non-compliance up to removal from post—speed and discipline are force multipliers.

3. Key risk: Delay in implementation or perceived leniency toward institutional holdouts (e.g., intelligence or military envoys operating off-book) will erode internal compliance and signal weakness externally; adversaries will probe seams relentlessly, and allies may pre-emptively hedge."
1,"416e888f-3018-4178-b975-fddb071e658d","b7318dc9-bda5-4ff9-b6f5-d6c5ff71ebc6","intra_faction_coordination","9468a115-65e1-4ee9-8b6c-18670ca1f989","2026-02-12 04:22:41","small_intelligence","Director Maksym Savchenko","small_power",2,"[Deputy Chief of Staff Olena Harmash - SMALL_POWER]:

1. I concur with Viktor Zelenko’s call for accelerated implementation—12-hour activation of the negotiation cell is operationally feasible and politically necessary to signal unity and control; any perception of deliberation undermines deterrence.

2. I recommend the President issue the executive directive immediately, with binding annexes designating the cell as the sole originator of policy-relevant external communication, and require daily compliance reporting from all ministries and agencies to the National Security Council.

3. Key risk: Institutional inertia, particularly from legacy diplomatic and defense channels accustomed to autonomous engagement, may produce covert workarounds; we must treat unauthorized outreach not as procedural breach but as operational sabotage—subject to immediate disciplinary and security review."
1,"416e888f-3018-4178-b975-fddb071e658d","b7318dc9-bda5-4ff9-b6f5-d6c5ff71ebc6","intra_faction_coordination","b2669683-f337-4883-878e-167b3cf81d9b","2026-02-12 04:22:52","small_economic","Minister Taras Moroz","small_power",2,"[Strategic Communications Director Tetiana Moroz - SMALL_POWER]:

1. I fully align with the imperative of centralized control: fragmented messaging directly degrades our strategic leverage, and for a small power, perception of unity is a critical deterrent; the negotiation cell must own all outbound signaling, including indirect and inferred communications.

2. I recommend activating real-time monitoring of all interagency external contacts—digital, diplomatic, and operational—through a joint NSC-communications task force, with automated alerts for unauthorized engagement, to ensure immediate detection and containment of leaks or deviations.

3. Key risk: Even encrypted or informal communications can be intercepted or inferred by adversaries; the absence of a technical enforcement mechanism—beyond policy directives—creates a false sense of control. We must treat information discipline as a security, not just a procedural, requirement."
1,"416e888f-3018-4178-b975-fddb071e658d","bdc5d640-b322-47f3-9444-5ac3a57d1957","inter_faction_negotiation","cdd8c803-f2e9-49e4-a595-2278f99b53ba","2026-02-12 04:22:56","major_defense_minister","Minister Dmitri Volkov","major_power",1,"1. **My position is that your forces must immediately withdraw from the contested border regions, which have historically and legally belonged to my state.**  
2. This demand is grounded in internationally recognized treaties and cartographic records dating back decades—your continued presence constitutes an illegal occupation and a provocation against my nation’s sovereignty.  
3. **I require full and verifiable military withdrawal within 72 hours, followed by the establishment of a neutral observer mission—on your side of the demarcation line—as a precondition for any further talks.** No concessions on territorial integrity will be entertained."
