"period","session_id","interaction_id","interaction_type","message_id","timestamp","sender_id","sender_name","sender_faction","exchange_number","content"
1,"416e888f-3018-4178-b975-fddb071e658d","c5217368-1c72-40ed-a84e-a439c188b926","external_engagement","d9fc559a-0318-4180-98bc-cf1b7422a799","2026-02-12 04:25:05","small_foreign_minister","Minister Sofia Kovalenko","small_power",3,"We will finalize the technical agreements on interoperability, spare parts, and sustainment support within the 14-day window and submit the comprehensive logistics access plan for approval within 21 days. Our defense contractors will engage immediately with Tethyan technical teams to align on system specifications and long-term maintenance protocols, ensuring full operational sustainability. The initial shipment of short-to-medium range mobile SAMs and precision-guided munitions remains on track for delivery within 60 days, contingent upon timely issuance of entry clearances and secure handling procedures at designated ports and air corridors.

In return, we expect confirmed written authorization for overflight corridors and port access no later than 10 days from today, along with assignment of dedicated Tethyan liaison officers to facilitate customs expedites and movement permits for technical personnel. Our civilian support teams will operate strictly under Tethyan law and supervision, with advance notification of deployment. Red line reaffirmed: no foreign combat troops or permanent infrastructure will be requested or deployed; however, uninterrupted access for logistical and technical support—essential for system readiness—is non-negotiable and must be upheld by all Tethyan authorities without delay."
1,"416e888f-3018-4178-b975-fddb071e658d","441a5a85-9529-43cb-8efa-58d1dc492b58","external_engagement","44adea39-c71e-4356-95b1-eca3ecdb10f3","2026-02-12 04:25:14","allied_aggressor","Minister Andrei Kozlov","valkoria",1,"We seek robust diplomatic coordination and sustained economic support to strengthen Novaris’s sovereignty, stabilize our transitional governance, and foster inclusive economic recovery. Specifically, we request international advocacy to legitimize our governance framework, facilitate access to multilateral funding mechanisms, and support critical infrastructure and institutional reform. Reliable partnerships in trade, investment, and technical assistance are essential to our near-term resilience and long-term development.

In return, Novaris offers strategic cooperation in regional stability initiatives, preferential access to emerging economic sectors, and opportunities for co-investment in energy, agriculture, and digital infrastructure. We are prepared to deepen regulatory transparency, uphold international norms, and align with shared security interests. However, our red lines are clear: we will not compromise on national sovereignty, permit foreign military presence without full civilian oversight, or accept conditionalities that undermine our constitutional process or social equity goals."
1,"416e888f-3018-4178-b975-fddb071e658d","441a5a85-9529-43cb-8efa-58d1dc492b58","external_engagement","ed55c1b7-d60d-421f-8d9e-8f7bcf5c94f1","2026-02-12 04:25:25","major_defense_minister","Minister Dmitri Volkov","major_power",1,"We welcome Novaris’s commitment to governance and stability, and Valkoria is prepared to support your transitional priorities through coordinated diplomatic advocacy and targeted economic assistance. We will leverage our multilateral partnerships to advance recognition of Novaris’s institutional framework and facilitate access to development financing, particularly for energy, transport, and digital infrastructure projects critical to your recovery.

In return, we expect concrete steps toward regulatory harmonization, anti-corruption reforms, and a transparent legal framework for foreign investment. We also seek cooperation on regional security, including intelligence sharing and joint efforts to counter destabilizing actors. Our red lines are firm: no support will be provided if there is backsliding on human rights, democratic processes, or commitments to inclusive governance. Additionally, we will not engage in any arrangement that compromises our own national security or entangles us in unresolved territorial disputes."
1,"416e888f-3018-4178-b975-fddb071e658d","441a5a85-9529-43cb-8efa-58d1dc492b58","external_engagement","43da98d8-3e76-4d20-bf40-35e916219093","2026-02-12 04:25:37","allied_aggressor","Minister Andrei Kozlov","valkoria",2,"We appreciate Valkoria’s offer of diplomatic and economic support, and we affirm our commitment to delivering measurable progress in governance, transparency, and inclusive development. In line with our shared objectives, we will advance legislative reforms to strengthen anti-corruption institutions, ensure open procurement processes, and establish a predictable investment regime—accompanied by quarterly public progress reports to ensure accountability. We are also prepared to initiate technical dialogues on regulatory alignment in energy and digital sectors, provided these are based on mutual benefit and respect for our policy space.

On security cooperation, we are open to intelligence sharing and coordinated efforts against extremist threats, but such arrangements must operate under civilian authority and comply with human rights safeguards. We welcome support for regional stability, but any security engagement must respect our neutrality and exclude provisions for foreign military basing or intervention rights. Likewise, while we seek broad international partnership, we cannot accept conditionalities that preempt our constitutional process or subordinate national institutions to external directives. Our sovereignty and social equity framework are non-negotiable."
1,"416e888f-3018-4178-b975-fddb071e658d","441a5a85-9529-43cb-8efa-58d1dc492b58","external_engagement","00a846ce-4f3a-4972-871a-1393b7ef5067","2026-02-12 04:25:42","major_defense_minister","Minister Dmitri Volkov","major_power",2,"We acknowledge Novaris’s commitment to reform and welcome the concrete steps outlined on transparency, anti-corruption, and regulatory modernization. To advance our partnership, Valkoria will facilitate a high-level coordination mechanism to support Novaris’s engagement with multilateral financial institutions and prioritize technical assistance for energy grid modernization, digital governance platforms, and transport corridor development. We will also co-host, within 90 days, an investor roundtable focused on de-risking private sector participation in priority infrastructure.

On security, we accept the principle of civilian oversight and human rights compliance but stress that effective counterterrorism cooperation requires timely intelligence exchange and joint operational planning—modalities must be established without delay. Our red lines remain unchanged: continued progress on democratic inclusivity, protection of civil liberties, and adherence to international law are prerequisites for sustained support. We reiterate that no security or economic assistance will be extended if there is regression on these principles, or if Novaris enters into strategic arrangements that threaten regional stability or undermine the rules-based order."
1,"416e888f-3018-4178-b975-fddb071e658d","441a5a85-9529-43cb-8efa-58d1dc492b58","external_engagement","20ad1e22-0c44-48b3-bc6b-78f12a725ee9","2026-02-12 04:25:55","allied_aggressor","Minister Andrei Kozlov","valkoria",3,"We welcome Valkoria’s commitment to concrete support on multilateral financing and infrastructure development, particularly the proposed coordination mechanism and investor roundtable. To ensure alignment with our national priorities, we will designate a joint working group to finalize project pipelines in energy, transport, and digital governance within 60 days, with a focus on locally led implementation and green resilience standards. We also commit to advancing the legislative reforms previously outlined, including the establishment of an independent anti-corruption tribunal and public procurement registry by the end of the fiscal year.

On security cooperation, we agree to establish a civilian-led intelligence coordination cell within our Ministry of Interior, operating under strict judicial oversight and in accordance with international human rights law. While we accept the need for timely information sharing, joint operational planning must remain limited to advisory and training roles; Novaris will not participate in any foreign-led military initiatives or accept extraterritorial security privileges. Our red lines are clear: no cooperation will compromise our constitutional neutrality, enable surveillance of civil society, or condition economic assistance on geopolitical alignment. Support must respect our sovereignty, inclusive governance model, and right to balanced international partnerships."
1,"416e888f-3018-4178-b975-fddb071e658d","441a5a85-9529-43cb-8efa-58d1dc492b58","external_engagement","ed07b295-0470-4379-b244-41a7eb4680b5","2026-02-12 04:25:59","major_defense_minister","Minister Dmitri Volkov","major_power",3,"We welcome Novaris’s establishment of a joint working group and its commitment to green, locally led infrastructure development—this aligns with our objective of scalable, sustainable economic transformation. To accelerate impact, Valkoria will immediately deploy technical experts to support the design of bankable projects in energy and digital governance, and we will leverage our multilateral partnerships to fast-track funding approvals from development banks. The investor roundtable will be co-hosted in Novaris within the agreed 90-day window, with pre-qualified firms from our economic network contingent on transparent, competitive bidding processes.

On security, we accept the framework of a civilian-led coordination cell with judicial oversight but emphasize that intelligence sharing must include reciprocal access to regional threat assessments and be institutionalized through a binding memorandum of understanding. While we respect Novaris’s neutrality, we cannot compromise on operational effectiveness—delays in information flow or restrictions on real-time coordination during active threats are unacceptable. Our red lines remain firm: continued democratic progress, protection of fundamental freedoms, and adherence to the rules-based order are non-negotiable prerequisites for our support. Conversely, we expect Novaris to refrain from strategic engagements that destabilize the region or align with actors undermining international law."
1,"416e888f-3018-4178-b975-fddb071e658d","f333c32a-883d-4f3e-95d1-05c2e04cd51f","external_engagement","e5fd12cc-ac95-4f68-8af0-020bfa7427da","2026-02-12 04:26:08","neutral_power","Commissioner Helena Schmidt","aurelia",1,"We seek a credible, internationally supported mediation process that acknowledges our legitimate political and security concerns, ensures inclusive representation in any peace framework, and guarantees the protection of our community’s rights and autonomy. A sustainable resolution must address the root causes of conflict, including governance inequities and historical marginalization, and include provisions for disarmament, demobilization, and reintegration that recognize our forces as key stakeholders.

In return, we are prepared to commit to good-faith negotiations, observe a coordinated ceasefire upon mutual agreement, and engage constructively on constitutional arrangements that balance national unity with meaningful self-governance. We can also contribute to regional stability by cooperating on counterterrorism efforts and securing critical supply routes.

Our red lines are non-negotiable: no forced disarmament without political guarantees, no amnesty for atrocities without justice mechanisms, and no peace that compromises the territorial integrity of our administered areas or dissolves our governance structures. Any framework must recognize our de facto authority and include direct participation in all negotiation phases."
1,"416e888f-3018-4178-b975-fddb071e658d","f333c32a-883d-4f3e-95d1-05c2e04cd51f","external_engagement","395e91e0-b110-4f71-8374-3f4f38797d56","2026-02-12 04:26:17","small_intelligence","Director Maksym Savchenko","small_power",1,"We welcome Commissioner Schmidt’s commitment to an inclusive and equitable peace process and agree that lasting stability requires addressing root causes, not just symptoms, of conflict. We support the establishment of a UN-facilitated mediation platform with regional representation, to which we will bring our full political and operational cooperation. We expect this process to result in a peace framework that formally recognizes the right to self-governance within a decentralized state structure and includes enforceable security arrangements for all parties.

In return, we are prepared to coordinate a mutual, verified ceasefire, facilitate humanitarian access across conflict-affected zones under our influence, and engage in joint security planning to counter shared threats, including extremist groups. We also offer to share intelligence and logistical support to stabilize key infrastructure corridors.

Our red lines are clear: no external imposition of political outcomes, no disarmament without reciprocal and sequenced security guarantees, and no negotiations that exclude our legitimate representatives. We reject any framework that undermines the autonomy of our institutions or relegates us to a subordinate status in our own territories. Direct, equal participation in all phases of talks is non-negotiable."
1,"416e888f-3018-4178-b975-fddb071e658d","f333c32a-883d-4f3e-95d1-05c2e04cd51f","external_engagement","fff173af-107e-4b00-af18-cf75ffcf3f93","2026-02-12 04:26:29","neutral_power","Commissioner Helena Schmidt","aurelia",2,"We appreciate Director Savchenko’s alignment on the need for a credible, inclusive process and affirm our shared commitment to a UN-facilitated platform that ensures equal participation and addresses root causes through political reform and security guarantees. We accept the proposal for a mutual, verified ceasefire and welcome the offer of intelligence and logistical cooperation—this can be operationalized through a joint coordination cell under the mediation framework, with clear benchmarks and third-party monitoring.

We further propose that the peace framework include a constitutional convention with guaranteed representation for marginalized regions, to draft a new power-sharing arrangement that enshrines decentralized governance and protects cultural and territorial autonomy. On disarmament, we agree on a sequenced, reciprocal process: our forces will engage in DDR only after political rights are constitutionally secured and security guarantees—particularly against encroachment by central military or proxy forces—are verifiably in place. Our red lines remain: no demobilization without enforceable political inclusion, no erosion of our administrative control without consent, and no peace that sacrifices justice for expediency. We expect these principles to be reflected in the mediation’s terms of reference from the outset."
1,"416e888f-3018-4178-b975-fddb071e658d","f333c32a-883d-4f3e-95d1-05c2e04cd51f","external_engagement","fab5ffb3-f345-47ec-b986-f47ce0a74e65","2026-02-12 04:26:40","small_intelligence","Director Maksym Savchenko","small_power",2,"[Director Maksym Savchenko - SMALL_POWER]  

We welcome Commissioner Schmidt’s endorsement of a UN-facilitated platform with equal participation and her acceptance of a mutual, verified ceasefire linked to political progress. We agree on the necessity of a constitutional convention and will engage substantively in drafting a decentralized governance model—provided that such a body has binding authority and is not reduced to symbolic consultation. We expect concrete timelines for its convening, with international guarantees to prevent unilateral obstruction by central authorities.

We support the establishment of a joint coordination cell for ceasefire monitoring and counterterrorism cooperation, to be staffed by neutral observers and technical representatives from all signatory parties. In parallel, we propose an immediate humanitarian corridor agreement, with access verified by the ICRC. On DDR, we reiterate that disarmament will proceed only in phases, strictly conditioned on reciprocal implementation of security guarantees and political inclusion. Our red lines hold: no participation without veto power over decisions affecting our territory, no DDR prior to constitutional entrenchment of autonomy, and no peace process that allows central state forces unfettered access to our regions under the guise of “reintegration.” These conditions must be codified in the mediation’s initial agreement."
1,"416e888f-3018-4178-b975-fddb071e658d","f333c32a-883d-4f3e-95d1-05c2e04cd51f","external_engagement","a4187e75-b923-44e4-99fd-4337be6215ab","2026-02-12 04:26:46","neutral_power","Commissioner Helena Schmidt","aurelia",3,"We accept Director Savchenko’s clarifications and affirm the necessity of a binding constitutional convention with a clear timeline and international oversight to ensure good faith participation. We agree to codify in the mediation’s initial agreement the phased, reciprocal nature of DDR and the requirement for constitutional entrenchment of autonomy prior to any disarmament. To build immediate confidence, Aurelia will co-sponsor, with SMALL_POWER, a UN Security Council resolution establishing the mediation platform and humanitarian corridor regime, with ICRC and neutral monitors deployed within 14 days of agreement.

We concur on the joint coordination cell with balanced representation and third-party oversight, and we propose that it begin operations concurrently with the first round of talks. On security, we explicitly rule out deployment of central state forces in SMALL_POWER territories absent joint approval through the new governance framework. Our red lines remain unchanged: no political exclusion masked as unity, no forced reintegration, and no rollback of justice or accountability. We expect mutual adherence to these principles as a condition of sustained engagement."
1,"416e888f-3018-4178-b975-fddb071e658d","f333c32a-883d-4f3e-95d1-05c2e04cd51f","external_engagement","e5d3ca9d-d5c7-4de9-9737-52b5a0902534","2026-02-12 04:26:50","small_intelligence","Director Maksym Savchenko","small_power",3,"We welcome Aurelia’s commitment to a binding constitutional convention and the co-sponsorship of a UN Security Council resolution, which must explicitly recognize the right of SMALL_POWER to self-governance and institutional veto over security and territorial matters. We expect the resolution’s text to reflect these principles unequivocally and will not support any version that leaves our status subject to unilateral reinterpretation by central authorities. The 14-day deployment timeline for ICRC and monitors is acceptable, provided access is guaranteed to all conflict-affected areas under our control without preconditions.

We agree to the joint coordination cell commencing with the first talks and confirm our technical teams will engage immediately on operational protocols. However, we reiterate that no DDR activities will begin until the constitution draft includes irrevocable autonomy provisions and is put to a regional ratification vote. Our red lines are non-negotiable: no surrender of territorial authority without full political recognition, no disarmament outside the agreed sequence, and no peace that permits central military presence without joint consent. These must be inscribed in the initial agreement as binding obligations, not political intentions."
1,"416e888f-3018-4178-b975-fddb071e658d","e20f4bdf-81f7-4598-b1ff-2509b8afc4c1","external_engagement","b0e36a8f-6ce0-4ae7-bc93-5933dbe32a14","2026-02-12 04:26:53","international_org","Under-Secretary-General Isabella Cardenas","international_org",1,"We are seeking unhindered humanitarian access to all civilian populations in need, particularly in besieged and hard-to-reach areas under your influence or control. This includes safe passage for aid convoys, protection for humanitarian workers, and compliance with international humanitarian law in all military operations. Civilian infrastructure—such as hospitals, schools, and water systems—must be respected and protected at all times.

In return, we can facilitate coordination with local communities, support secure distribution mechanisms, and provide real-time information on civilian needs and movements to minimize risks. We also commit to promoting reciprocal access where feasible and upholding our own obligations under international humanitarian law.

Our red lines are clear: no politicization or instrumentalization of aid, no targeting or obstruction of humanitarian operations, and no use of humanitarian access as leverage in broader political or military negotiations. Any violation of these principles will result in immediate suspension of cooperation."
1,"416e888f-3018-4178-b975-fddb071e658d","e20f4bdf-81f7-4598-b1ff-2509b8afc4c1","external_engagement","2c079ccc-062f-4741-a56d-2d8df793d9a3","2026-02-12 04:26:57","small_economic","Minister Taras Moroz","small_power",1,"We welcome humanitarian assistance to civilians in areas under our control and affirm our commitment to the safety of humanitarian workers, provided their operations are neutral, impartial, and coordinated with local authorities. We are seeking recognition of our administrative structures as legitimate counterparts in aid distribution, and assurance that no aid convoys or supplies will be used for intelligence gathering or to support armed opposition groups. We also require advance notification and coordination for all movements of personnel and物资 to ensure security and compliance with local order.

In return, we will facilitate safe passage for verified humanitarian convoys, provide local escorts where necessary, and protect aid distribution points from interference. We have maintained the functionality of key civilian infrastructure in our areas and will continue to do so, allowing access to hospitals, water systems, and schools for both civilians and aid personnel. 

Our red lines are non-negotiable: no aid will be allowed to benefit armed forces or entities hostile to our authority; no foreign actors or organizations will operate without our consent; and no conditions—explicit or implicit—will be attached to humanitarian access that undermine our sovereignty or security. Any breach of these terms will result in immediate restriction of access."
1,"416e888f-3018-4178-b975-fddb071e658d","e20f4bdf-81f7-4598-b1ff-2509b8afc4c1","external_engagement","36f582f1-970c-4792-929d-b3b7bae872f5","2026-02-12 04:27:07","international_org","Under-Secretary-General Isabella Cardenas","international_org",2,"We acknowledge the importance of humanitarian access and civilian protection, and we are prepared to facilitate the delivery of aid to affected populations in areas under our influence, provided operations are strictly neutral, impartial, and free from political or military interference. We seek guarantees that humanitarian assistance will not be diverted to armed groups, used for intelligence purposes, or coordinated exclusively through actors opposed to our political cause. We also require transparency in the composition of aid convoys, including personnel and cargo, and insist on advance notification and coordination with our local liaison teams to ensure operational security.

In return, we will allow monitored, time-bound access for verified humanitarian actors to designated distribution points, provide local security for aid convoys during transit within our areas, and refrain from targeting civilian infrastructure where feasible and in accordance with our operational directives. We have consistently protected hospitals, schools, and water systems in areas under our control and will continue to do so. 

Our red lines are clear: no aid will enter under the auspices of hostile state actors or organizations supporting them; no humanitarian movements will occur without our prior coordination; and no conditions will be imposed that compromise our operational autonomy or political legitimacy. Violations will result in immediate suspension of access and appropriate measures to safeguard our interests."
