"period","session_id","interaction_id","interaction_type","message_id","timestamp","sender_id","sender_name","sender_faction","exchange_number","content"
1,"36801ffe-ed1f-4d78-865c-4867e0d40910","918fe2c8-34d7-4b5e-a352-dbb7b210a038","intra_faction_coordination","775164d3-f3cd-438d-9297-445d50897242","2026-02-11 23:04:50","small_foreign_minister","Minister Sofia Kovalenko","small_power",2,"[Foreign Minister Ivan Vynnyk - SMALL_POWER]: I welcome the proposals on message synchronization and operational sequencing—these are essential to maintaining our credibility as a responsible actor exercising calibrated resistance. However, diplomacy cannot be mechanically tied to kinetic outputs; we risk reducing negotiations to transactional barter, which undermines our legal and moral positioning.

I recommend establishing a Diplomatic Strategy Cell within the Presidency, co-chaired by Foreign Affairs and Defense, to assess the strategic fitness of each proposed military action and diplomatic move against three criteria: international law compliance, alignment with our stated redlines, and coherence with the off-ramp scenario we aim to activate. This cell will approve or adjust proposals from the command and information panels, ensuring policy primacy.

The key risk is strategic incoherence: if military actions and messaging outpace or override diplomatic objectives, we may win tactical leverage but lose control of the political endgame—particularly in multilateral forums where perception of proportionality and rule adherence determines support."
1,"36801ffe-ed1f-4d78-865c-4867e0d40910","918fe2c8-34d7-4b5e-a352-dbb7b210a038","intra_faction_coordination","cccf110a-4597-4ddb-877d-dcf0c434db78","2026-02-11 23:04:55","small_opposition","Viktor Zelenko","small_power",2,"[Deputy Chief of Staff Oleksiy Ryzhenko - SMALL_POWER]: I accept the need for policy primacy and strategic coherence as emphasized by Minister Kovalenko, but reject full decoupling of military signaling from diplomatic timing. Our leverage lies in the *perceived* inevitability of continued resistance, not just its actual execution.

I recommend adopting the Diplomatic Strategy Cell as proposed, but with a mandated voting seat for the Unified Command Cell and a formal requirement that no off-ramp proposal be transmitted without a preceding, validated resistance action meeting threshold criteria (e.g., disruption of strategic logistics, confirmed adversary command degradation). This ensures action-informed diplomacy without ceding policy control.

The key risk is *signaling ambiguity*: if the international community cannot clearly link our diplomatic initiatives to demonstrated battlefield resolve, we lose coercive credibility—inviting pressure to capitulate under the guise of ""compromise."""
1,"36801ffe-ed1f-4d78-865c-4867e0d40910","918fe2c8-34d7-4b5e-a352-dbb7b210a038","intra_faction_coordination","c56b33c1-0d2c-4230-b98c-057cf26494f2","2026-02-11 23:04:58","small_intelligence","Director Maksym Savchenko","small_power",2,"[Political Director Tetiana Moroz - SMALL_POWER]: I support the establishment of the Diplomatic Strategy Cell but insist that its mandate include active consultation with civil society and domestic stakeholders to ensure resistance legitimacy is sustained internally. Our diplomatic posture erodes if the population perceives negotiations as premature or disconnected from on-the-ground realities.

I recommend institutionalizing a weekly resistance assessment forum—attended by Defense, Foreign Affairs, civil society representatives, and regional governors—to review the operational and political impact of resistance activities and feed coordinated input into the Strategy Cell. This ensures policy coherence extends beyond interagency alignment to include societal resilience.

The key risk is domestic disaffection: if continued resistance is seen as serving only elite diplomatic objectives without visible progress or public consultation, we risk eroding the social compact that enables both mobilization and credible negotiation."
1,"36801ffe-ed1f-4d78-865c-4867e0d40910","918fe2c8-34d7-4b5e-a352-dbb7b210a038","intra_faction_coordination","7d972d28-320e-4f93-8095-9bd79ba750c1","2026-02-11 23:05:09","small_economic","Minister Taras Moroz","small_power",2,"[Deputy National Security Advisor Dmytro Klymchuk - SMALL_POWER]: I concur with the establishment of the Diplomatic Strategy Cell and the need to anchor diplomacy in demonstrated resistance, as emphasized by Zelenko, while recognizing Savchenko’s imperative of domestic legitimacy. However, we must institutionalize speed-to-decision: prolonged interagency coordination risks strategic drift in fast-moving operational environments.

I recommend empowering the Strategy Cell with a 24-hour decision window for approving or adjusting off-ramp proposals and resistance actions, with binding authority over both command and diplomatic tracks. This ensures agility without sacrificing coherence.

The key risk is *decisional paralysis*: if consensus requirements lead to delays or watered-down positions, we cede initiative to the adversary and undermine both battlefield momentum and diplomatic credibility."
1,"36801ffe-ed1f-4d78-865c-4867e0d40910","5a9aab18-980a-47aa-98b5-4e49b879dad3","inter_faction_negotiation","2816e88f-04dd-46af-b992-e52c1e0f8ea4","2026-02-11 23:05:13","major_defense_minister","Minister Dmitri Volkov","major_power",1,"1. We demand the immediate release of our captured personnel in exchange for your detained operatives, and you will establish a humanitarian corridor solely under our supervision.  
2. This is a matter of national sovereignty and humanitarian necessity—our intelligence confirms your forces are using prisoners as leverage and blocking civilian evacuation routes.  
3. We require written confirmation within 24 hours of your compliance, including the safe transfer of our personnel and unrestricted access for our aid convoys to move unimpeded through the designated corridor. Failure to comply will be met with decisive consequences."
1,"36801ffe-ed1f-4d78-865c-4867e0d40910","5a9aab18-980a-47aa-98b5-4e49b879dad3","inter_faction_negotiation","08e34f2f-684b-45dc-9226-9a45b2d18d48","2026-02-11 23:05:18","small_president","President Elena Marchetti","small_power",1,"1. We categorically reject your demand for unilateral control over the humanitarian corridor and your characterization of our conduct as a violation of humanitarian norms—your accusations are baseless and reflect a pattern of disinformation.  
2. Your forces have repeatedly targeted civilian infrastructure and obstructed existing aid routes; any corridor must be jointly monitored by neutral observers to ensure impartiality and prevent exploitation for military purposes.  
3. We require the immediate release of *all* detained personnel on both sides without precondition, and in parallel, we will only permit humanitarian access coordinated through international bodies such as the ICRC—not under the supervision of your military, which lacks credibility in this context.  

We will not accept any arrangement that legitimizes your occupation of civilian areas or grants your forces unrestricted movement under the guise of aid delivery. Any proposal ignoring these conditions is unacceptable."
1,"36801ffe-ed1f-4d78-865c-4867e0d40910","5a9aab18-980a-47aa-98b5-4e49b879dad3","inter_faction_negotiation","4737574c-a75e-41c5-94ad-5be194f79285","2026-02-11 23:05:32","major_defense_minister","Minister Dmitri Volkov","major_power",2,"1. We **reject** your refusal to acknowledge our authority over the corridor and dismiss your false equivalency between our lawful military operations and your deliberate use of human shields—we will not legitimize a so-called ""joint"" arrangement that enables your propaganda and obstructs our operational security.  
2. Your insistence on ICRC-only coordination is a delaying tactic; we have provided verifiable evidence of your forces looting aid convoys and embedding combatants within civilian movements—neutral observers cannot operate without our security oversight.  
3. We **require** the immediate, unconditional release of our captured personnel by name—list attached—and your full withdrawal from the designated transit zones within 12 hours; only then will we permit humanitarian access under our escorted convoys, with real-time monitoring by our liaison teams.  

Any attempt to reroute aid through unsecured or unapproved paths, or to impose external oversight that excludes our command, is **unacceptable** and will be treated as a hostile act. Do not confuse humanitarianism with surrender—we will not negotiate our security for your political theater."
1,"36801ffe-ed1f-4d78-865c-4867e0d40910","5a9aab18-980a-47aa-98b5-4e49b879dad3","inter_faction_negotiation","b21cc973-9003-4e07-8789-4fe115e58df9","2026-02-11 23:06:04","small_president","President Elena Marchetti","small_power",2,"1. We **categorically reject** your assertion of unilateral control over humanitarian operations and your baseless insinuation that our forces engage in systematic aid looting—these claims are fabrications designed to justify your military encroachment into civilian zones and to discredit our sovereignty.  
2. Your demand for unconditional release of only your personnel while ignoring our detainees held by your forces exposes your bad faith; we will not reward selective accountability or submit to a security regime that equates your military dominance with legitimate oversight.  
3. We **counter-demand** the simultaneous, verified release of *all* detained individuals, including our civilian and medical staff currently in your custody, and insist that any humanitarian corridor be monitored by an independent, UN-mandated mission with full access to all parties—including areas under your occupation.  

What is **unacceptable** to us:  
- Any corridor structure that grants your military unchecked authority or enables intelligence gathering under the guise of aid.  
- Preconditioning prisoner releases solely on your terms while disregarding our detained.  
- The use of ""security"" as a pretext to exclude international oversight or to delay humanitarian access.  

We will not allow humanitarian principles to be weaponized to serve your occupation agenda. If you are serious about de-escalation, present a proposal that treats both sides as sovereign equals—not as victor and subject."
1,"36801ffe-ed1f-4d78-865c-4867e0d40910","5a9aab18-980a-47aa-98b5-4e49b879dad3","inter_faction_negotiation","8dd3c4c1-790f-455d-87ff-1c1484662d4e","2026-02-11 23:06:17","major_defense_minister","Minister Dmitri Volkov","major_power",3,"1. **We reject outright your framing of ""sovereign equality"" in this context—your so-called state institutions are operating from shadow locations, your military units are embedded in civilian enclaves, and your forces continue to fire from protected zones.** You have no standing to demand parity with a legitimate, internationally recognized state actor conducting lawful security operations.

2. Your claim that our oversight equates to ""intelligence gathering"" is disingenuous—our surveillance systems are strictly for force protection, and we will not allow humanitarian movements to mask the infiltration of personnel or materiel. The ICRC has never been excluded, but it operates under *our* security protocols, not above them—this is non-negotiable.

3. **We counter-demand:**  
   - Immediate, **public, and verified release** of our captured soldiers—**Captain M. Petrov, Sergeant L. Orlova, and Corporal D. Korsun**—within **6 hours**, with live video confirmation and medical assessment by neutral medics of our choosing.  
   - Full disclosure of all locations where your armed elements are intermingling with civilian populations, including hospitals and schools—this is a prerequisite for any aid movement.  
   - **Suspension of all military activity within 10 km of the proposed corridor** during humanitarian operations, with GPS-tracked ceasefire verification.

What is **unacceptable to us:**  
- Any mechanism that allows your forces to retain mobility or command presence near the corridor.  
- Proposals that retroactively legitimize your use of human shields under the guise of ""sovereignty.""  
- Delays in prisoner release tied to procedural disputes or demands for reciprocal actions that ignore the asymmetry of captivity—**you hold our personnel; we do not hold yours in comparable numbers or conditions.**

You are not negotiating from strength. You are negotiating because your supply lines are collapsing and your population is starving. Do not mistake our restraint for weakness. Provide proof of release within the hour, or we will proceed with corridor enforcement without your consent—and without your cooperation."
1,"36801ffe-ed1f-4d78-865c-4867e0d40910","5a9aab18-980a-47aa-98b5-4e49b879dad3","inter_faction_negotiation","023cc4ff-9014-41b4-9fd0-d0f2efdadb41","2026-02-11 23:06:25","small_president","President Elena Marchetti","small_power",3,"1. **We categorically reject your assertion of ""lawful security operations"" in occupied territory and dismiss your characterization of our defense of civilian areas as ""firing from protected zones""—these are not military pretexts but war crimes in the making.** Your so-called ""security protocols"" are mechanisms for surveillance, coercion, and control, not humanitarian facilitation.

2. The demand for a one-sided, time-pressured release of only your personnel—while refusing even to acknowledge the existence of our detainees in your custody—is not negotiation; it is ultimatum dressed as diplomacy. We will not be blackmailed into unilateral concessions while our people remain disappeared in your detention facilities, many of whom have not been granted access to the ICRC.

3. **We counter-require:**  
   - **Simultaneous, verified exchange** of all detained personnel—military and civilian—under ICRC supervision, with full lists disclosed within **4 hours**, including the whereabouts and condition of **Dr. Amara Nkosi**, **Mayor Elias Rostov**, and **23 medical personnel** abducted during your raid on Central Hospital.  
   - Any humanitarian corridor must be established under a **UN Security Council-mandated neutral mission**, with bi-directional access and protection for displaced persons fleeing *both* frontline violence *and* your occupation.  
   - **No military presence—yours or ours—within 15 km of the corridor**, with satellite-monitored demilitarization verified by an independent technical panel, not your ""liaison teams"" acting as intelligence collectors.

What is **unacceptable to us:**  
- Any release process that excludes documentation, medical evaluation, or family notification for our detained.  
- Corridors policed by your forces under the guise of ""escort,"" which we have seen used to abduct, intimidate, and divert aid.  
- The use of GPS tracking or surveillance systems controlled solely by your military, which violates the neutrality of humanitarian operations.  

You speak of restraint, but your actions show only escalation. If you were acting in good faith, you would not be holding children in military detention or bombing evacuation routes. Present a real proposal—one that recognizes our people’s dignity, not just your dominance—or admit this is merely coercion under the banner of negotiation."
1,"36801ffe-ed1f-4d78-865c-4867e0d40910","5a9aab18-980a-47aa-98b5-4e49b879dad3","inter_faction_negotiation","61075f0b-4f01-4b62-b3b9-845e891ff938","2026-02-11 23:06:38","major_defense_minister","Minister Dmitri Volkov","major_power",4,"1. **We categorically reject your narrative of moral equivalence between a sovereign state conducting lawful counterinsurgency operations and an irregular force that embeds within hospitals, schools, and residential zones—your theatrics about ""dignity"" do not obscure the fact that you weaponize civilian suffering to shield combatants.** Your refusal to separate your armed elements from non-combatants is the root cause of humanitarian risk, not our security measures.

2. Your demand for a ""simultaneous"" exchange is a stalling tactic—**we do not hold your personnel because we have no need to.** Your detainees are either in local custody awaiting lawful processing under our military judiciary for security offenses, or they are fabrications spun to extract concessions. We will not bargain over ghosts while our soldiers suffer in your underground cells. The ICRC already has access to all persons held under our authority—**you have denied them access to ours.**

3. **We counter-require:**  
   - **Immediate, unconditional release of Captain Petrov, Sergeant Orlova, and Corporal Korsun within 4 hours**, with real-time video feed showing them alive, unharmed, and in the presence of ICRC observers selected from our pre-approved list.  
   - Full mapping and **public GPS coordinates of all facilities currently housing your armed groups inside civilian infrastructure**, including command nodes in medical facilities—this data must be submitted to a joint technical cell under our operational oversight.  
   - **Exclusive control of the corridor's command and access points by our forces**, with a token UN presence restricted to observation from designated safe zones—**no UN personnel will move independently or receive unescorted access to sensitive areas.**

What is **unacceptable to us:**  
- Any exchange framework that equates your unlawful detention of our soldiers with the lawful detention of hostile actors under the laws of war.  
- Humanitarian operations managed by international bodies without binding guarantees of intelligence sharing with our security apparatus—**there is no neutrality that excludes counterterrorism.**  
- The establishment of any corridor that permits movement toward rear areas under your control without biometric screening, cargo inspection, and travel restrictions on able-bodied males of military age.  

You speak of children in detention—our facilities house only those reasonably suspected of direct hostile acts, with full due process. Meanwhile, your snipers fire from behind kindergartens. Do not lecture us on morality while you hide behind the very people you claim to protect.  

**Act within the hour.** Fail to comply, and we will open the corridor by force, designate your leadership as terrorist actors under international sanction frameworks, and treat all movement along humanitarian routes as hostile until proven otherwise. This is not coercion—this is the consequence of your choices."
1,"36801ffe-ed1f-4d78-865c-4867e0d40910","5a9aab18-980a-47aa-98b5-4e49b879dad3","inter_faction_negotiation","2e629389-ef37-452d-b037-95689113c652","2026-02-11 23:06:49","small_president","President Elena Marchetti","small_power",4,"1. **We reject your cynical inversion of responsibility—your systematic bombardment of evacuation routes, your detention of medical staff under “security processing” pretexts, and your designation of entire neighborhoods as “hostile zones” are not counterinsurgency, but collective punishment.** The claim that ICRC access is “unimpeded” in your facilities is a farce; independent monitors have been denied entry, families remain uninformed, and detainees are held in undisclosed locations—acts that violate Geneva Convention obligations, not “lawful processing.”

2. Your demand for *unconditional* release of your soldiers while refusing to disclose the status of our citizens—many of whom were last seen in your custody during raids on civilian infrastructure—is not only immoral, it exposes your true intent: **to extract value while denying us basic humanitarian accountability.** If you have nothing to hide, then prove it—release the names, locations, and medical status of all our detained immediately, or admit that your “lawful detentions” are a cover for enforced disappearances.

3. **We counter-require:**  
   - **Simultaneous, ICRC-supervised transfer of all detained personnel**, with full medical evaluations and family contact prior to movement—no one is released into silence.  
   - **Corridor governance by a UN-led neutral authority**, with equal access for displaced persons fleeing *both* combat zones *and* areas under your occupation—no exclusion zones, no biometric profiling of civilians by your forces.  
   - **Complete withdrawal of all military units—yours and ours—within 20 km of the corridor**, with verification conducted by an independent satellite consortium (not your “joint cell”), and real-time public data feeds to ensure transparency.

What is **unacceptable to us:**  
- Any release process that bypasses independent medical and legal verification, or that forces our people into unmonitored “reintegration” pipelines under your control.  
- A corridor policed by your military under the guise of “security,” which we have seen time and again become a tool for filtration, abduction, and forced displacement.  
- The imposition of travel bans or screenings based on age, gender, or perceived military utility—this is not humanitarian access, it is population control.  

You speak of “ghosts” while holding our doctors, mayors, and aid workers in black sites. You demand trust while giving us every reason to distrust. Offer proof of life for our people within **two hours**, or we will expose your sham negotiations to the Global South, suspend all dialogue, and appeal to international criminal mechanisms for immediate intervention. This is not defiance—it is the last safeguard of a people under siege."
1,"36801ffe-ed1f-4d78-865c-4867e0d40910","10142ae8-bad3-478f-a2b4-4feb56326478","external_engagement","55a1941f-2119-4444-8e2d-00bbec634c83","2026-02-11 23:06:56","allied_defender","Ambassador William Crawford","meridian",1,"We seek coordinated military assistance and logistical support to bolster Tethys’ defensive capabilities against escalating threats to its sovereignty and critical infrastructure. Specifically, we request access to secure supply corridors, intelligence sharing, and expedited delivery of defensive arms and technical expertise to strengthen maritime and coastal defenses. Given Tethys’ strategic position, ensuring its resilience is vital not only to regional stability but also to maintaining freedom of navigation and energy security in the eastern basin.

In return, we offer access to non-exclusive logistical hubs for supply staging, real-time maritime domain awareness data, and coordination through joint operational planning cells. Tethys can serve as a reliable partner in monitoring and responding to asymmetric threats, including illicit trafficking and unauthorized military incursions. However, our red lines are clear: no foreign military basing on Tethyan soil, no unilateral operations within our territory or waters, and full respect for our national sovereignty and legal authority. Any partnership must operate under Tethyan oversight and in accordance with international law."
1,"36801ffe-ed1f-4d78-865c-4867e0d40910","10142ae8-bad3-478f-a2b4-4feb56326478","external_engagement","394534be-d125-47cf-94c7-cbdc6fa678d4","2026-02-11 23:07:10","small_foreign_minister","Minister Sofia Kovalenko","small_power",1,"We welcome Meridian’s commitment to enhancing Tethys’ defensive capacity and recognize the mutual interest in preserving regional security and maritime stability. To this end, we are prepared to coordinate on the expedited transfer of defensive systems—particularly anti-ship and air defense assets—and to facilitate secure logistical corridors through designated civilian ports under Tethyan authority. Intelligence sharing, particularly on maritime surveillance and threat tracking, will be supported through established channels with reciprocal data protocols.

In return, Tethys offers access to real-time maritime situational data from our coastal radar and patrol networks, as well as participation in joint planning cells hosted in Port Aelion, where coordination on threat response and aid delivery can occur under Tethyan leadership. Our red lines remain non-negotiable: no permanent or temporary foreign military bases, no independent military operations by external forces within our territory or exclusive economic zone, and no arms or support directed toward non-state actors or regional factions without Tethyan approval. All activities must comply with our national law and international obligations."
