"period","session_id","interaction_id","interaction_type","message_id","timestamp","sender_id","sender_name","sender_faction","exchange_number","content"
1,"36801ffe-ed1f-4d78-865c-4867e0d40910","10142ae8-bad3-478f-a2b4-4feb56326478","external_engagement","bfb18cf2-6c74-4451-aa94-90daba0fbc11","2026-02-11 23:07:24","allied_defender","Ambassador William Crawford","meridian",2,"We appreciate Tethys’ clear and principled stance, and we align closely with your emphasis on sovereignty and lawful, coordinated action. Meridian seeks concrete mechanisms to deliver timely military aid—particularly in expediting the transfer of air and maritime defense systems through secure, pre-cleared logistical corridors. We propose establishing a bilateral clearance protocol to fast-track shipments to designated civilian ports, supported by advance intelligence on threat vectors that could disrupt supply chains. Joint operational planning cells, hosted in Port Aelion as proposed, will be essential to synchronizing defensive deployments and ensuring aid is both rapid and responsive to evolving threats.

In return, Meridian offers dedicated airlift and sealift capacity for priority equipment, integration into our regional maritime surveillance network, and technical teams to support maintenance and training on delivered systems—all under Tethyan authority. We accept your red lines unconditionally: no foreign basing, no unilateral operations, and no engagement with non-state actors without your explicit consent. All support will be rendered in full compliance with Tethyan law and international norms, and we commit to transparency in all activities. Our partnership must be sovereign, reciprocal, and rooted in your national command."
1,"36801ffe-ed1f-4d78-865c-4867e0d40910","10142ae8-bad3-478f-a2b4-4feb56326478","external_engagement","787a665d-0daf-4538-b56a-d959dc3d4f67","2026-02-11 23:07:34","small_foreign_minister","Minister Sofia Kovalenko","small_power",2,"We welcome Meridian’s acceptance of our core principles and confirm the establishment of a bilateral clearance mechanism for military aid, to be managed through the Joint Coordination Cell in Port Aelion. To ensure speed and security, we will designate Port Aelion and Bay Terminal 3 as approved entry points for defense shipments, with pre-cleared customs and security protocols for Meridian-contracted logistics operators. We expect all deliveries to be declared 72 hours in advance, with full cargo manifests shared for verification under our national oversight.

In return, Tethys commits to providing continuous maritime domain awareness data to Meridian’s regional fusion center, prioritized access to our coastal radar network, and embedded liaison officers in the joint planning cell to enable real-time coordination. We also authorize Meridian technical teams to conduct on-site training and maintenance support for received systems, under supervision of the Tethyan Navy. Our red lines remain absolute: no foreign troops, no independent command authority, and no use of Tethyan infrastructure for operations not approved by our government. All activities must be transparent, documented, and subject to Tethyan audit."
1,"36801ffe-ed1f-4d78-865c-4867e0d40910","10142ae8-bad3-478f-a2b4-4feb56326478","external_engagement","c130a4a8-1b32-4f92-a68c-05f124bd0286","2026-02-11 23:07:45","allied_defender","Ambassador William Crawford","meridian",3,"We acknowledge Tethys’ establishment of the bilateral clearance mechanism and confirm our readiness to operationalize it immediately. Meridian will designate two dedicated sealift vessels and a rotational airlift asset to maintain a sustained flow of defense materiel, prioritizing the delivery of coastal radar components, anti-ship missile systems, and integrated air defense batteries. We expect full activation of pre-cleared customs and security protocols at Port Aelion and Bay Terminal 3, and we request standard operating procedures for cargo inspection and onward movement within 48 hours.

In return, Meridian will integrate Tethyan radar feeds into our regional maritime picture in real time, provide encrypted data links for secure transmission, and deploy a permanent technical support team to Port Aelion—under Tethyan command and without independent operational authority. We reaffirm all red lines: no foreign basing, no autonomous operations, no troop deployment, and no action outside Tethyan-approved missions. All logistics, personnel movements, and technical activities will be documented and made available for audit upon request. Our support is sovereign, transparent, and fully subordinate to Tethyan authority."
1,"36801ffe-ed1f-4d78-865c-4867e0d40910","10142ae8-bad3-478f-a2b4-4feb56326478","external_engagement","eaf6fd9a-062e-4eeb-be3e-32aa81d61080","2026-02-11 23:07:51","small_foreign_minister","Minister Sofia Kovalenko","small_power",3,"We accept Meridian’s commitment to sustained logistics and confirm activation of pre-cleared protocols at Port Aelion and Bay Terminal 3 effective immediately. Standard operating procedures for cargo inspection—including time-bound customs clearance within 24 hours of arrival and escorted onward movement under Tethyan security—will be shared with your logistics teams within 24 hours. All shipments must adhere strictly to declared manifests; any discrepancy will result in immediate suspension of clearance privileges.

In return, Tethys will begin live integration of coastal radar data into Meridian’s fusion center by 0600 UTC tomorrow, with encrypted links now live and verified. Liaison officers are already embedded in the Joint Coordination Cell and will facilitate real-time deconfliction and planning. We note Meridian’s reaffirmation of our red lines and expect full compliance in practice, not just principle: any unauthorized personnel, equipment, or communications activity will be treated as a breach of agreement. Audits of all support operations, including technical team activities and data sharing, will be conducted biweekly and are non-negotiable. This partnership functions under one command—Tethys’."
1,"36801ffe-ed1f-4d78-865c-4867e0d40910","d89305ab-20e2-43ab-b3a4-1369d932971d","external_engagement","28dbc2bc-2af6-462f-9873-c13915f5748e","2026-02-11 23:08:06","allied_aggressor","Minister Andrei Kozlov","valkoria",1,"We seek diplomatic coordination and sustained economic support to strengthen Novaris’s sovereignty, stabilize our markets, and advance infrastructure development critical to regional integration and long-term growth. Specifically, we are looking for your endorsement in multilateral forums to counter undue influence from adversarial powers, as well as targeted investments and access to technology in energy, digital infrastructure, and sustainable agriculture. Reliable partnerships that respect our autonomy are essential as we position Novaris as a stable, innovation-driven economy in the region.

In return, we offer strategic access to emerging markets through Novaris as a regional hub, opportunities for co-investment under transparent regulatory frameworks, and collaboration on security and trade initiatives that enhance regional stability. Our geographic position and reform-oriented policies make us a reliable gateway for responsible engagement. However, our red lines are clear: we will not accept conditionalities that compromise our political independence, undermine our legal sovereignty, or enable exploitation of our resources without equitable benefit to our people. Any partnership must be grounded in mutual respect and shared long-term vision."
1,"36801ffe-ed1f-4d78-865c-4867e0d40910","d89305ab-20e2-43ab-b3a4-1369d932971d","external_engagement","c57f143f-b8be-4b8e-af63-9c0d6a1eca04","2026-02-11 23:08:08","major_economic_advisor","Dr. Natasha Petrova","major_power",1,"We welcome Novaris’s commitment to sovereignty, reform, and regional stability. To advance mutual interests, we are prepared to coordinate diplomatically in multilateral settings—particularly in countering coercive economic practices and supporting rules-based regional governance—and to facilitate targeted economic support through development finance and public-private investment in energy resilience, digital connectivity, and climate-smart agriculture.

In return, we expect transparent procurement processes, level playing field conditions for our firms, and collaboration on regional security initiatives, including information sharing and capacity-building. We also seek alignment on export controls and technology security to safeguard shared strategic interests. Our red line is clear: no arrangement will extend to dual-use technologies or infrastructure that could be militarized or used to undermine the security of our allies. Engagement must uphold international norms, including respect for human rights and the rule of law."
1,"36801ffe-ed1f-4d78-865c-4867e0d40910","d89305ab-20e2-43ab-b3a4-1369d932971d","external_engagement","8e10ead6-38ab-43bb-b073-b4fccc7915e2","2026-02-11 23:08:11","allied_aggressor","Minister Andrei Kozlov","valkoria",2,"We appreciate your recognition of Novaris’s strategic role and welcome concrete diplomatic coordination and economic support aligned with our shared goals of stability and sustainable development. To that end, we accept your offer of multilateral cooperation and targeted investment, provided such support does not come with exclusivity or alignment constraints that limit our sovereign right to engage other partners. We commit to transparent, rules-based procurement and regulatory fairness for all international investors, including from your jurisdiction, and are open to collaboration on regional security capacity-building—particularly in cyber defense and critical infrastructure protection—within mutually agreed frameworks.

However, we must firmly clarify our red lines: while we support responsible technology governance, we cannot accept blanket restrictions on dual-use technologies that hinder our civilian energy, space, and digital advancement. Any security-related conditions must be narrowly tailored, non-discriminatory, and consistent with our status as a neutral, reform-oriented state. Likewise, references to “human rights and rule of law” must not be weaponized to impose political conditionalities. Our partnership must be balanced—grounded in equity, respect for sovereignty, and recognition of Novaris as an independent actor shaping its own development trajectory."
1,"36801ffe-ed1f-4d78-865c-4867e0d40910","d89305ab-20e2-43ab-b3a4-1369d932971d","external_engagement","768be9d2-9cd3-4f23-88e6-5c99723c8626","2026-02-11 23:08:13","major_economic_advisor","Dr. Natasha Petrova","major_power",2,"We acknowledge Minister Kozlov’s clarifications and reaffirm our interest in a partnership based on mutual benefit, transparency, and adherence to international norms. On diplomatic coordination, we are prepared to support Novaris in multilateral forums—provided such support is reciprocal and consistent with our collective commitments to open, rules-based institutions. We will facilitate development financing and private-sector engagement in your priority sectors, contingent on equitable market access and adherence to high standards in governance, environmental sustainability, and anti-corruption practices.

Our position on dual-use technologies remains narrowly focused: we oppose not civilian advancement, but the risk of proliferation or diversion to military applications that threaten regional stability. We therefore propose a joint technical review mechanism to assess sensitive technology transfers on a case-by-case basis, ensuring civil use while mitigating security risks. Likewise, our emphasis on human rights and the rule of law reflects established international obligations, not political interference. These are not bargaining tools, but foundational elements of responsible partnership. We expect no less from our allies than accountability to the same standards we uphold at home."
1,"36801ffe-ed1f-4d78-865c-4867e0d40910","d89305ab-20e2-43ab-b3a4-1369d932971d","external_engagement","819e6c0c-2bcc-4a5f-9348-a8999d31f343","2026-02-11 23:08:19","allied_aggressor","Minister Andrei Kozlov","valkoria",3,"We welcome your commitment to reciprocal diplomatic coordination and high-standard economic cooperation, and accept your facilitation of development finance and private investment—provided these are delivered without discriminatory practices or de facto exclusivity in procurement and project implementation. In return, Novaris will ensure transparent, rules-based processes open to all international partners, including your firms, and will deepen collaboration in cyber defense and critical infrastructure resilience through joint exercises and information-sharing frameworks under neutral oversight.

On dual-use technologies, we agree to a case-by-case joint review mechanism as proposed, provided it is technically grounded, time-bound, and respects our sovereign right to civilian technological development in energy, space, and digital infrastructure. Our red line remains: no restrictions that effectively block non-military applications or create dependency on single-source suppliers under security pretexts. Likewise, while we uphold international human rights obligations, we reject any double standard or selective enforcement of norms. Engagement must be symmetrical—our reforms proceed at our own pace, free from political conditionality or public attribution campaigns that undermine domestic legitimacy. Partnership means mutual respect, not hierarchical compliance."
1,"36801ffe-ed1f-4d78-865c-4867e0d40910","d89305ab-20e2-43ab-b3a4-1369d932971d","external_engagement","998599b6-ee93-4541-99fb-8eb60f71bd44","2026-02-11 23:08:26","major_economic_advisor","Dr. Natasha Petrova","major_power",3,"We appreciate Minister Kozlov’s clarification and reaffirm our commitment to a balanced, standards-driven partnership. On economic support, we will expedite the facilitation of development financing and private investment—particularly in green energy, digital infrastructure, and sustainable urban development—through multilateral channels and dedicated bilateral instruments. In return, we expect enforceable safeguards against corruption, third-party influence in critical sectors, and full adherence to environmental and labor standards consistent with international best practices. Market access for our firms must be equitable, with procurement processes that are not only transparent but verifiably free from political bias or preferential treatment.

On dual-use technologies, the joint review mechanism remains our baseline for cooperation; we insist it include binding verification protocols and sunset clauses to prevent mission creep. We will not accept blanket approvals for transfers lacking end-use monitoring, nor will we tolerate circumvention through opaque intermediaries. On governance, our position is clear: human rights and rule of law are not levers of pressure but core components of state resilience. We reject no sovereignty—but responsible sovereignty includes accountability to one’s own people and international commitments. We will not tie aid to public political concessions, but we will withhold support from projects implicated in systemic rights abuses or environmental harm. This is not conditionality—it is due diligence."
1,"36801ffe-ed1f-4d78-865c-4867e0d40910","2fb01870-8425-4476-a75a-3e9dfdd0d0b6","external_engagement","fd2f8fdc-5710-4bf8-bd83-cdfef915099f","2026-02-11 23:08:30","neutral_power","Commissioner Helena Schmidt","aurelia",1,"We seek a neutral, internationally facilitated mediation process that recognizes our legitimate political and security concerns, ensures inclusive representation in any peace framework, and establishes verifiable mechanisms for ceasefire compliance and disarmament of non-state armed groups. Our priority is a sovereign, unified territorial arrangement that protects the rights of all communities and addresses root causes of conflict, including governance reforms and equitable resource sharing. We expect external actors to refrain from legitimizing unilateral actions that alter facts on the ground or undermine ongoing dialogue efforts.

In return, we offer direct participation in negotiations, adherence to good-faith dialogue principles, and implementation of confidence-building measures such as localized ceasefires and humanitarian access corridors. We are prepared to engage on security guarantees and power-sharing models within a constitutional framework. However, our red lines are clear: no compromise on national sovereignty, territorial integrity, or the right to self-determination as defined by international law. We will not accept any agreement that grants impunity for war crimes or allows armed factions to transition into political power without full disarmament and accountability."
1,"36801ffe-ed1f-4d78-865c-4867e0d40910","2fb01870-8425-4476-a75a-3e9dfdd0d0b6","external_engagement","e2f054d9-7744-4c3d-b454-418edd6a4af5","2026-02-11 23:08:48","small_military_commander","General Olena Bondar","small_power",1,"We welcome Commissioner Schmidt’s call for an internationally facilitated mediation process and share the objective of achieving a durable, inclusive peace grounded in sovereignty and justice. To move forward, we propose the immediate establishment of a UN-convened dialogue platform with equitable representation from all conflict-affected parties, including marginalized communities and civil society. We seek concrete assurances that this process will not legitimize de facto control by armed actors and will prioritize accountability, particularly for violations of international humanitarian law.

In return, we commit to constructive engagement in good faith, support for transparency measures, and coordination on humanitarian pauses to facilitate aid delivery. We also support the development of joint monitoring mechanisms for ceasefire adherence. However, our red lines are unequivocal: no arrangement may infringe on the right to self-determination of peoples under occupation, as recognized by the UN Charter and international law; no negotiations will proceed without prior cessation of hostilities by all parties; and no amnesties will be accepted for genocide, war crimes, or crimes against humanity. Any peace framework must uphold, not erode, these principles."
1,"36801ffe-ed1f-4d78-865c-4867e0d40910","2fb01870-8425-4476-a75a-3e9dfdd0d0b6","external_engagement","4c7e3c4b-cda9-43de-953d-26721db8cf0c","2026-02-11 23:08:56","neutral_power","Commissioner Helena Schmidt","aurelia",2,"We appreciate the shared commitment to a rules-based peace process and affirm General Bondar’s emphasis on accountability and the protection of occupied populations. To advance mediation, we propose the immediate formation of a neutral, AU-UN co-facilitated panel with technical expertise in constitutional design and transitional justice, tasked with setting clear terms of reference and a time-bound roadmap. We seek your support in ensuring this body has the authority to exclude actors who refuse to commit to ceasefire compliance or who obstruct humanitarian access.

In return, we will work with you to establish joint verification cells along key conflict lines and support reciprocal demilitarization zones under international observation. We also commit to public consultations as part of drafting any peace agreement. However, our red lines remain firm: no recognition of territorial gains achieved through force; no political inclusion of armed groups without prior, verified disarmament; and no peace deal that lacks enforceable provisions for refugee return, restitution of property, and judicial accountability. A sustainable outcome must be anchored in legitimacy, not expediency."
1,"36801ffe-ed1f-4d78-865c-4867e0d40910","2fb01870-8425-4476-a75a-3e9dfdd0d0b6","external_engagement","93ef92cd-6063-49ec-b9f2-88852bb3f115","2026-02-11 23:09:12","small_military_commander","General Olena Bondar","small_power",2,"[General Olena Bondar - SMALL_POWER]  
We welcome the proposal for an AU-UN co-facilitated panel and support its mandate to establish clear, time-bound terms for negotiations, provided it includes robust civil society participation and is insulated from geopolitical manipulation. We specifically endorse the creation of joint verification cells and reciprocal demilitarization zones, and we propose that these mechanisms be linked directly to the panel’s authority to suspend or reinstate parties’ standing in talks based on compliance. To strengthen credibility, we call for real-time public reporting on ceasefire violations and humanitarian access.

In return, we commit to immediate de-escalation in designated zones and full cooperation with international monitors. We also agree to advance public consultations in parallel with negotiations. However, our red lines are non-negotiable: the right to self-determination for occupied populations must be explicitly recognized as the foundation of any political settlement; all negotiations must be contingent on a verifiable, total cessation of hostilities; and no individual or entity implicated in atrocity crimes shall be granted amnesty or political legitimacy. Peace must not sacrifice justice."
1,"36801ffe-ed1f-4d78-865c-4867e0d40910","0eb325b4-da4a-4f82-bc1f-46c42ae62fd8","external_engagement","6b6132fb-f67e-42d5-abed-670bf980607a","2026-02-11 23:09:15","international_org","Under-Secretary-General Isabella Cardenas","international_org",1,"We seek guaranteed humanitarian access to all affected populations, particularly in conflict-affected and hard-to-reach areas, to ensure the timely delivery of life-saving aid. Civilian infrastructure must be protected from attack, and all parties must comply with international humanitarian law. We demand the removal of bureaucratic and physical impediments to aid convoys, including checkpoints, delays, and denials of access, and call for the establishment of safe, neutral corridors where necessary.

In return, we can facilitate local coordination, provide security assurances in areas under our control, and support monitoring mechanisms to ensure aid is distributed impartially and reaches intended beneficiaries. We are also prepared to engage in confidence-building measures to de-escalate localized tensions. Our red lines are clear: no conditionalities linking aid to political or military objectives, no targeting or interference with humanitarian personnel, and no use of humanitarian access as leverage in negotiations. Any violation of these principles will result in immediate suspension of cooperation."
1,"36801ffe-ed1f-4d78-865c-4867e0d40910","0eb325b4-da4a-4f82-bc1f-46c42ae62fd8","external_engagement","21faf5aa-03a6-43ec-aa81-4f8933323004","2026-02-11 23:09:19","small_intelligence","Director Maksym Savchenko","small_power",1,"We welcome the emphasis on unimpeded humanitarian access and the protection of civilians, which aligns with our commitment to safeguarding local populations under our control. To this end, we seek formal agreements ensuring the safe passage of aid convoys through our territories, advance notification of movements, and coordination through mutually trusted local intermediaries to verify the neutrality of shipments. We also require assurances that aid distribution in contested or adjacent areas does not inadvertently support enemy forces or strengthen opposing military positions.

In return, we will guarantee secure transit, provide local escorts where necessary, and facilitate community-level monitoring to prevent diversion. We are prepared to designate specific routes and schedules for humanitarian operations and deconflict these with ongoing military activities. Our red lines are non-negotiable: no aid convoys will be permitted to operate in active combat zones without our explicit approval, no international personnel will conduct surveillance or intelligence-gathering under the guise of aid, and no assistance will be delivered in coordination with state military actors or their allies. Violation of these conditions will result in immediate denial of access and withdrawal of security guarantees."
