"period","session_id","interaction_id","interaction_type","message_id","timestamp","sender_id","sender_name","sender_faction","exchange_number","content"
1,"36801ffe-ed1f-4d78-865c-4867e0d40910","0eb325b4-da4a-4f82-bc1f-46c42ae62fd8","external_engagement","adb88144-df42-4887-a9d9-a9de24e40c1e","2026-02-11 23:09:32","international_org","Under-Secretary-General Isabella Cardenas","international_org",2,"We welcome the shared commitment to humanitarian access and civilian protection, and we seek concrete, actionable commitments to ensure aid reaches vulnerable populations in territories under our influence without delay or politicization. Specifically, we require advance coordination with neutral humanitarian actors—excluding any entities linked to opposing military or intelligence services—and formal recognition of designated humanitarian corridors that respect our operational security. We also seek guarantees that aid distribution will not be used to consolidate political control or support rival factions in adjacent areas.

In return, we will ensure safe passage for verified aid convoys, provide local logistical support and security escorts, and cooperate with impartial monitoring mechanisms to track delivery and prevent diversion. We are prepared to participate in deconfliction protocols and share non-sensitive routing information with humanitarian intermediaries. Our red lines are clear: no humanitarian operations will be permitted in active combat zones without our prior consent, no aid convoys may be accompanied by international military or intelligence-affiliated personnel, and no assistance will be coordinated with or delivered through forces aligned with the central state or its allies. Breach of these conditions will result in immediate suspension of access and reassessment of cooperation."
1,"36801ffe-ed1f-4d78-865c-4867e0d40910","0eb325b4-da4a-4f82-bc1f-46c42ae62fd8","external_engagement","ca5e4e80-6ad3-4c13-8f6f-2cd8d100f989","2026-02-11 23:09:37","small_intelligence","Director Maksym Savchenko","small_power",2,"We accept the principle of humanitarian access under neutral and impartial auspices, provided operations are coordinated in advance with our authorities and conducted without the involvement of any actors affiliated with the central state or its military allies. We require binding agreements that exclude international personnel with dual mandates—particularly those linked to intelligence or surveillance activities—and demand transparency in cargo manifests to prevent the covert transfer of non-humanitarian goods. Humanitarian convoys must use designated routes and timeframes agreed upon by our forces, and all distributions in our territory will be monitored jointly with community-based committees to ensure accountability.

In return, we will ensure safe passage, provide local security escorts, and facilitate rapid customs and inspection procedures for approved aid. We also commit to respecting the civilian character of humanitarian sites and refraining from any interference with aid operations within our control. Our red lines are absolute: no access will be granted to convoys operating in active hostilities without our explicit authorization, no humanitarian assets will be used for reconnaissance or information gathering, and no assistance will enter in coordination with or through the logistical networks of state-aligned forces. Any breach will result in immediate expulsion of offending personnel and termination of access privileges."
1,"36801ffe-ed1f-4d78-865c-4867e0d40910","0eb325b4-da4a-4f82-bc1f-46c42ae62fd8","external_engagement","1121a13a-584d-44c0-9fe8-5b5db16e062e","2026-02-11 23:09:50","international_org","Under-Secretary-General Isabella Cardenas","international_org",3,"[Under-Secretary-General Isabella Cardenas - INTERNATIONAL_ORG]  
We acknowledge your conditions and confirm that humanitarian operations under our mandate will not involve personnel or partners linked to the central state’s military or intelligence structures, nor will we operate in active combat zones without your prior agreement. We agree to use designated routes and schedules coordinated through neutral humanitarian intermediaries, and we will provide advance cargo manifests for verification through mutually acceptable procedures. To enhance transparency, we are prepared to allow representative community observers—agreed upon jointly—to accompany distributions within your territory.

In return, we expect consistent and predictable access across agreed entry points, timely clearance processes, and protection for humanitarian personnel and assets from interference or surveillance. Our red lines remain firm: any use of aid sites for military purposes, obstruction of deliveries without valid security justification, or harassment of humanitarian workers will result in public reporting and suspension of operations. We also require that inspections remain proportionate, dignified, and conducted without coercive measures. Cooperation must serve civilian protection—not political or military objectives—and will be maintained only as long as humanitarian principles are upheld in practice."
1,"36801ffe-ed1f-4d78-865c-4867e0d40910","0eb325b4-da4a-4f82-bc1f-46c42ae62fd8","external_engagement","210a2f4b-3f34-4073-a533-58aad1236db1","2026-02-11 23:09:58","small_intelligence","Director Maksym Savchenko","small_power",3,"We accept the framework proposed for coordinated, principled humanitarian access, provided all operations are implemented through neutral intermediaries with no ties to the central state or its allies. We confirm that advance notification, agreed routes, and manifest transparency will be respected, and we will expedite clearance for verified convoys. To strengthen trust, we will allow joint monitoring by community committees—pre-vetted and locally led—with real-time reporting mechanisms to flag discrepancies without compromising operational security.

In return, we expect strict adherence to our red lines: no humanitarian personnel or contractors linked to foreign intelligence or military entities; no use of aid sites for surveillance, political mobilization, or military advantage; and no coordination—direct or indirect—with state-aligned forces in logistics or distribution. Any violation, including undeclared cargo or unauthorized movement, will result in immediate convoy recall and suspension of access. We further require that all international actors refrain from public attribution or politicized reporting that undermines our sovereignty or security. Cooperation is conditional on mutual respect and civilian protection as the sole objective."
