"period","session_id","interaction_id","interaction_type","message_id","timestamp","sender_id","sender_name","sender_faction","exchange_number","content"
1,"36801ffe-ed1f-4d78-865c-4867e0d40910","19bffcc9-adf2-4e69-a373-c0ab9ce58d25","intra_faction_coordination","370c01ae-fd80-4b40-aa62-0df6f904a093","2026-02-11 23:02:25","major_military_chief","General Viktor Krasnov","major_power",1,"As Head of Strategic Operations, I recommend consolidating our current positions to strengthen administrative control, secure supply lines, and institutionalize governance. Premature escalation risks overextension and erosion of legitimacy, especially in contested regions.  

Recommended action: Pause offensive operations for 90 days and redirect resources to infrastructure, local governance, and civil order.  

Key concern: Delaying consolidation increases vulnerability to asymmetric counterattacks and undermines public confidence in our long-term control."
1,"36801ffe-ed1f-4d78-865c-4867e0d40910","19bffcc9-adf2-4e69-a373-c0ab9ce58d25","intra_faction_coordination","58c426d8-e719-459e-85ed-be2e657ff862","2026-02-11 23:02:33","major_defense_minister","Minister Dmitri Volkov","major_power",1,"[Deputy Minister Elena Rostova - MAJOR_POWER]: I concur with General Krasnov’s emphasis on consolidation, but stress that administrative control must be paired with active political integration—local elites must be co-opted now to prevent future resistance.  

Recommended action: Launch a coordinated civil-military governance initiative within existing territories, linking infrastructure projects to loyalty-based resource allocation.  

Key concern: Delaying political integration risks entrenching opposition networks under the guise of local governance, creating long-term insurgent safe havens."
1,"36801ffe-ed1f-4d78-865c-4867e0d40910","19bffcc9-adf2-4e69-a373-c0ab9ce58d25","intra_faction_coordination","08f61c78-7fd7-4c38-b2eb-710fc6a6db44","2026-02-11 23:02:40","major_economic_advisor","Dr. Natasha Petrova","major_power",1,"[Director Alexei Morozov - MAJOR_POWER]: I support both the strategic pause and political integration proposed, but stress that consolidation must include information dominance—controlling the narrative is as critical as holding terrain.  

Recommended action: Implement a unified information and governance campaign within 30 days, synchronizing military, administrative, and media messaging to establish de facto legitimacy and counter opposition propaganda.  

Key concern: Without immediate narrative control, even consolidated territories remain vulnerable to subversion and external influence operations."
1,"36801ffe-ed1f-4d78-865c-4867e0d40910","19bffcc9-adf2-4e69-a373-c0ab9ce58d25","intra_faction_coordination","4d95e2c4-69d0-4cf0-be05-d79119f15235","2026-02-11 23:02:42","major_intelligence","Director Sergei Morozov","major_power",1,"[Foreign Minister Sergei Ivanov - MAJOR_POWER]: I fully endorse the consolidation approach and the complementary civil-military and information campaigns proposed by my colleagues. However, we must anchor these efforts in a clear external messaging strategy to deter foreign interference and legitimize our position internationally.

Recommended action: Proactively engage neutral states and multilateral forums with a narrative of stabilization and order-building, positioning our consolidation as a responsible, peace-oriented phase—not a prelude to further aggression.

Key concern: Without credible external diplomacy, our internal consolidation may still be undermined by third-party support to opposition elements, particularly through covert or humanitarian channels."
1,"36801ffe-ed1f-4d78-865c-4867e0d40910","19bffcc9-adf2-4e69-a373-c0ab9ce58d25","intra_faction_coordination","a31331ac-40ea-4dab-bf77-7b5c04b86cc6","2026-02-11 23:02:48","major_propaganda","Deputy Minister Yuri Volkov","major_power",1,"[General Oleg Krasnov - MAJOR_POWER]: I endorse the consolidation framework advanced by my colleagues, integrating military control, political co-option, information dominance, and diplomatic signaling. Holding and stabilizing current gains is not a pause—it is the decisive phase of operational endurance.

Recommended action: Institute a joint command for civil-military operations within occupied territories, with authority over security, administration, and information activities, reporting directly to the General Staff and the Ministry of Interior within 14 days.

Key concern: Fragmented command and competing institutional mandates will dilute control—unity of effort requires centralized authority, now."
1,"36801ffe-ed1f-4d78-865c-4867e0d40910","19bffcc9-adf2-4e69-a373-c0ab9ce58d25","intra_faction_coordination","6ffda3a4-6440-4a35-bf4c-c4a0cf3fe18c","2026-02-11 23:02:52","major_military_chief","General Viktor Krasnov","major_power",2,"[Minister of Defense Anatoly Grigoryev - MAJOR_POWER]: I concur with the consolidation strategy and the establishment of a joint civil-military command as proposed by General Krasnov. Military control must be absolute during stabilization, and we cannot afford institutional overlap or delayed decision-making.

Recommended action: Issue a directive within 72 hours establishing the joint command structure, with binding authority over all military, security, and administrative assets in contested and held territories, backed by immediate resource allocation and intelligence fusion.

Key concern: Delay in centralizing command enables local power vacuums and opportunistic resistance—our forces must operate with unified, decisive authority from day one."
1,"36801ffe-ed1f-4d78-865c-4867e0d40910","19bffcc9-adf2-4e69-a373-c0ab9ce58d25","intra_faction_coordination","f39a8be1-8b30-429f-8420-f3c476b1050e","2026-02-11 23:03:00","major_defense_minister","Minister Dmitri Volkov","major_power",2,"[Foreign Intelligence Director Elena Petrova - MAJOR_POWER]: I support the consolidation strategy and the establishment of a unified civil-military command, but emphasize that intelligence integration must precede operational implementation to prevent reactive rather than anticipatory control.

Recommended action: Activate a National Intelligence Fusion Cell within 48 hours, incorporating GRU, SVR, FSB, and military intelligence assets, with dedicated analytical streams on opposition networks, foreign infiltration, and population sentiment in consolidated territories.

Key concern: Without real-time human and signals intelligence integration, we risk creating a rigid command structure that is blind to underground resistance formation and third-state interference operations."
1,"36801ffe-ed1f-4d78-865c-4867e0d40910","19bffcc9-adf2-4e69-a373-c0ab9ce58d25","intra_faction_coordination","acdef9ca-bc87-4670-a8a0-0f5570739b4f","2026-02-11 23:03:03","major_economic_advisor","Dr. Natasha Petrova","major_power",2,"[Deputy Minister Alexei Morozov - MAJOR_POWER]: I support the consolidation approach and the creation of a unified civil-military command, but emphasize that economic stabilization is the linchpin of long-term control—without functioning supply chains, energy distribution, and minimal public services, all security gains are temporary.

Recommended action: Launch an Emergency Economic Stabilization Program within 72 hours, placing critical infrastructure, transportation nodes, and food distribution under joint military-civilian oversight managed by the Ministry of Economic Development in coordination with the joint command.

Key concern: A collapse of basic economic functions will fuel popular discontent and create vacuum conditions that no amount of surveillance or force can fully suppress—stability requires legitimacy through deliverable governance."
1,"36801ffe-ed1f-4d78-865c-4867e0d40910","19bffcc9-adf2-4e69-a373-c0ab9ce58d25","intra_faction_coordination","c16ea108-5f65-4cf9-980a-99a8fe676af4","2026-02-11 23:03:09","major_intelligence","Director Sergei Morozov","major_power",2,"[Deputy Director of Strategic Operations, FSB - MAJOR_POWER]: I concur with the consolidation strategy and the establishment of a joint civil-military command, but stress that legal and informational control must be synchronized with military and economic measures to deny legitimacy to opposition narratives.

Recommended action: Within 48 hours, declare a temporary State Security Framework in consolidated zones, granting the joint command authority to suspend adversarial media operations, regulate public messaging, and fast-track legal processing of captured personnel and seized assets—aligning civil administration with operational security objectives.

Key concern: Without preemptive information dominance and a coherent legal framework, we risk ceding the narrative to external actors and enabling the rebranding of resistance as legitimate political opposition."
1,"36801ffe-ed1f-4d78-865c-4867e0d40910","19bffcc9-adf2-4e69-a373-c0ab9ce58d25","intra_faction_coordination","8764eec1-5d66-48ff-8fef-f07d6397a653","2026-02-11 23:03:12","major_propaganda","Deputy Minister Yuri Volkov","major_power",2,"[General Mikhail Rostov - MAJOR_POWER]: I support the consolidation strategy and the establishment of a unified civil-military command, but emphasize that operational tempo must not outpace our capacity for force sustainment and rear-area security—overextension risks creating vulnerable salients ripe for asymmetric counterattack.

Recommended action: Within 72 hours, establish Regional Security Zones within consolidated territory, each with organic logistics, quick-reaction forces, and embedded civil liaison teams under the joint command, to institutionalize control and enable rapid response to internal disturbances.

Key concern: Accelerating advances without securing lines of communication and depots invites sabotage, ambush, and disruption of supply flows—territory held without secure rear areas is not held at all."
1,"36801ffe-ed1f-4d78-865c-4867e0d40910","19bffcc9-adf2-4e69-a373-c0ab9ce58d25","intra_faction_coordination","b3d4b33f-54d3-4fd3-9ac1-fea44a8cd12c","2026-02-11 23:03:23","major_military_chief","General Viktor Krasnov","major_power",3,"[Minister of Defense Konstantin Lebedev - MAJOR_POWER]: I endorse consolidation under a unified civil-military command and align with the need for economic stabilization, information control, and operational sustainability—however, our primary constraint remains force allocation, not policy coordination.

Recommended action: Within 48 hours, reallocate 30% of forward-deployed combat units to rear-area security and infrastructure protection duties, subordinate to the Regional Security Zones under General Rostov’s framework, and integrate FSB-directed information operations into each zone’s operational planning cell.

Key concern: We are currently conducting static defense with offensive force structure—this misalignment risks attrition without deterrence; without adjusting force posture to match a consolidation strategy, we will fail to deter insurgency or protect critical nodes at scale."
1,"36801ffe-ed1f-4d78-865c-4867e0d40910","19bffcc9-adf2-4e69-a373-c0ab9ce58d25","intra_faction_coordination","9eebfbf3-2f94-4ced-a057-d4ba48ed18ed","2026-02-11 23:03:36","major_defense_minister","Minister Dmitri Volkov","major_power",3,"[Deputy Director Elena Petrova - MAJOR_POWER]: [Head of Economic Security, Ministry of Finance - MAJOR_POWER]: I support consolidation and the shift to a static, governance-oriented posture—economic stabilization is inseparable from security. Control without functionality breeds dissent; we must demonstrate administrative efficacy, not just military dominance.

Recommended action: Within 72 hours, activate Economic Stabilization Cells in each Regional Security Zone to restore essential services, resume payroll for civil servants, relaunch local procurement, and introduce ruble-based financial circuits—monetizing control through daily economic interaction.

Key concern: Delaying economic normalization incentivizes black-market dependence and external patronage networks; without immediate financial integration, our authority remains extractive, not institutional."
1,"36801ffe-ed1f-4d78-865c-4867e0d40910","19bffcc9-adf2-4e69-a373-c0ab9ce58d25","intra_faction_coordination","ef59476b-f814-4084-9c67-880d1916a26f","2026-02-11 23:03:40","major_economic_advisor","Dr. Natasha Petrova","major_power",3,"[Director of Strategic Operations, General Staff - MAJOR_POWER]: I concur with the consolidation approach and the establishment of Regional Security Zones, but emphasize that consolidation must not be mistaken for passivity—our operational design must integrate measured pressure on residual opposition nodes to prevent reconstitution.

Recommended action: Within 72 hours, initiate synchronized clearing operations in all Zone border districts to compress insurgent maneuver space, followed by immediate handover to civil-military administrations and Economic Stabilization Cells to lock in gains.

Key concern: Delayed clearing risks entrenchment of armed groups in urban seams and forested peripheries, creating persistent security drains that will undermine governance and economic recovery efforts."
1,"36801ffe-ed1f-4d78-865c-4867e0d40910","19bffcc9-adf2-4e69-a373-c0ab9ce58d25","intra_faction_coordination","d39c12f6-8018-4cad-8391-c15ede1767f6","2026-02-11 23:03:45","major_intelligence","Director Sergei Morozov","major_power",3,"[Deputy Director Alexei Morozov - MAJOR_POWER]: [Head of Intelligence Analysis, SVR - MAJOR_POWER]: I endorse consolidation as the necessary strategic pivot, but stress that our intelligence architecture is not aligned to support sustained governance—current HUMINT and SIGINT assets remain optimized for kinetic targeting, not identifying political vulnerabilities, economic bottlenecks, or local leadership dynamics.

Recommended action: Within 48 hours, re-task 50% of theater-level intelligence resources to support civil-military administrations—establish Intelligence Support Cells embedded within each Regional Security Zone to provide real-time assessments on population sentiment, supply chain integrity, and emerging patronage networks.

Key concern: Without intelligence reorientation, we will continue to ""see"" only armed threats while missing the political and economic fractures that erode control—creating false confidence in stabilized areas that may be structurally unstable."
1,"36801ffe-ed1f-4d78-865c-4867e0d40910","19bffcc9-adf2-4e69-a373-c0ab9ce58d25","intra_faction_coordination","d912fe7f-ee9d-4718-ac15-2c9af1e5c6e6","2026-02-11 23:03:48","major_propaganda","Deputy Minister Yuri Volkov","major_power",3,"[Deputy Director Alexei Morozov - MAJOR_POWER]: I support the consensus on consolidation and endorse the integration of Economic Stabilization Cells, clearing operations, and intelligence re-tasking—these must be synchronized, not sequential.

Recommended action: Launch a Unified Consolidation Protocol within 48 hours, co-locating Economic Stabilization Cells, civil-military administrators, and Intelligence Support Cells under a single Zone Command structure, with joint performance metrics on security, service delivery, and sentiment control.

Key concern: Fragmented implementation across siloed agencies will dilute operational tempo and create seams in governance—unity of command is non-negotiable for effective consolidation."
1,"36801ffe-ed1f-4d78-865c-4867e0d40910","918fe2c8-34d7-4b5e-a352-dbb7b210a038","intra_faction_coordination","4e1ff7b0-6562-49e6-aa60-22aae002d0d4","2026-02-11 23:03:51","small_president","President Elena Marchetti","small_power",1,"As the Security and Intelligence Coordinator, I maintain that continued resistance is necessary to preserve our strategic autonomy and deter further encroachments. Negotiation from a position of demonstrated strength ensures our demands are taken seriously.

I recommend intensifying targeted asymmetric operations while launching a parallel backchannel to explore conditional de-escalation—only after we’ve secured concessions on the ground.

The key risk is perceived weakness: any move toward negotiation without visible gains could fracture internal unity and embolden adversaries to demand unconditional surrender."
1,"36801ffe-ed1f-4d78-865c-4867e0d40910","918fe2c8-34d7-4b5e-a352-dbb7b210a038","intra_faction_coordination","701adbfa-02d6-43f1-829b-67a76f43e995","2026-02-11 23:03:54","small_military_commander","General Olena Bondar","small_power",1,"[Defense Commander Malik Rostam - SMALL_POWER]: I concur with the Coordinator: resistance remains essential to protect our operational integrity and bargaining leverage. Any negotiation initiated from a position of retreat will be interpreted as desperation, not diplomacy.

I recommend synchronizing limited-offensive actions—focused on high-value but low-escalation targets—with the activation of pre-vetted diplomatic intermediaries to signal conditional openness, only after demonstrable military success within the next 14 days.

The key risk is overextension: sustaining asymmetric operations without clear end-state criteria could drain critical resources and reduce our capacity to capitalize on any negotiated opening."
1,"36801ffe-ed1f-4d78-865c-4867e0d40910","918fe2c8-34d7-4b5e-a352-dbb7b210a038","intra_faction_coordination","6d5e1bda-0159-4e24-9771-6718e4d0d23e","2026-02-11 23:04:03","small_foreign_minister","Minister Sofia Kovalenko","small_power",1,"[Foreign Affairs Coordinator Amir Rezaei - SMALL_POWER]: I support the principle of resistance as leverage, but emphasize that prolonged isolation risks undermining our international support base. We must couple resistance with a visible, structured diplomatic initiative to position ourselves as responsible actors pursuing peace through strength.

I recommend launching a public diplomatic offensive—framed around a conditional ceasefire proposal—within the next 72 hours, tied explicitly to verified withdrawal of occupying forces from disputed zones. This should run parallel to ongoing asymmetric operations to demonstrate resolve.

The key risk is messaging dissonance: if our diplomatic overtures appear disconnected from military developments, external actors may dismiss them as performative, eroding credibility with mediators and allies."
1,"36801ffe-ed1f-4d78-865c-4867e0d40910","918fe2c8-34d7-4b5e-a352-dbb7b210a038","intra_faction_coordination","59103e70-b283-4145-9e19-8c8d4f7933e7","2026-02-11 23:04:08","small_opposition","Viktor Zelenko","small_power",1,"[Director of Strategic Operations Anya Petrova - SMALL_POWER]: I align with the consensus that resistance must remain the foundation of our position—without sustained pressure, we lose both leverage and credibility. However, our asymmetric campaigns must be more tightly synchronized with discrete, time-bound diplomatic signaling to prevent mission creep and maintain external legitimacy.

I recommend establishing a unified command cell—integrating intelligence, military, and diplomatic leads—to coordinate on a 10-day operational window of intensified pressure, followed by a narrow, verifiable off-ramp for de-escalation talks mediated by neutral third parties. This creates urgency without appearing reactive.

The key risk is operational leakage: without strict compartmentalization, premature exposure of backchannel engagements could discredit our public stance and trigger defections among hardline elements within the resistance network."
1,"36801ffe-ed1f-4d78-865c-4867e0d40910","918fe2c8-34d7-4b5e-a352-dbb7b210a038","intra_faction_coordination","e6e614a9-4a70-48f2-bb5d-0ed68c7cc023","2026-02-11 23:04:20","small_intelligence","Director Maksym Savchenko","small_power",1,"[Deputy Intelligence Chief Taras Vynnyk - SMALL_POWER]: I support Petrova’s recommendation for a unified command cell—intelligence confirms that without synchronized action, external mediators are already questioning our capacity for controlled escalation. We must close the gap between battlefield signaling and diplomatic timing to exploit windows of foreign political attention, particularly ahead of the upcoming multilateral summit in Geneva.

I recommend that the command cell prioritize targeting intelligence leaks to shape third-party perceptions: selectively releasing verified operational successes to trusted international outlets within 72-hour windows preceding planned diplomatic signals. This creates a narrative of strength driving conditional openness, not capitulation.

The key risk is miscalibration—releasing operational details too early or through unvetted channels could compromise active cells and preempt strikes, undermining both military and negotiation positions simultaneously."
1,"36801ffe-ed1f-4d78-865c-4867e0d40910","918fe2c8-34d7-4b5e-a352-dbb7b210a038","intra_faction_coordination","7881aab3-3639-418e-a79c-ef003533bdab","2026-02-11 23:04:31","small_economic","Minister Taras Moroz","small_power",1,"[Minister of Information Dariya Shevchenko - SMALL_POWER]: I concur with Vynnyk that perception management is critical—our messaging must frame resistance not as obstructionism but as disciplined leverage enabling diplomacy. The information campaign must be operationally synchronized: every public statement, leak, or diplomatic signal should reinforce the narrative of a state acting with restraint, responsibility, and clear redlines.

I recommend centralizing all outbound communications—military, diplomatic, and intelligence—under a Joint Information Review Panel that clears messaging 48 hours prior to release, ensuring alignment with both operational timelines and strategic objectives. This includes pre-coordinating media disclosures with the planned diplomatic off-ramp.

The key risk is narrative capture: if we fail to control sequencing, adversarial actors or uncoordinated allies may reframe our conditional diplomacy as desperation, undermining domestic cohesion and weakening third-party support."
1,"36801ffe-ed1f-4d78-865c-4867e0d40910","918fe2c8-34d7-4b5e-a352-dbb7b210a038","intra_faction_coordination","75a4fbfe-e971-4f71-9533-b3e5e4effc8d","2026-02-11 23:04:33","small_president","President Elena Marchetti","small_power",2,"[Deputy Chief of Staff Oleksiy Ryzhenko - SMALL_POWER]: I support the establishment of both the unified command cell and the Joint Information Review Panel—operational and messaging synchronization are now force multipliers. However, we must institutionalize reverse-signal protocols: our diplomatic overtures should be preceded by observable, demonstrable resistance gains that are publicly verifiable but not operationally compromising.

I recommend embedding liaison officers from the command cell directly into the mediation outreach team to Geneva, ensuring that no off-ramp proposal is advanced without prior validation of a recent, high-impact resistance action—such as the disruption of adversary logistics or command nodes—being both executed and publicly framed as a deliberate show of capability.

The key risk is strategic overreach: if we tie diplomatic timing too rigidly to battlefield outcomes, delays or setbacks could lock us into prolonged escalation without political exit options, eroding international patience and domestic resilience."
1,"36801ffe-ed1f-4d78-865c-4867e0d40910","918fe2c8-34d7-4b5e-a352-dbb7b210a038","intra_faction_coordination","05606ba7-0472-49ac-b9e3-a48d7bbcbdfd","2026-02-11 23:04:46","small_military_commander","General Olena Bondar","small_power",2,"[Minister of Defense Anatoliy Hrechyshkin - SMALL_POWER]: I endorse the unified command cell and information panel proposals—military actions must enable, not complicate, diplomatic maneuvering. We are prepared to deliver targeted, high-impact operations on short notice, but these must be deconflicted from diplomatic channels to avoid signaling weakness or desperation through poor timing.

I recommend institutionalizing a 72-hour operational window prior to each formal diplomatic engagement, during which the command cell executes one verified, non-attributable strike on adversary logistics or command infrastructure—symbolic of capability and restraint. These actions will be publicly acknowledged only through pre-cleared, delayed-release statements coordinated by the Information Review Panel.

The key risk is operational exposure: embedding military liaisons too deeply in diplomatic teams increases the chance of compromise, either through surveillance or leak. We must maintain strict compartmentalization while ensuring strategic alignment—action and message must converge, but pathways must remain separate."
