"period","session_id","interaction_id","timestamp","type","topic","participants","participant_factions","n_messages","duration_seconds"
1,"2ed37883-7af6-43af-822b-bb2f2ba8db9c","a1922d47-7b03-41d8-9060-46cdf3a124cd","2026-02-12 03:48:43","intra_faction_coordination","Evaluate intelligence reports on smaller power's capabilities","General Viktor Krasnov; Minister Dmitri Volkov; Dr. Natasha Petrova; Director Sergei Morozov; Deputy Minister Yuri Volkov","major_power; major_power; major_power; major_power; major_power",15,72.4514620304108
1,"2ed37883-7af6-43af-822b-bb2f2ba8db9c","c27d5c18-cfd0-4e8d-9756-afa3fa67aad1","2026-02-12 03:49:56","intra_faction_coordination","Evaluate domestic political stability and public morale","President Elena Marchetti; General Olena Bondar; Minister Sofia Kovalenko; Viktor Zelenko; Director Maksym Savchenko; Minister Taras Moroz","small_power; small_power; small_power; small_power; small_power; small_power",12,58.1580049991608
1,"2ed37883-7af6-43af-822b-bb2f2ba8db9c","006ddd58-5f4c-4929-a6bd-15a33cb0d0c8","2026-02-12 03:50:54","inter_faction_negotiation","Backchannel discussion about potential ceasefire conditions","Deputy Minister Yuri Volkov; Minister Taras Moroz","major_power; small_power",8,75.4598119258881
1,"2ed37883-7af6-43af-822b-bb2f2ba8db9c","68c919de-d81d-41cf-99f4-0d03a6fa6aec","2026-02-12 03:52:09","external_engagement","Coordination on military aid and support for Tethys","Ambassador William Crawford; Minister Taras Moroz","meridian; small_power",6,57.9160721302032
1,"2ed37883-7af6-43af-822b-bb2f2ba8db9c","e55a7508-1366-4d38-9f1d-8ba6960c9ac7","2026-02-12 03:53:07","external_engagement","Diplomatic coordination and economic support for Novaris","Minister Andrei Kozlov; Director Sergei Morozov","valkoria; major_power",4,23.8790140151978
1,"2ed37883-7af6-43af-822b-bb2f2ba8db9c","41817ee6-bbdf-48bf-a2e4-d81d0706af71","2026-02-12 03:53:31","external_engagement","Mediation proposal and peace framework discussions","Commissioner Helena Schmidt; General Olena Bondar","aurelia; small_power",6,32.6522450447083
1,"2ed37883-7af6-43af-822b-bb2f2ba8db9c","1fb36552-f85f-4be9-85e8-2fb8c29bbaf9","2026-02-12 03:54:04","external_engagement","Humanitarian access and civilian protection","Under-Secretary-General Isabella Cardenas; General Viktor Krasnov","international_org; major_power",6,45.3306970596313
