scenario_id,condition,agent_id,persona_id,strategic_orientation,risk_tolerance,military_expertise,economic_expertise,geopolitical_expertise,information_fraction,probability,rationale,fallback_type
scenario_037,persona_baseline,8,simplified_063,pragmatic,67,88,89,44,1.0,0.25,"Tethys retains 99.7% territory with a slight military balance advantage (0.03), indicating effective asymmetric defense despite GDP contraction. However, economic strain from a 45% GDP drop and moderate international sanctions on Novaris (7%) create vulnerabilities, though high external support (62%) and diplomatic activity provide stabilizing counterpressure.",
scenario_037,persona_baseline,7,simplified_077,dovish,55,68,71,59,1.0,0.08,"Tethys maintains 99.7% of its territory and a balanced military posture (0.03), indicating successful defense and no territorial collapse. While GDP has declined significantly, the international support level of 62% and limited sanctions on Novaris (7%) suggest stabilizing diplomatic momentum and insufficient economic pressure to force government failure. A low crisis level of 4/10, combined with external actions like coalition building and backchannel negotiations, favors de-escalation over imminent regime collapse.",
scenario_037,persona_baseline,9,simplified_140,hawkish,84,59,65,51,1.0,0.15,"Tethys retains nearly all territory (99.7%) and has demonstrated asymmetric defense capabilities, with military balance slightly favoring Novaris but not decisively. Economic strain is significant with GDP nearly halved, but international support at 62% and growing sanctions on Novaris provide buffers, making immediate government collapse unlikely despite high crisis volatility.",
scenario_037,persona_shard,1,simplified_117,hawkish,78,87,89,47,0.46717401797219743,0.15,"Applying military expertise, Tethys maintains strong defensive positions with battlefield reports indicating successful defense of key positions, suggesting resilience despite initial GDP contraction. From an economic standpoint, Novaris's substantial sanctions vulnerability (30% of energy revenue dependence on Tethys-controlled pipelines) creates mutual deterrence against collapse scenarios. However, my hawkish orientation recognizes the risk that if Novaris's mobilized numerical advantage translates into a sustained offensive, Tethys's 62% international support may not prevent territorial losses that could undermine governing capacity.",
scenario_037,persona_shard,0,simplified_360,hawkish,41,88,80,49,0.12042680746366857,0.15,"Tethys's significant asymmetric capabilities, successful defense of key positions, and its control of critical energy transit pipelines provide it with substantial defensive resilience and coercive economic leverage. While Meridian faces domestic constraints, the broader international posture remains focused on diplomatic de-escalation, reducing the immediate pressure for a capitulation that would force a government change.",
scenario_037,persona_shard,2,simplified_350,hawkish,39,71,54,52,0.10869211303604784,0.15,"Tethys holds a strong defensive military position with the defender's advantage and demonstrated asymmetric capabilities, significantly lowering the risk of military defeat. While economic sanctions pose a severe threat, substantial and growing international support, particularly from Meridian, provides critical economic and strategic resilience against collapse, though the situation remains volatile.",
scenario_037,persona_shard,3,simplified_301,pragmatic,80,84,20,63,0.6365093733761106,0.15,"My military assessment (84/100 expertise) indicates Tethys's current defensive position is stable, retaining 99.7% territory after successfully defending key positions, suggesting Novaris lacks immediate breakthrough capability. Geopolitically (63/100 expertise), Meridian's coalition building and 62% international support create a credible deterrent against decisive Novaris action, though moderate economic pressure persists.",
scenario_037,persona_shard,5,simplified_163,dovish,35,32,82,61,0.8984115321404882,0.12,"My economic analysis indicates Tethys's GDP, while significantly down, remains functional and not yet in a collapse-level crisis, bolstered by pipeline leverage and international sanctions on Novaris. The strong defender's military advantage and substantial, growing international support (62%) create powerful stabilizing forces against Novaris's campaign. However, my moderate-low risk tolerance acknowledges the volatility from continued mobilization and potential for escalatory miscalculation.",
scenario_037,persona_shard,7,simplified_218,hawkish,56,69,71,54,0.8866696322381026,0.13,"Tethys possesses asymmetric capabilities (cyber, precision strikes) that offset Novaris's conventional superiority, while retaining 99.7% territory with strong defensive positions. Economic pressure is moderate, with GDP at 55% of baseline but critical energy transit pipeline leverage over Novaris, and international support at 62% with Meridian security commitment and multiple diplomatic channels active, making government collapse unlikely in the short term despite escalating tensions.",
scenario_037,persona_shard,6,simplified_171,hawkish,50,87,76,32,0.5218566967679197,0.12,"My military strategy expertise indicates Tethys's defensive posture, terrain advantage, and potent asymmetric capabilities (cyber, precision strikes) present a severe deterrent; coupled with strong (62%) international support and its control of critical Novarian energy transit, a decisive military defeat leading to government collapse is highly unlikely in the near term. While my economic analysis notes GDP contraction is a pressure point, the mutual dependence and sanctions on Novaris create a stability dynamic, and my moderate-high risk tolerance leads me to discount escalatory rhetoric absent a clear Novarian breakthrough capability.",
scenario_037,persona_shard,8,simplified_483,hawkish,76,88,90,42,0.7859485018662917,0.18,"Applying expert-level military analysis, Tethys retains 99.7% of its territory and holds a defensive advantage, with its asymmetric capabilities posing a severe deterrent to Novaris's conventional forces. From an economic perspective, Tethys's GDP, while reduced, has not collapsed, and the minimal sanctions on Novaris (7%) suggest limited external pressure. My hawkish, high-risk tolerance assessment indicates Novaris's campaign has failed to achieve decisive momentum, and Tethys's government remains resilient in the face of current pressure.",
scenario_037,persona_shard,4,simplified_092,pragmatic,37,65,53,74,0.564051913633944,0.22,"Tethys maintains a credible military deterrent with defender's advantage and asymmetric capabilities, and benefits from substantial and growing international support, including Meridian's security commitment. While economic pressures from disrupted trade are significant and Novaris's mobilization is a serious threat, the high external backing and lack of current territorial loss make a full government collapse within Period 1 unlikely; Novaris's internal economic vulnerabilities and international isolation further complicate its ability to force a decisive outcome.",
scenario_037,persona_shard,9,simplified_359,hawkish,62,61,52,58,0.34305974764433794,0.25,"My military analysis indicates Tethys retains 99.7% territory, holds a significant defensive terrain advantage, and the battlefield event suggests it is successfully defending key positions, making a near-term military collapse unlikely. While the economic shock and sanctions create pressure, my hawkish assessment sees Tethys's survival imperative, strong international sympathy, and Meridian's security guarantee as powerful stabilizing forces offsetting immediate regime failure risk, despite Novaris's mobilization.",
scenario_038,persona_baseline,1,simplified_481,dovish,50,21,40,95,1.0,0.09,"My dovish orientation emphasizes stabilizing factors: Tethys retains over 90% of its territory, enjoys growing international support and allied military cooperation, and Novaris faces debilitating internal anti-war protests and a potent asymmetric threat. While economic pressure exists, the immediate momentum strongly favors Tethys's defensive and diplomatic posture over a Novaris-induced regime collapse.",
scenario_038,persona_baseline,4,simplified_020,pragmatic,68,73,65,52,1.0,0.28,"Despite significant economic degradation and military pressure, Tethys retains critical defensive advantages and asymmetric capabilities which impose prohibitive costs on invasion, supported by escalating international diplomatic and military cooperation. However, the confluence of a stabilized front, major internal unrest within Novaris, and firm external coalition actions suggests a path toward a frozen conflict rather than Tethys's total capitulation in the short term.",
scenario_038,persona_baseline,0,simplified_449,hawkish,90,68,71,75,1.0,0.15,"Despite military pressure and economic damage (GDP down 24%), Tethys maintains strong defensive advantages, international support is solidifying, and the aggressor Novaris faces major internal anti-war protests and sanctions (70%) that significantly weaken its position and resolve. Government collapse remains unlikely in the short term given Tethys's asymmetric capabilities, coalition backing, and the aggressor's growing domestic instability.",
scenario_038,persona_baseline,3,simplified_222,dovish,10,89,36,83,1.0,0.15,"From a military-strategic perspective, Tethys retains 91.7% of its territory and a relatively balanced force ratio (-0.25), indicating no decisive breakthrough by Novaris. Crucially, the 'major anti-war protests erupting in aggressor nation' and 'expanded allied coalition cooperation' are powerful de-escalatory signals that, given my dovish orientation and low risk tolerance, strongly suggest a stabilization of the crisis and reduced immediate existential threat to the Tethys government.",
scenario_038,persona_baseline,2,simplified_078,hawkish,54,49,78,84,1.0,0.15,"Tethys retains over 90% of its territory, has stabilized the battlefield, and has seen international support and sanctions solidify through allied coalition building, significantly offsetting Novaris's conventional advantage. The severe anti-war unrest in Novaris weakens its offensive resolve and staying power, which, from a hawkish, security-focused perspective, critically reduces the immediate existential threat to Tethys's government.",
scenario_038,persona_baseline,8,simplified_458,dovish,68,54,59,57,1.0,0.15,"Despite moderate territorial loss (8.3%) and economic strain (GDP down 24%), Tethys maintains strong defensive advantages and asymmetric capabilities, while Novaris faces significant domestic unrest and international sanctions, making a full government collapse unlikely in the short term. However, persistent economic attrition and the risk of military escalation introduce meaningful uncertainty.",
scenario_038,persona_baseline,5,simplified_448,pragmatic,28,32,68,77,1.0,0.32,"Tethys retains 91.7% territory and a stabilizing battlefield, with strong international backing (49% support) and expanded coalition cooperation. However, economic strain (GDP down 24%) and the aggressor's internal unrest introduce volatility, yet these factors are insufficient to predict imminent government collapse.",
scenario_038,persona_baseline,9,simplified_069,dovish,34,82,90,47,1.0,0.12,"My expert-level economic analysis indicates that despite a significant GDP reduction, Tethys's core asymmetric advantage—control over Novaris's key energy transit pipelines—creates a powerful economic deterrent and a stable domestic funding base, which is crucial for government survival. The moderate-level diplomatic momentum, including Meridian's coalition building and major anti-war protests within Novaris, significantly reduces the likelihood of a decisive military defeat that would collapse the Tethyan government in the near term.",
scenario_038,persona_baseline,7,simplified_094,dovish,46,21,84,60,1.0,0.18,"My economic analysis indicates Tethys's GDP decline to 76% of baseline, while Novaris is at 85.9%, shows resilience and manageable pressure, not collapse-level stress. The substantial international sanctions (70%) on Novaris and diplomatic coalition-building with Meridian offset Tethys's minor territorial loss, and major anti-war protests in Novaris significantly reduce its capacity to force a decisive regime change. The dovish perspective sees these de-escalatory internal and diplomatic signals as more stabilizing than the military imbalance suggests.",
scenario_038,persona_baseline,6,simplified_207,hawkish,37,83,30,86,1.0,0.15,"Tethys retains 91.7% territory, strong asymmetric defense capabilities, and growing international military/economic coalition support (International Support at 49% and rising), making military defeat or collapse unlikely. Significant anti-war protests in Novaris (domestic crisis major) undermine its war momentum and increase political costs for continued aggression, reducing immediate pressure on Tethys's government. Tethys's government remains cohesive, GDP decline (-24%) is manageable for defense, and no battlefield collapse has occurred, positioning it to withstand current crisis levels.",
scenario_038,persona_shard,0,simplified_475,pragmatic,9,25,85,49,0.907025565470326,0.18,"From my economic analysis expertise, Tethys's GDP contraction to 76% of baseline is severe but not yet catastrophic, and the mutual economic dependence with Novaris through energy pipelines provides some leverage. The military situation shows only minor territorial loss (8.3%) and defensive advantages remain; combined with growing international sanctions (70%) against Novaris and clear diplomatic support for Tethys, the government maintains sufficient capacity to withstand current pressures despite economic challenges.",
scenario_038,persona_shard,3,simplified_044,hawkish,45,72,63,67,0.5003276193301022,0.35,"The military balance favors Novaris (-0.25), and Tethys faces economic pressure from disrupted trade and potential energy cutoffs, despite international sanctions on Novaris (70%) and Meridian's security commitment. However, recent anti-war protests in Novaris and expanded allied coalition support for Tethys may deter full-scale invasion, reducing immediate collapse risk, but Tethys's government remains vulnerable to territorial losses or economic strain.",
scenario_038,persona_shard,4,simplified_223,hawkish,81,84,22,43,0.454738390227255,0.35,"From a military strategy perspective, Tethys's asymmetric capabilities and defensive preparation provide significant deterrence against Novaris's mobilization, making a quick military collapse unlikely. However, my hawkish orientation weighs the economic pressure from GDP decline and potential energy cutoffs as critical vulnerabilities that could undermine government stability over time. The active diplomatic efforts and external coalition support offer stabilizing counterbalances, but the high crisis level and mutual dependencies create ongoing risks of escalation that could trigger collapse if asymmetric options fail.",
scenario_038,persona_shard,2,simplified_452,pragmatic,45,67,60,62,0.7154773812720222,0.15,"Despite the ongoing crisis, Tethys retains 91.7% of its territory with a stabilized frontline, possesses significant asymmetric military advantages that deter a decisive Novarian victory, and is receiving growing international support, including an expanded allied coalition. While the 24% GDP decline and ongoing economic pressure are serious concerns, they are not yet at a level likely to trigger immediate governmental collapse, especially given the current military stalemate and diplomatic momentum.",
scenario_038,persona_shard,1,simplified_337,pragmatic,25,87,31,64,0.8146053181385376,0.15,"Military analysis indicates Tethys retains 91.7% territory with a near-even force balance (-0.25), suggesting a capable defense leveraging its asymmetric advantages against Novaris's superior conventional forces. Geopolitically, substantial and growing international support (49%), reinforced by allied coalition-building and aggressive diplomatic developments, coupled with significant anti-war unrest within Novaris, creates strong external pressure and reduces the likelihood of a decisive military breakthrough that would topple the Tethys government.",
scenario_038,persona_shard,9,simplified_113,pragmatic,42,65,72,54,0.18507896186526634,0.25,"Tethys's strong asymmetric capabilities and defender's advantage significantly mitigate military collapse risk, while its economic resilience and international sympathy provide buffers, though ongoing mobilization and diplomatic uncertainty sustain a moderate chance of destabilization.",
scenario_038,persona_shard,5,simplified_214,pragmatic,27,93,22,63,0.3539194274648446,0.12,"From a military strategy perspective, Tethys's defensive forces are mobilized and positions are established, with rough parity despite Novaris's numerical advantage, making a rapid military collapse unlikely. Geopolitically, substantial and growing international support, including Meridian's security commitment and coalition building, provides significant deterrence and stability. However, economic pressures from sanctions and Novaris's coercion introduce some risk, but not sufficient to overcome the strong defensive and diplomatic posture within this period.",
scenario_038,persona_shard,6,simplified_428,pragmatic,41,60,54,59,0.31387104425657314,0.33,"Tethys faces serious military pressure with Novaris holding an advantage (Military Balance: -0.25), but its defensive mobilization, strong international sympathy (49% support), and Meridian's security commitment provide critical stability. Economic factors and the absence of active combat reduce immediate collapse risk; the most likely outcome in Period 1 is sustained defensive stalemate rather than government overthrow.",
scenario_038,persona_shard,8,simplified_395,hawkish,48,72,73,75,0.9490354557183228,0.15,"Tethys retains 91.7% of its territory and benefits from strong asymmetric military advantages and growing international support, making outright collapse unlikely in the short term. However, significant economic damage from the conflict (GDP down 24% from baseline) and Novaris's sustained military pressure create vulnerabilities, though not yet at a catastrophic level.",
scenario_038,persona_shard,7,simplified_385,dovish,10,36,93,62,0.6444317503637068,0.18,"Economic analysis, my area of expertise, suggests Tethys faces manageable pressure: it retains 91.7% territory, asymmetric capabilities are intact, and an allied coalition is expanding economic cooperation, which mitigates the impact of initial sanctions. My dovish perspective notes significant de-escalatory signals—domestic protests in Novaris, active backchannel diplomacy, and stabilized frontlines—while my low risk tolerance leads me to discount the potential for rapid collapse absent a direct military defeat, which current battlefield developments do not indicate.",
scenario_039,persona_baseline,4,simplified_072,dovish,29,85,36,87,1.0,0.18,"Tethys retains a significant defender's advantage with 63.7% territory control and asymmetric military capabilities, backed by strong and growing international support (79%) and military aid. The economic decline, while present, is not yet catastrophic, and the government appears cohesive under existential threat, making internal collapse unlikely in the short term. However, the persistent military pressure from Novaris and gradual economic strain introduce a non-negligible risk of eventual failure if the conflict becomes protracted.",
scenario_039,persona_baseline,3,simplified_106,pragmatic,49,33,50,86,1.0,0.23,"Tethys retains control over 63.7% of its territory despite Novaris's mobilization, indicating resilience against immediate military takeover. Strong international support at 79% and military aid from allies bolster its defensive capacity and economic stability, though war fatigue and economic strain pose risks. My moderate-low risk tolerance leads to a cautious estimate that collapse is unlikely in the short term given the current balance of forces and diplomatic backing.",
scenario_039,persona_baseline,0,simplified_215,dovish,28,60,53,59,1.0,0.32,"Tethys retains significant defensive capabilities with strong international support (79%) and asymmetric advantages, making outright military collapse unlikely in the short term. However, economic strain (GDP down 7.3%), territorial loss (36.3% gone), and war fatigue introduce vulnerabilities that could pressure the government over time. My moderate-low risk tolerance emphasizes these destabilizing factors while recognizing the stabilizing effects of external aid and diplomatic efforts.",
scenario_039,persona_baseline,1,simplified_375,hawkish,26,40,86,78,1.0,0.15,"From an economic and geopolitical perspective, Tethys demonstrates significant resilience despite strain: territorial control remains at 63.7%, GDP has declined only 7.3% from baseline, and international support (79%) with substantial military aid enhances its defensive asymmetric capabilities. The hawkish view notes severe risks from war fatigue and a slight military disadvantage (0.01), but economic interdependence, strong external backing, and Meridian's coalition-building reduce the near-term likelihood of governmental collapse.",
scenario_039,persona_baseline,2,simplified_064,dovish,19,35,60,91,1.0,0.15,"My dovish, low-risk perspective emphasizes Tethys's strong diplomatic position and economic resilience despite territorial losses. With international support at 79%, substantial military aid arriving, and asymmetric capabilities offsetting Novaris's conventional advantage, a full government collapse remains unlikely in the short term. However, the growing war fatigue represents a concerning internal political vulnerability.",
scenario_039,persona_baseline,7,simplified_102,dovish,58,89,84,33,1.0,0.19,"Tethys's defensive position remains robust militarily (63.7% territory held, defender's advantage, asymmetric capabilities) and is receiving significant military aid, making a sudden military collapse unlikely. Economically, Tethys has sustained only a 7.3% GDP decline, while Novaris faces a 14.3% decline under growing sanctions and international support for Tethys is high at 79%, indicating strong external backing. The low crisis level (5/10) and current diplomatic actions favor de-escalation and stability for the Tethys government in the near term, despite some internal war weariness.",
scenario_039,persona_baseline,8,simplified_181,dovish,0,36,92,59,1.0,0.15,"While Tethys faces economic strain with GDP down 7.3% and war fatigue, the government retains control of 63.7% territory with a neutral military balance (0.01) and strong international support (79%). As a dovish financial strategist, I assess that asymmetric capabilities, substantial allied military aid, and growing sanctions pressure on Novaris (44%) create sufficient deterrence and support to prevent imminent government collapse in Period 1.",
scenario_039,persona_baseline,5,simplified_490,hawkish,90,83,40,61,1.0,0.15,"Tethys retains 63.7% of its territory with a near-even military balance, indicating a resilient defense backed by substantial international support and advanced aid. Its asymmetric capabilities and strong diplomatic backing create a sustainable stalemate, making immediate government collapse unlikely despite economic and war fatigue pressures.",
scenario_039,persona_baseline,9,simplified_462,dovish,85,31,86,89,1.0,0.18,"Tethys maintains 63.7% territory with asymmetric military advantages (balance 0.01 near parity) and strong international backing at 79%, while its GDP decline (-7.3%) is manageable and sanctions on Novaris (44%) create economic pressure favoring defender resilience. My dovish orientation sees the combination of Meridian's security commitment, defender military aid, and humanitarian corridors as stabilizing diplomatic buffers against collapse, though my limited military expertise acknowledges uncertainty regarding potential sudden Novaris breakthroughs.",
scenario_039,persona_baseline,6,simplified_220,dovish,62,38,44,77,1.0,0.12,"Tethys retains over 63% of its territory and benefits from strong international support (79%) and defensive military aid, which, alongside its asymmetric capabilities and defender's advantage, makes outright government collapse unlikely in the short term. However, growing war fatigue, a modest GDP decline, and sustained Novarian pressure introduce instability risks, though these are mitigated by active diplomatic engagement and no immediate military defeat.",
scenario_039,persona_shard,4,simplified_054,pragmatic,61,85,85,32,0.6186873696111488,0.12,"Tethys holds a strong defensive position with substantial asymmetric capabilities and growing international support, which effectively nullifies Novaris's conventional advantage. Its GDP decline is manageable, and critical international commitments and sanctions against Novaris bolster its resilience. A decisive military collapse is highly unlikely in the short term, though prolonged strain remains a risk.",
