scenario_id,condition,agent_id,persona_id,strategic_orientation,risk_tolerance,military_expertise,economic_expertise,geopolitical_expertise,information_fraction,probability,rationale,fallback_type
scenario_013,persona_shard,0,simplified_216,pragmatic,31,89,31,86,0.5384010687639095,0.15,"Military analysis indicates Tethys retains significant defensive advantages and asymmetric capabilities that can impose severe costs on Novaris, making outright military collapse unlikely. While economic pressures from sanctions and disrupted trade are mounting, Tethys maintains critical international support and diplomatic momentum, which mitigates immediate collapse risks. The pragmatic assessment is that Novaris faces substantial barriers to achieving regime change given Tethys's demonstrated resilience and growing external backing.",
scenario_013,persona_shard,6,simplified_201,hawkish,21,30,83,77,0.755566561034678,0.15,"From an economic analyst perspective, Tethys retains substantial defensive capacity: only 37.4% territorial loss with zero military disadvantage indicates effective asymmetric strategy, while GDP at 84% of baseline suggests economic resilience despite conflict. International support at 60% plus diplomatic momentum through neutral power framework provides critical stability buffers, though my hawkish orientation notes crisis level 5/10 warrants caution against sudden escalation.",
scenario_013,persona_shard,7,simplified_347,hawkish,48,53,75,68,0.5229087996426537,0.15,"Tethys's government shows resilience through asymmetric capabilities and strong international backing (60% support), making outright collapse unlikely in the short term. While Novaris exerts significant pressure through military mobilization and economic coercion, Tethys's cyber and precision strike capabilities, combined with Meridian's security alliance and emerging diplomatic frameworks, create credible deterrence. However, the escalating crisis level (5/10) and Novaris's historical claims introduce moderate risk, particularly if economic warfare intensifies or asymmetric responses prove insufficient against a determined Novarian advance.",
scenario_013,persona_shard,5,simplified_160,dovish,45,28,58,78,0.6481220433464399,0.25,"While Novaris's pressure campaign and economic coercion pose a serious threat, Tethys retains strong defensive positioning, substantial and growing international support, and no immediate military breakthrough by Novaris. From a dovish perspective, the current diplomatic intensification, neutral power proposal, and Meridian's coalition-building provide pathways for de-escalation that lower the near-term risk of governmental collapse. However, Tethys's economic vulnerability and the volatile military standoff maintain a moderate risk of internal destabilization.",
scenario_013,persona_shard,8,simplified_286,hawkish,76,93,39,65,0.23128771728601089,0.25,"Tethys's asymmetric military capabilities, substantial international support, and Novaris's economic vulnerabilities and internal ethnic divisions suggest it can withstand the pressure without collapsing. However, the volatile military mobilization and Meridian's domestic constraints introduce sufficient uncertainty to assign a significant, but not overwhelming, risk of government removal.",
scenario_013,persona_shard,9,simplified_125,hawkish,28,61,63,61,0.6438650293260523,0.05,"Tethys retains key strategic advantages, including home terrain, asymmetric capabilities sufficient to deter invasion, and growing international support, which offset Novaris's military mobilization. The modest economic pressure shown in the GDP data and the new diplomatic initiatives suggest the crisis remains below the threshold required to induce internal collapse or defeat in Period 1.",
scenario_014,persona_baseline,1,simplified_215,dovish,28,60,53,59,1.0,0.18,"Tethys retains significant defensive advantages with 89.8% territory control and asymmetric capabilities, mitigating Novaris's conventional superiority. International support, while fluctuating at 36%, provides diplomatic pressure and a viable off-ramp via ongoing negotiations, favoring a dovish analysis of sustained de-escalation. Economic pressure on Tethys is notable but its government's high survival imperative and the current crisis level suggest collapse is unlikely in this period.",
scenario_014,persona_baseline,2,simplified_317,pragmatic,45,62,74,60,1.0,0.18,"Tethys's territorial control remains high at 89.8%, its asymmetric capabilities and defender's advantage are stabilizing the frontline, and the international support increase and moderate sanctions create a resilient position. However, the 32% GDP contraction and wavering allied commitment introduce economic and diplomatic risks, making a near-term collapse unlikely but not impossible.",
scenario_014,persona_baseline,4,simplified_379,pragmatic,22,82,27,48,1.0,0.18,"Military analysis indicates Tethys retains a viable defensive position with territorial loss limited to 10.2%, and the battlefield has stabilized. Pragmatic assessment of international support shows it remains substantial and increasing, with key allies engaged, reducing the likelihood of a sudden collapse. While economic pressures are mounting, the current balance of asymmetric capabilities and defensive motivation does not indicate imminent regime failure.",
scenario_014,persona_baseline,3,simplified_023,hawkish,44,57,52,57,1.0,0.18,"While Tethys has lost 10% of its territory and a third of its GDP, its military balance remains resilient, asymmetric capabilities have deterred a Novarian knockout blow, and international support is rising despite some allied wavering. The core indicators—stable front lines, significant external diplomatic activity, and Tethys's successful framing of the conflict as defensive—suggest a grinding war of attrition is more likely than imminent state collapse. The government's survival imperative and the high cost of conquest for Novaris outweigh the significant but not yet catastrophic economic and territorial pressures.",
scenario_014,persona_baseline,5,simplified_108,dovish,18,83,40,85,1.0,0.12,"Tethys retains 89.8% of its territory and a stable military balance, indicating effective asymmetric defense. Its international support has increased to 36%, and sanctions pressure on Novaris is growing, suggesting Novaris's cost calculus is shifting against further escalation. As a dovish analyst, I see the combination of resilient military posture, diplomatic momentum, and the nascent neutral peace initiative as stabilizing factors that make a decisive collapse within this period unlikely, but I maintain moderate confidence due to the volatile crisis level.",
scenario_014,persona_baseline,6,simplified_390,pragmatic,52,86,79,35,1.0,0.28,"Tethys retains substantial defensive capabilities and international support despite economic pressure. While the conflict has eroded GDP and territorial control, asymmetric warfare advantages and continued allied backing make outright government collapse unlikely in this period. The stabilized military balance and diplomatic momentum reduce immediate regime-change risk, though sustained attrition could increase longer-term vulnerability.",
scenario_014,persona_baseline,0,simplified_005,dovish,3,62,53,52,1.0,0.17,"Despite a 10.2% territorial loss and a GDP decline to 67.7% of baseline, Tethys's government remains intact. The military balance is near parity, and its asymmetric capabilities provide a strong deterrent to invasion. International support is moderate but appears to be rising, sanctions pressure on Novaris is minimal, and external diplomatic initiatives and humanitarian support are providing stabilizing momentum, making a government collapse highly unlikely in this period.",
scenario_014,persona_baseline,7,simplified_251,pragmatic,0,59,75,68,1.0,0.32,"The Tethys government faces severe pressure but is not on the brink of collapse. My economic analysis indicates its GDP has fallen by a third, a serious stress but not yet catastrophic, and it retains critical energy transit leverage. Militarily, while the balance slightly favors Novaris (-0.12), Tethys holds defensive advantages and its asymmetric capabilities deter a decisive invasion; the stable simulated frontline suggests no imminent military defeat. Politically, international support for Tethys is growing (36%) and key external actors are actively engaged in support and diplomacy, which, combined with the defender's strong domestic motivation for survival, makes a total governmental collapse within this period unlikely.",
scenario_014,persona_baseline,8,simplified_442,pragmatic,70,26,83,55,1.0,0.2,"As an economic expert, I note that while Tethys's GDP has fallen by roughly one-third, this is consistent with a severe wartime contraction and not yet indicative of an imminent internal collapse. The moderate international sanctions (5%) have not crippled Novaris's economy enough to force a retreat, but the stable territorial situation (89.8% held) and rising international support from successful information warfare suggest Tethys retains significant resilience and external backing, making a near-term government collapse unlikely.",
scenario_014,persona_baseline,9,simplified_042,hawkish,53,83,90,36,1.0,0.28,"From a military perspective, Tethys retains 89.8% territory and a nearly balanced military posture (-0.12) against Novaris's numerical advantage—indicating strong defensive resilience and effective use of asymmetric capabilities. Economically, while Tethys's GDP has declined to $20.3B, the sanctions pressure on Novaris remains limited (5%), and Tethys controls critical energy transit pipelines, giving it ongoing economic leverage. The increase in international support to 36% and successful information framing of the conflict as defensive suggest diplomatic momentum favoring Tethys's survival, making near-term government collapse unlikely despite high crisis levels.",
scenario_014,persona_shard,4,simplified_266,hawkish,83,65,55,75,0.0850285900107663,0.15,"The data shows minimal direct military action and limited sanctions, indicating Novaris is primarily using economic and diplomatic pressure rather than force. While Tethys faces trade disruptions and energy insecurity, these are pressures for negotiation, not existential threats sufficient to trigger government collapse. My hawkish perspective notes the absence of decisive battlefield losses or major external military intervention, key drivers of regime change.",
scenario_014,persona_shard,1,simplified_413,hawkish,69,68,68,52,0.49681738110457796,0.25,"Tethys retains critical defensive military positions and has gained significant international diplomatic support (now at 36%), which offsets its economic contraction. Novaris faces meaningful sanctions and internal ethnic tensions, likely limiting its capacity for a decisive victory in the short term. However, the crisis level remains extremely high at 8/10, and Tethys's GDP has shrunk by a third, creating a precarious economic foundation that could lead to collapse under prolonged pressure.",
scenario_014,persona_shard,3,simplified_005,dovish,3,62,53,52,0.0539819279054301,0.22,"Tethys demonstrates proactive military and information posturing with amphibious exercises, while international support is growing due to successful framing of the conflict as defensive. However, my dovish, low-risk-tolerance perspective emphasizes the significant underlying pressures from trade disruption, potential energy cutoffs, and the economic strain of sustained conflict, which introduces non-trivial instability risks over time, though not immediate collapse.",
scenario_014,persona_shard,0,simplified_270,pragmatic,67,85,32,88,0.36430738253465983,0.15,"My military and geopolitical expertise indicates Tethys's significant asymmetric capabilities, control of critical energy pipelines, and modest gains in international support following their successful information framing of the conflict provide a stable defensive foundation. While a key ally faces internal pressures, the active diplomatic peace initiatives and coordinated international response create off-ramps, and the crisis metrics do not currently point toward imminent internal political or military collapse.",
scenario_014,persona_shard,2,simplified_030,hawkish,71,50,75,76,0.14496516446521138,0.25,"Tethys possesses significant defensive advantages, including strong asymmetric warfare capabilities and the defender's advantage on home terrain, which can impose severe costs on an invasion despite Novaris's numerical superiority. International support for Tethys is substantial and growing, with sanctions already imposed on Novaris, reducing the immediate economic and military threat to Tethys's government stability. However, the ongoing economic warfare, covert operations, and diplomatic isolation present sustained pressures that, while not likely to cause collapse within Period 1, introduce meaningful risk that warrants a probability above minimal levels.",
scenario_014,persona_shard,7,simplified_377,dovish,19,73,56,61,0.06546886915182103,0.28,"While Tethys faces significant military setbacks and economic pressure from sanctions, my dovish analysis emphasizes that government collapse is not imminent given their defensive capabilities and potential for diplomatic intervention. The 15% ethnic Tethyan population creates internal vulnerabilities, but Aurelia's balancing role and the lack of complete territorial loss suggest the government can maintain control through the period, though with substantial strain.",
scenario_014,persona_shard,5,simplified_086,dovish,13,57,62,59,0.39107623153087195,0.18,"Tethys's government faces significant military and economic pressure, but its defensive posture, substantial international support, and clear Meridian security commitment create a strong stabilizing framework. A low probability of collapse is assigned due to the substantial political and military costs Novaris would incur to achieve regime change against a well-supported and prepared adversary. The government's core functions appear intact and the crisis, while severe, has not yet reached a threshold that would cause internal state failure.",
scenario_014,persona_shard,6,simplified_317,pragmatic,45,62,74,60,0.31378946403030006,0.35,"As a pragmatic military and economic analyst, I assess the immediate probability of Tethys's government collapsing as relatively low. The current military balance, while showing a slight advantage for Novaris, is not decisive, and Tethys possesses strong defensive capabilities and symbolic international support. Economic contraction is a significant stressor, but the government's defiant stance, core military control, and active international diplomatic support create a strong buffer against a swift internal collapse. The primary risk is a sudden military escalation or breakthrough by Novaris that could shatter this defensive stability.",
scenario_014,persona_shard,9,simplified_063,pragmatic,67,88,89,44,0.5848055097301978,0.22,"My military analysis indicates Tethys retains a viable defensive posture with asymmetric capabilities that impose severe costs on invasion, while my economic assessment shows substantial international support offsetting initial GDP contraction. However, Novaris's 40% mobilization creates significant escalation risk, and Meridian's potential wavering introduces critical uncertainty.",
scenario_014,persona_shard,8,simplified_197,hawkish,76,66,54,64,0.8080404910462684,0.25,"Tethys retains strong defensive military positions and key territorial control (89.8%), supported by demonstrated asymmetric capabilities. While international pressure and economic strain are growing, the successful information warfare campaign boosting support and the military stalemate suggest Novaris's initial offensive is stalling, reducing immediate regime survival risk, though the crisis remains acute.",
scenario_015,persona_baseline,1,simplified_046,pragmatic,56,87,23,61,1.0,0.08,"Tethys retains 81.5% territory with asymmetric capabilities providing credible defense deterrence against Novaris's superior conventional forces; moderate economic contraction (-8% GDP) and growing international support (43%) suggest resilience against near-term collapse, though war fatigue introduces domestic pressure. The -0.09 military balance indicates Novaris holds marginal advantage, but Tethys's defensive terrain, precision strike capacity, and international backing likely prevent decisive breakthroughs or internal governance failure within this period.",
scenario_015,persona_baseline,2,simplified_123,hawkish,62,37,77,84,1.0,0.15,"Tethys retains 81.5% of its territory and has stabilized the battlefield, indicating resilient defense capabilities. The moderate international support (43%) and sanctions on Novaris (36%) provide crucial diplomatic and economic buffers, while Tethys's asymmetric strategies are likely imposing significant costs on Novaris, limiting its capacity to achieve a decisive victory. Although economic strain exists, the lack of catastrophic territorial loss or internal collapse signals suggests a low probability of governmental overthrow in the near term, consistent with a hawkish assessment that emphasizes Tethys's defensive resolve and Novaris's strategic overextension.",
scenario_015,persona_baseline,0,simplified_405,dovish,73,34,82,88,1.0,0.18,"While Tethys faces significant military pressure with 18.5% territorial loss and economic strain (8% GDP decline), its defensive position remains intact with strong international support (43% backing) and Meridian's coalition building. As a dovish analyst, I see the stabilizing diplomatic efforts by Valkoria and Aurelia, combined with Tethys's asymmetric capabilities and Novaris's own economic constraints ($14.4B GDP loss), creating conditions for continued resistance rather than imminent government collapse.",
scenario_015,persona_baseline,4,simplified_259,hawkish,54,92,32,58,1.0,0.18,"The military situation is stable (Tethys retains 81.5% territory, battlefield momentum uncertain), and its asymmetric capabilities impose prohibitive costs on Novaris for a full invasion. External support is substantial and strengthening, with Meridian's coalition building and significant sanctions on Novaris, indicating the crisis remains in the deterrence and coercion phase, not yet one of imminent state collapse.",
scenario_015,persona_baseline,5,simplified_121,pragmatic,41,88,30,55,1.0,0.28,"From a military-strategic perspective, Tethys retains over 80% territory with defensive advantages and asymmetric capabilities intact, while Novaris faces only marginal military advantage (-0.09) suggesting an unfavorable cost-benefit calculus for invasion. However, war fatigue, economic contraction, and international support below 50% create vulnerability; the pragmatic assessment suggests sustained defensive capacity with moderate risk of collapse from economic attrition rather than military defeat.",
scenario_015,persona_baseline,3,simplified_366,pragmatic,48,75,77,48,1.0,0.18,"Tethys retains over 80% of its territory with a stabilized battlefield and minimal military disadvantage (-0.09), indicating a strong defensive position against conventional invasion. While economic costs are mounting (GDP down 8%), substantial and growing international support (43%) plus sanctions on Novaris (36%) provide critical buffers, and the current crisis level (6/10) suggests managed escalation rather than imminent collapse. The asymmetric warfare capabilities of Tethys, combined with Novaris's own economic and diplomatic costs, make a government-ending defeat or internal collapse within this period unlikely.",
scenario_015,persona_baseline,7,simplified_278,pragmatic,79,64,53,66,1.0,0.12,"Despite significant military pressure and economic contraction, Tethys retains a credible defense posture with 81.5% territory control and robust international backing, reducing imminent collapse risk. The asymmetric warfare advantage, sustained Meridian support, and Novaris's own economic constraints make a decisive regime-change outcome unlikely in this period, though instability is increasing.",
scenario_015,persona_baseline,8,simplified_404,pragmatic,33,53,66,68,1.0,0.18,"Territorial retention at 81.5% and a near-even military balance (-0.09) indicate Tethys's defense is holding effectively, leveraging its asymmetric advantages. While war fatigue and economic strain pose risks, robust international backing via coalition building and humanitarian support, combined with Novaris's own economic pain from sanctions, makes an immediate government collapse unlikely. The crisis level of 6/10 reflects sustained pressure, not imminent breakdown.",
scenario_015,persona_baseline,6,simplified_072,dovish,29,85,36,87,1.0,0.15,"From a military-strategic perspective, the stabilization of the simulated frontline (-0.09 balance, 81.5% territory held) indicates Tethys's credible defensive posture and Novaris's restraint from a full-scale invasion, which avoids a direct path to military collapse. My dovish orientation emphasizes that diplomatic momentum—with major powers engaged in coalition building and negotiations, and no overt external military intervention favoring Novaris—creates substantial pressure for de-escalation rather than regime change. However, the 'defender strain' event and economic contraction present a real, moderate risk of internal political erosion over time, keeping the probability non-negligible but low for an immediate government collapse.",
scenario_015,persona_baseline,9,simplified_304,pragmatic,26,37,60,80,1.0,0.15,"Tethys retains over 80% of its territory, with only a slight military disadvantage (-0.09) indicating a stabilized frontline. Despite economic strain (8% GDP decline), this level of contraction does not signal an imminent internal collapse, especially given growing international support (43%) and Meridian's coalition building. The crisis level remains at 6/10, suggesting continued conflict but insufficient momentum for a government overthrow in this period.",
scenario_015,persona_shard,3,simplified_344,dovish,0,55,67,66,0.21787994981170478,0.15,"While Tethys faces moderate economic pressure and military provocations, the government shows defensive preparations and retains Meridian's security commitment, which likely deters immediate collapse. As a dovish analyst with low risk tolerance, I assess that economic disruptions and Novaris's isolation are not yet severe enough to trigger regime change, and ongoing diplomatic efforts by Valkoria and Aurelia provide stabilization pathways.",
scenario_015,persona_shard,1,simplified_062,dovish,96,67,57,51,0.09306007089470072,0.18,"Tethys maintains substantial international support and defensive positioning, with Novaris's 'Sovereign Shield' exercises representing deterrent signaling rather than imminent offensive action. While external military pressure exists, Tethys's governance structures remain intact with functioning institutions and growing diplomatic backing, reducing near-term collapse risk. The establishment of humanitarian corridors suggests international mediation efforts are gaining traction, further stabilizing the situation.",
scenario_015,persona_shard,2,simplified_357,pragmatic,60,78,78,47,0.5422054367753972,0.12,"From a military perspective, Tethys maintains a stable defensive posture with asymmetric warfare capabilities and defender's advantage, making rapid defeat unlikely. Economically, while GDP has contracted moderately, substantial international support and mutual energy interdependence with Novaris create resilience against collapse pressures. Pragmatically, the combination of Tethys's strong defensive will, growing diplomatic backing, and Novaris's economic vulnerabilities from sanctions suggests regime survival probability remains high in this early crisis phase.",
scenario_015,persona_shard,0,simplified_312,pragmatic,48,90,76,42,0.3231121306406858,0.15,"Tethys possesses significant asymmetric capabilities (advanced cyber, precision strike, economic leverage via pipelines) that offset Novaris's conventional military advantage, making a decisive military defeat unlikely. While the economy is strained (-8% GDP) and external support is constrained, the battlefield is stabilized, diplomacy is intensifying, and no critical territorial loss has been reported, reducing immediate collapse pressure. My pragmatic military analysis indicates the defender's position is tenable in the near term.",
scenario_015,persona_shard,4,simplified_441,hawkish,43,42,90,76,0.14513107777256828,0.28,"From my economic expertise, the sanctions impact on Novaris and Tethys's preparations for energy cutoffs suggest near-term economic pressure is manageable and not yet crippling; geopolitically, the situation lacks decisive military escalation or clear external intervention momentum that would rapidly overwhelm Tethys. My hawkish but moderate-low risk tolerance leads me to see the threat as significant but not yet at a tipping point for collapse.",
scenario_015,persona_shard,5,simplified_313,pragmatic,100,40,65,88,0.8154475121261356,0.28,"My pragmatic assessment weighs Tethys's significant asymmetric deterrent capabilities and robust external support against its territorial and economic erosion. While Novaris possesses the intent, my high-risk tolerance leads me to conclude the current cost-benefit calculus for a decisive Novarian victory remains unfavorable, making a complete government collapse within this timeframe improbable.",
