scenario_id,condition,agent_id,persona_id,strategic_orientation,risk_tolerance,military_expertise,economic_expertise,geopolitical_expertise,information_fraction,probability,rationale,fallback_type
scenario_026,persona_baseline,9,simplified_389,pragmatic,79,50,72,53,1.0,0.25,"Tethys's government faces significant military pressure with territorial loss and a negative military balance, but its strong asymmetric capabilities, high international support (86%), and economic resilience (GDP at 85% of baseline) provide buffers against collapse. The crisis level is high (9/10), yet pragmatic analysis suggests that external diplomatic efforts and Novaris's own economic constraints (sanctions at 66%, GDP at 90.7% of baseline) reduce the likelihood of immediate regime change, though the risk remains elevated due to ongoing conflict dynamics.",
scenario_026,persona_baseline,6,simplified_313,pragmatic,100,40,65,88,1.0,0.15,"Tethys retains 79.4% territory and strong international support (86%), but faces economic strain (GDP down 15%) and Novaris's military pressure; however, asymmetric capabilities and Meridian's backing make near-term government collapse unlikely despite high crisis level.",
scenario_026,persona_baseline,7,simplified_102,dovish,58,89,84,33,1.0,0.22,"Military analysis shows Tethys retains substantial territory (79.4%) and a near-neutral military balance (-0.14), indicating the frontline is holding despite Novaris's initial push; economic expertise highlights Tethys's GDP decline is moderate (15%) and severe external sanctions (66%) are crippling Novaris's economy more, undermining its sustained offensive capability. The high international support (86%) and active coalition building by Meridian provide a stabilizing diplomatic counterweight, making a near-term government collapse unlikely, though the elevated crisis level requires close monitoring.",
scenario_026,persona_shard,0,simplified_479,hawkish,70,59,63,66,0.9357656086680269,0.18,"Tethys retains significant defensive capacity despite territorial loss, with strong international backing and sanctions pressure on Novaris creating economic constraints. Asymmetric capabilities and domestic resolve remain high, while Novaris's costly military gains risk triggering further international escalation and internal opposition, making decisive regime change unlikely in the near term.",
scenario_026,persona_shard,1,simplified_093,dovish,46,80,76,40,0.2411786383546184,0.18,"From a military strategy perspective, Tethys's territorial retention (70%) and defensive positioning suggest a credible holding capacity against Novaris's advance, reducing immediate collapse risk from military defeat. Economically, the 15% GDP decline is manageable with substantial international support (86%), preventing acute internal instability. My dovish orientation sees the diplomatic momentum and lack of decisive escalatory actions this period as favoring de-escalation over government overthrow.",
scenario_026,persona_shard,4,simplified_408,hawkish,65,89,38,84,0.44626564996727563,0.25,"Despite Novaris's mobilization and pressure campaign, Tethys retains its territorial integrity with no ground seized and benefits from Meridian's firm security guarantee, which deters a full-scale invasion. However, Novaris's sustained economic coercion and cyber disruptions pose serious risks to Tethys's internal stability, especially given its economic vulnerabilities, making some chance of government failure plausible under prolonged strain.",
scenario_026,persona_shard,3,simplified_042,hawkish,53,83,90,36,0.703031895421454,0.25,"While Tethys's territory has been reduced to 79.4% and its GDP has declined by 15% from baseline, the defender's advantage, high international support at 86%, and substantial sanctions on Novaris at 66% create strong deterrents against a full-scale invasion that would lead to government collapse. As a hawkish economic analyst, I note the mutual economic dependence, particularly the 30% of Novaris's energy revenues flowing through Tethys, coupled with continued external diplomatic and proxy support, significantly lowers the near-term risk of Tethys's government being overthrown, despite the high 9/10 crisis level.",
scenario_026,persona_shard,6,simplified_337,pragmatic,25,87,31,64,0.050650067738543636,0.32,"My military expertise suggests Tethys's loss of 22% territory and force ratio deficit of 2.1:1 indicate serious structural vulnerabilities, particularly given their established defensive doctrine which can degrade over time under sustained pressure. However, as a pragmatic analyst with moderate-low risk tolerance, I weigh the facts that Tethys maintains critical infrastructure, retains most core territory, and has not yet reached strategic breaking points where military collapse becomes imminent, despite the severe crisis level. While significant risks exist, my military assessment suggests collapse probability remains below 50% within this period.",
scenario_026,persona_shard,7,simplified_354,pragmatic,57,47,90,87,0.8095548517649789,0.15,"While Novaris possesses conventional military superiority and has initiated coercive pressure, Tethys's significant asymmetric capabilities (cyber, precision strikes), strong international backing (86% support, Meridian security commitment), and economic leverage through pipeline control create meaningful deterrents against successful regime change. My economic analysis suggests Novaris faces growing costs from sanctions and potential revenue disruption, while Tethys's GDP contraction remains manageable at -15% from baseline; the mutual economic interdependence and diplomatic momentum toward de-escalation make full collapse unlikely in Period 1.",
scenario_026,persona_shard,9,simplified_181,dovish,0,36,92,59,0.2940718090138906,0.25,"From an economic standpoint, Tethys's defensive position and asymmetric military capabilities, coupled with the mutual energy interdependence with Novaris and strong external support from Meridian, create substantial resilience against government collapse. However, as a dovish analyst with low risk tolerance, I acknowledge that Novaris's significant military mobilization and potential for economic pressure introduce non-trivial risks that warrant a probability above base rates for a peaceful outcome.",
scenario_026,persona_shard,5,simplified_193,dovish,18,29,64,94,0.23699678496894366,0.18,"Tethys's government is under severe pressure from Novaris's multi-domain campaign, but its strong defensive military position, substantial and growing international support (86%), and significant GDP indicate a robust capacity to resist collapse in the short term. While my dovish orientation emphasizes the risks of escalation, the current data shows Tethys is more likely to endure the initial period, supported by coordinated diplomatic efforts and a military stalemate.",
scenario_026,persona_shard,8,simplified_175,pragmatic,37,27,90,50,0.5024209898540638,0.16,"Tethys retains 79.4% of its territory, possesses significant asymmetric capabilities, and enjoys strong international support (86%), which mitigates immediate military collapse risks. Economically, the moderate but growing pressures and Novaris's GDP decline are not yet severe enough to trigger governmental failure, given Tethys's control of critical energy transit pipelines provides leverage. Diplomatic constraints on direct intervention and the volatile crisis level suggest escalation risk, but pragmatic analysis indicates current defenses and support likely sustain the government through Period 1.",
scenario_026,persona_shard,2,simplified_299,dovish,37,64,67,62,0.7052164276130578,0.18,"My military analysis indicates Tethys's substantial asymmetric capabilities, defender's advantage, and intact territorial control (79.4%) create a strong defensive posture that makes military collapse unlikely in the short term. Economically, while Tethys's GDP has contracted to $25.5B, the significant sanctions pressure on Novaris (66%) and mutual energy interdependence create a stalemate that favors economic sustainability over collapse. Geopolitically, Meridian's reaffirmed security commitment, coalition building, and active diplomatic channels from neutral powers provide substantial external buttressing against government removal, aligning with my dovish assessment that de-escalatory pressures currently outweigh escalatory momentum.",
scenario_027,persona_baseline,2,simplified_239,dovish,40,59,62,51,1.0,0.32,"From my economic analysis perspective, Tethys faces severe stress with GDP down 36.7% and Novaris down 29%, but Tethys's critical pipeline leverage (30% of Novaris energy revenues) creates significant mutual economic deterrence. While military balance slightly favors Novaris, the defender's advantage, asymmetric capabilities, and growing international support at 52% suggest the government can withstand pressure. My dovish orientation interprets the 6/10 crisis level and multiple diplomatic initiatives as indicating manageable escalation rather than imminent collapse.",
scenario_027,persona_baseline,4,simplified_023,hawkish,44,57,52,57,1.0,0.15,"Despite significant economic strain and territorial loss, Tethys retains 84% of its territory, robust external diplomatic support, and vital asymmetric military capabilities. The military balance, though negative, is not catastrophic, and the crisis level remains below the threshold for immediate regime collapse. The combined effect of international pressure on Novaris and Tethys's demonstrated resilience makes a full government collapse unlikely in this period, though the situation remains precarious.",
scenario_027,persona_baseline,0,simplified_005,dovish,3,62,53,52,1.0,0.15,"Tethys retains 84.4% territory and moderate military balance (0.07) suggesting defensive resilience, while international support at 52% and sanctions on Novaris at 25% provide stabilizing pressure; however, economic strain with GDP down 37% poses internal risks, though asymmetric capabilities and diplomatic efforts likely prevent imminent collapse.",
scenario_027,persona_baseline,1,simplified_268,pragmatic,52,23,50,81,1.0,0.15,"Tethys retains 84.4% of its territory with a slight military advantage (0.07), indicating effective asymmetric defense, while its GDP drop to $19B, though severe, is manageable in the short term given strong international backing (52% support, sanctions on Novaris at 25%). The presence of a peace initiative and humanitarian corridors provides diplomatic off-ramps, making a total government collapse unlikely within this period, though economic strain remains a risk.",
scenario_027,persona_baseline,3,simplified_335,hawkish,27,63,75,72,1.0,0.28,"Tethys retains significant territorial control (84.4%) and a slightly favorable military balance (0.07), indicating strong defensive resilience against Novaris's conventional advantage. While the economy is degraded (GDP at 63% of baseline) and international support is moderate (52%), the absence of direct combat, substantial asymmetric capabilities, and active diplomatic backchanneling from neutral powers mitigate the risk of immediate government collapse. My hawkish orientation sees the 'Air Incident' and 'Information Warfare' as escalatory, but my moderate-low risk tolerance weighs the stabilizing indicators of territorial integrity and ongoing diplomacy more heavily against a near-term regime change.",
scenario_027,persona_baseline,6,simplified_343,pragmatic,67,90,40,67,1.0,0.1,"Tethys retains strong territorial control (84.4%) and significant international support (52%), with its asymmetric military capabilities and Meridian's security commitment providing deterrence. While economic pressures exist, the current crisis level of 6/10 and the presence of diplomatic initiatives suggest the situation is volatile but not yet at a breaking point for government collapse.",
scenario_027,persona_baseline,7,simplified_121,pragmatic,41,88,30,55,1.0,0.25,"Military analysis indicates Tethys retains strong defensive posture with minimal territorial loss (15.6%) and a near-even force balance, supported by asymmetric capabilities that deter Novaris escalation. Economic pressures are significant but not yet catastrophic, with international support growing and sanctions on Novaris increasing, suggesting Tethys can sustain resistance without imminent government collapse.",
scenario_027,persona_baseline,5,simplified_458,dovish,68,54,59,57,1.0,0.25,"Tethys retains over 84% of its territory and a defensive military advantage (balance of 0.07), indicating it can impose severe costs on an invasion despite its economic losses. While GDP has declined significantly, robust international support (52%) and active diplomatic initiatives provide a stabilizing counterweight. However, the sustained economic pressure and the moderate-high crisis level (6/10) create a non-trivial risk of internal fracture or forced capitulation over time.",
scenario_027,persona_baseline,8,simplified_089,dovish,29,56,73,56,1.0,0.18,"As a policy advisor with strong economic analysis skills, I note Tethys's GDP has fallen by a significant but not catastrophic 36.7% from baseline, suggesting economic resilience is strained but not broken. My dovish, moderate-low risk tolerance leads me to weigh the stabilizing factors—including substantial territorial retention (84.4%), Meridian's coalition building, and the nascent peace initiative—more heavily than the escalatory signals. The military balance remains unfavorable for Tethys but not decisively so, and a full government collapse at this stage, while possible, appears an unlikely outcome of the current pressure campaign.",
scenario_027,persona_baseline,9,simplified_208,pragmatic,83,30,84,63,1.0,0.25,"While Tethys has suffered significant GDP decline (37%) and territorial loss (15.6%), its defensive asymmetric capabilities, military balance near parity (0.07), and growing international support (52%) provide substantial resilience. My high risk tolerance focuses on the stabilizing factor of Tethys's control over critical energy pipelines and strong external diplomatic momentum, making a full government collapse unlikely in this first period.",
scenario_027,persona_shard,4,simplified_219,pragmatic,65,87,48,86,0.9122233440094388,0.2,"Tethys retains a solid military defense posture with asymmetric advantages and high defender motivation, while the conflict remains in a volatile but non-kinetic phase; external diplomatic and humanitarian efforts provide stability, but the risk of escalation and economic strain from GDP contraction and sanctions pressure keeps a non-zero probability of collapse.",
scenario_027,persona_shard,2,simplified_417,hawkish,80,88,47,90,0.1364641306317746,0.25,"Tethys holds significant defensive advantages including home terrain and asymmetric warfare capabilities that would impose severe costs on any invasion attempt, and growing international support with sanctions already targeting Novaris creates meaningful external pressure. However, the combination of economic warfare, covert operations, and Novaris's numerical advantage introduces serious risks of territorial losses or economic strain that could destabilize the government, though likely not to collapse levels within this period.",
scenario_027,persona_shard,0,simplified_245,dovish,55,64,74,66,0.3342835037948292,0.3,"Despite significant military pressure and economic damage, Tethys retains robust asymmetric capabilities and strong international backing focused on preserving its sovereignty. The current crisis level and sanctions pressure Novaris but do not yet indicate an imminent internal collapse of the Tethyan government; my dovish orientation emphasizes the stabilizing role of ongoing diplomatic coordination and the high costs to Novaris of pursuing regime change, though the economic strain and military mobilization present a serious, ongoing risk.",
scenario_027,persona_shard,3,simplified_259,hawkish,54,92,32,58,0.4653006464990426,0.28,"Tethys retains 84.4% territory and maintains defensive positions with moderate international support (52%), indicating resilience against Novaris's mobilization. However, economic strain from a 37% GDP decline and disrupted trade routes creates internal pressure, while Meridian's coalition-building and Aurelia's diplomacy offer stabilizing counterweights to Novaris's military posturing. My hawkish perspective notes the volatile military standoff and economic vulnerability, but current defensive readiness and external backing make full government collapse unlikely in the short term.",
scenario_027,persona_shard,1,simplified_330,pragmatic,80,79,84,50,0.8185605030410156,0.12,"Tethys retains strong defensive military capabilities including asymmetric warfare and home terrain advantage, which my military analysis suggests makes direct conquest prohibitively costly for Novaris. My economic assessment indicates severe but not terminal GDP contraction, and Tethys holds critical economic leverage through pipeline control; internal collapse remains unlikely while external diplomatic support holds. The current crisis level and recent events suggest a volatile stalemate, not an imminent regime change tipping point.",
scenario_027,persona_shard,6,simplified_068,hawkish,41,68,62,74,0.08268074077670494,0.25,"While Tethys faces severe military pressure from Novaris's advances and economic strain from sanctions, its defensive mobilization, Meridian's security commitment, and international diplomatic appeals provide critical stabilizing factors; however, the loss of significant territory and mounting costs create substantial risk of government failure if external support falters or the conflict escalates abruptly.",
scenario_027,persona_shard,9,simplified_320,hawkish,91,71,68,55,0.9445136980703988,0.28,"From my military strategy perspective, Tethys's asymmetric capabilities (0.07 military balance despite Novaris's size advantage) combined with defender's home terrain provide credible deterrence against immediate collapse. My economic analysis indicates severe economic damage (GDP down 37% to $19B) creates internal pressure, but substantial international support (52%) and Novaris's own economic decline (GDP down 29%) limit Novaris's ability to force capitulation. My hawkish orientation recognizes real risk from escalatory signals like the air incident and information warfare, but Tethys's survival imperative and external backing suggest government collapse remains unlikely in this period, though economic viability is deteriorating rapidly.",
scenario_027,persona_shard,5,simplified_176,hawkish,59,61,61,74,0.6203600100690093,0.22,"Tethys retains 84.4% of its territory and holds asymmetric military advantages that offset Novaris's conventional edge, making a quick military collapse unlikely. Strong and growing international diplomatic support, including a Meridian security commitment, provides significant stabilizing pressure against Novaris's coercion, while Tethys's economic leverage through energy pipelines creates mutual deterrence. However, the elevated crisis level, GDP decline, and ongoing hybrid pressure campaign introduce real instability, keeping a non-zero probability of government failure from prolonged strain or miscalculation.",
scenario_027,persona_shard,8,simplified_075,pragmatic,76,34,90,82,0.5151321987017167,0.15,"While Tethys faces significant military disadvantage (-0.93 military balance) and economic pressure (GDP down 37% from baseline), its control of 84.4% of territory, possession of asymmetric capabilities (cyber, precision strikes, energy transit leverage), and Meridian's security commitment provide substantial resilience against government collapse in the immediate term. The crisis remains in a volatile but non-combat phase, and Tethys's economic leverage and defensive mobilization create high costs for Novaris, making rapid regime change unlikely in Period 1 despite escalatory risks.",
scenario_027,persona_shard,7,simplified_215,dovish,28,60,53,59,0.28725073326681444,0.5,,missing_probability_key
scenario_028,persona_baseline,1,simplified_433,pragmatic,59,30,94,68,1.0,0.19,"Tethys's economic position, my area of strongest expertise, remains tenable; a 29% GDP contraction is severe but likely reflects wartime reallocation, not imminent state failure, especially given robust 81% international support. The stabilized military front and external actions—financial aid and backchannel negotiations—point toward a managed, protracted conflict rather than a sudden collapse of governance capacity.",
scenario_028,persona_baseline,4,simplified_145,pragmatic,50,39,80,60,1.0,0.15,"Economic analysis indicates severe stress (GDP down 29%) but not immediate collapse, as the substantial (81%) and active international support provides a critical financial and political buffer. Militarily, the stabilized frontline and strong defensive position indicate the government is not facing imminent territorial defeat. The primary risk stems from potential internal fracture under sustained pressure, but the current international and military posture mitigates against a decisive regime failure in this period.",
scenario_028,persona_baseline,2,simplified_389,pragmatic,79,50,72,53,1.0,0.22,"Despite a significant 28.7% GDP contraction and ongoing cyber/economic pressure, Tethys retains strong asymmetric military capabilities (defensive advantage 0.09) and exceptionally high international support (81%). A pragmatic analysis, with a strong economic focus, suggests the current sanctions (15%) are insufficient to trigger internal collapse, and the government's defensive position, buttressed by substantial external backing, remains viable in the short term, making a regime change or capitulation unlikely this period.",
scenario_028,persona_baseline,3,simplified_382,pragmatic,69,20,91,68,1.0,0.15,"Despite a 12.4% decline in GDP and 36.2% territorial loss, Tethys maintains defensive military advantages (balance 0.09) and strong international support (81%), which provides critical aid and sanctions pressure on Novaris. The pragmatic assessment, drawing on economic expertise, suggests the economic shock from oil price decline is manageable with external aid, and the current crisis level of 7/10 indicates stabilization rather than imminent collapse risk.",
scenario_028,persona_baseline,7,simplified_296,pragmatic,87,56,75,52,1.0,0.18,"While Tethys faces significant economic strain (GDP down 29%) and military pressure (territorial loss of 36.2%), the current military balance remains near parity, asymmetric capabilities are intact, and international support remains very high at 81%. The external actor actions—financial aid from Meridian and humanitarian corridors from the International Organization—likely stabilized immediate collapse risks. My economic analysis suggests the crisis is not yet economically catastrophic enough to force government resignation given international backing.",
scenario_028,persona_baseline,0,simplified_487,dovish,40,30,68,79,1.0,0.18,"Tethys retains over 60% of its territory and has high (81%) international support, creating a stable diplomatic and defensive posture that makes near-term government collapse unlikely. While economic stress from a 29% GDP decline and cyber disruptions pose risks, the decisive military balance slightly favoring Tethys and substantial external financial aid and proxy support from allies like Meridian and Valkoria provide critical resilience against Novaris's pressure campaign.",
scenario_028,persona_baseline,8,simplified_221,hawkish,57,58,57,70,1.0,0.15,"Tethys retains strong defensive military positioning with a stable frontline and only moderate territorial loss (63.8% remains), supported by substantial international backing at 81% and demonstrated resilience. The economic shock from a 25% oil price decline and GDP contraction is significant, but external financial aid and Tethys's asymmetric capabilities provide buffers against immediate government collapse or defeat.",
scenario_028,persona_baseline,6,simplified_307,pragmatic,46,20,40,90,1.0,0.18,"Tethys retains significant territorial control (63.8%) and strong international support (81%), with Meridian's financial aid and asymmetric defenses stabilizing the front. Economic pressures are notable but not yet catastrophic, and diplomatic efforts continue, making full government collapse unlikely in the short term.",
scenario_028,persona_baseline,5,simplified_266,hawkish,83,65,55,75,1.0,0.15,"Tethys retains over 63% of its territory with the military balance near parity, indicating strong defensive resilience; substantial international support at 81% and Meridian's financial aid bolster stability, offsetting GDP decline. While the cyber disruption is a vulnerability, Tethys's asymmetric capabilities and high crisis motivation make government collapse unlikely in the short term, though the situation remains volatile.",
scenario_028,persona_baseline,9,simplified_082,pragmatic,37,27,64,89,1.0,0.15,"While Tethys faces significant economic strain (GDP down ~30%) and cyber disruption, its military position remains stable with strong international support (81%) and territorial control. My pragmatic assessment, heavily weighted by economic analysis, suggests the government retains sufficient resilience to withstand current pressures; the substantial economic decline is severe but not yet catastrophic enough to force collapse, especially given robust external diplomatic and financial backing.",
