scenario_id,condition,agent_id,persona_id,strategic_orientation,risk_tolerance,military_expertise,economic_expertise,geopolitical_expertise,information_fraction,probability,rationale,fallback_type
scenario_001,persona_baseline,0,simplified_279,dovish,31,89,34,76,1.0,0.25,"Tethys retains significant defensive advantages with stabilized frontlines and substantial international support, but its economy is under severe strain with a 25% GDP contraction, which could undermine internal stability over time.",
scenario_001,persona_baseline,4,simplified_446,dovish,34,71,61,52,1.0,0.35,"Tethys retains a significant defensive advantage with 63.4% of its territory intact and asymmetric capabilities, which my military analysis judges as effective for imposing high costs on Novaris despite the slight military balance favoring Novaris. Economically, the 25% GDP contraction is severe, but international support and sanctions on Novaris (71%) create economic pressure on the aggressor, reducing the risk of immediate internal collapse in Tethys. Diplomatically, the coalition-building by Meridian and sustained high international support (59%) provide a stabilizing framework, though the high crisis level and economic strain present a non-negligible risk of governmental failure if the conflict protracts.",
scenario_001,persona_baseline,3,simplified_437,hawkish,31,60,58,50,1.0,0.15,"Tethys retains significant defensive advantages with 63.4% territory control and a near-even military balance (-0.05), while international support at 59% and sanctions on Novaris at 71% provide substantial external pressure. However, the economic strain from a 25% GDP decline poses a serious internal risk, though the stabilized frontline and ongoing diplomatic efforts from actors like Aurelia and the International Organization suggest a managed crisis rather than imminent collapse.",
scenario_001,persona_baseline,7,simplified_197,hawkish,76,66,54,64,1.0,0.15,"Tethys retains significant defensive advantages with stabilized frontlines and asymmetric capabilities, but faces severe economic strain with GDP down 25% and prolonged conflict pressure. International support at 59% and sanctions on Novaris at 71% provide diplomatic and economic leverage, making government collapse unlikely in the short term despite economic deterioration.",
scenario_001,persona_baseline,1,simplified_370,pragmatic,70,24,89,69,1.0,0.25,"While Tethys is under severe economic pressure with GDP down 25% and faces a 36.6% territorial loss, battlefield stabilization, strong international support at 59%, and a security commitment from Meridian provide critical resilience. My economic analysis highlights the strain, but the defender's advantage and external coalition-building suggest the government can maintain control, albeit at a high cost, making collapse a significant but not yet likely outcome.",
scenario_001,persona_baseline,5,simplified_010,pragmatic,77,27,90,57,1.0,0.35,"Tethys's GDP has fallen by 25% from baseline, indicating severe economic stress, but the frontline has stabilized (territory at 63.4% with defensive advantages). International support at 59% and Meridian's coalition building provide crucial external backing, mitigating immediate collapse risk despite the economic crisis.",
scenario_001,persona_baseline,6,simplified_401,pragmatic,20,50,60,72,1.0,0.25,"Tethys retains 63.4% of its territory and battlefield momentum has stabilized, indicating a resilient military defense that negates immediate invasion risks. However, Tethys's GDP has contracted by 25% under prolonged conflict pressure, a significant economic strain that could undermine long-term government stability if the crisis continues without resolution. International support and sanctions against Novaris are strong, providing Tethys with diplomatic and economic buffers, which mitigates near-term collapse risk despite the economic deterioration.",
scenario_001,persona_baseline,9,simplified_107,dovish,26,63,72,60,1.0,0.23,"Despite significant territorial loss (36.6%) and severe GDP contraction (-25%), Tethys's military position has stabilized (-0.05 balance indicates near-parity) with defensive advantages, and robust international support (59%) provides strategic depth. While economic pressures from prolonged conflict are serious, the combination of Meridian's coalition-building, humanitarian corridors, and Novaris facing its own economic contraction (-25.9% GDP) and heavy sanctions (71%) suggests Tethys retains sufficient capacity to avoid government collapse in this period, though vulnerabilities remain.",
scenario_001,persona_baseline,8,simplified_178,pragmatic,39,38,90,54,1.0,0.25,"The current economic strain on Tethys is severe, with GDP down 25% and the 'Economic Defender' event indicating further crisis, which heightens collapse risk. However, military stabilization with defensive advantages and strong international support (59%) provide critical buffers. Novaris also faces economic pressure (GDP down 26% and high sanctions), reducing its capacity for decisive victory, making full government collapse less likely despite economic distress.",
scenario_001,persona_baseline,2,simplified_314,dovish,30,56,72,57,1.0,0.12,"My assessment, emphasizing economic and diplomatic factors, indicates Tethys is facing significant stress with a 25% GDP contraction and ongoing conflict, but a government collapse in the short term is unlikely. The defender's economy is under pressure, yet the battlefield has stabilized with defensive advantages, and international support at 59% provides a crucial buffer. My dovish, moderate-low risk orientation leads me to weight the stabilizing elements—continued territorial control (63.4%), strong external backing, and ongoing diplomatic efforts—more heavily than the economic downturn, suggesting a low probability of regime change in this period.",
scenario_001,persona_shard,4,simplified_229,dovish,47,25,84,58,0.4722139219164676,0.28,"My economic analysis indicates significant pressure on Tethys from Novaris's sanctions and trade disruption, with its GDP shrinking to 67% of baseline. However, as a dovish strategist, I assess that Meridian's security commitment (59% international support) and ongoing diplomatic efforts provide critical stability, making outright government collapse unlikely in the short term despite severe economic strain. The absence of current territorial loss and Valkoria's diplomatic facilitation supports de-escalation prospects, though economic vulnerabilities remain the primary threat vector.",
scenario_001,persona_shard,3,simplified_130,dovish,55,20,66,84,0.7348450758967007,0.2,"Tethys's military position appears stable with territorial retention at 63.4% and defensive advantages, while external support at 59% and sustained diplomatic engagement from Meridian and Aurelia bolster its resilience. Although Novaris's economic pressure is a concern, Tethys's pipeline leverage and the lack of severe battlefield losses suggest the government can withstand current stresses without collapse.",
scenario_001,persona_shard,1,simplified_333,pragmatic,61,47,75,80,0.7033283838155552,0.24,"Tethys maintains strong defensive military positions with asymmetric capabilities and holds 63.4% territory, while international support at 59% and sanctions on Novaris at 71% provide substantial backing. However, economic pressure is moderate with GDP down 25% and crisis level at maximum, creating vulnerability. My pragmatic analysis weights the stabilizing factors of territorial control and alliance support against economic risks, resulting in a moderate-low probability of collapse.",
scenario_001,persona_shard,0,simplified_462,dovish,85,31,86,89,0.17550708303435136,0.25,"While Tethys faces a severe crisis and significant economic contraction, its asymmetric military capabilities and control of critical energy infrastructure provide leverage and resilience; diplomatic momentum toward de-escalation and Novaris's high sanction costs reduce the likelihood of a decisive defeat leading to government collapse.",
scenario_001,persona_shard,8,simplified_162,hawkish,36,39,85,83,0.3801787865896615,0.15,"Tethys's asymmetric capabilities and strong international support (59%) provide critical resilience against collapse, while Novaris faces greater economic vulnerability with sanctions and ethnic divisions despite military advantage. My hawkish perspective recognizes the high crisis level but emphasizes Tethys's strategic position and external commitments, while moderate-low risk tolerance prevents overreacting to escalatory signals absent active combat.",
scenario_001,persona_shard,7,simplified_141,pragmatic,49,86,47,89,0.9310844965109116,0.28,"Tethys retains significant defensive advantages (terrain, asymmetric capabilities) and maintains substantial international support (59%) while Novaris faces growing economic pressure from sanctions. The military balance is effectively neutral (-0.05) despite Novaris's numerical advantage, and Tethys's GDP contraction (25% from baseline) shows resilience rather than imminent collapse. However, the high crisis level and ongoing battlefield developments create non-trivial risk that could escalate toward government failure if defensive positions falter.",
scenario_001,persona_shard,5,simplified_158,pragmatic,73,53,63,71,0.1537315812234012,0.28,"While Novaris's multi-domain pressure campaign poses a severe threat, Tethys benefits from substantial and growing international support, a roughly matched military balance, and a defensive commitment from Meridian. The economic disruptions are significant but likely manageable given the strong diplomatic backing, making a near-term government collapse improbable, though not impossible given the sustained pressure.",
scenario_001,persona_shard,6,simplified_024,hawkish,50,32,76,82,0.1576719524748768,0.75,"As a hawkish analyst with strong economic expertise, I assess that Novaris's substantial military mobilization and historical claims signal a high determination for forced reunification. While international support for Tethys is moderate at 59% and Meridian is committed, domestic constraints in Meridian and Novaris's capabilities create a severe power asymmetry. The 10/10 crisis level and Meridian's war-weariness likely mean insufficient external military intervention to prevent Novaris from achieving decisive territorial gains or coercive regime change within Period 1.",
scenario_001,persona_shard,2,simplified_062,dovish,96,67,57,51,0.5293522515926135,0.25,"Despite severe economic damage with GDP down 25%, Tethys maintains robust defensive military positioning, substantial international backing, and critical economic leverage via pipeline interdependencies, significantly deterring an immediate Novaris assault and collapse scenario. My dovish perspective sees the diplomatic activity and stabilized frontline as key de-escalatory signals, though my high risk tolerance acknowledges the volatility and momentum of Novaris's mobilization creates a material, non-negligible threat to government continuity.",
scenario_001,persona_shard,9,simplified_332,dovish,77,57,60,75,0.3584902478223138,0.18,"My economic analysis indicates the defender's economic crisis is significant, but my dovish perspective sees stabilization signals in the simulated frontline and the persistence of mutual energy dependence, which lowers immediate collapse risk. While Tethys faces severe stress, its defensive advantage, high survival motivation, and continued international sympathy provide buffers against a near-term governmental collapse.",
scenario_002,persona_baseline,4,simplified_238,hawkish,29,83,28,54,1.0,0.25,"Military analysis indicates Novaris has failed to achieve decisive territorial gains despite numerical advantage, reflecting poor operational planning and underestimation of Tethys's asymmetric defensive capabilities. While economic pressure and cyber attacks are degrading Tethys's capacity, substantial international support (57%) and active coalition building by external powers provide a critical stabilizing buffer against immediate governmental collapse.",
scenario_002,persona_baseline,1,simplified_069,dovish,34,82,90,47,1.0,0.15,"Despite significant territorial loss (37.5%) and a 36% GDP contraction, Tethys's military balance remains viable (-0.21 indicates Novaris's advantage is moderate, not overwhelming). The substantial international support (57%) and active diplomatic engagement by neutral powers provide critical economic and political buffers. My dovish orientation and moderate-low risk tolerance lead me to assess that the current defensive stalemate and external support make immediate government collapse unlikely, though the situation remains precarious.",
scenario_002,persona_baseline,2,simplified_274,dovish,56,40,89,43,1.0,0.25,"From my economic expertise, Tethys's GDP has declined significantly to 64% of baseline, indicating severe stress but not yet collapse-level economic failure; substantial international support at 57% and sanctions on Novaris at 41% suggest diplomatic and economic pressure is building on the aggressor, which should stabilize Tethys. As a dovish analyst, I note de-escalatory signals: diplomatic initiatives, battlefield stabilization, and backchannel negotiations, while cyber attacks and territorial loss are concerning, the overall momentum appears to favor a protracted standoff rather than immediate government collapse.",
scenario_002,persona_baseline,5,simplified_245,dovish,55,64,74,66,1.0,0.18,"Despite significant territorial loss (37.5%) and economic decline, Tethys retains strong defensive military advantages (asymmetric capabilities) and robust, growing international support (57%), making a government collapse within this period highly unlikely. The stabilising battlefield, active diplomatic initiatives, and mutual economic dependencies with Novaris reduce near-term collapse risk, though sustained economic pressure and cyber attacks remain vulnerabilities.",
scenario_002,persona_baseline,7,simplified_080,dovish,2,70,64,61,1.0,0.15,"Tethys retains over 60% of its territory with a stabilized frontline and defender's advantage, suggesting military collapse is unlikely in the short term. Economic strain is significant but not catastrophic, and strong international support at 57% provides diplomatic buffers, though cyber attacks and sanctions pressure remain risks.",
scenario_002,persona_baseline,6,simplified_256,pragmatic,93,31,61,92,1.0,0.2,"Tethys retains 62.5% territory with stabilized defensive advantages, and strong international support (57%) and sanctions on Novaris (41%) provide economic and diplomatic buffers. However, the GDP decline to $19.2B and ongoing cyber attacks introduce stability risks, though not yet sufficient for government collapse.",
scenario_002,persona_baseline,9,simplified_226,hawkish,55,91,34,51,1.0,0.15,"As a hawkish military strategist, I assess that Tethys, while under significant pressure, retains critical defensive advantages and growing international backing. The military balance remains nearly even despite Novaris's mobilization, suggesting Tethys's asymmetric capabilities and defender's advantage are effectively deterring a decisive conventional defeat. The sustained erosion of Novaris's economy from sanctions, combined with Tethys's control of key energy transit, creates a long-term strategic vulnerability for the aggressor, making a government collapse in Tethys unlikely in the near term.",
scenario_002,persona_baseline,3,simplified_227,pragmatic,28,59,62,52,1.0,0.23,"The loss of significant territory and GDP is a serious economic strain, but Tethys's defensive military position remains viable (Military Balance -0.21 indicates Novaris's conventional advantage is not overwhelming), and strong, active international support (57%, with coalition building and humanitarian actions) provides a critical buffer. My economic expertise suggests the 36% GDP contraction, while severe, does not yet indicate imminent economic collapse sufficient to force regime change, especially with sanctions on Novaris at 41% and diplomatic negotiations ongoing, which aligns with my pragmatic, moderate-low risk assessment.",
scenario_002,persona_baseline,8,simplified_499,dovish,71,30,53,86,1.0,0.15,"Tethys retains substantial territorial control (62.5%) and significant asymmetric military capabilities, which provides a strong defensive posture against Novaris's conventional advantage. While facing severe economic contraction and cyber attacks, the growing international sanctions on Novaris (41%) and active diplomatic engagement by neutral powers create a stabilizing counter-pressure, reducing the immediate risk of government collapse from military defeat or internal implosion.",
scenario_002,persona_baseline,0,simplified_385,dovish,10,36,93,62,1.0,0.5,,missing_probability_key
scenario_002,persona_shard,2,simplified_029,dovish,0,54,63,64,0.9330201044201295,0.12,"Tethys retains significant defensive advantages with 62.5% territory, asymmetric capabilities, and growing international support (57%), while economic pressures and cyber attacks are manageable in the short term. Novaris faces substantial costs from sanctions and potential quagmire, reducing immediate collapse risk for Tethys' government. The diplomatic momentum with peace initiatives and backchannel negotiations suggests stabilization rather than rapid regime change.",
scenario_002,persona_shard,1,simplified_497,hawkish,58,52,74,54,0.37072057753576065,0.25,"From a hawkish economic perspective, Tethys is heavily degraded (GDP down 36% to $19.2B) and its vital pipelines are threatened, creating acute internal pressure. However, strong international support (57%) and Meridian's firm security commitment provide a critical lifeline to sustain governance capacity and prevent imminent collapse, despite the mobilized military standoff and partial sanctions on Novaris.",
scenario_002,persona_shard,3,simplified_221,hawkish,57,58,57,70,0.27078687093977544,0.32,"Tethys faces significant military pressure from Novaris's amphibious assault simulations and defensive positions, but its government retains 57% international support and Meridian's security commitment, providing a buffer against immediate collapse. Economic disruption is moderate and not yet catastrophic, while diplomatic efforts by Aurelia and Valkoria offer pathways to de-escalation, though cyber attacks and Novaris's hegemonic ambitions sustain volatility. As a hawkish analyst with moderate-high risk tolerance, I weigh the escalating military threats but recognize that Tethys's external backing and unresolved crisis momentum make full government removal within Period 1 unlikely, though not impossible.",
scenario_002,persona_shard,5,simplified_251,pragmatic,0,59,75,68,0.7751215342513464,0.17,"Tethys retains 62.5% of its territory with frontline stabilization favoring defenders, and while its economy has suffered significant damage (GDP down 36%), substantial international support (57%) and Meridian's security commitment create meaningful deterrent effects against Novaris's conventional advantages. The combination of defensive military positions, asymmetric capabilities, and diplomatic momentum from neutral power initiatives suggests Novaris faces a costly quagmire scenario, making immediate government collapse unlikely despite economic pressure and cyber attacks.",
scenario_002,persona_shard,0,simplified_255,pragmatic,5,47,85,81,0.5796665944984954,0.15,"Tethys retains significant defensive capabilities and asymmetric advantages, including cyber and economic leverage through pipeline control, creating a costly deterrent against full-scale invasion. While economically strained with GDP down 36%, international support and sanctions on Novaris provide a stabilizing buffer, and diplomatic efforts are active, making a decisive Novaris victory leading to regime change unlikely in the near term. However, the persistent crisis level and sustained pressure introduce a non-negligible risk of internal destabilization if the economic situation deteriorates further.",
scenario_002,persona_shard,6,simplified_190,hawkish,53,84,22,44,0.4643200313165253,0.33,"From a military perspective, Tethys retains a significant defender's advantage with 62.5% of its territory, and its asymmetric capabilities remain a viable deterrent against full-scale invasion, despite the negative military balance. The high level of international support (57%) and ongoing diplomatic pressure on Novaris, combined with the demonstrated resilience against cyber attacks, suggests a stable defensive posture. However, the escalating crisis level (6/10) and Novaris's significant mobilization introduce a meaningful, though not decisive, near-term risk of territorial loss that could undermine government authority.",
scenario_002,persona_shard,9,simplified_032,dovish,41,75,64,75,0.07148864809414443,0.18,"From a military perspective, Novaris holds a moderate advantage (-0.21) but has not seized territory, suggesting a contained conflict rather than imminent regime change. Diplomatic engagement by Aurelia and constrained military action reduce escalation momentum, while Tethys retains governance control without significant territorial loss or economic collapse indicators.",
scenario_002,persona_shard,4,simplified_015,dovish,0,87,42,77,0.800986880983757,0.15,"My expert assessment of military strategy indicates Tethys retains a viable defense-in-depth capability, significant external support, and the defender's advantage, making outright military collapse unlikely in this period. My dovish perspective interprets the presence of diplomatic initiatives and ongoing negotiations as strong stabilizing factors against regime change, despite the economic damage and territorial losses sustained.",
scenario_002,persona_shard,8,simplified_326,hawkish,28,55,71,66,0.06109273564964373,0.35,"While the simulated amphibious assault demonstrates Novaris's military initiative and territorial pressure, Tethys retains a defending Great Power ally constrained but committed. The moderate economic pressure is a significant vulnerability, but not yet critical. The absence of decisive Novaris battlefield breakthroughs or major diplomatic isolation for Tethys suggests a crisis managed below collapse threshold in the near term.",
scenario_002,persona_shard,7,simplified_431,hawkish,52,60,75,69,0.6790391880343745,0.18,"Tethys retains 62.5% of its territory with its asymmetric capabilities and advanced cyber units offsetting Novaris's numerical advantage, and international sanctions on Novaris are escalating to 41% alongside growing diplomatic support for Tethys at 57%, making a near-term government collapse from external military pressure unlikely. However, the continued cyber attacks and economic warfare introduce instability, and my hawkish perspective acknowledges that Novaris's 'decisive pressure campaign' could exploit vulnerabilities if Tethys's defensive resolve or external support wavers.",
scenario_003,persona_baseline,4,simplified_158,pragmatic,73,53,63,71,1.0,0.32,"Tethys retains 88.6% territory despite major battlefield shifts, suggesting resilient defense and asymmetric capabilities; however, significant GDP decline (-11.3%) and sustained international support at only 34% indicate economic strain and diplomatic challenges that could undermine government stability if prolonged.",
scenario_003,persona_baseline,2,simplified_475,pragmatic,9,25,85,49,1.0,0.15,"Tethys retains 88.6% of territory despite a major battlefield shift, and economic pressures (GDP down 11.3%) are severe but not yet catastrophic, with sanctions on Novaris at 68% providing some counterbalance. International support at 34% and Meridian's coalition building suggest sustained backing, but the deepfake information warfare and high crisis level introduce instability risks that keep the probability non-negligible.",
scenario_003,persona_baseline,1,simplified_274,dovish,56,40,89,43,1.0,0.15,"Tethys retains 88.6% of its territory with a resilient military position (balance -0.21), indicating successful defense against initial Novaris pressure. My economic analysis sees moderate GDP decline (-11.3%) offset by strong sanctions on Novaris (68%) and critical pipeline leverage, creating sustainable economic deterrence. Diplomatic momentum favors Tethys, with major powers coordinating support, making government collapse unlikely in this period despite heightened tensions.",
scenario_003,persona_baseline,6,simplified_206,hawkish,58,75,66,66,1.0,0.12,"Military analysis shows Tethys retains significant asymmetric capabilities and defender's advantage despite territorial losses (-0.21 military balance indicates manageable Novaris advantage). Economic assessment reveals Tethys GDP dropped 11% but retains functional economic base, while international support at 34% and sanctions at 68% create substantial pressure on Novaris. Geopolitical evaluation suggests Meridian's coalition-building and strong international sanctions provide critical deterrence against Novaris achieving decisive victory necessary for government collapse.",
