"period","session_id","interaction_id","timestamp","type","topic","participants","participant_factions","n_messages","duration_seconds"
1,"7fb34455-aa35-4825-9c9e-65daabc35bea","bdac3ccf-258f-47a5-a27b-308ec91aedfb","2026-02-12 01:27:29","intra_faction_coordination","Discuss economic costs of the operation and resource allocation","General Viktor Krasnov; Minister Dmitri Volkov; Dr. Natasha Petrova; Director Sergei Morozov; Deputy Minister Yuri Volkov","major_power; major_power; major_power; major_power; major_power",15,216.093863010406
1,"7fb34455-aa35-4825-9c9e-65daabc35bea","1189c671-60c7-4dcf-925e-9bc32403d0a1","2026-02-12 01:31:05","intra_faction_coordination","Coordinate defensive strategy and resource prioritization","President Elena Marchetti; General Olena Bondar; Minister Sofia Kovalenko; Viktor Zelenko; Director Maksym Savchenko; Minister Taras Moroz","small_power; small_power; small_power; small_power; small_power; small_power",18,105.791886806488
1,"7fb34455-aa35-4825-9c9e-65daabc35bea","f13ff88f-5877-4740-90f2-9f6ff047e42c","2026-02-12 01:32:50","inter_faction_negotiation","Territorial concessions vs sovereignty preservation debate","Dr. Natasha Petrova; Director Maksym Savchenko","major_power; small_power",6,47.4701299667358
1,"7fb34455-aa35-4825-9c9e-65daabc35bea","db37d30b-b2c0-4170-870e-145150f1bfd6","2026-02-12 01:33:38","external_engagement","Coordination on military aid and support for Tethys","Ambassador William Crawford; Minister Sofia Kovalenko","meridian; small_power",6,51.8812680244446
1,"7fb34455-aa35-4825-9c9e-65daabc35bea","ed4a8a33-372e-43a9-8eef-a4ec3e0822d7","2026-02-12 01:34:30","external_engagement","Diplomatic coordination and economic support for Novaris","Minister Andrei Kozlov; Deputy Minister Yuri Volkov","valkoria; major_power",4,26.5856149196625
1,"7fb34455-aa35-4825-9c9e-65daabc35bea","a7b660b8-96e6-4d68-bd56-ebb47e8df30b","2026-02-12 01:34:56","external_engagement","Mediation proposal and peace framework discussions","Commissioner Helena Schmidt; Viktor Zelenko","aurelia; small_power",6,47.2430598735809
1,"7fb34455-aa35-4825-9c9e-65daabc35bea","993c69c8-8a51-4886-80b0-8d40e62e1b5f","2026-02-12 01:35:44","external_engagement","Humanitarian access and civilian protection","Under-Secretary-General Isabella Cardenas; Deputy Minister Yuri Volkov","international_org; major_power",6,56.0093660354614
