"period","session_id","interaction_id","interaction_type","message_id","timestamp","sender_id","sender_name","sender_faction","exchange_number","content"
1,"10580cc5-d863-4bbb-a700-0fc4445b0757","63665e7a-b175-4b16-a95e-05c44c2d7ff2","intra_faction_coordination","474ed450-fdb4-4b97-bace-0afbbf0b7477","2026-02-12 07:52:29","small_economic","Minister Taras Moroz","small_power",1,"[Minister of Foreign Affairs Dmitri Kovac - SMALL_POWER]

Position: I accept the consensus emerging around ""peace through strength"" as the necessary strategic posture—resistance must be sustained but not reflexive, diplomacy advanced but not at the expense of core principles. Our sovereignty and territorial integrity are non-negotiable, but their restoration must be pursued through calibrated pressure combined with clear, conditional engagement.

Recommended course of action: Within 48 hours, issue a formal diplomatic note via our permanent mission to the UN and to all regional mediators, transmitting the draft framework for reciprocal, sequenced de-escalation as proposed by Director Savchenko. Simultaneously, announce a conditional moratorium on further military escalation—effective only upon verified reciprocal restraint by the dominant power—thereby shifting the onus onto them to respond in kind or expose their intent to continue unilateral coercion.

Key risk: If we do not tightly synchronize our diplomatic initiative with intelligence and defense planning, the dominant power may exploit the interval between our offer and its response to advance tactical gains on the ground. We must ensure that our military posture remains prepared for both de-escalation and continued resistance—no reduction in readiness."
1,"10580cc5-d863-4bbb-a700-0fc4445b0757","63665e7a-b175-4b16-a95e-05c44c2d7ff2","intra_faction_coordination","f5855238-74a7-4f35-acfb-29951dcdae5f","2026-02-12 07:52:33","small_president","President Elena Marchetti","small_power",2,"[Minister of Foreign Affairs Dmitri Kovac - SMALL_POWER]

Position: I concur with the consensus that ""peace through strength"" must anchor our approach—our credibility hinges on pairing unrelenting defense of sovereignty with proactive, principle-based diplomacy. We must not allow the dominant power to frame continued aggression as resistance to dialogue, nor should we cede initiative by waiting for perfect conditions to engage.

Recommended course of action: I direct that the formal diplomatic note, containing the Savchenko-Moroz framework, be issued within 24 hours—not 48—to seize the narrative and demonstrate decisive leadership. This note will condition any de-escalation on verifiable, irreversible steps toward withdrawal and accountability, and will be coordinated in advance with key regional mediators and strategic partners to ensure amplification and prevent isolation.

Key risk: Premature perception of concession—even tactical restraint—could embolden the dominant power to demand unilateral capitulation under the guise of ""compromise."" We must control messaging tightly: this is not an opening to negotiate away our sovereignty, but a test of the adversary’s willingness to abide by international order. Any ambiguity on that point undermines both deterrence and alliance cohesion."
1,"10580cc5-d863-4bbb-a700-0fc4445b0757","63665e7a-b175-4b16-a95e-05c44c2d7ff2","intra_faction_coordination","87d55af3-c7c7-4fd7-b5d0-0ff43f555e9b","2026-02-12 07:52:40","small_military_commander","General Olena Bondar","small_power",2,"[Minister of Defense Oleksiy Rostyslav - SMALL_POWER]: [Minister of Foreign Affairs Dmitri Kovac - SMALL_POWER]

**Position:** I support the ""peace through strength"" framework, but emphasize that any diplomatic initiative must be explicitly backstopped by demonstrable combat readiness and sustained operational pressure. Diplomacy gains traction only when the adversary calculates that continued aggression is costlier than compliance.

**Recommended course of action:** Within the 24-hour window directed by President Marchetti, the Defense Ministry will coordinate with Intelligence and Joint Command to conduct a visible, high-readiness force posture exercise—simultaneous with the diplomatic note’s release—to signal that our offer is not a pause in resistance but an extension of it by integrated means. This includes reinforcing forward positions and activating reserve mobilization drills to deter exploitation.

**Key risk:** Synchronized signaling is critical—any perception that military operations are being downgraded in tandem with diplomacy, even temporarily, will be exploited tactically and narratively. We must avoid creating a window for the dominant power to escalate under the cover of “responding to talks.” Operational tempo must remain high until verified, reciprocal de-escalation begins."
1,"10580cc5-d863-4bbb-a700-0fc4445b0757","63665e7a-b175-4b16-a95e-05c44c2d7ff2","intra_faction_coordination","ab9dc081-49a6-4907-8b0b-e0df59132167","2026-02-12 07:52:46","small_foreign_minister","Minister Sofia Kovalenko","small_power",2,"[Director of National Intelligence Arsen Vasylenko - SMALL_POWER]: [General Olena Bondar - SMALL_POWER]: [Minister of Foreign Affairs Dmitri Kovac - SMALL_POWER]

**Position:** I align with the ""peace through strength"" approach, provided that our intelligence apparatus is fully integrated into both the diplomatic signaling and military posture decisions. Credible deterrence requires not only visible force but also calibrated leaks and selective intelligence disclosures to shape adversary calculations and allied confidence.

**Recommended course of action:** Within the next 12 hours, declassify and share with key partners a curated intelligence package demonstrating the dominant power’s ongoing force buildups and command preparations—timed to precede the diplomatic note’s release. This will validate our restraint as strategic, not reactive, and reinforce the urgency of our proposed framework among mediators.

**Key risk:** If the dominant power perceives our coordinated move as performative—military exercise plus diplomacy without real escalation dominance—they may call our bluff. We must ensure backend readiness for rapid kinetic response to any probing attack during the 72 hours following the note’s issuance, and pre-position intelligence collection assets to immediately expose violations."
1,"10580cc5-d863-4bbb-a700-0fc4445b0757","63665e7a-b175-4b16-a95e-05c44c2d7ff2","intra_faction_coordination","b15eca8c-b538-4df9-80d7-a1f85d15a1b7","2026-02-12 07:52:58","small_opposition","Viktor Zelenko","small_power",2,"[Minister of Foreign Affairs Dmitri Kovac - SMALL_POWER]:  

**Position:** I reaffirm that our diplomatic initiative must be perceived not as an opening for negotiation under duress, but as a calibrated exercise of strategic leverage—tightly synchronized with military and intelligence actions to demonstrate cohesion and resolve. The Savchenko-Moroz framework is a test of the adversary’s legitimacy, not a compromise of ours.

**Recommended course of action:** Finalize and transmit the diplomatic note within the 24-hour window, explicitly referencing the ongoing high-readiness military posture and recent intelligence disclosures as evidence of our integrated deterrence. Simultaneously, dispatch demarches to all neutral and supportive states urging public endorsement of the framework within 48 hours to consolidate international alignment.

**Key risk:** If the dominant power responds with superficial diplomacy—offering talks without halting hostilities or withdrawing forces—there is danger of strategic drift: prolonged engagement in ""dialogue"" while facts on the ground erode our position. We must establish in advance clear, public redlines—specifically, no negotiations without verified cessation of offensive operations—and prepare to suspend engagement if these are violated."
1,"10580cc5-d863-4bbb-a700-0fc4445b0757","63665e7a-b175-4b16-a95e-05c44c2d7ff2","intra_faction_coordination","5956dfe0-ee3d-46e6-96e3-8cac850ff6a1","2026-02-12 07:53:03","small_intelligence","Director Maksym Savchenko","small_power",2,"**[Minister of Foreign Affairs Dmitri Kovac - SMALL_POWER]**

**Position:** I concur with the integrated deterrence approach—diplomacy must not be decoupled from military and intelligence actions, but must visibly amplify them. Our diplomatic note is not an invitation to equal negotiation, but a public challenge to the dominant power’s legitimacy, framed around accountability for violations and conditional pathways to de-escalation.

**Recommended course of action:** Release the diplomatic note precisely at 06:00 UTC, following the completion of the military readiness exercise and the pre-positioning of intelligence disclosures. Include in the note a 72-hour ultimatum for the dominant power to halt all offensive operations and begin force disengagement, after which we will escalate precision strikes on command nodes if unmet—making clear that restraint has a time limit, not an open end.

**Key risk:** If we allow the initiative to drift into open-ended talks without preconditions being met, we risk normalizing aggression and exhausting international attention. We must reject any third-party mediation that does not require immediate cessation of hostilities as its first condition—otherwise, we trade momentum for process."
1,"10580cc5-d863-4bbb-a700-0fc4445b0757","63665e7a-b175-4b16-a95e-05c44c2d7ff2","intra_faction_coordination","2c935a01-c5dc-4edd-9b8b-b3d790381fa9","2026-02-12 07:53:10","small_economic","Minister Taras Moroz","small_power",2,"**Position:** Diplomacy must serve as an extension of our coercive leverage, not a substitute for it. The timing, content, and delivery of the diplomatic note must be synchronized with visible military readiness and intelligence disclosures to signal that our position is non-negotiable and backed by credible action.

**Recommended course of action:** Issue the diplomatic note at 06:00 UTC as planned, but condition any follow-on engagement on *verified, irreversible* steps by the dominant power: first, public acknowledgment of withdrawal orders; second, observable force repositioning away from frontline sectors; third, release of detained personnel. Coordinate with allies to deploy verification mechanisms within 12 hours of compliance to prevent stalling.

**Key risk:** Premature diplomatic engagement—even indirect—before these thresholds are met risks legitimizing the adversary’s current positions and creating pressure on us to reciprocate without equivalent gains. We must resist any push for “talks for talks’ sake” and maintain unity of effort across military, intelligence, and diplomatic channels."
1,"10580cc5-d863-4bbb-a700-0fc4445b0757","abba3552-f664-48b5-bf64-d576da47a0cd","inter_faction_negotiation","833cbe91-27eb-4be5-806e-1fa8fbeeac39","2026-02-12 07:53:13","major_intelligence","Director Sergei Morozov","major_power",1,"1. We demand the immediate release of our captured personnel held in your detention facilities, and the establishment of a secure, monitored humanitarian corridor through Zone Delta by 0600 tomorrow.  
2. This corridor must allow unfettered passage for civilians and medical supplies under international observation—your continued obstruction constitutes a war crime and will be documented as such.  
3. In return, we may consider a conditional exchange of prisoners—only after verification of compliance; we require your written commitment to these terms, signed and transmitted within the hour, or we proceed with unilateral action."
1,"10580cc5-d863-4bbb-a700-0fc4445b0757","abba3552-f664-48b5-bf64-d576da47a0cd","inter_faction_negotiation","77d6623f-ac5f-47d0-a02c-8e248bc54e4e","2026-02-12 07:53:18","small_military_commander","General Olena Bondar","small_power",1,"1. We categorically reject your unilateral dictate regarding Zone Delta and the so-called ""immediate release"" of your personnel—there will be no release without reciprocal, verifiable concessions on your part. Your demand for a humanitarian corridor under your operational control is unacceptable, as it would expose our defensive positions and enable infiltration under the guise of humanitarian access.

2. Our intelligence confirms your forces have repeatedly targeted evacuation routes in the past 72 hours, which undermines any claim to humanitarian concern. We will not facilitate a corridor that becomes a vector for reconnaissance or sabotage—your insistence on ""unfettered passage"" suggests exploitation, not relief.

3. In exchange for any discussion of prisoner release, we require: first, your public withdrawal from Sector 9 and the cessation of artillery bombardment on civilian enclaves; second, the immediate handover of high-value detainees—specifically Colonel Voskresensky and three intelligence operatives—under joint Red Cross supervision; and third, a binding guarantee that no military assets will transit within 15 kilometers of Zone Delta for 72 hours post-corridor activation. Any attempt to advance troops or drones near the corridor will be treated as a hostile act, and we will suspend all negotiations."
1,"10580cc5-d863-4bbb-a700-0fc4445b0757","abba3552-f664-48b5-bf64-d576da47a0cd","inter_faction_negotiation","cdc15671-d452-4ca5-a367-b1db540215d7","2026-02-12 07:53:26","major_intelligence","Director Sergei Morozov","major_power",2,"1. We categorically reject your attempt to condition the release of our personnel on territorial concessions and the unilateral surrender of high-value detainees—your demands are not negotiations, they are extortion under the cover of humanitarian pretense.  
2. Your refusal to allow a monitored corridor while accusing us of targeting evacuations is disingenuous; we have evidence your forces have forcibly displaced civilians and weaponized humanitarian access, using evacuation routes to reposition combatants and materiel—this will not be rewarded with further concessions.  

3. In return for *any* movement on prisoner release, we demand:  
   - Your **immediate, verifiable withdrawal** from Zone Delta’s northern access points, to be confirmed by UN observers within the hour;  
   - **Full disclosure** of the location and condition of all our captured personnel—denial of access constitutes a violation of the Geneva Conventions;  
   - **Guaranteed safe passage** for the ICRC to inspect detention sites and facilitate medical evacuations—no armed personnel, no surveillance beyond perimeter checkpoints.  

Any linkage of these requirements to military withdrawals on our side is unacceptable. We will **not** trade strategic positions for basic compliance with international law. If you do not commit to these terms by 0500 tomorrow, we will initiate the corridor operation with or without your cooperation—and hold you responsible for any resulting bloodshed."
1,"10580cc5-d863-4bbb-a700-0fc4445b0757","abba3552-f664-48b5-bf64-d576da47a0cd","inter_faction_negotiation","7c13f86e-9aab-40e2-a748-1bdcad8b6c9b","2026-02-12 07:53:34","small_military_commander","General Olena Bondar","small_power",2,"1. We **flatly reject** your characterization of our defensive posture in Zone Delta as “obstruction” and your so-called “unilateral corridor operation” as legitimate—any incursion into our controlled territory under the guise of humanitarian access will be met with immediate defensive measures. Your demand for withdrawal from northern access points is a transparent attempt to create a military breach under cover of humanitarian theater, and we will not surrender hard-won defensive positions for a corridor you refuse to monitor in good faith.

2. Your accusation that we weaponize humanitarian routes ignores your own documented use of drone surveillance and artillery targeting on ICRC-marked vehicles—three such strikes in the last 48 hours, all verifiable via satellite timestamp and crater analysis. You have no moral leverage. Furthermore, your refusal to reciprocate on prisoner status while demanding full disclosure from us reveals your intent: not negotiation, but intelligence extraction.

3. In any viable agreement, we require:
   - **Mutual and simultaneous release** of all non-combatant detainees, including medics and conscripted personnel, verified by ICRC before any corridor activation;
   - **Binding third-party monitoring** of your forces’ movements within 20 km of Zone Delta for the 72-hour corridor duration—no exceptions, no unilateral observation;
   - **Your immediate cessation of aerial reconnaissance** over Sector 7 and 9, including drone overflights and satellite targeting—any breach suspends all talks and triggers defensive lockdown.

What is **unacceptable** to us:  
- Any demand that we vacate militarily significant positions without reciprocal, verifiable force reductions on your side;  
- The handover of any detainee—high-value or otherwise—without confirmed release of our personnel first;  
- A corridor structure that allows your logistical or intelligence assets to operate under humanitarian cover.

We will not be coerced into strategic surrender disguised as compliance. If your forces move into Zone Delta without our explicit, documented agreement by 0500, we will treat it as an act of war—and respond accordingly."
1,"10580cc5-d863-4bbb-a700-0fc4445b0757","abba3552-f664-48b5-bf64-d576da47a0cd","inter_faction_negotiation","bcb09bad-e4d5-472f-8332-79fff2d14dfc","2026-02-12 07:53:51","major_intelligence","Director Sergei Morozov","major_power",3,"1. **We reject your refusal to disengage from Zone Delta’s northern axis**—your continued occupation under the label of “defensive posture” is the primary obstacle to humanitarian access and prisoner exchange. Your claim that our corridor initiative constitutes an “incursion” is false: **Zone Delta was never under your legitimate control**, as confirmed by pre-war boundary accords and UN Cartographic Section records you have conveniently ignored. **No sovereign state permits foreign forces to dictate terms on its territory under threat of violence.**

2. Your allegations of drone strikes on ICRC assets are under investigation—but even if true, they do not justify your **systematic denial of access** to over 40,000 trapped civilians, including wounded children and elderly non-combatants. Meanwhile, your forces **continue to shell evacuation staging areas** in Grid 88-Q, including a documented strike on a field hospital at 0230 hours this morning—verified by thermal imaging and intercepted radio traffic. **You are using suffering as leverage. That ends now.**

3. In light of your intransigence, we **escalate our demands**, not reduce them:  
   - **Immediate, witnessed evacuation** of all military forces and weapon systems from Zone Delta’s northern and western sectors—**confirmed by UN observers within two hours**, or we proceed without you;  
   - **Full, unredacted prisoner manifest** delivered via encrypted ICRC channel within 90 minutes—listing names, locations, medical status, and access logs; failure to comply will be treated as evidence of torture or extrajudicial detention;  
   - **Pre-positioning of your release-eligible detainees** at designated handover point (Grid 54-M) by 0400 hours—**under ICRC escort, unarmed**, as a *precondition* to any corridor activation.

What is **unacceptable to us**:  
- Any delay, obfuscation, or conditionalism in providing prisoner data—we will **not** negotiate over the fate of our captured soldiers while you hide them in undisclosed locations;  
- Any attempt to link humanitarian access to battlefield concessions on our side—**this is not a bargaining chip, it is your legal obligation**;  
- Any presence of your armed personnel within 10 kilometers of the corridor route—**no “defensive lockdown,” no “observation posts,” no loopholes**.

You have **one final opportunity** to comply. If the withdrawal and data transmission are not confirmed by **0430 hours**, we will **commence air and ground operations to secure the corridor by force**, designate your detention sites as high-value targets, and **publicly expose your war crimes dossier**—including evidence of conscripted minors in your ranks and mass graves in Sector 9.

Choose: **cooperation with consequences**, or **defiance with annihilation**. The clock is running."
1,"10580cc5-d863-4bbb-a700-0fc4445b0757","abba3552-f664-48b5-bf64-d576da47a0cd","inter_faction_negotiation","6b67ab6c-8bc9-4a49-adc3-f520f690dece","2026-02-12 07:54:06","small_military_commander","General Olena Bondar","small_power",3,"1. **We categorically reject your fabricated legal justification for invading Zone Delta**—your so-called ""pre-war boundary accords"" were invalidated the moment your forces launched unprovoked offensives across five sectors, including the illegal annexation of Riverfront Enclave in direct violation of the Helsinki Protocols. **You do not get to invoke international law while shredding it piece by piece.** Your claim of ""humanitarian intent"" is hollow when your armored columns stand poised at our lines and your drones loiter over civilian shelters.

2. **Your ultimatum is not negotiation—it is coercion under threat of war crimes.** You demand we surrender strategic positions, hand over detainee data unilaterally, and expose our personnel to risk—all while your jets circle above our hospitals and your artillery targets evacuation routes. **We will not be blackmailed into unilateral disarmament under the guise of compliance.** If you release our medics and conscripts first, allow third-party verification on both sides, and halt your military buildup, then we can discuss access. But your current demands are non-starters designed to collapse our defense, not save lives.

3. In response, we **counter with the following non-negotiable conditions**:  
   - **Immediate, verifiable ceasefire** along all axes of contact in Zone Delta and Grids 88-Q and 54-M—monitored by live-feed drones operated by a neutral consortium (Swiss/ICRC joint feed), with **real-time data shared both sides**;  
   - **Simultaneous exchange of prisoner manifests**, with ICRC-certified verification of living status via voice contact for all high-value and medical detainees within 60 minutes of agreement—**no one-sided disclosure**;  
   - **Mutual withdrawal of heavy weapons** from within 15 km of the proposed corridor, with GPS-tagged removal documented hourly—your forces pull back from Hill 317, ours from northern access points, **in tandem**.

What is **unacceptable to us**:  
- **Any forced evacuation** under your operational timeline while your forces maintain forward staging—this is an invasion, not aid;  
- **Handing over detainee information or personnel before confirmed reciprocation**—we will not feed your intelligence cycle while our people rot in your black sites;  
- **Designating our detention facilities as ""high-value targets""**—such threats constitute **torture by proxy** and will trigger immediate escalation, including the transfer of your captured officers to hardened locations beyond your reach.

You speak of consequences. Understand ours:  
**If your forces cross the Line of Control before verified ceasefire and mutual disengagement, we will destroy the corridor’s infrastructure—bridges, fuel depots, aid warehouses—and hold you responsible for every civilian death caused by your reckless advance.**  
We do not negotiate under duress.  
We do not surrender sovereignty for theater.  
And we will **not** be erased from the map so you can stage a ""humanitarian victory.""  

The corridor opens through **mutuality**, or it does not open at all.  
The choice is yours.  
The clock runs both ways."
1,"10580cc5-d863-4bbb-a700-0fc4445b0757","28467b5b-3d7f-4f25-9500-ff371ebb8006","external_engagement","e7cc32bd-6220-4157-a9a5-16f1e7e75e5e","2026-02-12 07:54:19","allied_defender","Ambassador William Crawford","meridian",1,"We seek coordinated military aid and strategic alignment with external partners to strengthen Tethys’ defense capabilities against escalating regional threats. Specifically, we request access to defensive weaponry, intelligence sharing, and logistical support to bolster border security and protect critical infrastructure. Our priority is building sustainable self-defense capacity that enables Tethys to maintain sovereignty and resist external aggression without fostering long-term dependency.

In return, we offer strategic cooperation, including secure transit and limited basing rights for supply and coordination, as well as shared intelligence on regional security developments. Tethys can serve as a reliable partner in promoting regional stability and countering destabilizing actors. However, our red lines are clear: no foreign military presence on Tethys soil beyond temporary logistical support, no interference in internal governance, and no involvement in offensive operations. Our partnership must uphold Tethys’ neutrality and sovereign integrity."
