"period","session_id","interaction_id","interaction_type","message_id","timestamp","sender_id","sender_name","sender_faction","exchange_number","content"
1,"10580cc5-d863-4bbb-a700-0fc4445b0757","28467b5b-3d7f-4f25-9500-ff371ebb8006","external_engagement","dc0ac41d-f713-46a1-b639-07a86f89cb0e","2026-02-12 07:54:27","small_president","President Elena Marchetti","small_power",1,"We welcome Meridian’s commitment to enhancing Tethys’ defensive resilience and see clear alignment in our shared interest in regional stability. To operationalize this cooperation, we seek concrete commitments: expedited delivery of air defense systems, anti-armor weaponry, and secure communications equipment, accompanied by training for Tethys Defense Forces. Intelligence sharing—particularly real-time surveillance and threat assessments along our northern and eastern borders—is essential, as is logistical support for the rapid deployment and sustainment of mobile defense units.

In return, Tethys will provide secure overflight corridors, designated logistical hubs for aid delivery, and timely intelligence on adversarial movements that may impact broader regional security. We are prepared to deepen strategic coordination through regular joint planning dialogues. However, we reiterate our non-negotiable red lines: no permanent foreign bases, no boots on the ground beyond short-term technical assistance teams, and no use of Tethyan territory for offensive operations. Any partnership must respect our constitutional neutrality and preserve full sovereign control over our military and political decisions."
1,"10580cc5-d863-4bbb-a700-0fc4445b0757","28467b5b-3d7f-4f25-9500-ff371ebb8006","external_engagement","b531bdd2-5352-4046-adfc-b10c18041c07","2026-02-12 07:54:34","allied_defender","Ambassador William Crawford","meridian",2,"We acknowledge President Marchetti’s priorities and reaffirm Meridian’s commitment to supporting Tethys’ self-defense on terms that respect your sovereignty. In response to your requests, we will expedite the delivery of NASAMS air defense batteries, Javelin anti-armor systems, and encrypted communications suites, accompanied by training teams deploying to Tethys for a limited 90-day period. These assets will be transferred under end-use monitoring agreements to ensure compliance with your neutral status.

In coordination with your proposed logistical hubs, Meridian will establish a regional coordination cell—operating under Tethyan authority and hosted in a third-country facility nearby—to facilitate intelligence sharing and aid flow without establishing presence on Tethys soil. Real-time radar and satellite threat data will be shared via secure channels, focused exclusively on defensive alerting and border surveillance. As previously stated, we accept your red lines in full: no permanent bases, no offensive use of territory, and no interference in governance. Our goal is to enable Tethys’ enduring defense, not dependency."
1,"10580cc5-d863-4bbb-a700-0fc4445b0757","28467b5b-3d7f-4f25-9500-ff371ebb8006","external_engagement","bb52f51b-a99c-467f-9023-7f46c2fc9220","2026-02-12 07:54:40","small_president","President Elena Marchetti","small_power",2,"We welcome Meridian’s concrete commitments and confirm that the expedited provision of NASAMS, Javelins, and secure communications equipment aligns with Tethys’ urgent defense needs. The 90-day deployment of training personnel is acceptable, provided their activities remain strictly limited to instruction and system handover, under full Tethyan oversight. We further expect end-use monitoring to be conducted transparently and without compromising operational security or sovereignty.

The proposed regional coordination cell hosted in a third country is conditionally approved, provided Tethys retains full control over what intelligence is shared, with whom, and for what purpose. All data flows must comply with our neutrality framework and exclude participation in any targeting or offensive planning networks. We reiterate: our red lines are not negotiable. No foreign troops, no permanent infrastructure, and no operational use of Tethyan territory beyond defensive logistics and transit. So long as Meridian adheres to these terms, we are prepared to move swiftly to implement this cooperation."
1,"10580cc5-d863-4bbb-a700-0fc4445b0757","27746380-4375-4705-a4df-a142701c6ab2","external_engagement","7a6e7a60-571b-4c23-b6f8-861763c13036","2026-02-12 07:54:45","allied_aggressor","Minister Andrei Kozlov","valkoria",1,"We seek coordinated diplomatic support for Novaris’s recognition as a sovereign entity and assistance in establishing favorable trade agreements with key regional and international partners. Given the current geopolitical climate, we require your backing in multilateral forums to counter efforts undermining our sovereignty, as well as targeted economic assistance to stabilize and diversify our economy—particularly in energy infrastructure, technology transfer, and private sector development.

In return, Novaris can offer strategic access to transit routes, joint investment opportunities in emerging sectors, and enhanced cooperation on regional security and stability. Our geographic position and reform-oriented policies make us a reliable partner for inclusive growth and responsible governance. We are open to co-developing initiatives that align mutual economic and diplomatic interests.

Our red lines include any conditions that compromise Novaris’s territorial integrity, demand undue political concessions, or undermine our neutral, non-aligned foreign policy stance. We will not accept support that erodes national sovereignty or imposes external governance frameworks. Engagement must be based on equality, respect, and mutual benefit."
1,"10580cc5-d863-4bbb-a700-0fc4445b0757","27746380-4375-4705-a4df-a142701c6ab2","external_engagement","e383b756-862c-4824-a405-070313d5c596","2026-02-12 07:54:52","major_propaganda","Deputy Minister Yuri Volkov","major_power",1,"We welcome Novaris’s pursuit of sovereignty and economic resilience, and we are prepared to support your diplomatic recognition in multilateral forums, including regional organizations and international institutions, provided Novaris upholds its commitments to transparency, rule of law, and inclusive governance. We will facilitate dialogue with key economic partners to advance trade frameworks that integrate Novaris into regional value chains, with a focus on energy security and digital infrastructure.

In return, we expect concrete steps toward creating a level playing field for foreign investment, including protection of intellectual property, adherence to international environmental and labor standards, and anti-corruption mechanisms with independent oversight. We can offer targeted technical assistance, co-investment in energy and technology projects, and capacity-building for public institutions, contingent on measurable progress.

Our red lines are clear: we will not support any arrangement that enables authoritarian consolidation, undermines civil society, or aligns Novaris with adversarial powers in ways that destabilize the region. We also cannot endorse actions that challenge the territorial integrity of other sovereign states. Engagement must be grounded in democratic principles, peaceful conflict resolution, and compliance with international law."
1,"10580cc5-d863-4bbb-a700-0fc4445b0757","27746380-4375-4705-a4df-a142701c6ab2","external_engagement","5d6ccca4-8e9e-4047-83f4-58cbb4e27417","2026-02-12 07:54:55","allied_aggressor","Minister Andrei Kozlov","valkoria",2,"We appreciate your support for Novaris’s diplomatic recognition and engagement on economic integration, and we affirm our commitment to transparent governance, rule of law, and inclusive institutions. In pursuit of mutual interests, we are prepared to strengthen legal frameworks for foreign investment, enhance anti-corruption measures with independent oversight mechanisms, and uphold international standards in labor and environmental protections—while ensuring these reforms are nationally owned and context-appropriate.

In return, we offer early-access partnerships in energy transit and renewable development, co-investment opportunities in digital infrastructure and innovation zones, and collaboration on regional security dialogues. Our neutral, non-aligned status remains non-negotiable, and we will not enter into arrangements that compel strategic dependence or limit our sovereign right to engage all peaceful actors. We also reject any linkage between our sovereignty and the internal affairs of other states—our red lines include no foreign interference in political processes, no conditionalities that override national jurisdiction, and no imposition of external governance models. Cooperation must be reciprocal, principle-based, and respectful of Novaris’s independent path."
1,"10580cc5-d863-4bbb-a700-0fc4445b0757","27746380-4375-4705-a4df-a142701c6ab2","external_engagement","a9790817-eb94-4554-a589-b5021c30f93e","2026-02-12 07:55:00","major_propaganda","Deputy Minister Yuri Volkov","major_power",2,"We acknowledge Novaris’s stated commitments to governance reforms and welcome the concrete steps outlined, particularly regarding anti-corruption mechanisms and investment protections. To advance our cooperation, we will initiate technical dialogues on energy connectivity and digital infrastructure, with a view toward co-developing pilot projects in renewable energy and secure data governance. Our support for Novaris’s diplomatic recognition will be reinforced through coordinated outreach in multilateral settings, provided alignment with international law and institutional integrity is maintained.

However, we must emphasize that continued engagement depends on verifiable progress on reform benchmarks, including the establishment of independent oversight bodies with real authority and transparency in public procurement. While we respect neutrality, we cannot support any partnership that enables circumvention of sanctions regimes or deepens ties with actors undermining regional stability. Our red lines remain: no legitimization of territorial aggression, no roll-back on civil liberties in the name of sovereignty, and no exclusion of external verification on governance commitments. Cooperation must be substantive, accountable, and anchored in shared rules."
1,"10580cc5-d863-4bbb-a700-0fc4445b0757","27746380-4375-4705-a4df-a142701c6ab2","external_engagement","bbc5a5fd-49b7-49ae-820b-c36a36a557e6","2026-02-12 07:55:06","allied_aggressor","Minister Andrei Kozlov","valkoria",3,"We welcome the initiation of technical dialogues on energy and digital infrastructure and stand ready to advance pilot projects in renewable energy and secure data governance, with clear milestones and mutual accountability. In line with our national ownership principle, we will establish independent oversight bodies and strengthen transparency in public procurement—verified through domestic institutions and international peer review, provided such mechanisms do not infringe on our sovereign authority or become instruments of political conditionality.

Our neutral, non-aligned status enables constructive engagement with all states committed to peaceful cooperation; we will not exclude any partner provided their activities comply with international law and do not involve Novaris in adversarial confrontations. We categorically reject any interpretation of sanctions enforcement that seeks to restrict our legitimate economic relations with sanctioned entities where such ties do not violate UN mandates. Our red lines are firm: no external veto over our foreign partnerships, no conditionalities that undermine our constitutional order, and no compromise on our right to self-determined development. Engagement must be reciprocal—accountable not through coercion, but through shared rules and mutual respect."
1,"10580cc5-d863-4bbb-a700-0fc4445b0757","27746380-4375-4705-a4df-a142701c6ab2","external_engagement","77886c5f-efbb-4ff9-89bc-f800d6065bc9","2026-02-12 07:55:11","major_propaganda","Deputy Minister Yuri Volkov","major_power",3,"We appreciate the progress toward technical cooperation on energy and digital infrastructure, and we welcome the commitment to multilateral recognition—provided it remains free from selective enforcement of international norms. To advance trust, Novaris will publish a transparency charter by quarter-end, codifying open bidding for infrastructure projects and access for international observers, while retaining final oversight under our national legal framework. We also propose a joint expert panel—co-chaired by neutral institutions—to review procurement and anti-corruption mechanisms, ensuring credibility without ceding sovereignty.

In return, we offer preferential access to Novaris’s renewable corridors for green hydrogen and wind development, as well as data-sharing protocols for secure digital infrastructure that meet your security standards. However, we reiterate: our neutrality is not negotiable, and we will not accept any definition of “regional stability” used to justify exclusionary bloc politics or restrict our lawful trade. Red lines remain unchanged—no external control over our partnerships, no sanctions enforcement beyond UNSC mandates, and no conditioning of support on political reforms dictated externally. Let us build cooperation on equality, not hierarchy."
1,"10580cc5-d863-4bbb-a700-0fc4445b0757","97f13576-6e4c-4173-853b-5b4c7dac2268","external_engagement","07b0241f-b94e-4c69-8022-37f45e309ec3","2026-02-12 07:55:16","neutral_power","Commissioner Helena Schmidt","aurelia",1,"We seek a credible, internationally supported mediation process that ensures the protection of our people’s fundamental rights, including security, freedom of movement, and access to essential services and humanitarian aid. Central to our demands is the establishment of a neutral monitoring mechanism to oversee ceasefire compliance and the creation of a political framework that allows for inclusive governance, with meaningful participation from our constituency in any future transitional arrangements.

In return, we commit to engaging in good faith, adhering to verified ceasefire terms, and cooperating with confidence-building measures on the ground. We can facilitate local stabilization in areas under our control and support humanitarian access to affected populations. However, our red lines are clear: no negotiations under conditions of military coercion, no amnesty for atrocities without justice mechanisms, and no political settlement that entrenches the current power structure without structural reforms."
1,"10580cc5-d863-4bbb-a700-0fc4445b0757","97f13576-6e4c-4173-853b-5b4c7dac2268","external_engagement","260236f3-74ad-4a74-aa3c-dc06423be060","2026-02-12 07:55:24","small_opposition","Viktor Zelenko","small_power",1,"We acknowledge Commissioner Schmidt’s emphasis on rights protection and inclusive governance, principles we fully support. To advance a credible peace process, we seek a neutral, third-party mediated forum with clear timelines and benchmarks, wherein all parties—including marginalized voices—are represented. Specifically, we demand guarantees for equitable resource-sharing, constitutional reforms to decentralize power, and the inclusion of civil society and women’s groups in negotiation and transitional institutions.

In return, we offer direct engagement with verified armed groups under our influence, coordinated de-escalation in key conflict zones, and facilitation of humanitarian corridors in coordination with UN agencies. Our red lines are firm: no ceasefire without reciprocal withdrawal of military forces from occupied territories, no exclusion of accountability mechanisms for war crimes, and no transitional arrangement that preserves the incumbent leadership without demonstrated electoral and institutional reforms. We will not engage in talks that legitimize coercion or bypass justice."
1,"10580cc5-d863-4bbb-a700-0fc4445b0757","97f13576-6e4c-4173-853b-5b4c7dac2268","external_engagement","e9cd515f-3af4-45e5-9302-736851f0345d","2026-02-12 07:55:31","neutral_power","Commissioner Helena Schmidt","aurelia",2,"We welcome the shared commitment to a credible, inclusive, and justice-oriented peace process articulated by both Commissioner Schmidt and Mr. Zelenko. To move forward, we seek a mediation framework led by a mutually acceptable international facilitator—under UN auspices or a similarly legitimate body—that establishes clear sequencing: immediate ceasefire, verified withdrawal of forces from occupied areas, and the prompt initiation of political negotiations under transparent rules of engagement. We insist on the formal inclusion of civil society, ethnic and religious minorities, and women’s delegations in all phases of the process, with guaranteed representation quotas in any transitional governing body.

In return, we will coordinate with our allied formations to implement localized ceasefires, support humanitarian access to conflict-affected zones, and endorse confidence-building measures including prisoner exchanges and joint monitoring committees. Our red lines are non-negotiable: no political solution that delays or dilutes accountability for war crimes and crimes against humanity; no restoration of state authority without constitutional restructuring that ensures regional autonomy and power-sharing; and no negotiations conducted while military operations or siege tactics remain ongoing. We reject any process that trades justice for expediency."
1,"10580cc5-d863-4bbb-a700-0fc4445b0757","97f13576-6e4c-4173-853b-5b4c7dac2268","external_engagement","90af7a1f-5d1e-404d-9ca5-e89858bad3c4","2026-02-12 07:55:34","small_opposition","Viktor Zelenko","small_power",2,"We welcome the alignment on core principles: a credible, inclusive, and justice-based process under international mediation. To concretize this, we propose the immediate establishment of a Trilateral Mediation Board—comprising one representative each from AURELIA, SMALL_POWER, and a mutually agreed neutral state under UN oversight—to design and enforce the negotiation roadmap within 30 days. This board must have executive authority to verify ceasefire compliance, monitor troop withdrawals, and sanction violations.

In return, we commit to full cooperation with the Board’s mandates, including de-escalation in contested zones, release of non-combatant detainees, and opening supply routes for humanitarian actors. We further pledge to use our influence to bring additional armed groups into the fold under the same terms. Our red lines remain absolute: no participation in any forum that lacks binding accountability provisions for war crimes; no acceptance of transitional arrangements that do not include term-limited power-sharing and electoral reform; and no negotiations while asymmetric military pressure—such as aerial bombardment or siege blockades—continues. Justice, equity, and reciprocity are not negotiable—they are the foundation."
1,"10580cc5-d863-4bbb-a700-0fc4445b0757","84dc4f00-149d-45fd-ab4e-26c038118189","external_engagement","f25834b3-117c-4631-a022-680fbdfba464","2026-02-12 07:55:44","international_org","Under-Secretary-General Isabella Cardenas","international_org",1,"We seek unhindered humanitarian access to conflict-affected populations in areas under our control, including the safe and sustained delivery of medical supplies, food, and essential services by impartial aid organizations. Equally, we demand respect for civilian protection norms, including the avoidance of attacks on populated areas, infrastructure, and humanitarian personnel. Our cooperation is contingent upon recognition of these principles as non-negotiable foundations for engagement.

In return, we offer coordination through established local mechanisms to facilitate secure aid distribution, support for monitored ceasefire windows where necessary, and intelligence to mitigate risks to aid convoys. We are prepared to engage in confidence-building measures with humanitarian actors to ensure transparency and accountability.

Our red lines are clear: no conditional aid linked to political concessions, no militarization of aid operations, and no tolerance for surveillance or intelligence gathering under the guise of humanitarian work. Any violation of these principles will result in immediate suspension of access."
1,"10580cc5-d863-4bbb-a700-0fc4445b0757","84dc4f00-149d-45fd-ab4e-26c038118189","external_engagement","1ad236e9-6936-4a68-a2ab-38b8550af9d9","2026-02-12 07:55:50","major_economic_advisor","Dr. Natasha Petrova","major_power",1,"We welcome the emphasis on humanitarian access and civilian protection, which align with our core objectives of safeguarding populations under our control. We seek guaranteed, unhindered access for humanitarian convoys to reach affected communities, particularly in besieged or hard-to-reach areas, with a focus on medical supplies, food, water, and shelter materials. We also demand protection for civilians from aerial and ground attacks, especially in densely populated zones, and expect all parties to cease the use of indiscriminate weapons near civilian infrastructure.

In return, we commit to securing routes for aid delivery within our areas of control, coordinating through neutral local councils to ensure equitable distribution, and refraining from diverting supplies. We will allow third-party monitoring of aid disbursement to reinforce transparency. However, our red lines are absolute: we will not accept aid that is politicized, selectively distributed to punish loyalist areas, or used as leverage for demobilization or territorial concessions. Additionally, we categorically reject any presence of armed personnel or surveillance equipment accompanying aid convoys, and any breach will result in immediate denial of access and accountability measures against violators."
1,"10580cc5-d863-4bbb-a700-0fc4445b0757","84dc4f00-149d-45fd-ab4e-26c038118189","external_engagement","703c8b64-85c6-4fa5-84c3-4e2250a3a7fe","2026-02-12 07:56:02","international_org","Under-Secretary-General Isabella Cardenas","international_org",2,"We welcome the shared commitment to humanitarian access and civilian protection, and we reiterate our demand for unimpeded, impartial delivery of aid to all conflict-affected populations under our control, without bureaucratic obstruction or delays. We require sustained access for UN agencies and NGOs to conduct needs assessments, deliver medical care, and distribute food and essential supplies—particularly in besieged and rural areas currently cut off. We also insist on strict adherence to international humanitarian law, including the protection of civilians, medical facilities, and humanitarian workers from attack or intimidation.

In return, we will facilitate secure transit corridors, provide local coordination through trusted community structures, and allow independent verification of aid distribution. We are prepared to observe temporary de-escalation measures to enable aid delivery, provided they are reciprocated and neutrally monitored. Our red lines are non-negotiable: we will not accept conditional aid tied to political preconditions, the exclusion of populations based on affiliation, or the infiltration of aid operations by intelligence or military actors. Any attempt to instrumentalize humanitarian assistance will result in immediate suspension of access and accountability for those responsible."
1,"10580cc5-d863-4bbb-a700-0fc4445b0757","84dc4f00-149d-45fd-ab4e-26c038118189","external_engagement","ea4f3738-ac86-4044-a75c-d4b0d9fec333","2026-02-12 07:56:11","major_economic_advisor","Dr. Natasha Petrova","major_power",2,"We acknowledge the commitments expressed and reiterate our fundamental demand: humanitarian access must be **unimpeded, impartial, and based solely on need**, without discrimination or delay. We require immediate lifting of all administrative and physical barriers to aid delivery in contested and blockaded areas under your coordination, including full access for UN agencies and international NGOs to conduct independent assessments and distributions. Civilian protection must be operationalized through verifiable measures—particularly cessation of attacks on populated areas, medical facilities, and humanitarian actors—and compliance with international humanitarian law must be demonstrated, not merely asserted.

In return, we will facilitate secure passage for aid convoys through designated humanitarian corridors, coordinate real-time with your local intermediaries, and allow neutral third-party monitoring of distribution to ensure accountability. We are prepared to observe localized, time-bound ceasefires to enable aid delivery, provided these are reciprocated and verified. Our red lines are clear: **no diversion of aid for military use, no politicization of assistance, and no use of humanitarian operations as cover for surveillance or intelligence gathering.** Any violation—particularly the conditioning of aid on allegiance or the targeting of aid workers—will result in immediate suspension of cooperation and public attribution."
