"period","session_id","interaction_id","interaction_type","message_id","timestamp","sender_id","sender_name","sender_faction","exchange_number","content"
1,"10580cc5-d863-4bbb-a700-0fc4445b0757","6f8ac0ef-e2ac-4b0c-8087-730c33e72a88","intra_faction_coordination","e3a7b9b2-e4f8-48a9-b99c-900a3bb97689","2026-02-12 07:50:11","major_military_chief","General Viktor Krasnov","major_power",1,"As Head of International Relations, I assess that the recent sanctions constitute a coordinated effort to undermine our strategic autonomy and economic stability. We must respond with calibrated countermeasures that signal resolve without triggering broader escalation.

I recommend immediate implementation of targeted trade restrictions on key sectors in sanctioning countries—particularly agriculture and specialty manufacturing—while accelerating diversification of export corridors through non-aligned partners.

A key concern is the potential for secondary sanctions that could disrupt our financial clearing mechanisms, particularly if major banks de-risk exposure preemptively."
1,"10580cc5-d863-4bbb-a700-0fc4445b0757","6f8ac0ef-e2ac-4b0c-8087-730c33e72a88","intra_faction_coordination","be9f80e2-ce60-4c88-afe1-a604b0de9bec","2026-02-12 07:50:15","major_defense_minister","Minister Dmitri Volkov","major_power",1,"[Minister Elena Petrova - MAJOR_POWER]: I concur with General Krasnov’s assessment and endorse the proposed targeted trade restrictions. As Minister of Economic Security, I stress the urgency of pairing retaliatory measures with domestic stabilization—specifically, activating strategic reserves to buffer input shortages and shielding critical industries from supply chain disruptions.

I recommend establishing a rapid-response economic task force under the Ministry to monitor price volatility, enforce export controls on dual-use materials, and expedite barter arrangements with partner states to circumvent financial restrictions.

A key risk is inflationary pressure on essential goods due to disrupted import channels, which could erode public confidence and create internal instability if not proactively managed."
1,"10580cc5-d863-4bbb-a700-0fc4445b0757","6f8ac0ef-e2ac-4b0c-8087-730c33e72a88","intra_faction_coordination","9fd70b51-0ad9-47ac-99e0-b9ad3511c8de","2026-02-12 07:50:22","major_economic_advisor","Dr. Natasha Petrova","major_power",1,"[Director Alexei Morozov - MAJOR_POWER]: I support the proposed countermeasures and economic safeguards, but we must integrate intelligence and diplomatic reconnaissance into the response. As Director of Strategic Analysis, I recommend launching a covert influence campaign targeting political divisions within the sanctioning coalition—leveraging economic grievances in affected sectors to amplify dissent and delay further unified action.

We should also accelerate outreach to neutral states through backchannel diplomacy to secure alternative logistics hubs and financial intermediaries, particularly in Asia and the Global South.

A key concern is overreliance on asymmetric responses; if perceived as aggressive, they may justify expanded sanctions under the pretext of ""destabilizing behavior,"" undermining our efforts to portray restraint."
1,"10580cc5-d863-4bbb-a700-0fc4445b0757","6f8ac0ef-e2ac-4b0c-8087-730c33e72a88","intra_faction_coordination","8cdcb51b-1c86-4fcb-9a2d-0057bd17f058","2026-02-12 07:50:31","major_intelligence","Director Sergei Morozov","major_power",1,"[Commissar Igor Sokolov - MAJOR_POWER]: I align with the proposed economic and diplomatic measures but emphasize the necessity of reinforcing state control over strategic sectors to prevent exploitation by foreign actors during this period of pressure. As Commissar for Strategic Industries, I recommend immediate regulatory review and, where necessary, state intervention in critical supply chains—including energy, transport, and high-tech manufacturing—to prevent vulnerabilities from being weaponized through third-party dependencies.

I direct that all dual-use production facilities operate under heightened security protocols and that export licensing be centralized under a wartime economic framework to ensure compliance and maximize leverage.

A key concern is the potential for internal dissent among industrial elites who may prioritize commercial interests over national resilience, risking noncompliance or quiet sabotage of state-directed countermeasures."
1,"10580cc5-d863-4bbb-a700-0fc4445b0757","6f8ac0ef-e2ac-4b0c-8087-730c33e72a88","intra_faction_coordination","d190ae16-847e-4d3a-bbc2-4769fee01172","2026-02-12 07:50:35","major_propaganda","Deputy Minister Yuri Volkov","major_power",1,"[Deputy Minister Anatoly Kuznetsov - MAJOR_POWER]: I endorse the coordinated economic, intelligence, and industrial measures proposed by my colleagues. As Deputy Minister for Foreign Economic Relations, I stress that our immediate priority must be to operationalize alternative financial and trade mechanisms—specifically, fast-tracking the activation of currency swap lines with key partners and expanding the use of non-USD settlement platforms to insulate our trade in energy and critical goods.

I recommend designating a lead agency—under the Ministry of Economic Security—to integrate these tools into a unified sanctions evasion architecture, with binding protocols for domestic firms operating abroad to prevent exposure of our networks.

A key risk is the consolidation of secondary sanctions targeting our financial intermediaries and shipping assets, which could severely constrain our ability to project economic power if not preemptively mitigated through anonymized transit structures and expanded use of proxy entities."
1,"10580cc5-d863-4bbb-a700-0fc4445b0757","6f8ac0ef-e2ac-4b0c-8087-730c33e72a88","intra_faction_coordination","bd76892c-db90-4e22-9f1b-222da8e81cfe","2026-02-12 07:50:38","major_military_chief","General Viktor Krasnov","major_power",2,"[Senior Advisor Elena Rostova - MAJOR_POWER]: I concur with the strategic direction outlined by my colleagues, particularly the emphasis on financial resilience, industrial control, and political fragmentation of the sanctioning coalition. As Senior Advisor for National Security Strategy, I recommend we immediately activate our contingency protocols for sovereign payment system redundancy—fully migrating all state-backed critical trade settlements to the SPFS equivalent and synchronizing technical interoperability with strategic partners’ systems within 72 hours.

We must also impose reciprocal sanctions on foreign firms actively complying with adversarial measures, designating them as restricted entities to be excluded from public contracts and access to domestic markets.

A key concern is the risk of intelligence leakage through private-sector actors with dual affiliations; we must mandate real-time reporting of foreign contact by executives in strategically significant companies to prevent premature exposure of our countermeasures."
1,"10580cc5-d863-4bbb-a700-0fc4445b0757","6f8ac0ef-e2ac-4b0c-8087-730c33e72a88","intra_faction_coordination","0f0a68f2-a07b-4d84-83c9-07fb601f812e","2026-02-12 07:50:50","major_defense_minister","Minister Dmitri Volkov","major_power",2,"[Deputy Minister Natalia Petrova - MAJOR_POWER]: I support the proposed measures on financial redirection, industrial control, and retaliatory designations. As Deputy Minister for Energy and Resource Security, I direct that all major energy exporters immediately shift contract settlements to approved non-USD mechanisms, with pricing indexed to baskets of allied currencies; noncompliant firms will be barred from export licenses.

I further recommend the imposition of selective energy delivery curtailments to nations actively enforcing sanctions—framed as ""technical adjustments"" through state-controlled operators—to signal resolve without triggering full market collapse.

A key risk is overextension of our logistical workarounds; we must avoid creating bottlenecks in shipping and storage infrastructure as trade routes reroute eastward, which could undermine credibility of our energy leverage."
1,"10580cc5-d863-4bbb-a700-0fc4445b0757","6f8ac0ef-e2ac-4b0c-8087-730c33e72a88","intra_faction_coordination","4bed27a2-859f-40fb-b9da-c6f2476131be","2026-02-12 07:50:57","major_economic_advisor","Dr. Natasha Petrova","major_power",2,"[Deputy Minister Alexei Morozov - MAJOR_POWER]: I align with the operational urgency emphasized by my colleagues on financial rerouting, retaliatory measures, and energy leverage. As Deputy Minister for Trade and Logistics, I direct the immediate establishment of dedicated sanctions bypass corridors—designated shipping lanes, rail routes, and warehousing hubs in friendly third countries—under state supervision to ensure uninterrupted flow of sanctioned goods, with priority clearance for dual-use and defense-industrial inputs.

I recommend mandating the use of state-approved front companies and flagging arrangements for all outward-bound shipments transiting high-risk jurisdictions, coupled with real-time cargo rerouting protocols managed through the Federal Customs Service in coordination with military intelligence.

A key risk is the potential for interdiction or forensic tracking via vessel AIS spoofing detection and banking transaction pattern analysis; we must institute mandatory electronic signature masking and periodic audit simulations to stress-test our obfuscation protocols within 48 hours."
1,"10580cc5-d863-4bbb-a700-0fc4445b0757","6f8ac0ef-e2ac-4b0c-8087-730c33e72a88","intra_faction_coordination","d6c51004-d6f5-49e9-af2b-41e1ead9318d","2026-02-12 07:51:08","major_intelligence","Director Sergei Morozov","major_power",2,"[Minister of Defense Sergei Ivanov - MAJOR_POWER]: I endorse the accelerated activation of financial, energy, and trade countermeasures as outlined. From a defense and strategic deterrence perspective, we must treat economic warfare as a domain of national security no less critical than kinetic operations.

I direct the General Staff, in coordination with the GRU and SVR, to prepare contingency plans for asymmetric responses—including precision cyber operations against critical infrastructure of leading sanctioning states—should restrictive measures escalate to threaten the stability of our command, control, or strategic supply chains.

A key risk is premature escalation; we must calibrate any offensive cyber or hybrid action to avoid crossing thresholds that trigger collective defense clauses under Article 5–type arrangements, while maintaining plausible deniability."
1,"10580cc5-d863-4bbb-a700-0fc4445b0757","6f8ac0ef-e2ac-4b0c-8087-730c33e72a88","intra_faction_coordination","594fb5cb-c5a4-4b06-86d5-bdc1ffe9eefd","2026-02-12 07:51:14","major_propaganda","Deputy Minister Yuri Volkov","major_power",2,"[Deputy Minister Yelena Kozlova - MAJOR_POWER]: I concur with the coordinated measures on financial rerouting, energy leverage, and logistical bypass corridors. As Deputy Minister for Economic Resilience and Domestic Production, I direct the immediate activation of state procurement overrides to redirect all sanctioned technology imports toward domestically produced or allied-sourced equivalents, with emergency funding unlocked for priority sectors: microelectronics, aviation components, and precision chemicals.

I recommend instituting a centralized wartime allocation system—modeled on crisis production frameworks—effective within 72 hours, granting the Ministry authority to commandeer production lines, raw materials, and R&D outputs in designated strategic industries.

A key risk is domestic inflationary pressure and supply shortfalls in dual-use sectors; we must impose price controls and rationing on critical inputs to prevent market panic and ensure equitable distribution to defense-critical enterprises."
1,"10580cc5-d863-4bbb-a700-0fc4445b0757","6f8ac0ef-e2ac-4b0c-8087-730c33e72a88","intra_faction_coordination","7524a788-10ec-4ce9-89db-625033e184b0","2026-02-12 07:51:19","major_military_chief","General Viktor Krasnov","major_power",3,"[Minister of Foreign Affairs Dmitriy Sokolov - MAJOR_POWER]: I support the operational and defensive measures outlined, but emphasize that unchecked escalation in financial, cyber, and trade domains risks isolating us diplomatically and entrenching long-term coalition unity among adversaries. As Minister of Foreign Affairs, I direct the immediate dispatch of high-level political envoys to non-aligned and Global South partners—particularly in ASEAN, Africa, and Latin America—to frame the sanctions as illegal coercion and secure public statements of non-recognition of their legitimacy.

I recommend launching a targeted diplomatic offensive to expand the ""sanctions solidarity"" group by offering preferential energy and grain deals in exchange for political cover and logistical access, particularly in ports and financial intermediaries beyond Western jurisdiction.

A key risk is overreliance on covert and retaliatory measures at the expense of strategic messaging; without a compelling international narrative, we cede the normative battlefield and accelerate coalition coalescence against us."
1,"10580cc5-d863-4bbb-a700-0fc4445b0757","6f8ac0ef-e2ac-4b0c-8087-730c33e72a88","intra_faction_coordination","7cd833e3-cffa-4734-8777-5506cd85cbdc","2026-02-12 07:51:21","major_defense_minister","Minister Dmitri Volkov","major_power",3,"[Deputy Director Natalya Petrova - MAJOR_POWER]: I concur with the acceleration of countermeasures and the need for integrated civil-military-economic resilience. As Deputy Director for Strategic Coordination, I direct the immediate establishment of a Cross-Domain Response Cell (CDRC) under the Security Council apparatus, with real-time representation from Defense, Foreign Affairs, Central Bank, and State Industry, to synchronize financial, diplomatic, and operational responses and eliminate bureaucratic friction.

I recommend instituting a tiered escalation protocol that links specific sanction intensifications to pre-authorized counteractions—economic, informational, or operational—ensuring rapid, calibrated, and unified responses without ad hoc decision-making at the highest level.

A key risk is internal coordination failure across siloed institutions under pressure; without a centralized command mechanism, we risk delayed reactions, contradictory policies, and exploitable gaps in deterrence signaling."
1,"10580cc5-d863-4bbb-a700-0fc4445b0757","6f8ac0ef-e2ac-4b0c-8087-730c33e72a88","intra_faction_coordination","dab168be-7366-4302-aac0-25f263f154e5","2026-02-12 07:51:29","major_economic_advisor","Dr. Natasha Petrova","major_power",3,"[Deputy Minister Alexei Morozov - MAJOR_POWER]: I endorse the establishment of the Cross-Domain Response Cell and affirm the urgency of domestic production redirection and diplomatic outreach. As Deputy Minister for Energy and Critical Infrastructure, I direct the immediate reconfiguration of energy export flows—diverting 40% of refined product volumes from sanctioned markets to pre-identified alternative hubs in Asia and the Middle East via state-controlled trading entities, using non-dollar settlement mechanisms.

I recommend activating emergency interconnection protocols between national grids and pipeline networks of allied and non-aligned states to create fallback routes and enhance mutual dependency, thereby increasing strategic leverage and reducing isolation risk.

A key risk is physical and cyber targeting of transit infrastructure in third countries; we must deploy defensive security teams and pre-position repair assets along priority corridors to ensure continuity of energy flows under duress."
1,"10580cc5-d863-4bbb-a700-0fc4445b0757","6f8ac0ef-e2ac-4b0c-8087-730c33e72a88","intra_faction_coordination","6ab4bd35-f296-4710-8801-3ea9ea2719e0","2026-02-12 07:51:31","major_intelligence","Director Sergei Morozov","major_power",3,"[Deputy Minister Alexei Morozov - MAJOR_POWER]: I support the activation of the Cross-Domain Response Cell and the diplomatic offensive proposed by Foreign Affairs, but stress that economic countermeasures must be operationalized faster than diplomatic narratives can take effect. As Deputy Minister for Energy and Critical Infrastructure, I direct the immediate implementation of barter and rupee-rouble settlement pilots with India, Türkiye, and Iran for crude and refined products, backed by state guarantees to incentivize private tanker operators to de-risk through our routing hubs.

I recommend fast-tracking the conversion of four floating storage units into mobile transshipment platforms in the Persian Gulf and the South China Sea to bypass port-based interdiction and enable stealthier delivery to secondary markets.

A key risk is overexposure of our shadow fleet to interdiction or insurance cutoffs; without enhanced vessel ownership obfuscation and expanded flags-of-convenience partnerships, we face systemic disruption in energy revenue flows within six months."
1,"10580cc5-d863-4bbb-a700-0fc4445b0757","6f8ac0ef-e2ac-4b0c-8087-730c33e72a88","intra_faction_coordination","220af18d-7c5d-4333-8e88-6d64807b58ab","2026-02-12 07:51:43","major_propaganda","Deputy Minister Yuri Volkov","major_power",3,"[Minister Dmitri Volkov - MAJOR_POWER]: I approve the establishment of the Cross-Domain Response Cell and endorse the energy diversion and financial de-dollarization measures advanced by Deputy Minister Morozov. As Minister of Economic Security, I direct the Central Bank and Ministry of Finance to immediately implement capital controls limiting outbound transfers above $10,000 per entity, suspend dividend payouts for all strategic-sector firms, and activate reciprocal asset freezes on entities complying with foreign sanction regimes.

I recommend designating a Counter-Sanctions Enforcement Unit within the Federal Financial Monitoring Service to track and penalize domestic non-compliance with these measures, including forced asset reallocation for violators.

A key risk is unintended macroeconomic contraction due to liquidity crunches in non-strategic sectors; we must ring-fence essential imports and maintain limited foreign exchange access for food and medicine supply chains to prevent domestic unrest."
1,"10580cc5-d863-4bbb-a700-0fc4445b0757","63665e7a-b175-4b16-a95e-05c44c2d7ff2","intra_faction_coordination","4d2f161e-c0a9-46ea-a893-77c5b8db0803","2026-02-12 07:51:45","small_president","President Elena Marchetti","small_power",1,"Position: Continued resistance maintains our leverage and signals resolve, but we must assess whether the costs undermine our long-term influence. Negotiation positions should only be pursued if they secure concrete concessions without compromising core principles.

Recommended course of action: Suspend escalatory actions temporarily to probe for negotiated outcomes through quiet bilateral channels, while maintaining public unity and readiness to resume resistance if no progress is made within a defined timeframe.

Key risk: Premature de-escalation could be perceived as weakness, emboldening the dominant side to impose unfavorable terms or erode our coalition’s cohesion."
1,"10580cc5-d863-4bbb-a700-0fc4445b0757","63665e7a-b175-4b16-a95e-05c44c2d7ff2","intra_faction_coordination","6fd37dbf-ae5d-49f1-b968-6a5fc64cbb20","2026-02-12 07:51:49","small_military_commander","General Olena Bondar","small_power",1,"Position: While President Marchetti’s cautious approach has merit, I believe we must maintain visible resistance to preserve domestic credibility and deter further encroachments. Any negotiation must be preceded by demonstrable shifts from the dominant side—symbolic gestures are insufficient.

Recommended course of action: Reject any suspension of resistance until we secure a binding commitment to substantive talks with a clear agenda and timelines. Simultaneously, task our diplomatic envoys to coordinate with like-minded states to amplify pressure and insulate us from isolation.

Key risk: Over-reliance on quiet channels risks sidelining our priorities and ceding strategic initiative to larger powers who may strike bilateral deals at our expense."
1,"10580cc5-d863-4bbb-a700-0fc4445b0757","63665e7a-b175-4b16-a95e-05c44c2d7ff2","intra_faction_coordination","e82ac39a-c5b2-4e71-a834-e6efa27b019d","2026-02-12 07:51:53","small_foreign_minister","Minister Sofia Kovalenko","small_power",1,"[Minister of Foreign Affairs Dmitri Kovac - SMALL_POWER]  

Position: I concur with General Bondar that visible resistance remains essential to uphold our sovereignty narrative and prevent strategic marginalization. However, President Marchetti is correct that undirected escalation without exploring diplomatic off-ramps risks entrenching our isolation—our leverage lies in calibrating pressure with precision, not abandoning either.

Recommended course of action: Launch a time-bound, public diplomatic initiative—framed as a ""peace through strength"" effort—where we restate our core demands in multilateral fora (e.g., UN or regional body), invite third-party mediation, and condition any de-escalation on reciprocal, verifiable actions from the dominant side. This preserves resolve while creating international accountability.

Key risk: If we do not proactively shape the diplomatic agenda, the dominant power will define the terms of engagement unilaterally, painting us as obstructionist and weakening coalition support."
1,"10580cc5-d863-4bbb-a700-0fc4445b0757","63665e7a-b175-4b16-a95e-05c44c2d7ff2","intra_faction_coordination","e3f03d98-71eb-44b7-916f-6f23313ffa7a","2026-02-12 07:52:07","small_opposition","Viktor Zelenko","small_power",1,"[Minister of Foreign Affairs Dmitri Kovac - SMALL_POWER]

Position: I support Minister Kovalenko’s framing of ""peace through strength"" as the guiding principle. We must avoid being perceived either as intransigent or acquiescent; our posture should fuse unyielding defense of sovereignty with disciplined diplomacy. Resistance without a visible, principled pathway to negotiation risks ceding moral high ground—especially with fence-sitting states whose support we need.

Recommended course of action: Immediately table a resolution in the Regional Council demanding an independent verification mechanism for compliance with existing agreements, coupled with a standing offer to enter into reciprocal de-escalation—contingent on verifiable steps from the dominant side. This institutionalizes our demands, leverages multilateral legitimacy, and forces them to either engage substantively or expose their rejectionism.

Key risk: If we allow the narrative to solidify that we are resisting dialogue *per se*, rather than resisting *bad-faith* dialogue, we risk losing critical diplomatic oxygen—even among allies who value stability alongside sovereignty."
1,"10580cc5-d863-4bbb-a700-0fc4445b0757","63665e7a-b175-4b16-a95e-05c44c2d7ff2","intra_faction_coordination","3d613f93-0479-485a-9d15-3d4ab8b7f2e5","2026-02-12 07:52:22","small_intelligence","Director Maksym Savchenko","small_power",1,"[Minister of Foreign Affairs Dmitri Kovac - SMALL_POWER]

Position: I fully align with the principle of ""peace through strength"" advanced by Minister Kovalenko and supported by Mr. Zelenko. Our strategy must reject false binaries between resistance and diplomacy—credibility comes from demonstrating both capability and responsibility. We cannot negotiate under duress, but we must also not become obstacles to a rules-based resolution.

Recommended course of action: I propose we activate our standing offer for conditional de-escalation by formally transmitting, within 72 hours, a draft framework to the Regional Council and key mediators—detailing specific, sequenced steps for reciprocal confidence-building measures, tied to the restoration of territorial integrity and enforcement of international commitments. This preempts narrative capture, positions us as solution-oriented, and compels the dominant power to either engage or reveal its dismissal of orderly process.

Key risk: Delaying a structured diplomatic initiative—even while maintaining military resistance—invites external actors to coalesce around weaker, compromise frameworks that may sacrifice core interests in pursuit of rapid de-escalation. We must own the terms of engagement before others define them for us."
