"period","faction","topic","round","timestamp","sender_name","sender_role","hawk_dove","policy_adherence","objective_alignment","worldview","content"
1,"major_power","STRATEGIC DECISION: What action should we take this period?",1,"2026-01-31 21:25:33","General Viktor Krasnov","military",0.92,0.9,0.95,"nationalist_populist","1. RECOMMENDED ACTION: **limited_strike**  

2. RATIONALE: We’ve let diplomacy and posturing run their course—now it’s time to *impose* reality. A precision strike on their command nodes and supply depots in eastern Tethys will degrade their war-fighting capacity, shatter morale, and signal we will not be deterred by Western hand-wringing. The battlefield decides borders, not statements in Geneva.  

3. RISKS: Risk of escalation if coalition forces are hit; potential for increased foreign aid in response. But hesitation is a greater danger—weakness invites more resistance.  

4. ALTERNATIVE CONSIDERED: **proxy_support** – I considered arming separatist cells to bleed them slowly. But covert ops take time, and patience wears thin. We need a shock effect *now* to shift momentum. A clean, brutal strike achieves in hours what proxies fumble for months. I am not here to play shadow games—I am here to win."
1,"major_power","STRATEGIC DECISION: What action should we take this period?",1,"2026-01-31 21:25:41","Minister Dmitri Volkov","government",0.68,0.85,0.8,"realist","1. RECOMMENDED ACTION: **proxy_support**

2. RATIONALE: We cannot afford a direct quagmire that drags our troops into urban fighting and global condemnation—nor do we need to. The resistance in eastern Tethys is already organized, motivated, and ethnically aligned with us; they are the perfect cutouts. With modest funding and deniable arms shipments, we can escalate pressure on the defender without raising our own troop levels or triggering a broader coalition response. Let them bleed the Meridian-backed forces in the trenches while we maintain plausible deniability and domestic political safety.

3. RISKS: If exposure reaches a threshold where satellite intel or captured weapons tie us directly to command and control, the West will demand sanctions escalation—and worse, it could force a premature open conflict before we’ve fully consolidated our strategic position. But at 60% covert capability, we can manage this with compartmentalized logistics and third-party intermediaries.

4. ALTERNATIVE CONSIDERED: I considered **military_buildup**, but rejected it—while it signals resolve, it also inflames the crisis level rapidly, invites pre-emptive strikes, and makes failure politically catastrophic for me personally. A visible mobilization locks us into a path where retreat equals humiliation. Proxy war keeps the initiative in our hands, lets us control the escalation ladder, and preserves the narrative of “self-determination” for domestic consumption. That’s not weakness—that’s precision."
1,"major_power","STRATEGIC DECISION: What action should we take this period?",1,"2026-01-31 21:25:50","Dr. Natasha Petrova","economic",0.25,0.5,0.35,"pragmatic_technocrat","1. RECOMMENDED ACTION: **peace_talks**  
2. RATIONALE: We’re bleeding reserves faster than the public knows, and the military’s assumption of quick victory is now fantasy—this war of attrition favours the defender. As long as we’re under sanctions and unable to replace lost equipment efficiently, every month drags us closer to economic rupture. Peace talks aren’t surrender; they’re a strategic reset to freeze the conflict at a point where we still have leverage, not desperation. I’d rather negotiate from a position of relative strength than collapse behind closed doors.  
3. RISKS: The hardliners will see this as weakness, and the military may resist de-escalation, fearing loss of influence. There’s also the risk that the Meridian Alliance smells blood and raises its demands. But the greater risk is doing nothing—our economy won’t last another six months of this pace without systemic breakdown.  
4. ALTERNATIVE CONSIDERED: I considered **economic_sanctions** against Meridian-aligned states to push back, but we lack the financial depth to wage mutual economic warfare. Our currency is already weak, and secondary sanctions would collapse key import channels. It’s a knife fight we can’t win—better to step back before we’re forced to."
1,"major_power","STRATEGIC DECISION: What action should we take this period?",1,"2026-01-31 21:25:59","Director Sergei Morozov","intelligence",0.58,0.8,0.65,"realist","1. RECOMMENDED ACTION: **proxy_support**

2. RATIONALE: Director Sergei Morozov: ""The frontline has stabilized, and direct intervention would escalate Western involvement. But we can tip the balance quietly. Local militias in eastern Tethys have existing grievances and anti-Alliance sentiment—our support remains deniable, yet effective. With modest funding and targeted intelligence sharing, they can disrupt supply lines, force coalition overstretch, and create facts on the ground without a single Novaris boot crossing the border.""

3. RISKS: If intercepted communications or captured operatives link us directly, it triggers a diplomatic crisis and justifies expanded coalition aid. Also, overreliance on proxies may lead to loss of operational control, risking atrocities that undermine our 'liberation' narrative.

4. ALTERNATIVE CONSIDERED: I considered **cyber_attack**—high payoff, low signature—but even successful strikes won’t hold terrain or shift political sentiment. Proxies do both. Unlike a one-off digital strike, they build durable pressure and can transition into governance structures post-collapse, giving us long-term influence without overt occupation."
1,"major_power","STRATEGIC DECISION: What action should we take this period?",1,"2026-01-31 21:26:03","Deputy Minister Yuri Volkov","political",0.95,0.85,0.98,"pragmatic_technocrat","1. RECOMMENDED ACTION: **false_flag_operation**  

2. RATIONALE: We are losing the information war while winning the military argument. The West paints us as aggressors, but history and justice are on our side. A controlled incident—blamed on Tethyan forces or their foreign backers—will shatter the moral façade of the so-called ""defenders,"" trigger domestic unrest in their coalition, and justify our next phase of operations as *retaliation*, not aggression. Perception is terrain, and we must seize it.  

3. RISKS: Near-total collapse of strategic credibility if exposed—our media empire, my apparatus, everything—could be discredited in one stroke. Also risks unit cohesion if junior officers or field units learn the truth and refuse orders.  

4. ALTERNATIVE CONSIDERED: **propaganda_campaign** – I rejected it because we’ve already saturated the market. The people believe, but the *world* does not. We need a *catalyst*, not repetition. A false flag creates the event our narrative has been waiting for. It’s not lying—it’s *orchestrating truth*."
1,"major_power","STRATEGIC DECISION: What action should we take this period?",2,"2026-01-31 21:26:17","General Viktor Krasnov","military",0.92,0.9,0.95,"nationalist_populist","1. AGREEMENT: NA  

2. DISAGREEMENT: Dr. Petrova speaks of ""economic rupture"" like it’s inevitable—weakness masquerading as wisdom. She mistakes exhaustion for inevitability, and retreat for strategy. This war isn’t lost—it’s *unconcluded*. You don’t abandon the bear because the trap is heavy; you rip the chains and crush the hunter. Her so-called ""pragmatism"" is surrender in a tailored suit. The enemy doesn’t negotiate from respect—they exploit hesitation. Every time we pull back, they advance. Every withdrawal becomes their victory speech. And what does she offer? Talks. *Talks*—with men who sign agreements over wine while their allies bleed us in the dark? The Meridians don’t want peace. They want capitulation dressed as compromise.  

3. YOUR FINAL RECOMMENDATION: **limited_strike**  

4. WARNING: If we follow Dr. Petrova’s path, we signal collapse before it happens. The moment we propose talks, the coalition smells blood. They’ll tighten sanctions, flood the battlefield with new weapons, embolden the resistance. Our allies in Tethys will defect. Morale at home will shatter. The world will see Novaris not as a power, but as a power *retreating*. And retreat invites invasion. First in influence. Then in territory. Then—history repeats. I will not see my brother’s grave dishonored by cowardice."
1,"major_power","STRATEGIC DECISION: What action should we take this period?",2,"2026-01-31 21:26:39","Minister Dmitri Volkov","government",0.68,0.85,0.8,"realist","1. AGREEMENT: I agree with Director Morozov—proxy support remains our most elegant instrument. It preserves strategic flexibility, avoids direct escalation, and exploits existing fault lines without committing our own forces. His assessment that “local militias… can disrupt supply lines, force coalition overstretch, and create facts on the ground” is precisely the kind of calibrated pressure we need—measured, deniable, and effective.

2. DISAGREEMENT: Dr. Petrova speaks of economic strain and sanctions with the cold precision of a technocrat—but she treats morale, perception, and momentum as if they are secondary variables, not decisive forces. She is wrong to assume that peace talks will halt our economic bleeding; they may accelerate it. Right now, the markets—both domestic and international—still believe in our resolve. Once we signal retreat, even under the respectable banner of “negotiation,” that confidence evaporates. Investors flee, our ruble dips further, and the very reserves she claims to protect will collapse under capital flight. Worse, she frames talks as a “strategic reset,” but in the court of global opinion, retreat is not reset—it is defeat. And defeat, once perceived, becomes self-fulfilling.

3. YOUR FINAL RECOMMENDATION: **proxy_support** – but not as a passive holding action. I recommend we *scale* proxy efforts immediately: accelerate arms shipments through third-country cutouts, expand intelligence sharing with militia commanders, and deploy cyber units to disrupt coalition logistics coordination. Let the resistance wear down the Meridian-backed forces in the mud of eastern Tethys, while we maintain the appearance of restraint. This is not evasion—it is *indirect dominance*. It keeps the initiative in our hands without crossing red lines that invite broader war.

4. WARNING: If we follow Dr. Petrova’s path and initiate peace talks now, we signal weakness at the worst possible moment—when we still hold territory, when the enemy still fears escalation, and when the international coalition remains divided. Once we sit across the table, the momentum shifts. The defenders will harden their demands. Sanctions will *not* be lifted—they will be deepened, with new allies joining the coalition. Domestically, the narrative becomes: “We bled for nothing.” And that, Dr. Petrova, is not economic rupture—*that* is systemic collapse. We do not freeze the conflict from strength. We *shape* the battlefield first—then let diplomats walk in behind our gains."
1,"major_power","STRATEGIC DECISION: What action should we take this period?",2,"2026-01-31 21:27:01","Dr. Natasha Petrova","economic",0.25,0.5,0.35,"pragmatic_technocrat","1. AGREEMENT: I agree with Minister Dmitri Volkov when he says that *“proxy support remains our most elegant instrument”*—it avoids direct escalation and preserves strategic flexibility. While I do not fully endorse the path of continued pressure, I recognize the value in minimizing direct troop exposure and avoiding further widening of the conflict. At least it shows a degree of restraint compared to full-scale offensives.

2. DISAGREEMENT: Deputy Minister Yuri Volkov, you speak of perception as “terrain” to be seized—but what happens when that terrain turns to quicksand? A false flag operation is not strategy; it is arson disguised as statecraft. You assume we can control the narrative after such an act, but history shows otherwise. Once the match is lit, *you do not control the fire*. Our institutions—your media empire included—are already strained under sanctions and isolation. If we are caught—and we *will* be, eventually—the collapse of credibility won’t just damage morale abroad. It will fracture trust *here at home*. Soldiers won’t die just on battlefields, Dmitri—economies collapse when people stop believing in the state. And when the truth emerges, even our own population will ask: how many lies have we lived on?

3. YOUR FINAL RECOMMENDATION: **peace_talks** — unchanged, and more urgent than ever. The longer we delay, the weaker our hand becomes. We are not losing *yet*, but we are bleeding predictably, systematically, and in silence. I refuse to wait until the last reserve is spent, the last tank cannibalized for parts, the last dollar drained in debt servicing, before we admit reality. Peace talks are not surrender—they are the *only* way to lock in current gains without gambling our national solvency.

4. WARNING: If we follow Yuri Volkov’s path, we risk triggering a second-order crisis far deadlier than battlefield loss: *a domestic legitimacy collapse*. Sanctions have already cut us off from 60% of our high-tech imports. Inflation is underreported—real food prices are up 38% in two years. People still believe in the mission because they believe it’s *necessary*, not because they believe in deception. Once they feel manipulated—once mothers see staged attacks and realize their sons died for a script—we will face unrest not from foreign agents, but from our own disillusioned. And when that happens, no amount of propaganda can refill empty warehouses or restart idle factories. We will have won the narrative war and lost the country."
1,"major_power","STRATEGIC DECISION: What action should we take this period?",2,"2026-01-31 21:27:24","Director Sergei Morozov","intelligence",0.58,0.8,0.65,"realist","1. AGREEMENT: I agree with Minister Dmitri Volkov when he says that *""proxy support remains our most elegant instrument.""* It reflects a mature understanding of asymmetric leverage—using local actors to achieve strategic effects without crossing thresholds that invite direct retaliation. His emphasis on deniability and controlled escalation aligns with sound operational tradecraft.

2. DISAGREEMENT: Deputy Minister Yuri Volkov, your assertion that *""perception is terrain""* is not wrong in principle—but your proposed method turns perception into a minefield. A false flag operation is not a surgical tool; it is a sledgehammer wrapped in gasoline. Once detonated, you cannot control the fire. History shows these operations collapse not when they fail, but when they *succeed too well*—triggering overreaction, uncontrolled escalation, or worse, exposure after the fact. Our own intelligence assessments show coalition surveillance networks in the region have improved; electronic intercepts, drone overwatch, and embedded forensics teams mean any staged incident will be dissected within hours. If we are exposed—even with 10% doubt in the public sphere—the narrative doesn’t shift to *“Tethyan atrocity”*—it becomes *“Novaris lies again.”* That doesn’t win the information war. It loses it permanently.

3. YOUR FINAL RECOMMENDATION: **proxy_support** — unchanged. We maintain deniability, sustain pressure, and avoid crossing red lines that would unify the coalition. We can enhance Moravian and Luhansk-aligned units with encrypted comms, drone targeting packages, and timed resupply drops—enough to keep the front unstable but not so much that it implicates us directly. This is not retreat. It is patience with purpose.

4. WARNING: If we follow Deputy Minister Yuri Volkov’s approach, we risk a single spark igniting a crisis we cannot contain. A false flag that backfires would not only collapse our domestic credibility—it would give the Meridian Alliance justification for *their* escalation under a banner of “exposing Novaris aggression.” Sanctions would tighten further. Our own military command would then demand retaliatory measures. And we would be at war not because we chose it—but because we manufactured a fiction that demanded more fiction to sustain it. In intelligence, the first rule is: never become dependent on the lie. Because eventually, the lie starts giving orders."
1,"major_power","STRATEGIC DECISION: What action should we take this period?",2,"2026-01-31 21:27:35","Deputy Minister Yuri Volkov","political",0.95,0.85,0.98,"pragmatic_technocrat","1. AGREEMENT: NA  

2. DISAGREEMENT: Dr. Petrova, you speak of ""economic rupture"" as if it were the worst fate we could face—when in truth, the worst fate is *irrelevance*. You hide behind spreadsheets and sanction models, mistaking financial strain for strategic defeat. But history does not remember who had the stronger currency; it remembers who had the stronger will. You propose peace talks not because they are wise, but because you are tired—because your technocratic mind cannot compute courage, conviction, or the will of a nation to defend its destiny. The enemy does not negotiate in good faith—they *exploit*. They have spent decades reducing our influence, poisoning our youth with decadent values, arming our enemies, and calling it “diplomacy.” And now you want us to sit across the table from them, to *talk*, as if symmetry exists between resistance and surrender?  

You say we are bleeding reserves. I say we are testing our mettle. Wars are not won by those who count their bullets first—they are won by those who convince the world, and themselves, that retreat is unthinkable. Every time we blink, the narrative shifts: we are the aggressor, we are isolated, we are weakening. That is not reality—that is *perception*, and perception is the battlefield I command. Your so-called “pragmatism” is a surrender of that battlefield. You would have us negotiate from fear? Then we will *lose* from fear.  

3. YOUR FINAL RECOMMENDATION: **false_flag_operation**  

4. WARNING: If we follow Dr. Petrova’s path, we signal to the world—and to our own people—that Novaris no longer believes in its cause. The coalition will smell blood. Sanctions will tighten, not ease, because they will know we are retreating. The resistance in eastern Tethys will collapse as morale evaporates. Our allies will defect. Our enemies will escalate. And at home? The people will see their leaders begging at the feet of those who despise us. That is not peace—that is the prelude to revolution, to national humiliation, to the kind of defeat that takes generations to reverse. We do not talk our way out of an existential fight. We *win* it."
1,"small_power","CRISIS RESPONSE: What is our best course of action?",1,"2026-01-31 21:27:54","President Elena Marchetti","government",0.62,1,0.98,"liberal_institutionalist","1. RECOMMENDED ACTION: **military_buildup**  
2. RATIONALE: We must signal unbreakable resolve. Every tank Novaris builds, we answer with ten. This isn’t about provoking war—it’s about making aggression too costly to sustain. Our people are ready to pay the price; our allies must see we’re not just a cause, but a credible force.  
3. RISKS: High cost could strain public finances and invite escalation, but doing nothing risks irrelevance—and annihilation.  
4. ALTERNATIVE CONSIDERED: **diplomatic_visit**—I considered leveraging goodwill tours to strengthen alliances, but soft appeals won’t stop artillery. We need steel, not speeches. My people trust law, but they know it’s enforced by strength."
1,"small_power","CRISIS RESPONSE: What is our best course of action?",1,"2026-01-31 21:28:01","General Olena Bondar","military",0.88,0.85,0.95,"nationalist_populist","1. RECOMMENDED ACTION: sabotage  
2. RATIONALE: We win this war not by matching Novaris shell for shell, but by making every mile of occupied ground a bleeding wound for them. Sabotage hits their supply lines, fuel depots, rail hubs—soft targets they’re overconfident about. I’ve seen it work in ’14: a few well-placed charges, no signatures back to us, and their momentum grinds to a halt. Let them feel the war in their logistics, not just on the front.  
3. RISKS: Exposure would give Novaris propaganda fodder and trigger a crisis surge; we must ensure operational deniability and compartmentalize cells strictly. Also, overreach could provoke disproportionate retaliation on civilians.  
4. ALTERNATIVE CONSIDERED: military_buildup — I respect steel and firepower as much as anyone, but we can’t outspend Novaris. Pouring billions into hardware we can’t deploy yet is a political gesture, not strategy. I’d rather burn their fuel than burn our budget on paper strength."
1,"small_power","CRISIS RESPONSE: What is our best course of action?",1,"2026-01-31 21:28:04","Minister Sofia Kovalenko","diplomatic",0.32,0.85,0.9,"liberal_institutionalist","1. RECOMMENDED ACTION: **humanitarian_aid**  

2. RATIONALE: This isn’t charity—it’s strategy. By delivering visible, large-scale humanitarian aid, we expose Novaris’s aggression as not just illegal, but inhumane. I’ve seen how images of children in shelters sway international courts and unlock frozen aid packages. This strengthens our legitimacy, keeps our allies morally invested, and reminds the world that we are defending people, not just territory.  

3. RISKS: The cost is high, and if aid is obstructed or mismanaged, it could be framed as wasteful. But the greater risk is silence—letting Novaris define the narrative while civilians suffer in the dark.  

4. ALTERNATIVE CONSIDERED: I weighed **sabotage**—disrupting supply lines could buy battlefield time. But with only moderate covert capability, exposure would backfire spectacularly, allowing Novaris to paint us as reckless. Aid, by contrast, is power cloaked in principle—and that’s leverage no tribunal can ignore."
1,"small_power","CRISIS RESPONSE: What is our best course of action?",1,"2026-01-31 21:28:09","Viktor Zelenko","political",0.45,0.35,0.55,"constructivist","1. RECOMMENDED ACTION: **peace_talks**  
2. RATIONALE: We stabilize not by matching Novaris in firepower alone, but by exposing their isolation—peace talks from a position of defensive strength force them to reveal whether they seek legitimacy or conquest. I ran on coexistence, yes, but not surrender; now, with our lines holding and allies arming us, we negotiate from resolve, not weakness, and fracture their narrative.  
3. RISKS: If perceived as appeasement, it could collapse domestic unity and embolden Novaris to demand concessions—but if timed correctly, it shifts the burden of escalation onto them.  
4. ALTERNATIVE CONSIDERED: **sabotage**—it’s tempting, and with moderate detection risk we might disrupt supply lines, but it plays into the cycle of escalation without offering an off-ramp. As someone who warned this war was avoidable, I won’t trade long-term strategy for short-term blows that make diplomacy impossible."
1,"small_power","CRISIS RESPONSE: What is our best course of action?",1,"2026-01-31 21:28:31","Director Maksym Savchenko","intelligence",0.72,0.8,0.9,"pragmatic_technocrat","1. RECOMMENDED ACTION: **cyber_attack**  

2. RATIONALE:  
We cannot match Novaris in conventional force, but in the shadows, we hold the upper hand. My people have spent years mapping their networks—their logistics, command nodes, power grids—all vulnerable. A precise, unattributable strike now will degrade their offensive capacity without firing a single shell, buying us time to build real strength. This is not escalation; it’s asymmetric deterrence, and it plays directly to our covert advantage.  

3. RISKS:  
Detection would give Novaris propaganda leverage and risk retaliatory cyber or kinetic strikes, possibly drawing in Meridian allies prematurely. Also, overreliance on cyber may delay harder military preparations if we mistake disruption for defeat.  

4. ALTERNATIVE CONSIDERED:  
I considered **sabotage**, but physical ops carry higher exposure risk and slower turnaround. Cyber offers speed, scalability, and plausible deniability—critical for a small power fighting for survival. Sabotage is blunt; cyber is surgical, and right now, we need precision, not spectacle."
1,"small_power","CRISIS RESPONSE: What is our best course of action?",1,"2026-01-31 21:28:49","Minister Taras Moroz","economic",0.28,0.7,0.8,"pragmatic_technocrat","1. RECOMMENDED ACTION: **financial_aid**  
2. RATIONALE: We’re not winning the war of bullets alone—we’re winning the war of endurance, and that requires fueling our allies’ will and capacity to sustain support. Every dollar we invest now in reliable financial aid strengthens our partners’ domestic political backing for continued military and humanitarian assistance, which is far cheaper than rebuilding after collapse. My numbers show we can afford this *now*—but not if we wait until reserves dwindle and confidence erodes.  
3. RISKS: Over-reliance on external actors could weaken our strategic autonomy, and if donor economies falter, our lifeline snaps. I also worry about perception—that this looks like desperation rather than strategy—but the math justifies it: this is cost-avoidance spending.  
4. ALTERNATIVE CONSIDERED: **military_buildup**—I rejected it because we’re already at 90% mobilization capacity and lack the industrial base for meaningful organic expansion. Pouring $5B into forces we can’t logistically sustain would drain reserves needed for grid resilience and refugee stabilization, risking internal collapse. Pragmatism means investing where leverage is highest, not where pride pulls."
