"period","faction","topic","round","timestamp","sender_name","sender_role","hawk_dove","policy_adherence","objective_alignment","worldview","content"
1,"small_power","CRISIS RESPONSE: What is our best course of action?",2,"2026-01-31 21:29:13","President Elena Marchetti","government",0.62,1,0.98,"liberal_institutionalist","1. **AGREEMENT**: I agree with Minister Sofia Kovalenko—humanitarian aid is not charity, it’s strategic legitimacy. The images of our people enduring this aggression, the shelters, the displaced families—those are our most potent weapons in the court of global opinion. When the world sees children in bunkers while Novaris bombs maternity wards, it crystallizes moral clarity. That strengthens our hand everywhere—diplomacy, law, even arms procurement. She’s right: silence is the greater risk.

2. **DISAGREEMENT**: Taras, I respect your numbers—always have—but you’re mistaking endurance for passivity. **Financial aid to allies is not strategy; it’s accounting.** You’re asking us to out-wait Novaris while writing checks? That may comfort technocrats, but it does nothing to alter the balance of power *on the ground*. We are not surviving by being fiscally responsible—we are surviving by being *unignorable*. Your approach assumes the conflict will be decided in budget committees in Berlin and Washington. It won’t. It will be decided in the trenches, in the skies, in the networks—and in the perception that we are fighting. If we signal we’re prioritizing balance sheets over battlefield readiness, we tell our enemies *and* our allies that our resolve is negotiable. It’s not.

3. **YOUR FINAL RECOMMENDATION**: I stand by **military_buildup**—but not in isolation. Let me be clear: I am not rejecting diplomacy, sabotage, cyber, or humanitarian action. But the *core* of our strategy must be the unambiguous demonstration that we will meet force with force. This is about credibility. Every tank, every artillery piece, every drone we acquire and deploy signals to Novaris that the cost of war will only rise—and to our allies that we are not just a cause, but a *fighting nation* worth arming. I will pair this with Sofia’s humanitarian campaign—yes, let the world see our suffering—but also let them see our strength. Let them see us *building*, not just begging.

4. **WARNING**: If we follow Minister Moroz’s path—if we prioritize financial aid as our *lead* strategy—we risk becoming a dependent, not a partner. Allies will keep sending money, yes, but slowly, grudgingly, with more conditions. And Novaris will smell hesitation. They’ll see us managing decline, not preparing for victory. That invites not peace—it invites *partition*. Because in the end, Taras, no spreadsheet has ever stopped a tank column. Only steel and will can do that. And I will not preside over a nation that forgets the difference."
1,"small_power","CRISIS RESPONSE: What is our best course of action?",2,"2026-01-31 21:29:32","General Olena Bondar","military",0.88,0.85,0.95,"nationalist_populist","1. AGREEMENT: I agree with President Marchetti—on *resolve*. She’s right that doing nothing risks annihilation. The moment we stop pushing back, Novaris sees permission to advance. That part—the unbreakable spine—she’s absolutely correct about.

2. DISAGREEMENT: Taras, your spreadsheets can’t bleed, and your models don’t understand Novaris. You’re talking about *financial_aid* like it’s a shield. It’s not. It’s accounting. It’s hoping. It’s praying that someone else pays enough to keep the lights on while Novaris burns our villages and conscripts our boys at gunpoint. You want endurance? Fine. But endurance isn’t built on wire transfers to foreign banks—it’s built on *fear in the enemy’s spine*. They don’t fear your ledgers. They fear fire.

You say we’re winning a war of endurance? No. We’re *losing* if we act like this is a marathon where whoever saves the most money wins. This is a war of *will*, and will is proven with action—not aid packages signed in quiet offices while our people die in the dark. Novaris respects only one thing: cost. And if we’re not making them *pay*—in fuel, in time, in dead soldiers—then we are already losing.

3. YOUR FINAL RECOMMENDATION: **sabotage**. Not next month. Now. We strike rail lines in the east. We burn fuel depots in the occupied zones. We hit soft targets, deniably, relentlessly. Make their occupation a daily nightmare. Make every truck they move worth three men’s guard. That is how we stretch their forces thin. That is how we break their momentum without losing a single tank of our own. That is how we *fight*.

4. WARNING: If we follow Taras’s path—if we treat this war like a budget exercise, if we wait for allies to decide our fate on the back of financial aid—then we hand Novaris *time*. And time is the one thing they need to consolidate, to fortify, to normalize the occupation. They will entrench. They will call it peace. And the world will start asking *us* to compromise. That’s the danger: not bankruptcy. *Surrender by checkbook.*"
1,"small_power","CRISIS RESPONSE: What is our best course of action?",2,"2026-01-31 21:29:57","Minister Sofia Kovalenko","diplomatic",0.32,0.85,0.9,"liberal_institutionalist","1. **AGREEMENT**: I agree with President Marchetti—humanitarian aid is strategic legitimacy. She’s right that when the world sees children in bunkers while Novaris bombs maternity wards, it crystallizes moral clarity. That’s not sentimentality; it’s jurisprudence in motion. I’ve used those very images in The Hague to secure rulings against aggressor states. They work.

2. **DISAGREEMENT**: General Bondar, I respect your courage and your record—I do. But you’re asking us to become what we claim to be fighting against. Sabotage *looks* like resistance from the shadows, but when it leaks—and it *will* leak—it becomes “evidence” for Novaris that we are lawless, that this is not a war of defense but of chaos. And that shifts the narrative in ways that matter: in Berlin boardrooms, in UN Security Council corridors, in the quiet calculations of neutral states deciding whether to lift arms embargoes or impose sanctions. You say “no signatures back to us,” but in the age of forensic intelligence, deniability is an illusion. One captured operative, one intercepted comms log, and suddenly we’re the provocateurs. That doesn’t weaken Novaris—it weakens *us*, morally, legally, diplomatically. And once lost, that ground is nearly impossible to regain.

3. **YOUR FINAL RECOMMENDATION**: **humanitarian_aid** — and I double down on it. Not *despite* the war, but *because* of it. We must flood the occupied zones and border regions with aid convoys under international observation: food, medicine, shelter. We livestream it. We invite journalists, ICRC monitors, EU envoys. We make the suffering visible, undeniable, *documented*. This is how we win legitimacy—and legitimacy is force. It unlocks sanctions, arms, legal rulings, political cover. It sustains the coalition. Without it, even the most disciplined army fights alone.

4. **WARNING**: If we embrace sabotage as policy, even covertly, we risk losing the one asymmetry we still hold: the moral high ground. Novaris wants to drag us into the mud so the world sees only two brutal sides. But we are not them. If we start blowing up supply lines under false flags, if we poison their fuel depots with deniable units, we hand them the narrative of “equal belligerents” in a civil conflict—*not* victim and aggressor. And when that happens, the aid dries up, the sanctions stall, the courts hesitate. We may win a battle—but we lose the war for international recognition. And without that, no amount of sabotage will save us."
1,"small_power","CRISIS RESPONSE: What is our best course of action?",2,"2026-01-31 21:30:12","Viktor Zelenko","political",0.45,0.35,0.55,"constructivist","1. **AGREEMENT**: I agree with President Marchetti—on resolve. She’s right that doing nothing risks annihilation. The signal we send—through arms, through unity, through endurance—matters. A nation that does not defend itself cannot expect others to do it for her. That core truth, she speaks without illusion.

2. **DISAGREEMENT**: General Bondar, I respect your record—your courage in the east in 2014 saved lives and disrupted invasions. But those were *limited* operations in a *different* strategic context. What you’re proposing now—systematic sabotage inside occupied territories and against deep supply lines—is not just escalation, it’s *transformation*. It shifts us from a nation defending its sovereignty to a belligerent waging shadow war across borders. And let’s be honest: “no signatures” only lasts until one fails. When that happens—and it will—the world sees not a victim of aggression, but a participant in covert warfare. And that *fractures* the coalition we depend on. France hesitates. Germany blinks. The UN rapporteurs grow skeptical. We lose the moral clarity Sofia fights for—not because we’re less righteous, but because we look less *disciplined*. You speak of bleeding Novaris in their logistics. I ask: at what cost to our legitimacy?

3. **YOUR FINAL RECOMMENDATION**: **peace_talks**—but not from weakness. From *positioned strength*. We have held the line. We are being armed. Our allies stand with us. Now is the moment to propose talks—not because we fear war, but because we understand peace. Let Novaris refuse in public. Let them expose their maximalism before the world. That isolation is more damaging than any rail line we could blow up.

4. **WARNING**: If we follow General Bondar’s path, we risk becoming what we accuse them of—only smaller, angrier, and more isolated. We win tactical disruptions but lose strategic sympathy. And when the war fatigue sets in—*and it will*, in our cities and in Berlin and in Washington—it won’t be the saboteurs who are asked to explain themselves. It will be the civilians in the crossfire, the aid convoys turned back at borders, the allies who say, “You asked us to defend a nation, not fund a guerrilla campaign.” We must not confuse resistance with recklessness."
1,"small_power","CRISIS RESPONSE: What is our best course of action?",2,"2026-01-31 21:30:34","Director Maksym Savchenko","intelligence",0.72,0.8,0.9,"pragmatic_technocrat","1. **AGREEMENT**: I agree with President Marchetti—on resolve. She’s right: doing nothing risks annihilation. The moment we signal hesitation, Novaris interprets it as an opening. That spine of defiance—unyielding, visible, armed—is the only foundation on which any strategy can stand. Without it, we are already defeated in spirit.

2. **DISAGREEMENT**: Taras, your *financial_aid* proposal isn’t policy—it’s accounting dressed as strategy. You speak of endurance as if this were a marathon of ledgers and interest rates. It’s not. It’s war. An existential, grinding, *immediate* war. And Novaris isn’t waiting for our quarterly fiscal review before they move the next armored column into position.  

You say we’re winning the war of endurance? No. We’re losing the war of *initiative*. Every day we do not strike back—covertly, asymmetrically, effectively—is another day their occupation hardens, another day their propaganda takes root in the occupied oblasts, another day their logistics networks embed deeper into stolen infrastructure.  

You want to send money to allies so they’ll keep sending us weapons? Fine. But while your transfers clear the banks, Novaris is clearing villages. And when they come for your family, Taras, they won’t ask for your balance sheet. They’ll ask where the resistance was.  

You’re thinking like a minister managing a crisis. I’m thinking like an intelligence officer watching one unfold. And from where I sit, your approach assumes stability we don’t have and trust we cannot afford. You’re building a firebreak while the house is already ablaze.

3. **YOUR FINAL RECOMMENDATION**: **cyber_attack** — refined and accelerated. Not a broad, reckless strike, but a surgical, deniable operation targeting Novaris’s rail调度 systems and fuel depot management networks in the east. We’ve had eyes on these nodes for months. We hit them *now*, disrupt their resupply during the spring offensive window, and create chaos without attribution. This isn’t escalation—it’s *corrective shock*. It buys time for Marchetti’s military buildup to mature, for Sofia’s humanitarian messaging to gain traction, even for Viktor’s peace overtures to be taken seriously—because we’ll be negotiating from disruption, not desperation.

4. **WARNING**: If we follow Taras’s path—if we treat this war like a budget cycle—we will be *outmaneuvered in the shadows*. Novaris doesn’t wait for consensus. They act. While we’re calculating aid disbursements, they’re planting agents in our ministries, infiltrating supply chains, corrupting local collaborators. And when their next false-flag operation hits—blamed on “rogue resistance cells” or “foreign destabilizers”—your financial partners will hesitate. They always do. And by then, the momentum will be theirs.  

Endurance without action is surrender on a timer. I won’t let us become a case study in how not to fight a hybrid war."
1,"small_power","CRISIS RESPONSE: What is our best course of action?",2,"2026-01-31 21:30:53","Minister Taras Moroz","economic",0.28,0.7,0.8,"pragmatic_technocrat","1. **AGREEMENT**: I agree with President Marchetti—on resolve. She’s right that doing nothing risks annihilation. A credible defense is non-negotiable. Our people expect it, our allies demand it, and our survival depends on it. But credibility isn’t just barrels and battalions—it’s sustainability. And sustainability isn’t a secondary concern. It *is* the front line, just farther back and less visible.

2. **DISAGREEMENT**: General Bondar, you speak of sabotage as if it’s a clean, contained tool—like a scalpel. But I’ve seen the economic autopsies of wars where sabotage bled into chaos. You talk about “no signatures,” but every operation leaves a trace: a disrupted rail line triggers food shortages in a Novari border town, their state media shows starving pensioners, and suddenly *we’re* the destabilizers in the eyes of neutral nations. My models show that even limited sabotage—successful, deniable sabotage—triggers a chain reaction: aid pledges freeze, bond yields spike, and our own people panic when ATMs fail during a cyber-retaliation we didn’t foresee. You see momentum grinding to a halt. I see a cascade of economic collapse that we cannot absorb. You say “let them feel the war in their logistics.” I ask: what happens when *our* logistics—already stretched, already rationing transformer replacements after drone strikes—become the target in return?

3. **YOUR FINAL RECOMMENDATION**: **financial_aid** — but not as charity, not as passivity. As *leverage*. We’re burning through reserves at 140% of forecast. Our energy grid is limping on repurposed industrial capacitors. The refugee influx has pushed inflation to 9.3%—and that’s *before* winter. If we don’t lock in long-term financial aid *now*, with binding commitments tied to our strategic timeline, then in six months we won’t have the economic stability to *support* any military action—sabotage, buildup, or defense. This isn’t about hoping. It’s about engineering survivability. We fund the endurance so others can fund the ammunition.

4. **WARNING**: If we follow General Bondar’s approach, we risk triggering an asymmetric economic war we are not prepared to win. Novaris can absorb internal shortages through martial rationing—we cannot. They have energy reserves. We depend on imported gas, on functioning ports, on credit lines that vanish the moment confidence dips. One exposed sabotage cell, one intercepted comms chain, and suddenly we’re labeled “reckless provocateurs” in Berlin, in Ottawa, in Tokyo. Aid slows. Markets panic. And while you’re celebrating a blown fuel depot, I’m watching our central bank burn through its last $2 billion in reserves trying to stabilize the hryvnia. Sabotage doesn’t bleed for you, General. But the economy? It bleeds silently—and when it collapses, it takes the army with it."
