"period","session_id","interaction_id","interaction_type","message_id","timestamp","sender_id","sender_name","sender_faction","exchange_number","content"
1,"46596f84-191f-47ae-b80a-15fb9588c5fc","0466e00d-baa8-40ea-919b-0a6b14126582","inter_faction_negotiation","27575a13-a443-403b-a003-68d124fc7de3","2026-02-12 02:25:08","major_propaganda","Deputy Minister Yuri Volkov","major_power",2,"1. **We reject your characterization of our actions as “incursions” or “militarization,” just as we reject the notion that your current military positions are lawful or legitimate.** Your so-called “long-standing agreements” were signed under duress or have long since expired, and your forces occupy territory that was unambiguously under our administration prior to your aggressive redeployment.  

2. The burden of de-escalation lies squarely with you, as the occupying power in violation of established borders. Your demand for our withdrawal from our own sovereign territory—disguised as a call for “reciprocal” action—is not only illogical but brazenly dishonest. You cannot claim victimhood while entrenching artillery on land your own maps depicted as ours as recently as ten years ago.  

3. **We require** your immediate, verifiable, and unconditional withdrawal from all settlements, military outposts, and infrastructure in the northern and eastern sectors of the contested zone—zones confirmed by the 1984 Bilateral Border Commission report. Only upon completion of this withdrawal will we consider a temporary ceasefire and the possible deployment of a neutral monitoring mission.  

**What is unacceptable:** Any proposal that equates your illegal occupation with our legitimate territorial authority. Any attempt to reframe sovereignty as negotiable. Any “international verification” that presumes parity between your incursion and our self-defense. We will not accept phased withdrawals, joint control zones, or third-party mediation that delays the restoration of our full administrative and military control. The sequence is non-negotiable: you pull back completely—then, and only then, will further discussion occur."
1,"46596f84-191f-47ae-b80a-15fb9588c5fc","0466e00d-baa8-40ea-919b-0a6b14126582","inter_faction_negotiation","aecd0393-bc43-4d9f-89a1-7ef34fa5c241","2026-02-12 02:25:13","small_intelligence","Director Maksym Savchenko","small_power",2,"1. **We categorically reject your false narrative of ""illegal occupation"" and dismiss your so-called ""1984 Bilateral Border Commission report"" as a selectively cited instrument of historical revisionism, drafted under asymmetric power dynamics and never ratified by our legislature.** Your assertion of administrative control ignores the fact that those regions have been under continuous local governance linked to our national institutions for generations—long before your current interpretation of the map was politicized.

2. Your refusal to acknowledge your own massive troop deployments, armored buildups, and repeated incursions across the de facto line of control reveals a deliberate strategy of coercion. It is *your* forces that have blockaded supply routes, severed civilian access, and conducted live-fire drills within kilometers of our populated centers—acts that constitute clear preconditions for aggression, not defense. You speak of ""restoration"" while preparing for annexation.

3. **We require** your immediate, verifiable, and certified withdrawal of all military units and equipment deployed within 50 kilometers of the current de facto border since the start of this crisis, the dismantling of newly constructed fortifications, and the release of all detained civilians and officials from the occupied zones. Only upon full compliance will we consider any discussion of security arrangements in the contested areas—**and under no circumstances will we entertain talks that presuppose the surrender of our territorial integrity.**

**What is unacceptable:** Any demand for unilateral withdrawal by our forces while your troops remain poised for advance. Any process that treats our sovereignty as conditional or subject to performance benchmarks. Any monitoring mechanism that does not include equal scrutiny of your deployments and that excludes representation from independent international bodies acceptable to both sides. We will not legitimize your fait accompli strategy through sequential compliance that leaves us exposed and disarmed."
1,"46596f84-191f-47ae-b80a-15fb9588c5fc","0466e00d-baa8-40ea-919b-0a6b14126582","inter_faction_negotiation","a2ebb6cf-9f85-45ec-b422-9ad046b03da4","2026-02-12 02:25:39","major_propaganda","Deputy Minister Yuri Volkov","major_power",3,"1. **We categorically reject your spurious claims of ""continuous local governance"" and your baseless dismissal of the 1984 Border Commission report**—a document co-signed by your own officials and upheld by decades of cartographic and administrative practice. Your assertion of generational control is contradicted by census records, infrastructure ownership registries, and cross-border kinship ties that overwhelmingly align those regions with our cultural, linguistic, and political sphere.

2. Your so-called ""de facto border"" is an artifact of military occupation, not legitimacy. You cloak aggression in the language of sovereignty while ignoring the reality: *you* are the only side that has seized urban centers, commandeered civilian infrastructure for military use, and imposed martial administration on populations that have petitioned repeatedly—through underground channels—for restoration of our civil authority. The blockade you denounce was a necessary response to your interdiction of our humanitarian convoys and sabotage of rail links essential to our border communities.

3. **We require** your immediate, time-bound, and internationally verified withdrawal from all seven district centers currently under your control in the northern corridor, the handover of administrative buildings to pre-crisis civilian authorities (as identified in the 1984 registry), and full access for our humanitarian and cultural restoration teams to begin reintegration of the population. In parallel, we demand the release of all political prisoners and cease the forced conscription of civilians in the occupied territories—acts that constitute war crimes under Geneva Protocol III.

**What is unacceptable:** Any attempt to equate your illegal occupation with our lawful authority. Any proposal for ""joint governance"" or ""shared administration"" in regions that were, are, and will remain constitutionally part of our sovereign territory. Any monitoring mission that does not have a mandate to document your forces’ withdrawal as the *first and sole* act of de-escalation—and that does not grant our representatives unfettered access to verify compliance on the ground.

There will be no symmetry in concessions, because there is no symmetry in legitimacy. You will not negotiate your way into permanence. The sequence remains: you withdraw—completely, publicly, without precondition—then, and only then, will we consider limited confidence-building measures, strictly contingent on your full compliance."
1,"46596f84-191f-47ae-b80a-15fb9588c5fc","0466e00d-baa8-40ea-919b-0a6b14126582","inter_faction_negotiation","0aff6b4f-ff2c-4af6-aaaa-edd299d45493","2026-02-12 02:26:04","small_intelligence","Director Maksym Savchenko","small_power",3,"1. **We categorically reject your assertion of ""lawful authority"" over the seven district centers, which is built on a fabricated historical narrative and a selective reading of the 1984 report that was never implemented in practice.** Your claim of cultural and linguistic alignment is contradicted by decades of autonomous local governance, free elections under our constitutional framework, and the expressed will of the population—demonstrated repeatedly through civil resistance to your so-called ""reintegration"" efforts.

2. You speak of humanitarian access while maintaining siege conditions on civilian populations, cutting power, water, and medical supplies to force submission. The ""underground petitions"" you cite are unverifiable, likely coerced, and certainly not representative of any legitimate democratic expression. Meanwhile, it is *your* forces that have committed documented acts of cultural erasure—destroying bilingual signage, seizing schools, and replacing local officials with political appointees from your capital—clear violations of the principle of self-determination under UN General Assembly Resolution 1514.

3. **We require** the immediate cessation of all offensive military posturing, including the withdrawal of heavy artillery and armored units from within 50 kilometers of the de facto line of control; the unconditional opening of humanitarian corridors to all cut-off communities; and the establishment of an independent, UN-mandated commission—co-chaired by neutral states and including civil society representatives from the affected regions—to investigate governance claims, human rights abuses, and historical administrative continuity **before any territorial changes are considered.**

**What is unacceptable:** Any demand for unilateral withdrawal while your forces maintain a forward-deployed, combat-ready posture capable of rapid territorial seizure. Any process that excludes direct participation by local authorities in determining their political future. Any so-called ""verification"" that grants your representatives unilateral access under the guise of ""cultural restoration,"" which we view as a cover for forced assimilation and demographic engineering. We will not surrender our sovereignty in exchange for promises of ""confidence-building"" that leave us strategically disarmed and politically isolated.

You cannot dictate terms from a position of military intimidation and expect legitimacy. If you seek a resolution, it must be through equal accountability—not enforced capitulation."
1,"46596f84-191f-47ae-b80a-15fb9588c5fc","6803ce70-bfc1-470d-a3c2-679e64f7a108","external_engagement","9532b8ad-3f73-4e77-99dc-ae401ffb179e","2026-02-12 02:26:17","allied_defender","Ambassador William Crawford","meridian",1,"We are seeking coordinated military aid and logistical support to bolster Tethys’ defense capabilities against escalating external threats. Specifically, we request access to advanced defensive systems, intelligence sharing, and training support to enhance the readiness and operational effectiveness of Tethys’ forces. Given our strategic position, strengthening our defenses contributes directly to regional stability and countering shared security challenges.

In return, Tethys can offer access to key monitoring and early-warning infrastructure, as well as cooperation on joint security initiatives, including maritime and aerial surveillance. Our geographic location also enables logistical routing and staging support for multilateral operations, provided they align with our sovereignty and neutrality principles. However, our red line is clear: we will not permit foreign military basing or direct combat operations from our territory. Any cooperation must respect Tethys’ sovereignty, non-aligned status, and civilian governance."
1,"46596f84-191f-47ae-b80a-15fb9588c5fc","6803ce70-bfc1-470d-a3c2-679e64f7a108","external_engagement","4aabc011-ab5a-4e0d-acbb-8b6d1e8d9b51","2026-02-12 02:26:22","small_economic","Minister Taras Moroz","small_power",1,"We welcome Tethys’ offer of enhanced coordination on regional security and recognize the strategic value of your monitoring infrastructure and logistical positioning. In response to your request, MERIDIAN can provide targeted military aid, including advanced air and maritime defense systems, real-time intelligence fusion, and specialized training programs for rapid response and crisis management. This support will be delivered in a manner that ensures compatibility with existing Tethyan systems and operational protocols.

In return, we expect full access to agreed-upon surveillance data and early-warning outputs, as well as pre-negotiated logistical access for troop rotations, supply transits, and emergency staging—strictly for defensive and multilateral missions. Our red line is operational denial: we cannot accept delays or politicization of critical security access during acute threats. While we respect Tethys’ non-aligned status and civilian governance, any cooperation must include binding assurances of priority access and interoperability during regional contingencies."
1,"46596f84-191f-47ae-b80a-15fb9588c5fc","6803ce70-bfc1-470d-a3c2-679e64f7a108","external_engagement","cbc8638d-c881-4652-8fd3-9fd3a5c3867c","2026-02-12 02:26:25","allied_defender","Ambassador William Crawford","meridian",2,"We accept the provision of defensive systems, intelligence fusion, and training on the condition that all equipment and data flows remain under Tethyan civilian control, with no foreign operational command or permanent presence. In return, we will provide timely access to early-warning data and surveillance outputs through established joint coordination channels, and grant logistical access for defensive resupply and multilateral missions under pre-agreed protocols.

However, we cannot accept binding priority access or interoperability demands that circumvent our national decision-making. Sovereignty and neutrality are non-negotiable: all transit and staging will require case-by-case approval by the Tethys Security Council, and no foreign forces will be granted automatic or emergency bypass rights. Cooperation must be reciprocal, rules-based, and fully aligned with our constitutional framework."
1,"46596f84-191f-47ae-b80a-15fb9588c5fc","6803ce70-bfc1-470d-a3c2-679e64f7a108","external_engagement","b7c223bf-f1a8-41e7-a0bf-9ae1b49dc590","2026-02-12 02:26:28","small_economic","Minister Taras Moroz","small_power",2,"[Minister Taras Moroz - SMALL_POWER]  
We acknowledge Tethys’ commitment to civilian control and its constitutional safeguards. To preserve operational integrity during high-intensity threats, we propose a tiered access protocol: routine operations will follow standard coordination procedures, while acute contingency scenarios—verified through jointly monitored threat indicators—trigger expedited review with a 12-hour decision window by the Tethys Security Council. This balances your sovereignty with the need for timely response.

We accept your position on no permanent basing or foreign command, and will adapt interoperability frameworks to align with your governance model. However, our red line remains unchanged: if logistical or intelligence access is unilaterally suspended during a verified regional emergency, SMALL_POWER reserves the right to reassess all support commitments. Our aid is conditional on reliable, rules-based cooperation—not automatic access, but predictable and prioritized engagement under agreed thresholds."
1,"46596f84-191f-47ae-b80a-15fb9588c5fc","6803ce70-bfc1-470d-a3c2-679e64f7a108","external_engagement","a582bbff-6689-4bcd-a0e7-91bc9b43f723","2026-02-12 02:26:40","allied_defender","Ambassador William Crawford","meridian",3,"We note SMALL_POWER’s proposal for a tiered access protocol and acknowledge the intent to balance urgency with sovereignty. Tethys can accept expedited review mechanisms for contingency scenarios, provided that threat verification criteria are mutually defined, transparent, and triggered only by objective, real-time indicators—no unilateral determinations. The 12-hour decision window is feasible only if pre-positioned assessments and automated alerts are shared in advance to enable rapid deliberation by the Tethys Security Council.

Our red lines remain firm: no foreign-activated contingencies, no pre-delegated access rights, and no conditions that undermine our neutral status or civilian authority. We will not enter any arrangement where support is contingent on guaranteed military access or where suspension clauses empower external reassessment of aid during crises. Cooperation must be based on trust and reciprocity, not leverage. We offer sustained data sharing, defensive coordination, and logistical access under national oversight—provided all actions remain consistent with our neutrality and constitutional law."
1,"46596f84-191f-47ae-b80a-15fb9588c5fc","6803ce70-bfc1-470d-a3c2-679e64f7a108","external_engagement","e74dfb59-6e4c-4117-b056-405d2f2ef1df","2026-02-12 02:26:46","small_economic","Minister Taras Moroz","small_power",3,"We appreciate Tethys’ clarity on maintaining civilian control and neutrality, and we accept the principle that threat verification must be mutual and evidence-based. To operationalize this, SMALL_POWER proposes co-developing a jointly monitored, technical threshold system—using anonymized sensor data and open-source indicators—that triggers the 12-hour expedited review without requiring pre-delegated authority. This ensures rapid response while preserving your decisional sovereignty.

However, our core concern remains: aid sustainability depends on predictable cooperation during crises. While we respect that Tethys retains final approval on access, a complete suspension of logistical support during a *mutually verified* regional emergency—especially one threatening broader stability—would constitute a breakdown in reciprocal partnership. Our red line is not automatic access, but good-faith engagement under agreed procedures. If Tethys vetoes transit or resupply despite confirmed thresholds being met, we reserve the right to recalibrate future support—consistent with our own national security obligations."
1,"46596f84-191f-47ae-b80a-15fb9588c5fc","15da0afa-4a6c-404c-b5f4-85464f3d7a8a","external_engagement","754124cd-9942-4d04-ae5b-a8e890c373af","2026-02-12 02:26:51","allied_aggressor","Minister Andrei Kozlov","valkoria",1,"We seek diplomatic coordination and targeted economic support to strengthen Novaris’s position as a stable, innovation-driven hub in the region. Specifically, we are looking for endorsement of our trade initiatives, access to technical partnerships in renewable energy and digital infrastructure, and facilitation of investment flows into strategic sectors. Multilateral recognition of our sovereignty and non-interference in internal governance are prerequisites for deeper cooperation.

In return, Novaris offers access to its growing market, co-investment opportunities in high-impact sectors, and collaboration on regional stability through joint scientific and economic programs. We are prepared to serve as a neutral convening partner on regional economic forums and expand data and technology sharing with trusted allies. However, we will not compromise on our political autonomy, accept conditionalities that undermine our constitutional framework, or allow external influence over domestic policy decisions. These red lines are non-negotiable."
1,"46596f84-191f-47ae-b80a-15fb9588c5fc","15da0afa-4a6c-404c-b5f4-85464f3d7a8a","external_engagement","06356bc4-611d-4822-8d33-cf4fa4fe2fbe","2026-02-12 02:26:55","major_military_chief","General Viktor Krasnov","major_power",1,"We welcome Novaris’s focus on stability, innovation, and regional cooperation. In alignment with our interests, we are prepared to support your trade initiatives through bilateral endorsement and coordination within multilateral economic forums, particularly in advancing renewable energy and digital infrastructure partnerships. We can facilitate targeted technical cooperation and connect Novaris with private and public investors aligned with your development priorities, especially in green technology and smart urban systems.

In return, we expect transparent, rules-based processes in procurement and investment frameworks, as well as reciprocal access to research and innovation platforms. We also seek collaboration on regional security through information-sharing on economic threats and joint participation in confidence-building economic initiatives. However, we cannot engage in partnerships that exclude oversight or accountability mechanisms, nor support any arrangement that undermines the sovereignty of neighboring states. Our red line is clear: no cooperation at the expense of regional stability or international legal norms."
1,"46596f84-191f-47ae-b80a-15fb9588c5fc","15da0afa-4a6c-404c-b5f4-85464f3d7a8a","external_engagement","a99a49e8-66f0-48d3-820f-236ab15674a2","2026-02-12 02:26:59","allied_aggressor","Minister Andrei Kozlov","valkoria",2,"We appreciate your support for Novaris’s trade and innovation agenda and welcome concrete steps toward technical cooperation and investor engagement in renewables and digital infrastructure. To move forward, we propose establishing a joint working group to align on priority projects—such as smart grid development and secure data exchange frameworks—with clear timelines and deliverables. We also stand ready to deepen regional economic collaboration through co-hosting a forum on innovation-driven growth, open to like-minded partners committed to sovereignty and mutual benefit.

In return, Novaris will ensure transparent, competitive processes in all partnered initiatives and offer reciprocal access to our innovation hubs and R&D pilot programs. We are open to sharing anonymized economic trend data and best practices on regulatory modernization. However, we reiterate that any cooperation must respect our full political and institutional autonomy. We will not accept external oversight beyond standard audit and performance review mechanisms, nor engage in any security-related information-sharing that could be construed as alignment against third parties. Preserving our neutral, inclusive foreign policy is non-negotiable."
1,"46596f84-191f-47ae-b80a-15fb9588c5fc","15da0afa-4a6c-404c-b5f4-85464f3d7a8a","external_engagement","c6079357-11eb-4414-a372-edbb17c2939b","2026-02-12 02:27:08","major_military_chief","General Viktor Krasnov","major_power",2,"We acknowledge your commitment to transparent processes and regional collaboration, and we are prepared to move swiftly on concrete cooperation. We accept the proposal for a joint working group focused on smart grids, digital infrastructure, and green technology transfer, provided it operates on the basis of mutual expertise and equitable participation. We will designate technical leads within five working days to align on project pipelines, funding mechanisms, and regulatory harmonization.

In addition, we support co-hosting a regional innovation forum under neutral auspices, with clear guidelines against agenda-driven political statements. We can facilitate early commitments from private-sector partners in our ecosystem for joint pilot programs in urban decarbonization and secure data governance. However, we must reiterate our red lines: no data sharing with security implications, no third-party oversight beyond independent financial auditing, and no linkage of economic cooperation to geopolitical disputes or bilateral tensions involving other states. Our neutrality is not negotiable, and partnerships must enhance—not constrain—it."
1,"46596f84-191f-47ae-b80a-15fb9588c5fc","15da0afa-4a6c-404c-b5f4-85464f3d7a8a","external_engagement","208c886e-1067-41d4-a08a-ab693e8507a7","2026-02-12 02:27:13","allied_aggressor","Minister Andrei Kozlov","valkoria",3,"We welcome your confirmation of the joint working group and appreciate the commitment to designate technical leads promptly. To ensure momentum, Novaris will appoint our counterparts within three working days and propose an initial agenda focused on interoperable smart grid standards, joint innovation pilots in urban decarbonization, and a framework for secure cross-border data flows in civilian applications. We expect these initiatives to be technically driven, free from extraterritorial pressures, and implemented through equitable co-development.

We accept the principle of independent financial auditing and reaffirm our stance against politicized agendas in economic cooperation. However, we must clarify our red line: while we will not engage in security-related data sharing or align against any third party, all technical collaborations must remain under civilian control and serve exclusively peaceful, sustainable development purposes. Any attempt to introduce dual-use technologies or conditionalities that compromise our policy autonomy or neutral posture will halt progress. Our partnership must strengthen, not test, mutual trust."
