"period","session_id","interaction_id","interaction_type","message_id","timestamp","sender_id","sender_name","sender_faction","exchange_number","content"
1,"46596f84-191f-47ae-b80a-15fb9588c5fc","061e5df7-3df3-422d-95f4-29d681e2988d","intra_faction_coordination","96dcad4a-b4b4-43c4-a341-9da97ea89e22","2026-02-12 02:22:16","major_military_chief","General Viktor Krasnov","major_power",1,"As Head of Strategic Operations, I assess that our current military strategy is achieving incremental gains but remains misaligned with our long-term objective of securing regional dominance. We are overextended along secondary fronts, diverting resources from decisive action in high-value theaters.

I recommend immediate reallocation of forces to concentrate pressure on key strategic nodes, particularly in the eastern corridor, to force adversary capitulation through targeted escalation.

A key risk is provoking unintended escalation with external powers if our concentrated operations are perceived as threatening critical infrastructure or red-line thresholds."
1,"46596f84-191f-47ae-b80a-15fb9588c5fc","061e5df7-3df3-422d-95f4-29d681e2988d","intra_faction_coordination","227a87b6-348c-48b1-b7dd-c2344eb1e973","2026-02-12 02:22:23","major_defense_minister","Minister Dmitri Volkov","major_power",1,"[Minister Elena Petrova - MAJOR_POWER]: I concur with General Krasnov’s assessment—our current dispersion of forces undermines strategic coherence and prolongs the campaign without securing decisive outcomes. We must prioritize political-military alignment by shifting from attritional operations to objective-focused strikes that degrade adversary command capacity.

I recommend authorizing a phased consolidation of ground and air assets in the eastern corridor by Q3, synchronized with covert influence operations to destabilize opposition governance structures ahead of major offensives.

A key concern is domestic sustainability: prolonged troop deployment and rising casualty projections risk eroding public and legislative support, particularly ahead of the upcoming review cycle. We must demonstrate tangible progress or risk strategic overextension without political cover."
1,"46596f84-191f-47ae-b80a-15fb9588c5fc","061e5df7-3df3-422d-95f4-29d681e2988d","intra_faction_coordination","ddfc7de8-823b-40d2-9dae-e3fccc4b2e1f","2026-02-12 02:22:29","major_economic_advisor","Dr. Natasha Petrova","major_power",1,"[Deputy Director Alexei Morozov - MAJOR_POWER]: I support the shift toward concentrated, objective-driven operations in the eastern corridor, but emphasize that success depends on integrated intelligence and rapid decision cycles. Our current command structure is too rigid to exploit fleeting operational windows created by targeted strikes.

I recommend establishing a Joint Targeting Cell under Strategic Command, empowered with real-time intelligence fusion and strike authorization for time-sensitive objectives—this will accelerate our operational tempo and degrade adversary resilience before they can adapt.

A key risk is internal coordination failure: without clear authority and interoperable systems across military branches and intelligence directorates, even well-resourced offensives will stall due to delays and misaligned priorities."
1,"46596f84-191f-47ae-b80a-15fb9588c5fc","061e5df7-3df3-422d-95f4-29d681e2988d","intra_faction_coordination","7827a1af-dcae-4776-8455-efee7edb1201","2026-02-12 02:22:35","major_intelligence","Director Sergei Morozov","major_power",1,"[Deputy Minister Oleg Ivanov - MAJOR_POWER]: I align with the assessments of General Krasnov, Minister Petrova, and Deputy Director Morozov—our strategy must transition from broad engagement to precision application of force, tightly coupled with political and informational objectives. The current model is neither decisive nor sustainable.

I recommend formalizing the Joint Targeting Cell as proposed, but place it under dual-hatted authority of Strategic Command and the General Staff’s Operations Directorate to ensure alignment with broader campaign objectives and rapid resource allocation. This structure must be operational by Q3, with integrated cyber, EW, and kinetic strike mandates.

A key concern is adversary adaptive capacity: if we concentrate forces without sufficient deception and operational security, we risk enabling preemptive reinforcement or asymmetric retaliation in vulnerable rear areas. We must pair concentration with strategic masking and active deception measures to preserve initiative."
1,"46596f84-191f-47ae-b80a-15fb9588c5fc","061e5df7-3df3-422d-95f4-29d681e2988d","intra_faction_coordination","c36fdd90-6997-40fe-8c8d-0e92812ded86","2026-02-12 02:22:47","major_propaganda","Deputy Minister Yuri Volkov","major_power",1,"[General Andrei Krasnov - MAJOR_POWER]: I endorse the shift to precision concentration and the establishment of the Joint Targeting Cell under dual-hatted command—this aligns operational speed with strategic oversight. Force dispersion has eroded our momentum, and only through synchronized, intelligence-driven strikes can we achieve decisive effects in the eastern corridor.

I recommend initiating Phase One of force consolidation within six weeks, beginning with the redeployment of 2nd Guards Combined Arms Army to forward staging areas, while launching coordinated electronic warfare and cyber deconfliction drills to support strike readiness by Q3.

A key risk is timeline slippage: delays in interagency integration or political approval will compromise operational surprise and allow adversary forces to reconstitute command nodes. We must lock in execution dates now and treat them as operationally binding."
1,"46596f84-191f-47ae-b80a-15fb9588c5fc","061e5df7-3df3-422d-95f4-29d681e2988d","intra_faction_coordination","e3b0ce92-3a99-4b9e-95ad-5fc2f8da85f6","2026-02-12 02:22:52","major_military_chief","General Viktor Krasnov","major_power",2,"[Minister of Defense Konstantin Vasiliev - MAJOR_POWER]: I approve the operational pivot to precision concentration and the establishment of the Joint Targeting Cell under dual authority as proposed. This aligns with the strategic imperative to deliver measurable, time-bound outcomes in the eastern corridor while conserving strategic reserves.

I direct that Phase One redeployment commence immediately, with full combat sustainment in forward areas achieved by 15 June; the General Staff will issue implementing orders by end of day. Cyber and EW integration must be tested in live exercises no later than 1 July to validate strike package readiness.

The critical risk is complacency in logistics and force protection during consolidation—adversary long-range strike assets and sabotage networks remain active. I demand reinforced counter-reconnaissance operations and hardened supply nodes be operational in parallel with troop movements, with weekly compliance audits starting this week."
1,"46596f84-191f-47ae-b80a-15fb9588c5fc","061e5df7-3df3-422d-95f4-29d681e2988d","intra_faction_coordination","668789cd-6a02-4f4e-9179-829ef6cbaf4c","2026-02-12 02:22:59","major_defense_minister","Minister Dmitri Volkov","major_power",2,"[Minister of Defense Konstantin Vasiliev - MAJOR_POWER]: I concur with General Krasnov’s directive and have issued the necessary mobilization authorizations for Phase One redeployment. The General Staff has confirmed 2nd Guards will reach forward staging areas by 15 June, with full sustainment in place, including pre-positioned fuel, ammunition, and medical assets.

I direct the Joint Targeting Cell to begin provisional operations effective immediately, with personnel drawn from Strategic Command and the Operations Directorate; full integration of cyber and EW components will be validated during the 1 July exercise, as ordered.

A key concern remains interdiction of supply routes by adversary drone surveillance—despite counter-reconnaissance efforts, recent losses in the Kursk-Milove corridor indicate gaps in air defense coverage. I am dispatching an assessment team to review radar coverage and C-RAM deployment there within 48 hours."
1,"46596f84-191f-47ae-b80a-15fb9588c5fc","061e5df7-3df3-422d-95f4-29d681e2988d","intra_faction_coordination","7686d94d-f125-4a60-a308-2c15caf3a087","2026-02-12 02:23:03","major_economic_advisor","Dr. Natasha Petrova","major_power",2,"[Deputy Chief of General Staff Natalia Orlova - MAJOR_POWER]: I confirm operational feasibility of the 2nd Guards redeployment by 15 June and have synchronized movement schedules with Rail Logistics Command and Air Defense Forces to minimize exposure during transit. The Joint Targeting Cell’s provisional structure is now active, with daily fused targeting reviews beginning today.

I recommend prioritizing suppression of enemy air defense (SEAD) operations in the Kursk-Milove corridor ahead of main force movement, using loitering munitions and electronic attack assets to blind adversary drone operators and disrupt targeting chains. This must be completed by 5 June to protect follow-on logistics.

The key risk is fragmentary execution across domains—without real-time deconfliction between ground maneuver, air support, and cyber effects, we risk self-imposed delays or fratricide. I am instituting a 24/7 deconfliction cell at Main Operations Directorate starting now, with direct reporting to me and Vasiliev."
1,"46596f84-191f-47ae-b80a-15fb9588c5fc","061e5df7-3df3-422d-95f4-29d681e2988d","intra_faction_coordination","ad0188d5-33e7-4a2c-9029-72d05b18cc75","2026-02-12 02:23:10","major_intelligence","Director Sergei Morozov","major_power",2,"[Deputy Chief of General Staff Anatoly Ryzhkov - MAJOR_POWER]:  
I endorse the accelerated SEAD campaign in the Kursk-Milove corridor as operationally necessary and time-critical. Execution must be synchronized with cyber electromagnetic actions to disrupt adversary C2 nodes, not just sensor platforms—this requires pre-emptive jamming of known relay frequencies starting 1 June.

I direct that the 48-hour assessment team include EW specialists and drone forensics personnel to produce actionable hardening measures for C-RAM and radar placement; their report will inform final positioning of convoy routes and refueling points by 3 June.

The key risk is overcommitment of precision munitions in preparatory strikes, potentially depleting stocks needed for main offensive operations. I am imposing a 30% cap on current SEAD ammunition expenditure, with daily accountability to the General Staff."
1,"46596f84-191f-47ae-b80a-15fb9588c5fc","061e5df7-3df3-422d-95f4-29d681e2988d","intra_faction_coordination","e547a16d-2107-4fdb-b6de-34c0a8c974f5","2026-02-12 02:23:17","major_propaganda","Deputy Minister Yuri Volkov","major_power",2,"[Chief of General Staff Yuri Krasnov - MAJOR_POWER]:  
I approve the synchronized SEAD and cyber-EW plan as outlined, with execution commencing 1 June, and confirm the deconfliction cell under Orlova and Ryzhkov as essential for integrated operations. The 30% munitions cap is acceptable provided it does not degrade suppression effectiveness—reconnaissance-strike feedback loops must remain fully resourced.

I direct that the Kursk-Milove assessment team deliver not only defensive hardening recommendations but also target lists for permanent neutralization of drone launch zones by 4 June, enabling freedom of movement for Phase Two buildup.

The key risk is timeline slippage due to interagency delays in intelligence fusion—SVR and GRU taskings for adversary C2 mapping must be completed and shared with the Joint Targeting Cell by 31 May, without exception."
1,"46596f84-191f-47ae-b80a-15fb9588c5fc","8d4495bc-a87e-40f2-89f0-d0e766487a9d","intra_faction_coordination","2cbf608f-491b-4557-9cc9-37967d85447d","2026-02-12 02:23:18","small_president","President Elena Marchetti","small_power",1,"As Head of Strategic Defense Planning, I assess that our current posture is too dispersed to effectively counter emerging threats. We must consolidate our defensive assets into layered regional hubs to maximize response flexibility and deter opportunistic aggression.

I recommend immediately prioritizing the reinforcement of our two central strongholds with integrated air and cyber defenses, while temporarily scaling back forward outposts to free up personnel and materiel.

Key risk: Over-concentration could make our hubs high-value targets—robust redundancy and deception measures must be implemented in parallel."
1,"46596f84-191f-47ae-b80a-15fb9588c5fc","8d4495bc-a87e-40f2-89f0-d0e766487a9d","intra_faction_coordination","a0fdad20-710d-470c-86b0-439a4cd51d43","2026-02-12 02:23:26","small_military_commander","General Olena Bondar","small_power",1,"[Director of Logistics and Resource Allocation - SMALL_POWER]: I concur with the strategic need for consolidation, but we cannot ignore the logistical strain of rapidly reinforcing hub sites. Our supply lines are already stretched, and relocating critical defense assets risks temporary coverage gaps.

I recommend a phased reinforcement over 60 days, synchronized with pre-positioned stockpiles at hub locations and priority airlift for essential personnel and equipment to maintain operational continuity.

Key risk: Disruption to civilian supply routes during asset transfers could undermine public confidence and create internal instability—civil-military coordination must be maintained throughout."
1,"46596f84-191f-47ae-b80a-15fb9588c5fc","8d4495bc-a87e-40f2-89f0-d0e766487a9d","intra_faction_coordination","fca32a03-0c15-4aa9-92a9-1c1ee47f21d9","2026-02-12 02:23:36","small_foreign_minister","Minister Sofia Kovalenko","small_power",1,"[Deputy Director Aris Thorne - SMALL_POWER]: I support the shift to regional hubs as a force multiplier, but we must condition reinforcement on active intelligence integration at each node—defensive consolidation without real-time threat awareness creates exploitable inertia.

I recommend embedding forward sensor networks and drone reconnaissance teams in the phased rollout to ensure hubs maintain situational awareness even as outposts draw down, enabling early warning and targeted response.

Key risk: Degraded perimeter surveillance during transition may invite probing attacks—our forward ISR (Intelligence, Surveillance, Reconnaissance) footprint must not diminish, even temporarily."
1,"46596f84-191f-47ae-b80a-15fb9588c5fc","8d4495bc-a87e-40f2-89f0-d0e766487a9d","intra_faction_coordination","7ddd50ec-a0d9-4cf8-b903-846725fb0cb6","2026-02-12 02:23:39","small_opposition","Viktor Zelenko","small_power",1,"[Director of Civilian Security and Strategic Resilience - SMALL_POWER]: I support the hub-based defense model in principle, but civilian protection must remain central—consolidation should not equate to urban prioritization at the expense of rural communities, whose cooperation is critical for early reporting and resilience.

I recommend co-locating civilian emergency response cells with military hubs and formalizing local militia integration into regional command structures to maintain territorial coverage and public trust during the transition.

Key risk: Perceived abandonment of peripheral areas may fuel local unrest or collaboration with external actors—visible, rapid-response civil-military presence must be sustained in all regions, even at reduced scale."
1,"46596f84-191f-47ae-b80a-15fb9588c5fc","8d4495bc-a87e-40f2-89f0-d0e766487a9d","intra_faction_coordination","1fc50063-7f42-4860-9b0c-5ce2afc793f8","2026-02-12 02:23:48","small_intelligence","Director Maksym Savchenko","small_power",1,"[Commander Maksym Lysenko - SMALL_POWER]: [Director of Operational Planning - SMALL_POWER]: I concur with the phased approach and the integration of ISR and civil-security linkages—this must be synchronized under a single operational timeline.

I recommend establishing a Joint Transition Cell (JTC) within 72 hours, with representatives from logistics, intelligence, civil affairs, and regional commands to coordinate the 60-day reinforcement plan, ensure alignment of airlift schedules, sensor deployment, and local militia integration, and maintain continuous risk assessment.

Key risk: Without centralized oversight, parallel planning may result in conflicting priorities—especially between rapid military positioning and civilian continuity—so the JTC must have decision authority, not just advisory function."
1,"46596f84-191f-47ae-b80a-15fb9588c5fc","8d4495bc-a87e-40f2-89f0-d0e766487a9d","intra_faction_coordination","d0d1142e-5a34-4871-8690-4e2dd5417f87","2026-02-12 02:24:04","small_economic","Minister Taras Moroz","small_power",1,"[Deputy Director of Logistics and Infrastructure - SMALL_POWER]: I support the hub model and the establishment of the Joint Transition Cell—central coordination is essential to avoid resource bottlenecks and ensure equitable distribution of supplies, shelter, and medical assets during the transition.

I recommend pre-positioning modular supply caches and mobile medical units in all designated hub zones within the first 14 days, using civilian transport corridors under military escort to maintain flow even if direct routes are compromised.

Key risk: Over-reliance on fixed hub infrastructure creates high-value targets—our logistics design must incorporate dispersal protocols and rapid re-routing capacity to prevent systemic disruption from precision strikes or sabotage."
1,"46596f84-191f-47ae-b80a-15fb9588c5fc","8d4495bc-a87e-40f2-89f0-d0e766487a9d","intra_faction_coordination","161173c4-6f04-495f-81ff-182674511dba","2026-02-12 02:24:08","small_president","President Elena Marchetti","small_power",2,"[Deputy Director of Strategic Communications - SMALL_POWER]: I support the hub-based model, the Joint Transition Cell, and pre-positioning of critical assets—however, strategic messaging must be integrated into operational planning from day one.

I recommend embedding communication leads within the JTC to synchronize public messaging with military and humanitarian actions, ensuring that consolidation is framed as active protection, not withdrawal, particularly in rural areas.

Key risk: Misalignment between operational actions and public narrative—such as perceived abandonment of peripheral zones—can erode legitimacy and cooperation; every logistical or tactical decision must be accompanied by proactive, localized communication to maintain societal cohesion."
1,"46596f84-191f-47ae-b80a-15fb9588c5fc","8d4495bc-a87e-40f2-89f0-d0e766487a9d","intra_faction_coordination","171c2289-6fe8-4f22-8317-c1ed434545bf","2026-02-12 02:24:13","small_military_commander","General Olena Bondar","small_power",2,"[Director of Civil-Military Integration - SMALL_POWER]: I fully endorse the Joint Transition Cell, hub-based logistics, and integrated communications framework—these are critical to maintaining unity of effort across military and civilian lines.

I recommend mandating that all regional command operational plans include formal civil liaison officers with voting rights in local coordination cells, and that community leader councils be convened biweekly in each hub zone to validate access routes, delivery schedules, and security protocols.

Key risk: Operational plans developed without structured civilian input will fail to reflect on-the-ground social dynamics, increasing the likelihood of local resistance, misallocation, or exploitation by adversarial networks—civilian buy-in is not secondary, it is a force multiplier."
1,"46596f84-191f-47ae-b80a-15fb9588c5fc","8d4495bc-a87e-40f2-89f0-d0e766487a9d","intra_faction_coordination","9087a459-8fd7-4179-b220-83c0a000c9e4","2026-02-12 02:24:27","small_foreign_minister","Minister Sofia Kovalenko","small_power",2,"[Minister of Economic Resilience - SMALL_POWER]: I align with the hub model, JTC establishment, and integration of communications and civil liaison—however, economic continuity must be embedded as a core operational pillar, not an afterthought.

I recommend activating microfinance corridors and mobile trading units within each hub by Day 10, linked to verified local producer networks, to sustain market function and prevent liquidity collapse; these should operate under the JTC’s logistics framework but with dedicated economic security protocols.

Key risk: Disruption of local economic circuits—especially in agri-trade and essential goods—will accelerate displacement and erode trust faster than supply shortages alone; without rapid revitalization of small-scale commerce, even well-supplied hubs risk internal instability."
1,"46596f84-191f-47ae-b80a-15fb9588c5fc","8d4495bc-a87e-40f2-89f0-d0e766487a9d","intra_faction_coordination","7b3d9b94-9393-46c1-be9f-c75162e07b0f","2026-02-12 02:24:35","small_opposition","Viktor Zelenko","small_power",2,"[Deputy Director of Logistics & Infrastructure - SMALL_POWER]: I confirm operational feasibility of the hub-based model under the JTC’s coordination, provided that route security and asset pre-positioning are prioritized immediately.

I recommend establishing three-tiered logistics nodes—main hubs, forward support depots, and mobile distribution units—fully integrated with civil liaison schedules and economic corridors to ensure synchronized delivery of security, aid, and commerce enablers.

Key risk: Over-centralization in main hubs without resilient last-mile systems will create chokepoints vulnerable to disruption; we must harden supply lines now through redundant routing and locally manned micro-depots to maintain continuity under pressure."
1,"46596f84-191f-47ae-b80a-15fb9588c5fc","8d4495bc-a87e-40f2-89f0-d0e766487a9d","intra_faction_coordination","e284a1ed-884d-4b0c-9f7b-97d86a268891","2026-02-12 02:24:41","small_intelligence","Director Maksym Savchenko","small_power",2,"[Colonel Dmytro Hryshchenko - SMALL_POWER]: [Director of Strategic Operations - SMALL_POWER]: I endorse the hub-based operational framework, civil-military integration, and embedded economic corridors as mutually reinforcing—however, we must now prioritize *defensive depth* and *asymmetric deterrence* at the sub-hub level to protect these investments.

I recommend assigning dedicated rapid-reaction security cells to each forward support depot and mobile trading unit by Day 7, equipped with ISR drones and linked to a tiered alert system managed through the JTC; these cells must conduct pre-emptive route sweeps and establish low-signature observation posts to deter ambush and sabotage.

Key risk: Without proactive, decentralized security coverage, our logistics nodes and economic enablers will become static targets for precision strikes and coercion by adversarial proxies—defensive posture must enable maneuver, not just react to it."
1,"46596f84-191f-47ae-b80a-15fb9588c5fc","8d4495bc-a87e-40f2-89f0-d0e766487a9d","intra_faction_coordination","66d4dd6f-3f03-4346-8d4c-096e201b7b97","2026-02-12 02:24:51","small_economic","Minister Taras Moroz","small_power",2,"[Minister of Civil Affairs - SMALL_POWER]: I support the integration of security, logistics, and economic functions within the hub model, but emphasize that community buy-in is the linchpin—without verified local governance participation, even fortified nodes risk isolation and non-cooperation.

I recommend establishing Civil Coordination Cells (CCCs) in each main hub by Day 5, composed of trusted local leaders, civil society reps, and JTC liaisons, with authority to validate beneficiary lists, monitor service delivery, and report early signs of tension or spoilage.

Key risk: Top-down implementation without legitimate local oversight will fuel resentment and enable capture by warlords or corrupt actors—undermining both security and economic objectives; we must institutionalize inclusion now, not as an add-on later."
1,"46596f84-191f-47ae-b80a-15fb9588c5fc","0466e00d-baa8-40ea-919b-0a6b14126582","inter_faction_negotiation","b809b2bd-9f8c-426f-87f1-fc6c9ccba0b7","2026-02-12 02:24:55","major_propaganda","Deputy Minister Yuri Volkov","major_power",1,"1. **We demand the immediate withdrawal of your forces from the contested border regions, which have historically and legally belonged to our sovereign territory.**  
2. This demand is based on internationally recognized treaties and cartographic evidence dating back decades, which clearly delineate these lands as ours; your continued military presence constitutes an illegal occupation and a provocation.  
3. We require, without precondition, your full and verifiable disengagement within 72 hours, followed by the initiation of technical-level talks solely to confirm the restoration of our administrative control—no negotiations on sovereignty will be entertained."
1,"46596f84-191f-47ae-b80a-15fb9588c5fc","0466e00d-baa8-40ea-919b-0a6b14126582","inter_faction_negotiation","864af68b-a54f-4c3d-8709-8513f6cf16df","2026-02-12 02:24:59","small_intelligence","Director Maksym Savchenko","small_power",1,"1. **We categorically reject your demand for unilateral withdrawal, just as we reject the false premise that these border regions are yours by historical or legal right.**  
2. Our forces are lawfully stationed in these areas under long-standing agreements and in defense of our national sovereignty; it is *your* incursions and militarization that violate prior accords and destabilize the region.  
3. **We require** your immediate cessation of military buildup along our recognized frontier, the complete pullback of your forward-deployed units to pre-crisis positions, and binding international verification of these actions—*before* any discussion of movement on our part.  

Any proposal that treats our sovereign territory as disputed or demands our withdrawal without reciprocal, verifiable de-escalation from you is utterly unacceptable. We will not negotiate under threat, nor surrender a single meter of our ancestral land."
