"period","session_id","interaction_id","interaction_type","message_id","timestamp","sender_id","sender_name","sender_faction","exchange_number","content"
1,"46596f84-191f-47ae-b80a-15fb9588c5fc","15da0afa-4a6c-404c-b5f4-85464f3d7a8a","external_engagement","e3ebebfe-cdbf-4a8e-bde3-212ca4d15c5b","2026-02-12 02:27:24","major_military_chief","General Viktor Krasnov","major_power",3,"We accept the proposed timeline and will coordinate through our technical teams to finalize the joint working group’s structure and mandate by the end of the week. We confirm our commitment to interoperable smart grid standards, urban decarbonization pilots, and civilian data governance frameworks—all to be developed through co-equal technical collaboration. Our innovation hubs in Novaris City and Port Elenara will host the first round of joint pilots, with open access for participating firms from both economies under clear IP protection protocols.

We fully agree on civilian control and peaceful application: all projects will undergo transparency reviews to exclude dual-use risks, and we welcome independent auditing of both financial and technical compliance. However, our red line remains firm—cooperation must not create de facto alignment in foreign policy or economic statecraft. We will not accept conditionalities that restrict engagement with other partners, nor allow project governance to be subject to extraterritorial jurisdiction. Our neutrality is operational, not symbolic, and must be respected in practice, not just principle."
1,"46596f84-191f-47ae-b80a-15fb9588c5fc","0fc8b98f-1386-4150-9007-cfdabbe5ac92","external_engagement","828e7edf-ee74-4216-947b-f3a5eb33f25e","2026-02-12 02:27:30","neutral_power","Commissioner Helena Schmidt","aurelia",1,"We are seeking a credible, internationally supported mediation process that ensures the protection of our people’s rights, including security guarantees, equitable resource sharing, and political inclusion in any future governance structure. Our priority is a ceasefire followed by inclusive negotiations that address the root causes of the conflict, with mechanisms for accountability and transitional justice. We insist on the immediate lifting of blockades restricting humanitarian access to our territories.

In return, we are prepared to commit to a ceasefire concurrent with tangible confidence-building measures, participate in good faith in peace talks, and cooperate on counter-terrorism and regional stability efforts. We can facilitate local-level de-escalation and support humanitarian operations in areas under our control.  

Our red lines are non-negotiable: no disarming of our self-defense forces without guaranteed security arrangements; no amnesty for war crimes without justice; and no political settlement that excludes our representatives or undermines our community’s right to self-governance within a unified state."
1,"46596f84-191f-47ae-b80a-15fb9588c5fc","0fc8b98f-1386-4150-9007-cfdabbe5ac92","external_engagement","ad996092-7201-45d0-893d-0259d7155a39","2026-02-12 02:27:38","small_military_commander","General Olena Bondar","small_power",1,"We welcome Commissioner Schmidt’s call for a credible, internationally backed mediation process and share the priority of achieving a sustainable ceasefire and inclusive political settlement. To advance this, we propose the immediate establishment of a neutral mediation panel—under UN auspices—tasked with facilitating direct talks, verifying compliance with the ceasefire, and ensuring equitable representation of all communities, including yours, in governance and resource decisions. Humanitarian access must be restored unconditionally as a first step.

In return, we can support the deployment of international monitoring observers along key supply routes, coordinate with humanitarian agencies to deliver aid in contested zones, and deconflict military movements to prevent escalation during negotiations. We will also endorse a temporary moratorium on offensive operations, contingent on reciprocal restraint.  

Our red lines are clear: no external interference in internal security arrangements without host-state consent; no transitional justice mechanism that bypasses national sovereignty or due process; and no territorial or political concessions that compromise the constitutional integrity of the state. Self-governance must be exercised within the framework of national unity, not at its expense."
1,"46596f84-191f-47ae-b80a-15fb9588c5fc","0fc8b98f-1386-4150-9007-cfdabbe5ac92","external_engagement","9b4da809-c57a-4cd4-8db1-5bf4c6dad8be","2026-02-12 02:27:40","neutral_power","Commissioner Helena Schmidt","aurelia",2,"We acknowledge General Bondar’s support for a UN-facilitated mediation process and welcome the commitment to humanitarian access and de-escalation measures. However, credibility hinges on ensuring that the mediation panel includes representatives acceptable to our community and has a mandate to address self-governance, security guarantees, and resource equity as substantive negotiation tracks—not merely as confidence-building addenda. We insist that ceasefire verification mechanisms include third-party monitoring on the ground in our territories, with real-time reporting and rapid response protocols.

In response, we will uphold our ceasefire commitment, allow unimpeded humanitarian passage through areas under our control, and engage in direct talks through designated delegates. We also offer intelligence sharing on extremist elements threatening regional stability, provided such cooperation is not weaponized against our leadership or civilian structures.  

Our red lines remain unchanged: no disarmament without verified, reciprocal security arrangements; no justice process that equates victims with perpetrators; and no political framework that subordinates our self-governance rights to centralized control. Any settlement must recognize our community’s territorial autonomy and decision-making authority in local security, education, and resource management within a reformed, unified state."
1,"46596f84-191f-47ae-b80a-15fb9588c5fc","0fc8b98f-1386-4150-9007-cfdabbe5ac92","external_engagement","e3342ec1-effa-434e-9cb0-84bfce6c0768","2026-02-12 02:27:43","small_military_commander","General Olena Bondar","small_power",2,"[General Olena Bondar - SMALL_POWER]: We accept the need for a credible, UN-mandated mediation panel with technical expertise and impartiality, and we agree on third-party ceasefire monitoring—provided that monitors operate under a unified mandate across all territories and report through established UN channels. We will work with you to identify mutually acceptable international observers and ensure their access, while expecting full transparency and coordination from all sides. On self-governance, we affirm that decentralized administration—including in security, education, and local resource management—can be part of the negotiation agenda, as long as it remains within the constitutional framework and does not create parallel state structures.

In return, we will facilitate the immediate resumption of humanitarian convoys along pre-conflict corridors, support joint coordination cells with your representatives for aid distribution in contested areas, and share verified intelligence on cross-border extremist movements through secure, multilateral channels. We also commit to refraining from military operations in populated zones during active talks, if reciprocated.

Our red lines hold: no unilateral declarations of autonomy; no external recognition of armed groups as governing authorities; and no justice mechanisms that override national courts without legislative basis. Sovereignty, territorial integrity, and the rule of law are non-negotiable. We expect adherence to these principles in all phases of the process."
1,"46596f84-191f-47ae-b80a-15fb9588c5fc","5e151965-34c6-4cd0-9f32-b8c43b7cca26","external_engagement","463b765b-25ec-480c-b433-11d6cc886979","2026-02-12 02:27:49","international_org","Under-Secretary-General Isabella Cardenas","international_org",1,"We seek unimpeded humanitarian access to all affected populations in contested areas, including medical evacuations, delivery of essential supplies, and protection for aid workers. Civilian infrastructure must be respected under international humanitarian law, and we demand accountability for violations. Our priority is ensuring the safety and dignity of non-combatants, particularly in active conflict zones.

In return, we can facilitate local coordination, provide security assurances in areas under our control, and support humanitarian convoys with route guidance and protection. We are prepared to share real-time information to enable safe and effective aid delivery. However, our red line is clear: humanitarian operations must remain neutral and impartial—no aid will be tolerated as a cover for intelligence gathering, political interference, or support to hostile actors. Any breach of this principle will result in immediate restriction of access."
1,"46596f84-191f-47ae-b80a-15fb9588c5fc","5e151965-34c6-4cd0-9f32-b8c43b7cca26","external_engagement","dbd58151-d94e-46fb-b5f5-3d127b9adaa5","2026-02-12 02:27:56","major_propaganda","Deputy Minister Yuri Volkov","major_power",1,"We welcome your commitment to humanitarian principles and affirm our shared interest in protecting civilians and ensuring life-saving assistance reaches those in need. To this end, we seek guaranteed, unimpeded access for humanitarian convoys to populations in areas under our control, including permission for medical evacuations and the timely delivery of food, water, and medical supplies. We also require protection for aid workers and civilian infrastructure, in line with international humanitarian law, and expect all parties to respect these obligations.

In return, we will provide secure passage, local coordination support, and embedded liaison officers to facilitate safe movement of aid convoys through contested zones. We are prepared to deconflict areas temporarily to enable deliveries and will uphold the neutrality of humanitarian operations. However, our red line is absolute: no humanitarian actor may operate in coordination with or provide material support to opposing forces, and all convoys must submit to advance screening to prevent the smuggling of weapons or intelligence assets. Any violation will result in immediate suspension of access."
1,"46596f84-191f-47ae-b80a-15fb9588c5fc","5e151965-34c6-4cd0-9f32-b8c43b7cca26","external_engagement","bacd50d1-9047-4dff-aedf-20fda60c0c3d","2026-02-12 02:28:00","international_org","Under-Secretary-General Isabella Cardenas","international_org",2,"We welcome the reaffirmation of humanitarian principles and acknowledge the importance of safe, unimpeded access for aid delivery. However, we insist that humanitarian operations in areas under your control must include independent monitoring and verification mechanisms to ensure aid reaches all affected populations without discrimination, particularly in besieged or hard-to-reach communities. We also require binding commitments to protect medical facilities, schools, and other civilian infrastructure from attack, and demand accountability for recent incidents involving civilian casualties caused by airstrikes and shelling.

In return, we can coordinate through neutral channels to verify convoy contents, share route assessments, and support rapid response for medical evacuations. We are prepared to facilitate third-party oversight of aid distribution to uphold transparency. Our red lines are non-negotiable: no targeting of civilians or civilian infrastructure under any circumstances, no conditional or weaponized use of aid, and no screening procedures that compromise the impartiality of humanitarian actors or serve as a pretext for intelligence operations. Any attempt to instrumentalize humanitarian access will result in public condemnation and withdrawal from cooperation."
1,"46596f84-191f-47ae-b80a-15fb9588c5fc","5e151965-34c6-4cd0-9f32-b8c43b7cca26","external_engagement","6d7f016b-df71-4c35-93d6-76c59ff6c00d","2026-02-12 02:28:11","major_propaganda","Deputy Minister Yuri Volkov","major_power",2,"We accept the requirement for independent monitoring and will permit neutral third-party verification of aid distribution in areas under our control, provided such mechanisms operate transparently and do not impede timely delivery. We reaffirm our commitment to protect civilian infrastructure and investigate reported incidents involving civilian harm. To this end, we will share relevant operational data with the UN’s monitoring bodies, consistent with national security considerations.

In return, we expect humanitarian actors to fully comply with our screening protocols, which are designed solely to prevent the infiltration of weapons or hostile elements—not to obstruct aid or conduct intelligence activities. We will continue to facilitate secure transit, including deconfliction and liaison support, for verified humanitarian convoys. Our red line remains clear: no humanitarian entity may coordinate with armed opposition groups, conduct unauthorized surveillance, or use aid distribution to advance political objectives. Any breach will result in immediate suspension of access and potential legal action."
1,"46596f84-191f-47ae-b80a-15fb9588c5fc","5e151965-34c6-4cd0-9f32-b8c43b7cca26","external_engagement","c588a96f-f073-4065-a23c-ba7b66c37635","2026-02-12 02:28:18","international_org","Under-Secretary-General Isabella Cardenas","international_org",3,"[Representative Amara Nkwo – HUMANITARIAN_COALITION]  

We acknowledge your acceptance of independent monitoring and commit to deploying rapid verification teams to assess aid delivery and civilian protection conditions on the ground. To ensure timely assistance, we require pre-approval of standardized convoy schedules and guaranteed access to besieged and high-risk areas without last-minute denials. Medical evacuations must be permitted based on clinical urgency, not bureaucratic delays, and we expect immediate investigation and public reporting of incidents involving attacks on healthcare.

In return, we will maintain strict neutrality, provide advance shipment manifests for review, and use only vetted, non-military transport routes. Our partners will refrain from any engagement with armed opposition groups. Our red lines are clear: screening of convoys must not include invasive searches of medical supplies or personnel, nor delay life-saving deliveries beyond 12 hours; any use of humanitarian data for military targeting or intelligence purposes will result in immediate suspension of operations and public exposure. Impartiality is not negotiable—we will not operate under conditions that compromise our mandate."
1,"46596f84-191f-47ae-b80a-15fb9588c5fc","5e151965-34c6-4cd0-9f32-b8c43b7cca26","external_engagement","35bb6c59-f73a-4358-a676-1bbc0aae0b23","2026-02-12 02:28:35","major_propaganda","Deputy Minister Yuri Volkov","major_power",3,"[Representative Amara Nkwo – HUMANITARIAN_COALITION]  

We welcome your commitment to deconfliction and third-party verification, and we reiterate our operational readiness to deliver life-saving aid under agreed protocols. To ensure effectiveness, we require binding pre-approvals for biweekly convoy rotations to designated high-risk zones, including Aleppo, Daraa, and eastern Deir ez-Zor, with no retroactive denials. Access must extend to all civilians in need—without exception—and medical evacuations will be triggered by independent clinical assessments, not security clearance procedures. We expect full cooperation with rapid incident investigations, particularly regarding recent strikes on health facilities, and demand public disclosure of findings and corrective measures.

In return, we commit to full transparency: advance sharing of cargo manifests, use of UN-vetted transport, and real-time tracking of distributions via neutral monitors. Our teams will not engage with any armed actors, nor conduct activities beyond humanitarian scope. Our red lines are non-negotiable: screening may not exceed 12 hours, must exclude intrusive inspection of medical materials or patient records, and cannot be used to extract intelligence. Any evidence of humanitarian data misuse or targeting of aid assets will trigger immediate operational suspension and public attribution. Impartiality is not a concession—it is the foundation of our mandate."
