"period","faction","agent_name","agent_role","timestamp","action","target","reasoning","expected_outcome","success","result_message"
3,"major_power","Minister Dmitri Volkov","government","2026-01-31 19:56:14","military_buildup",NA,"As a realist, I recognize that power is the foundation of all negotiations. With the Meridian Alliance consolidating gains and expanding military cooperation with Tethys, a visible and credible military buildup is necessary to deter further escalation and signal resolve. This action strengthens our position without crossing the threshold into open conflict, maintaining plausible deniability while forcing the adversary to miscalculate the cost of continued defiance.","Enhanced deterrence, improved domestic and allied confidence, and leverage in any future diplomatic engagement.",TRUE,"Military buildup increases combat capability"
3,"small_power","President Elena Marchetti","government","2026-01-31 19:59:15","military_buildup",NA,"As a liberal institutionalist and wartime leader, I believe in the rule of law and democratic resilience—but also in the necessity of strength to defend them. The recent battlefield success and coalition support provide a strategic window to institutionalize deterrence. A credible, long-term military commitment signals to Novaris that aggression will be met with sustained resistance, while reinforcing domestic and allied confidence in Tethys’s sovereignty. This is not escalation for its own sake, but the foundation of future peace through strength.","Enhanced military readiness deters further aggression, solidifies NATO and allied support, and enables Tethys to negotiate from a position of demonstrated resolve rather than desperation.",TRUE,"Military buildup increases combat capability"
3,"meridian","Ambassador William Crawford","foreign_government","2026-01-31 19:59:25","proxy_support","small_power","As a realist diplomat with a hawkish inclination, I assess that Meridian must maintain credible deterrence without triggering direct war. Continued proxy support strengthens the smaller power’s defensive capacity, signals resolve to Novaris, and preserves alliance credibility—all while staying below the threshold of direct confrontation.","Enhanced defensive posture of the small power, increased costs to Novaris aggression, and strengthened cohesion among Meridian’s allies.",TRUE,"Proxy forces strengthened"
3,"valkoria","Minister Andrei Kozlov","foreign_government","2026-01-31 19:59:36","proxy_support","small_power","As a realist with a hawkish inclination, I view continued indirect support to Novaris-aligned forces as essential to counter Western encroachment without triggering direct confrontation. Given the recent success of our proxy_support and Meridian’s escalating aid to the defender, reinforcing our commitment ensures strategic momentum and deters further Western intervention.","Strengthened combat capability of allied non-state actors, leading to territorial gains and increased pressure on the defender ahead of potential negotiations.",TRUE,"Proxy support exposed - diplomatic fallout"
3,"aurelia","Commissioner Helena Schmidt","foreign_government","2026-01-31 19:59:52","diplomatic_visit","novaris","As a liberal institutionalist, I believe sustained dialogue is essential to de-escalate tensions and create space for negotiation. Given Aurelia's energy dependence and the balanced military posture, direct engagement with Novaris offers the best chance to craft a face-saving off-ramp and prevent invasion.","Opening a backchannel for diplomacy that could lead to mutual de-escalation and revive stalled peace efforts.",FALSE,"Diplomatic visit declined or produced no results"
3,"international_org","Under-Secretary-General Isabella Cardenas","international_org","2026-01-31 20:00:03","humanitarian_aid",NA,"As a liberal institutionalist focused on humanitarian outcomes, providing aid aligns with international law and preserves civilian protection amid rising tensions. Given the pre-invasion crisis and balanced military posture, visible support for affected populations strengthens the organization’s credibility and creates space for future dialogue.","Increased international support for the organization’s role, improved access to conflict zones, and marginal de-escalation pressure through demonstrated neutrality and compassion.",TRUE,"Humanitarian aid delivered successfully"
