"period","faction","faction_name","decision_maker","decision_maker_role","proposed_by","proposed_by_role","timestamp","proposed_action","final_action","approval_status","domain","priority","target","proposal_rationale","decision_rationale","success","result_message"
8,"major_power","Novaris","Minister Dmitri Volkov","government","General Viktor Krasnov","military","2026-02-09 15:35:49","military_buildup","military_buildup","approved","military","primary","Tethys","A visible northern troop concentration will force Tethys to divert resources, creating openings for asymmetric pressure elsewhere.","Northern concentration serves our strategic interests by forcing Tethys resource diversion while maintaining plausible defensive posture","TRUE","Military buildup increases combat capability"
8,"major_power","Novaris","Minister Dmitri Volkov","government","General Viktor Krasnov","military","2026-02-09 15:35:49","cyber_attack","cyber_attack","approved","military","secondary","Tethys","Disrupting Tethys’ energy logistics coordination undermines their ability to leverage our pipeline dependency.","Cyber disruption of energy logistics is proportionate response that exploits our technical capabilities without crossing kinetic threshold","FALSE","Cyber attack traced back - diplomatic incident"
8,"major_power","Novaris","Minister Dmitri Volkov","government","General Viktor Krasnov","military","2026-02-09 15:35:49","show_of_force","show_of_force","vetoed","military","tertiary","self","Conducting a joint naval-air exercise near the pipeline route signals resolve without immediate escalation.","Naval exercises near pipeline route risks uncontrolled escalation and potential infrastructure damage to our own economic interests","","Vetoed action (tertiary priority)"
8,"major_power","Novaris","Minister Dmitri Volkov","government","Director Sergei Morozov","intelligence","2026-02-09 15:35:49","false_flag_operation","false_flag_operation","vetoed","intelligence","primary","Tethys","Stage a provocation in the border region to erode international sympathy and justify our next-phase operations.","False flag operations carry unacceptable risk of exposure and international isolation at this critical juncture","","Vetoed action (primary priority)"
8,"major_power","Novaris","Minister Dmitri Volkov","government","Director Sergei Morozov","intelligence","2026-02-09 15:35:49","cyber_theft","cyber_theft","approved","intelligence","secondary","Tethys","Extract data on Tethys’ reserve deployment patterns to anticipate economic and military thresholds.","Intelligence on Tethys deployment patterns provides essential strategic advantage for future decision-making","TRUE","Cyber theft successful - technological secrets obtained"
8,"major_power","Novaris","Minister Dmitri Volkov","government","Director Sergei Morozov","intelligence","2026-02-09 15:35:49","leadership_targeting","leadership_targeting","approved","intelligence","tertiary","Tethys","Discredit key Tethys defense planners through leaked communications to induce command paralysis.","Targeted information warfare against defense leadership creates command disruption without kinetic escalation","FALSE","Leadership targeting attempt exposed - major diplomatic crisis"
8,"major_power","Novaris","Minister Dmitri Volkov","government","Dr. Natasha Petrova","economic","2026-02-09 15:35:49","resource_embargo","trade_restrictions","counter_proposed","economic","primary","Tethys","Halt all non-essential energy exports through the Tethys pipeline to pressure their economy while conserving our reserves.","Selective trade limitations maintain pressure while preserving critical energy revenue streams","TRUE","Trade restrictions implemented - target commerce disrupted"
8,"major_power","Novaris","Minister Dmitri Volkov","government","Dr. Natasha Petrova","economic","2026-02-09 15:35:49","strategic_stockpiling","strategic_stockpiling","approved","economic","secondary","self","Accelerate domestic accumulation of critical inputs to insulate core industries from retaliatory cuts.","Strategic stockpiling protects our industrial base and provides leverage for extended confrontation","FALSE","Stockpiling limited by supply constraints and high prices"
8,"major_power","Novaris","Minister Dmitri Volkov","government","Dr. Natasha Petrova","economic","2026-02-09 15:35:49","currency_manipulation","currency_manipulation","vetoed","economic","tertiary","Tethys","Weaken the Tethys currency through selective forex interventions to inflate their import costs and erode public confidence.","Currency manipulation risks broader financial retaliation and undermines our long-term economic stability","","Vetoed action (tertiary priority)"
8,"small_power","Tethys","President Elena Marchetti","government","General Olena Bondar","military","2026-02-09 15:37:21","show_of_force","show_of_force","approved","military","primary","Novaris","Demonstrate combat readiness through high-visibility troop deployments and air patrols to deter further escalation.","Show of force demonstrates resolve while avoiding direct escalation, aligns with defensive posture","TRUE","Show of force demonstrates military capability"
8,"small_power","Tethys","President Elena Marchetti","government","General Olena Bondar","military","2026-02-09 15:37:21","cyber_attack","cyber_attack","vetoed","military","secondary","Novaris","Disrupt Novaris military logistics networks to delay mobilization without triggering kinetic retaliation.","Cyber attacks risk uncontrolled escalation and undermine diplomatic efforts","","Vetoed action (secondary priority)"
8,"small_power","Tethys","President Elena Marchetti","government","General Olena Bondar","military","2026-02-09 15:37:21","naval_deployment","naval_deployment","approved","military","tertiary","self","Position stealth corvettes along Tethys coast to asymmetrically threaten energy pipeline security.","Naval deployment provides asymmetric deterrent while maintaining plausible defensive character","TRUE","Naval forces deployed to region"
8,"small_power","Tethys","President Elena Marchetti","government","Director Maksym Savchenko","intelligence","2026-02-09 15:37:21","sabotage","sabotage","vetoed","intelligence","primary","Novaris","Disable key rail junctions in Novaris border regions to degrade supply chain resilience and slow reinforcement.","Sabotage operations too provocative and risk exposing our involvement at critical diplomatic moment","","Vetoed action (primary priority)"
8,"small_power","Tethys","President Elena Marchetti","government","Director Maksym Savchenko","intelligence","2026-02-09 15:37:21","share_intelligence","share_intelligence","approved","intelligence","secondary","Meridian,Aurelia","Leak verified mobilization data to Western allies to strengthen diplomatic pressure.","Intelligence sharing strengthens alliance coordination and maintains institutional cooperation","TRUE","Intelligence shared successfully - ally coordination improved"
8,"small_power","Tethys","President Elena Marchetti","government","Director Maksym Savchenko","intelligence","2026-02-09 15:37:21","false_flag_operation","false_flag_operation","vetoed","intelligence","tertiary","Novaris","Stage a minor, deniable provocation to expose Novaris overreaction and sway international opinion.","False flag operations violate international norms and could backfire catastrophically","","Vetoed action (tertiary priority)"
8,"small_power","Tethys","President Elena Marchetti","government","Minister Sofia Kovalenko","diplomatic","2026-02-09 15:37:21","backchannel_negotiations","backchannel_negotiations","approved","diplomatic","primary","Novaris","Open discreet talks via neutral intermediaries to de-escalate while preserving public resolve.","Backchannel negotiations essential for finding face-saving exit ramp from crisis","FALSE","Backchannel approach rebuffed - no secret dialogue established"
8,"small_power","Tethys","President Elena Marchetti","government","Minister Sofia Kovalenko","diplomatic","2026-02-09 15:37:21","humanitarian_corridors","humanitarian_corridors","approved","diplomatic","secondary","none","Propose protected routes to project moral authority and isolate Novaris if they obstruct aid.","Humanitarian corridors project moral leadership and strengthen international support","FALSE","Humanitarian corridor negotiations failed - access denied"
8,"small_power","Tethys","President Elena Marchetti","government","Minister Sofia Kovalenko","diplomatic","2026-02-09 15:37:21","cultural_exchange","cultural_exchange","approved","diplomatic","tertiary","Meridian","Accelerate soft diplomacy with regional swing states to build long-term alignment.","Cultural exchanges build long-term regional stability through institutional ties","TRUE","Cultural exchange successful - people-to-people ties strengthened"
8,"small_power","Tethys","President Elena Marchetti","government","Minister Taras Moroz","economic","2026-02-09 15:37:21","resource_embargo","economic_sanctions","counter_proposed","economic","primary","Novaris","Restrict transshipment of Novaris energy exports through Tethys pipelines to strangle revenue at the source.","Resource embargo too aggressive; targeted sanctions maintain pressure while preserving negotiation space","FALSE","Sanctions imposed but largely circumvented through third parties"
8,"small_power","Tethys","President Elena Marchetti","government","Minister Taras Moroz","economic","2026-02-09 15:37:21","strategic_stockpiling","strategic_stockpiling","approved","economic","secondary","self","Secure critical inputs now to extend economic endurance beyond six-month reserve horizon.","Strategic stockpiling essential for economic resilience during prolonged crisis","TRUE","Strategic stockpiling successful - reserves increased"
8,"small_power","Tethys","President Elena Marchetti","government","Minister Taras Moroz","economic","2026-02-09 15:37:21","trade_negotiation","trade_negotiation","approved","economic","tertiary","Aurelia","Fast-track green energy deals to diversify exports and reduce dependency on Novaris-linked markets.","Trade diversification reduces strategic vulnerabilities and strengthens alliance partnerships","FALSE","Trade negotiations stalled - terms unacceptable"
8,"meridian","meridian","Ambassador William Crawford","foreign_government","","","2026-02-09 15:37:35","economic_sanctions","economic_sanctions","approved","economic","primary","major_power","As a realist diplomat with a hawkish inclination, I recognize that while direct military involvement is too escalatory, sustained economic pressure is both feasible and effective. Repeating sanctions leverages our previous success and aligns with Meridian’s strategy of maximum support short of war, further isolating the aggressor.","Continued degradation of the major power's economic stability, deterring immediate invasion and signaling resolve to allies, thereby preserving the credibility of the alliance system.","FALSE","Sanctions imposed but largely circumvented through third parties"
8,"valkoria","valkoria","Minister Andrei Kozlov","foreign_government","","","2026-02-09 15:37:47","spread_disinformation","spread_disinformation","approved","information","primary","Meridian","As a realist with intelligence background, I assess that sustained information operations undermine Meridian’s cohesion and erode public support for intervention. Repeating this action leverages existing networks and exploits Western media vulnerabilities.","Reduced Western political will to intervene, increased domestic pressure on Meridian to avoid escalation, and strengthened perception of Novaris as resilient and legitimate.","FALSE","Disinformation exposed - major credibility damage"
8,"aurelia","aurelia","Commissioner Helena Schmidt","foreign_government","","","2026-02-09 15:38:12","backchannel_negotiations","backchannel_negotiations","approved","diplomatic","primary","major_power","As a liberal institutionalist with a strong preference for diplomacy, I believe sustained secret talks offer the best chance to de-escalate before war begins. My recent successes suggest channels are still open, and repeating this action leverages existing momentum despite diminishing returns.","Reopening discreet dialogue to explore conditional de-escalation, potentially securing a mutual freeze in military movements in exchange for sanctions relief and security assurances.","FALSE","Backchannel approach rebuffed - no secret dialogue established"
8,"international_org","international_org","Under-Secretary-General Isabella Cardenas","international_org","","","2026-02-09 15:38:22","backchannel_negotiations","backchannel_negotiations","approved","diplomatic","primary","major_power and small_power","Given the repeated failure of formal talks and the high humanitarian stakes, discreet backchannel diplomacy offers a lower-pressure avenue to explore mutual de-escalation. My liberal-institutionalist worldview prioritizes dialogue, and this approach preserves dignity while testing for potential compromise.","Reopening of discreet communication lines that could lead to confidence-building measures and create space for renewed public diplomacy.","FALSE","Backchannel approach rebuffed - no secret dialogue established"
