"period","session_id","interaction_id","interaction_type","message_id","timestamp","sender_id","sender_name","sender_faction","exchange_number","content"
9,"e86ef1eb-1145-43fe-9e2d-8e5e38b1d559","4a692144-e3bc-4c9d-a7be-7937929e3c04","external_engagement","30836c6a-69c3-4d5a-b376-d1464f2dec76","2026-02-09 15:57:14","major_economic_advisor","Dr. Natasha Petrova","major_power",2,"We appreciate Novaris’s clarity on mutual cooperation and respect for its sovereign framework. Valkoria reaffirms its willingness to advance concrete collaboration in renewable energy and digital infrastructure, provided projects adhere to internationally recognized standards on transparency, procurement, and intellectual property protection. We accept your condition of reciprocal market access and are prepared to negotiate a bilateral agreement facilitating entry for Novarisian tech firms into our markets, subject to standard security reviews consistent with our domestic laws.

On security and technology governance, we can accommodate intelligence coordination on non-attributive, threat-based data and support multilateral export control frameworks that do not impede Novaris’s legitimate technological development. We will not insist on exclusion of non-sanctioned third parties, but we require binding assurances that no technology or infrastructure co-developed with Valkoria will be transferred to entities or states under multilateral sanctions. Our red line stands: cooperation cannot enable circumvention of sanctions or involve dual-use technologies in unsecured environments. Projects must be auditable, and partnerships must operate within the bounds of the rules-based order."
9,"e86ef1eb-1145-43fe-9e2d-8e5e38b1d559","b60d77bb-d830-4a6d-b2e6-50c83995cc56","external_engagement","5c7e9d19-4bda-44e9-98a0-24e879d3d8ba","2026-02-09 15:57:17","neutral_power","Commissioner Helena Schmidt","aurelia",1,"We seek a mediated pathway toward a permanent political settlement that ensures the self-determination of our people, including internationally guaranteed security, recognition of our governance structures, and the right to return for displaced populations. We call for an inclusive peace process facilitated by neutral actors, with direct participation in negotiations to address core issues of sovereignty, territory, and justice. A comprehensive ceasefire and the immediate lifting of unlawful blockades restricting humanitarian access are prerequisites for meaningful dialogue.

In return, we are prepared to commit to good-faith negotiations, de-escalation measures, and coordination with humanitarian agencies to stabilize affected areas. We can contribute to regional security by countering shared threats and supporting post-conflict reconciliation mechanisms. However, our red lines are clear: no compromise on the fundamental rights to self-determination and territorial integrity; no negotiations under coercion or military duress; and no solutions that legitimize occupation or ethnic exclusion. Any proposal failing to uphold these principles is unacceptable."
9,"e86ef1eb-1145-43fe-9e2d-8e5e38b1d559","b60d77bb-d830-4a6d-b2e6-50c83995cc56","external_engagement","4bb62e17-a327-4c60-bc3d-0daf0ba94731","2026-02-09 15:57:23","small_economic","Minister Taras Moroz","small_power",1,"We welcome Commissioner Schmidt’s call for a mediated political settlement grounded in self-determination, humanitarian access, and inclusive dialogue. To advance this, we propose the immediate establishment of a neutral mediation panel—comprising non-aligned states or international bodies with verified impartiality—to oversee confidence-building measures, including a monitored ceasefire and the unfreezing of humanitarian corridors. We seek concrete commitments from all parties to cease offensive operations and allow unimpeded aid delivery, as a foundation for sustained negotiations.

In return, we can facilitate local de-escalation, support verification mechanisms for ceasefire compliance, and engage constructively in a structured negotiation framework addressing sovereignty, refugee returns, and transitional justice. However, our red lines are firm: no recognition of unilateral annexations or administrative changes imposed during conflict; no delay or dilution of the right to self-determination; and no peace process that excludes legitimate representatives of the affected population. Any framework failing to uphold these principles will not be entertained."
9,"e86ef1eb-1145-43fe-9e2d-8e5e38b1d559","b60d77bb-d830-4a6d-b2e6-50c83995cc56","external_engagement","a4014b21-32ba-4f0f-8fd3-27d7d790debb","2026-02-09 15:57:25","neutral_power","Commissioner Helena Schmidt","aurelia",2,"We welcome the principled positions articulated by both Commissioner Schmidt and Minister Moroz, and we align with the core demand for a credible, inclusive peace process anchored in international law. We seek a binding mediation framework that prioritizes not only a permanent ceasefire but the full restoration of territorial integrity within internationally recognized borders, coupled with robust, enforceable security guarantees against future aggression. Equally, we insist on the establishment of a specialized mechanism to address accountability for war crimes and systematic human rights violations, ensuring justice and deterrence as pillars of lasting peace.

In return, we are prepared to support immediate humanitarian de-escalation, including coordination on aid delivery and prisoner exchanges, and to engage constructively in a phased negotiation process under neutral facilitation. We can contribute technical and logistical resources to support ceasefire monitoring and post-conflict stabilization. However, our red lines are non-negotiable: no territorial concessions under duress; no normalization of occupation through political arrangements; and no amnesty for atrocities. Any peace framework that sacrifices sovereignty, justice, or the rights of displaced populations to return will be categorically rejected."
9,"e86ef1eb-1145-43fe-9e2d-8e5e38b1d559","b60d77bb-d830-4a6d-b2e6-50c83995cc56","external_engagement","d2d686c2-c890-4bda-8c8e-a7effbf7e7e8","2026-02-09 15:57:32","small_economic","Minister Taras Moroz","small_power",2,"We welcome the shared commitment to a rules-based peace process and affirm our alignment with the principles of self-determination, territorial integrity, and accountability. To move forward, we propose the immediate convening of a UN-mandated mediation forum with binding authority, supported by a neutral quartet of non-regional states to ensure impartiality. We seek concrete timelines for a monitored ceasefire, the lifting of blockades, and the establishment of humanitarian corridors—conditions without which negotiations lack credibility.

In return, we will commit to full participation in good faith, contribute technical expertise to ceasefire monitoring, and coordinate with humanitarian actors for aid delivery. We also stand ready to engage in confidence-building measures, including prisoner exchanges and de-escalation zones. However, our red lines remain absolute: no recognition of territorial changes resulting from aggression; no negotiations that exclude legitimate representative bodies; and no peace that bypasses justice for war crimes. A settlement must be just, not merely expedient—anything less will not bring lasting stability."
9,"e86ef1eb-1145-43fe-9e2d-8e5e38b1d559","b60d77bb-d830-4a6d-b2e6-50c83995cc56","external_engagement","0ca4fd30-01d1-4f83-adde-2c87d17b280c","2026-02-09 15:57:44","neutral_power","Commissioner Helena Schmidt","aurelia",3,"We welcome the converging emphasis on a credible, rules-based mediation process and affirm our commitment to an outcome that upholds international law, human dignity, and lasting security. To this end, we endorse the proposal for a UN-mandated mediation forum with binding authority, provided it includes clear benchmarks for ceasefire compliance, immediate humanitarian access, and the progressive withdrawal of forces from occupied territories. We seek a timeline-driven process with enforceable verification mechanisms—particularly through an independent monitoring mission with real-time reporting capabilities—to prevent violations and build mutual trust.

In return, we will facilitate local-level cooperation with monitoring teams, support the rapid deployment of humanitarian assistance, and engage in good faith in negotiations on political settlement, refugee returns, and transitional justice. We also offer technical coordination on demining and infrastructure repair in post-conflict zones. However, our red lines are unequivocal: no legitimization of occupation through interim governance arrangements; no negotiations that defer or dilute accountability for war crimes; and no peace agreement that undermines the sovereign equality of the affected state. A sustainable resolution must be grounded in justice, not compromise on core principles."
9,"e86ef1eb-1145-43fe-9e2d-8e5e38b1d559","b60d77bb-d830-4a6d-b2e6-50c83995cc56","external_engagement","71e3c65d-795f-4531-96a2-d1865bcc8c64","2026-02-09 15:58:00","small_economic","Minister Taras Moroz","small_power",3,"We welcome the clear alignment on a rules-based, justice-oriented peace process and affirm our readiness to advance a robust mediation framework under UN auspices. We specifically endorse the proposal for a binding, monitored ceasefire with defined withdrawal timelines and verification mechanisms, and we support the establishment of humanitarian corridors and the immediate lifting of blockades as prerequisites for credible negotiations. We seek a mediation structure with empowered, independent monitoring—equipped with mandate and access—to ensure compliance and deter violations, particularly in frontline and occupied areas.

In return, we commit to full participation in the negotiation process, including technical contributions to ceasefire monitoring, de-mining initiatives, and coordination of humanitarian logistics. We further offer to facilitate local-level cooperation with international observers and support early confidence-building measures, such as mutual prisoner releases and de-escalation zone implementation. However, our red lines are absolute: no territorial adjustments resulting from aggression will be recognized; no political arrangement may legitimize or institutionalize occupation; and accountability for war crimes—including through an internationally supported tribunal—must be non-negotiable components of any final settlement. Peace must be just, verifiable, and grounded in sovereignty and law."
9,"e86ef1eb-1145-43fe-9e2d-8e5e38b1d559","11f96f27-c5e9-436e-beb8-cf63ba282107","external_engagement","c9815f0d-0b83-4d0f-af8e-3b2a6b4526fc","2026-02-09 15:58:06","international_org","Under-Secretary-General Isabella Cardenas","international_org",1,"We seek unimpeded humanitarian access to all affected populations, particularly in besieged and hard-to-reach areas, and demand respect for international humanitarian law to ensure the protection of civilians, medical facilities, and critical infrastructure. All parties must cease indiscriminate attacks, end the use of starvation as a method of warfare, and allow neutral aid organizations to operate freely and safely.

In return, we can facilitate local coordination, provide security assurances in areas under our control, and support the monitoring and verification of aid delivery to ensure accountability. We are committed to upholding our obligations under international law and will cooperate with impartial humanitarian actors.

Our red lines are clear: no conditions will be accepted that compromise the neutrality or independence of humanitarian operations, nor will we tolerate aid being used as a tool of political coercion or military advantage. Any engagement must recognize the rights of affected communities without preconditions or diversion of assistance."
9,"e86ef1eb-1145-43fe-9e2d-8e5e38b1d559","11f96f27-c5e9-436e-beb8-cf63ba282107","external_engagement","41598fdb-edca-4217-b22f-e5c5713cd16b","2026-02-09 15:58:09","small_foreign_minister","Minister Sofia Kovalenko","small_power",1,"We welcome the emphasis on unimpeded humanitarian access and civilian protection, which align with our core objective of ensuring the survival and dignity of the civilian population under our care. We seek formal agreements that guarantee safe, sustained, and monitored delivery of humanitarian aid—particularly food, medicine, and fuel—to all civilians in need, including in blockaded and frontline areas. We also demand strict adherence to international humanitarian law by all parties, especially cessation of aerial bombardments on populated areas and attacks on medical facilities.

In return, we will ensure safe passage for aid convoys through our checkpoints, provide local escorts, and facilitate community-level coordination with trusted humanitarian partners. We can also share verified access routes and support third-party monitoring to ensure aid reaches intended recipients.  

Our red lines are non-negotiable: no aid will be conditional on political concessions, military intelligence gathering, or regime-affiliated distribution mechanisms. We reject any attempt to instrumentalize assistance for counter-insurgency or surveillance purposes. Humanitarian access must be neutral, impartial, and based solely on need."
9,"e86ef1eb-1145-43fe-9e2d-8e5e38b1d559","11f96f27-c5e9-436e-beb8-cf63ba282107","external_engagement","e4942376-9af3-4293-99e4-3c6f0724cba8","2026-02-09 15:58:17","international_org","Under-Secretary-General Isabella Cardenas","international_org",2,"We welcome the shared commitment to humanitarian access and civilian protection, which are critical to alleviating suffering in conflict-affected areas under our operational reach. We seek concrete, verified mechanisms to ensure uninterrupted delivery of aid—including medical supplies, food, and water—to civilians in besieged and hard-to-reach zones, with particular attention to areas cut off by active hostilities. We also demand an immediate end to deliberate attacks on civilian infrastructure, including hospitals, schools, and water systems, and call for strict accountability for violations of international humanitarian law.

In return, we will guarantee safe passage for humanitarian convoys through our controlled territories, provide advance coordination for route security, and cooperate with neutral monitors to verify aid distribution without diversion. We are prepared to engage in technical-level coordination with humanitarian actors to establish trusted delivery protocols.  

Our red lines are clear: we will not accept conditional access tied to political recognition, intelligence sharing, or restrictions on local partner involvement. Aid must be distributed impartially, without coercion or linkage to counter-terrorism designations that hinder legitimate community-based assistance. Any attempt to use humanitarian operations as a cover for surveillance or military targeting will terminate cooperation immediately."
9,"e86ef1eb-1145-43fe-9e2d-8e5e38b1d559","11f96f27-c5e9-436e-beb8-cf63ba282107","external_engagement","30bdeee5-716d-473b-b2d6-2c97406db596","2026-02-09 15:58:23","small_foreign_minister","Minister Sofia Kovalenko","small_power",2,"We welcome the reaffirmation of humanitarian principles and the shared commitment to civilian protection. We seek guaranteed, sustained access for humanitarian actors to deliver life-saving assistance—particularly food, medical supplies, and shelter—to civilians in conflict-affected and besieged areas under our control or influence. We demand recognition of our locally trusted networks as legitimate partners in distribution and insist on the removal of bureaucratic impediments, including de-listing certain organizations wrongfully designated under counter-terrorism measures that block aid delivery.

In return, we will ensure physical protection of aid convoys, provide secure transit corridors, and facilitate real-time coordination with humanitarian agencies operating in our areas. We can also enable independent monitoring and reporting on aid distribution to verify compliance and prevent diversion.  

Our red lines are absolute: no aid will be contingent upon political recognition, disarmament, or intelligence cooperation. We reject any condition that undermines the neutrality of humanitarian action or excludes community-based actors from participation. Furthermore, we will not accept pauses or denials of aid as leverage during military operations—protection of civilians must be upheld at all times, independent of battlefield dynamics."
9,"e86ef1eb-1145-43fe-9e2d-8e5e38b1d559","11f96f27-c5e9-436e-beb8-cf63ba282107","external_engagement","f8b0159a-1ab7-49cd-9d4b-dbf97b98743b","2026-02-09 15:58:46","international_org","Under-Secretary-General Isabella Cardenas","international_org",3,"[Under-Secretary-General Isabella Cardenas - INTERNATIONAL_ORG]  
We acknowledge your commitment to operational access and the inclusion of local networks, which are essential for effective aid delivery. To move forward, we require verifiable assurances that aid entering areas under your control will be distributed impartially, with transparent mechanisms to prevent diversion by armed elements. We also insist on standardized monitoring protocols—including the deployment of neutral observers and use of biometric verification—where security permits, to uphold accountability to donors and affected populations.

In return, we will expedite the de-risking and approval of financial channels for designated local partners, advocate for humanitarian exemptions within counter-terrorism frameworks at the international level, and scale up cross-border aid operations with your coordination. We can also provide technical support for needs assessments and logistics planning in hard-to-reach areas.  

Our red lines remain firm: no restrictions on our ability to monitor, report, and independently verify aid delivery; no interference with the selection of implementing partners based on neutrality and capacity; and no tolerance for the use of humanitarian assets—personnel, vehicles, or supplies—for military purposes. Cooperation continues only where these principles are fully respected."
9,"e86ef1eb-1145-43fe-9e2d-8e5e38b1d559","11f96f27-c5e9-436e-beb8-cf63ba282107","external_engagement","b87c29b5-c585-4421-86f5-1f53d21d9b15","2026-02-09 15:58:52","small_foreign_minister","Minister Sofia Kovalenko","small_power",3,"We welcome your commitment to operationalizing humanitarian access and recognize the importance of transparency and accountability. To that end, we agree to establish joint technical committees with your humanitarian teams to design and implement monitoring protocols that include neutral observers and biometric verification—tailored to local conditions and security constraints. We will also designate trusted local partners for direct engagement and fast-track their inclusion in international aid frameworks, ensuring last-mile delivery without compromising neutrality.

In return, we expect immediate progress on humanitarian exemptions for listed entities engaged solely in relief work, unfettered cross-line access from secure hubs under your coordination, and sustained donor support for community-led response mechanisms. We can offer secure transit, real-time route intelligence, and protection for aid personnel operating in our zones, as well as regular access for needs assessments and post-distribution monitoring.

Our red lines are clear: no monitoring mechanism will be used to collect operational or intelligence data beyond aid verification; no partner will be excluded solely based on political or administrative designations without due process; and no delay or denial of aid will be justified retroactively on unverified diversion claims. Civilian protection is non-negotiable—we will not allow humanitarian action to be instrumentalized, nor will we accept collective punishment through aid obstruction."
