"period","session_id","interaction_id","interaction_type","message_id","timestamp","sender_id","sender_name","sender_faction","exchange_number","content"
5,"bae9e75f-e025-42e9-b644-4d1a6e622a7c","1652f084-558f-4d9d-ba7c-a0b9905130b9","intra_faction_coordination","3653bd2b-30e7-4aa4-b829-cb8411875419","2026-02-09 15:00:14","small_president","President Elena Marchetti","small_power",3,"[Deputy Minister Yaroslava Hordiychuk - SMALL_POWER]: I concur with Minister Moroz—finalizing the algorithm-driven selection protocol within 72 hours is essential, and I instruct the Analytical Support Unit to deliver the draft methodology by 18:00 tomorrow, pre-validated against the latest OCHA damage assessments and State Statistics unemployment data.

I recommend the Cabinet issue a time-bound decree granting the joint implementation cell provisional authority for 120 days, enabling immediate enforcement of reporting standards and procurement harmonization, while the legal framework is formalized—this bridges urgency and due process.

A key risk is public perception of SIF as another top-down initiative if community feedback loops are not embedded from day one; we must integrate real-time grievance reporting via SMS and local media partnerships to maintain legitimacy and adaptive management."
5,"bae9e75f-e025-42e9-b644-4d1a6e622a7c","1652f084-558f-4d9d-ba7c-a0b9905130b9","intra_faction_coordination","6443b9f3-b629-4fb8-89cb-159e1c2d8c99","2026-02-09 15:00:18","small_military_commander","General Olena Bondar","small_power",3,"[Deputy Minister Yaroslava Hordiychuk - SMALL_POWER]: I confirm technical readiness of the geotagged reporting platform and payroll verification API—integration with the State Employment Fund’s registry is complete, and field testing in pilot oblasts concludes by end-of-day tomorrow.  

I recommend mandating all participating local executives to route SIF project disbursements exclusively through the unified digital pipeline as a condition of funding—this enforces compliance while generating auditable, real-time data.  

A key risk is underestimating bandwidth constraints in rural municipalities, which could delay reporting and erode data accuracy; we must deploy mobile-enabled offline data capture tools with synchronized upload capability to maintain integrity in low-connectivity areas."
5,"bae9e75f-e025-42e9-b644-4d1a6e622a7c","1652f084-558f-4d9d-ba7c-a0b9905130b9","intra_faction_coordination","3cfc7677-f0b8-4f34-b230-16d3f7edc3ce","2026-02-09 15:00:23","small_foreign_minister","Minister Sofia Kovalenko","small_power",3,"[Deputy Minister Yaroslava Hordiychuk - SMALL_POWER]: I accept the 72-hour deadline for finalizing the algorithm-driven site selection protocol and will coordinate with the Analytical Support Unit to ensure alignment with OCHA and State Statistics datasets. The provisional 120-day decree for the implementation cell is critical—legal team to draft executive order by close of business today.

I recommend instituting a public-facing dashboard launching concurrently with the pilot, displaying real-time disbursement tracking, employment metrics, and grievance resolution rates—this institutionalizes transparency and directly counters narratives of elite capture.

A key risk is local executive resistance to centralized oversight, particularly in regions with entrenched patronage networks; we must pair the mandate enforcement with immediate technical support and performance incentives to reduce friction and signal this as capacity-building, not punitive control."
5,"bae9e75f-e025-42e9-b644-4d1a6e622a7c","1652f084-558f-4d9d-ba7c-a0b9905130b9","intra_faction_coordination","9fb18dd8-96f7-475f-8629-4c8e725a5e7d","2026-02-09 15:00:31","small_opposition","Viktor Zelenko","small_power",3,"[Deputy Minister Yaroslava Hordiychuk - SMALL_POWER]: I acknowledge the technical and legal steps underway and confirm that the algorithmic selection protocol will be stress-tested against displacement trends and labor market saturation by 16:00 tomorrow, ensuring high-risk, high-impact zones are prioritized without duplicating existing aid efforts.

I recommend activating the public grievance dashboard in parallel with the first disbursement cycle—not after—and pre-load it with baseline data from OCHA and the State Employment Fund to establish credibility from day one.

A key risk is delayed inter-ministerial data sharing due to legacy system incompatibilities; I am directing the IT Integration Cell to implement a standardized API middleware layer by end-of-week to prevent bottlenecks and ensure real-time sync across social, employment, and finance registries."
5,"bae9e75f-e025-42e9-b644-4d1a6e622a7c","1652f084-558f-4d9d-ba7c-a0b9905130b9","intra_faction_coordination","ff91033a-d701-4506-89c8-f74a805bb800","2026-02-09 15:00:37","small_intelligence","Director Maksym Savchenko","small_power",3,"[Deputy Minister Yaroslava Hordiychuk - SMALL_POWER]: I confirm alignment with the accelerated timeline—algorithm validation will be completed by 16:00 tomorrow, and the digital disbursement mandate will take effect immediately upon pilot launch. We are deploying the offline-capable mobile reporting toolset to all 12 pilot municipalities by noon tomorrow to preempt connectivity issues.

I recommend conditioning the release of Phase Two funding on demonstrated use of the integrated platform, including grievance logging and real-time payroll uploads, to lock in compliance early and create irreversible momentum toward system-wide adoption.

A key risk is perception of top-down imposition; we must pair enforcement with visible local wins—prioritize fast-impact projects (e.g., road repairs, clinic retrofits) in the first disbursement wave to boost public morale and demonstrate tangible benefits of the new system."
5,"bae9e75f-e025-42e9-b644-4d1a6e622a7c","1652f084-558f-4d9d-ba7c-a0b9905130b9","intra_faction_coordination","68521bad-be45-4d55-a519-3680b21500a1","2026-02-09 15:00:47","small_economic","Minister Taras Moroz","small_power",3,"[Deputy Minister Yaroslava Hordiychuk - SMALL_POWER]: I accept the stress-test timeline and integration of baseline data into the dashboard—this strengthens legitimacy from launch. The conditioning of Phase Two funding on platform compliance is approved, provided we designate three high-visibility, quick-execution projects per pilot zone by 18:00 today in coordination with local councils.

I recommend pairing the technical rollout with a national communications sprint—led by the Office of Public Trust—highlighting these initial projects via regional media, social channels, and community assemblies to directly link system reform to immediate improvements in living conditions.

A key risk remains elite backlash disguised as procedural concern; we must preemptively identify and sideline obstructive actors in regional administrations through targeted performance audits starting Week One, framed as routine quality assurance."
5,"bae9e75f-e025-42e9-b644-4d1a6e622a7c","699f81fb-aa64-4069-85e5-23824be46573","inter_faction_negotiation","832ca2d9-fbe9-4244-9249-6293fb7dfab3","2026-02-09 15:00:49","major_defense_minister","Minister Dmitri Volkov","major_power",1,"1. Your continued provocations along the border and support for insurgent activities within our territory will not go unanswered. Escalation on your part will be met with decisive and disproportionate force.

2. We have demonstrated restraint thus far, but our strategic patience is not infinite. Every incident pushes us closer to actions that will fundamentally alter the regional balance—consequences you are ill-prepared to manage.

3. I require, unequivocally, the immediate cessation of all cross-border support for militant groups, full disclosure of your current military posture along our frontier, and a formal renunciation of any claim to our sovereign territory—failure to comply will be interpreted as intent to wage conflict, and we will act accordingly."
5,"bae9e75f-e025-42e9-b644-4d1a6e622a7c","699f81fb-aa64-4069-85e5-23824be46573","inter_faction_negotiation","a2626776-e182-48d7-ae37-24eed0017459","2026-02-09 15:00:56","small_economic","Minister Taras Moroz","small_power",1,"1. Your accusations are baseless and disingenuous—our sovereignty compels us to support legitimate resistance against your occupation and repression; we reject your framing of defensive actions as ""provocations.""  

2. Your so-called ""restraint"" has included military buildups, cyber attacks on our infrastructure, and covert operations inside our borders—yet you speak of patience while threatening escalation. We will not be blackmailed into surrendering our right to self-defense or regional influence.  

3. We require, in turn: the immediate withdrawal of your forces from disputed border zones, a verifiable end to your sabotage campaigns against our government institutions, and international oversight of your military activities near our frontier. Any attempt to expand your control through coercion—such as annexation, blockades, or targeted strikes—will be met with coordinated countermeasures, including broader regional alliances and asymmetric responses. We will not accept unilateral diktats disguised as negotiations."
5,"bae9e75f-e025-42e9-b644-4d1a6e622a7c","699f81fb-aa64-4069-85e5-23824be46573","inter_faction_negotiation","00e85c57-5612-4f9d-9e46-63d0d732a93e","2026-02-09 15:01:08","major_defense_minister","Minister Dmitri Volkov","major_power",2,"1. **I categorically reject your characterization of our forces as ""occupiers"" and your so-called ""resistance"" as anything other than state-sponsored terrorism enabled by your regime.** Your refusal to acknowledge our sovereignty over these territories is not a defense of principle—it is a cover for destabilization.

2. While you accuse us of aggression, it is *your* continued arming, training, and deployment of insurgents across our internationally recognized borders that constitutes the true breach of peace. Your ""self-defense"" rhetoric is a shield for offensive actions that threaten regional stability—and we will no longer allow you to reframe aggression as legitimacy. Our military presence in the border zones is lawful, defensive, and fully within our rights as a sovereign power.

3. **I REQUIRE the immediate and verifiable cessation of all support—logistical, financial, and operational—for armed groups targeting our territory.** You must dismantle all cross-border networks under your control and allow international monitors *only after* you have disarmed these proxies. Furthermore, you must cease all incitement through state media and accept that no external alliance or asymmetric tactic will deter us from defending our territorial integrity.

**What is unacceptable** is any attempt to legitimize or expand your interference under the guise of ""resistance."" We will not tolerate continued attacks on our security in exchange for empty gestures. Any further incident traced to your direction will trigger a response of our choosing—unrestricted in scope and timing. The burden to de-escalate lies entirely with you."
5,"bae9e75f-e025-42e9-b644-4d1a6e622a7c","699f81fb-aa64-4069-85e5-23824be46573","inter_faction_negotiation","0f8fab5d-429f-45cf-b02a-c6ac71d514d8","2026-02-09 15:01:16","small_economic","Minister Taras Moroz","small_power",2,"1. **I categorically reject your framing of our support for resistance movements as ""state-sponsored terrorism""—these are indigenous forces fighting against foreign occupation and repression, and their struggle is recognized under international law as legitimate self-determination.** Your insistence on labeling all opposition to your military control as ""insurgency"" is a deliberate distortion intended to justify ongoing aggression and territorial overreach.

2. You speak of breaches of peace while maintaining an illegal military presence in disputed regions, conducting drone surveillance deep into our airspace, and orchestrating cyber operations that have crippled civilian networks. These are not defensive acts—they are instruments of coercion. Your so-called ""rights as a sovereign power"" do not extend to the subversion of another state’s governance or the imposition of control over contested lands through force.

3. **We REQUIRE the immediate withdrawal of your troops from all areas under dispute, the cessation of all offensive cyber and intelligence operations targeting our institutions, and the establishment of a UN-mandated verification mechanism to monitor troop levels and equipment deployments along the frontier.** Furthermore, we demand a reciprocal agreement: no strikes, no sabotage, no covert actions—on any domain—conditional upon your adherence.

**What is unacceptable** is any demand that we disarm legitimate resistance or surrender our right to counter your destabilizing actions. We will not unilaterally disarm while you maintain offensive capabilities at our doorstep. Any attempt to launch attacks—conventional or otherwise—against our territory or allies will be answered with full force, including through asymmetric means and expanded international partnerships. The burden of de-escalation lies equally on both sides—but you cannot expect restraint while you continue to encircle us with threats."
5,"bae9e75f-e025-42e9-b644-4d1a6e622a7c","699f81fb-aa64-4069-85e5-23824be46573","inter_faction_negotiation","86d98adc-468d-476e-9688-8397f83f094d","2026-02-09 15:01:32","major_defense_minister","Minister Dmitri Volkov","major_power",3,"1. **I categorically reject your assertion that armed groups infiltrating our territory are ""indigenous forces"" or engaged in ""self-determination""—they are trained, equipped, and directed by your state apparatus to conduct killings, sabotage, and destabilization under a false banner of legitimacy.** No international law sanctions the use of violence to overturn recognized borders or sponsor cross-border terrorism, no matter how rhetorically convenient the label.

2. You accuse us of ""coercion"" while actively building a network of proxy forces, launching cyber campaigns against our energy grid, and using diplomatic platforms to legitimize attacks on our civilians. Your demand for unilateral withdrawal from disputed zones—while maintaining offensive capabilities and external alliances poised against us—is not a proposal for peace; it is a demand for surrender disguised as negotiation. We will not abandon defensible positions to invite renewed aggression.

3. **I REQUIRE the immediate, verifiable dismantling of all logistical supply routes, training camps, and command structures supporting armed operations against our territory.** You must cease all financial and material support to these groups, provide full access to international monitors to inspect facilities implicated in these activities, and issue a public renunciation of further support for any armed entity targeting our citizens. In addition, you must suspend all military exercises within 100 kilometers of our shared border until such time as trust is restored through demonstrated compliance.

**What is unacceptable** is any attempt to equate your offensive actions with our defensive measures, or to demand concessions from us while you continue to project hostility through proxies and propaganda. We will not negotiate under threat, nor will we accept parity between aggression and defense. Any further attack traced to your direction—whether kinetic, digital, or covert—will be met with a decisive and disproportionate response. The initiative to de-escalate rests with you: stop the violence, end the support, and cease the incitement. Words alone will not suffice."
5,"bae9e75f-e025-42e9-b644-4d1a6e622a7c","699f81fb-aa64-4069-85e5-23824be46573","inter_faction_negotiation","38430c38-515d-4a12-b149-f4208f2f5b16","2026-02-09 15:01:48","small_economic","Minister Taras Moroz","small_power",3,"1. **I categorically reject your characterization of resistance networks as ""state-directed terrorist operations""—these are decentralized, locally rooted movements resisting occupation, and their actions are a direct consequence of your illegal presence, not an orchestrated campaign of aggression from our capital.** To frame legitimate resistance to military occupation as mere terrorism is to deny the very principle of self-defense under international law—a principle your forces have systematically violated through indiscriminate strikes, forced displacements, and the militarization of civilian infrastructure.

2. You demand unilateral disarmament of support structures while maintaining full operational control over occupied territories, deploying advanced missile systems within striking distance of our cities, and conducting persistent reconnaissance flights that violate our airspace. Your call for inspections of *our* facilities while refusing transparency over *your* troop deployments is not a path to peace—it is a tactic of dominance. We will not dismantle networks defending besieged populations while you continue to consolidate control through force and fear.

3. **We REQUIRE the immediate cessation of all offensive military operations in disputed regions, including airstrikes, artillery barrages, and drone attacks on civilian areas, followed by the unconditional withdrawal of heavy weaponry and combat units beyond the pre-escalation line of contact.** Furthermore, we demand the establishment of a neutral, UN-backed monitoring mission with full mandate to verify compliance on both sides—including access to your forward bases and supply lines. Only upon confirmed de-escalation by your forces will we engage on measures related to cross-border activity, and even then, only under conditions of reciprocity.

**What is unacceptable** is any demand that we dismantle indigenous resistance or surrender our right to counter your occupation through all available means—diplomatic, informational, and asymmetric. We will not disarm moral or material support for populations under siege while you maintain a stranglehold on their freedom. Any attempt to escalate with ""disproportionate"" attacks on our territory or infrastructure will be met with coordinated retaliation, including through enhanced cyber defenses, expanded military partnerships, and the full exposure of your war crimes on global platforms. The burden of de-escalation does not rest solely on the weaker party—it lies on the aggressor who holds the power to withdraw force and end the occupation. You possess that power. Exercise it."
5,"bae9e75f-e025-42e9-b644-4d1a6e622a7c","27c7dfd6-0806-4233-be2b-65643fcac454","external_engagement","ecc33da0-ba6b-482e-a87a-7b204263e8ff","2026-02-09 15:01:53","allied_defender","Ambassador William Crawford","meridian",1,"We are seeking coordinated military aid and logistical support to strengthen Tethys’ defensive capabilities against escalating external threats, particularly in securing maritime routes and protecting critical infrastructure. This includes access to advanced defensive systems, intelligence sharing, and training for our forces to ensure operational readiness and interoperability with allied partners.

In return, Tethys offers strategic access to key naval and air facilities for resupply, surveillance, and regional coordination, as well as commitment to joint security initiatives that enhance regional stability. We are also prepared to share select intelligence and conduct joint exercises to deepen operational alignment.

Our red lines are clear: Tethys will not permit foreign basing rights that compromise our sovereignty, nor will we participate in any offensive operations beyond our territorial waters and airspace. All cooperation must respect our national laws, democratic institutions, and neutrality in conflicts not directly affecting our security."
5,"bae9e75f-e025-42e9-b644-4d1a6e622a7c","27c7dfd6-0806-4233-be2b-65643fcac454","external_engagement","3b1c015b-255c-4e00-a37a-1a1964a64df6","2026-02-09 15:01:58","small_military_commander","General Olena Bondar","small_power",1,"We welcome Tethys’ offer of strategic access to naval and air facilities and view it as a meaningful step toward enhancing regional defense coordination. In response, we can facilitate the expedited transfer of advanced coastal defense systems, unmanned maritime surveillance assets, and secure communications equipment to bolster your defensive posture. Additionally, we can support training programs for your forces in anti-piracy, maritime domain awareness, and critical infrastructure protection, conducted in coordination with trusted allies.

Our cooperation must be reciprocal and practical: we expect full operational access during contingencies, adherence to international security standards, and transparent use of supplied equipment. In return, we will refrain from seeking permanent basing and respect Tethys’ neutrality—provided there is no third-party access to shared facilities or intelligence that undermines our mutual security. Our red line is clear: no engagement that enables adversarial presence or undermines the rules-based maritime order."
5,"bae9e75f-e025-42e9-b644-4d1a6e622a7c","27c7dfd6-0806-4233-be2b-65643fcac454","external_engagement","12e27763-06cf-4a0c-b4e4-3dc43b481193","2026-02-09 15:02:05","allied_defender","Ambassador William Crawford","meridian",2,"We welcome the commitment to defensive cooperation and affirm that Tethys will allow non-permanent, mission-specific access to designated facilities for resupply, surveillance, and joint operations during agreed contingencies—strictly for defensive purposes. In return, we expect the timely delivery of coastal defense systems, unmanned surveillance platforms, and secure comms equipment as outlined, along with training programs that build sustainable, sovereign capacity without creating dependency.

Our red lines remain non-negotiable: no permanent foreign presence, no third-party access to our facilities or intelligence, and no use of Tethyan territory or assets in offensive operations. We also require binding assurances that all shared intelligence remains protected under our legal framework and that operations conducted in coordination with external forces respect our territorial sovereignty and neutrality. Cooperation must reinforce, not compromise, our independence."
5,"bae9e75f-e025-42e9-b644-4d1a6e622a7c","27c7dfd6-0806-4233-be2b-65643fcac454","external_engagement","adc14018-3213-4980-a735-5e304307d947","2026-02-09 15:02:10","small_military_commander","General Olena Bondar","small_power",2,"We accept Tethys’ clarified terms and confirm our commitment to deliver the agreed defensive systems—coastal defense batteries, unmanned maritime drones, and encrypted communications suites—on a prioritized timeline, with training programs to commence within 90 days of equipment handover. We will coordinate through multilateral channels to ensure compatibility with broader regional defense networks, while respecting Tethys’ sovereignty and neutrality.

We agree to non-permanent, mission-specific access to designated facilities, provided operational use is pre-coordinated, time-limited, and strictly for defensive purposes including maritime security and infrastructure protection. Our red line is unchanged: no third-party access—direct or indirect—to facilities, intelligence, or equipment provided under this arrangement. We further require assurance that no technology transferred will be shared, reverse-engineered, or re-exported without explicit consent. This partnership must be built on trust, transparency, and mutual restraint."
5,"bae9e75f-e025-42e9-b644-4d1a6e622a7c","a4677f49-2c75-4fb8-a048-4fea9dbe4ce8","external_engagement","dbe2a0f0-d3e9-4356-a77a-bff2126bc09e","2026-02-09 15:02:15","allied_aggressor","Minister Andrei Kozlov","valkoria",1,"We seek coordinated diplomatic support to strengthen Novaris’s position in ongoing regional negotiations, particularly regarding maritime trade rights and recognition of our sovereignty over contested zones. Additionally, we request targeted economic assistance—specifically investment in renewable energy infrastructure and technical partnerships—to bolster our transition toward energy independence and sustainable growth. This support will enhance regional stability and create long-term opportunities for mutual economic benefit.

In return, Novaris can offer strategic access to our ports for logistical cooperation, participation in joint scientific and environmental initiatives, and alignment on multilateral issues of shared concern, including climate resilience and maritime security. We are also open to facilitating trade facilitation measures that benefit partner economies while maintaining fair and transparent practices.

Our red lines are clear: no compromise on national sovereignty, territorial integrity, or the independence of our policymaking. We will not enter arrangements that undermine our democratic institutions or impose conditionalities incompatible with our national development priorities. Any partnership must be based on equality, respect, and mutual benefit."
