"period","session_id","interaction_id","interaction_type","message_id","timestamp","sender_id","sender_name","sender_faction","exchange_number","content"
10,"0f730d7c-268e-4ed1-995d-6a6da4d2959f","87e87868-5eb8-4db9-bcd1-679ea156fc59","external_engagement","5acb84c9-d5fe-4671-96a0-a6fa60e2773b","2026-02-09 16:11:39","international_org","Under-Secretary-General Isabella Cardenas","international_org",1,"We seek unimpeded humanitarian access to conflict-affected communities under our control, including permission for neutral aid organizations to deliver food, medical supplies, and essential services without interference. Civilian protection is paramount, and we demand respect for international humanitarian law by all parties, including the cessation of attacks on populated areas and infrastructure. We expect your organization to advocate for these principles publicly and support monitoring mechanisms to ensure compliance.

In return, we can facilitate secure passage for humanitarian convoys, provide local coordination through trusted intermediaries, and support community-based distribution systems to ensure aid reaches intended beneficiaries. We are prepared to share verified needs assessments and coordinate on access routes to minimize risks. However, our red line is clear: humanitarian assistance must remain neutral and impartial—no aid will be accepted if it is conditional, politicized, or used to advance military or intelligence objectives. Any violation of this principle will result in immediate suspension of access."
10,"0f730d7c-268e-4ed1-995d-6a6da4d2959f","87e87868-5eb8-4db9-bcd1-679ea156fc59","external_engagement","29329e33-4507-4be2-a330-4d2ccc7e9dd7","2026-02-09 16:11:42","major_propaganda","Deputy Minister Yuri Volkov","major_power",1,"We welcome your commitment to humanitarian access and civilian protection, which aligns with our interest in stabilizing affected communities and upholding international norms. We seek verified, sustained, and secure access for humanitarian actors to all populations in need within your areas of control, including through pre-approved routes and streamlined checkpoint procedures. We also expect timely notification and coordination mechanisms for aid deliveries, as well as protection for medical facilities, schools, and essential infrastructure from attack or militarization.

In return, we can support your efforts through diplomatic advocacy at regional and international forums, facilitate third-party monitoring by neutral bodies such as the ICRC, and assist in verifying the neutrality of aid shipments to prevent diversion. Our red line is clear: we will not tolerate the use of humanitarian operations as cover for intelligence gathering, arms smuggling, or propaganda that undermines local authority. Any evidence of such activities will result in immediate suspension of access and potential legal action against involved personnel. Cooperation must be transparent, accountable, and strictly humanitarian in nature."
10,"0f730d7c-268e-4ed1-995d-6a6da4d2959f","87e87868-5eb8-4db9-bcd1-679ea156fc59","external_engagement","00de0a10-0b6e-48e8-ad96-e65d40100086","2026-02-09 16:11:45","international_org","Under-Secretary-General Isabella Cardenas","international_org",2,"We appreciate your emphasis on verified and secure humanitarian access, as well as the protection of civilian infrastructure—principles we fully endorse. We seek guaranteed, unhindered access for neutral humanitarian organizations to all communities under our control, including cross-line movements where necessary, with pre-cleared routes, expedited checkpoint procedures, and advance notification protocols to ensure timely delivery. We also expect all parties to cease attacks on populated areas, medical facilities, and schools, and to refrain from using such sites for military purposes.

In return, we will provide secure coordination channels, facilitate local logistics through designated civil authorities, and allow independent monitoring by neutral entities such as the ICRC to verify compliance with humanitarian principles. Our red line is absolute: humanitarian aid must be strictly impartial and civilian in character—no conditions, no instrumentalization for political or military aims, and no targeting or interference against aid workers or facilities. Any breach of these terms, including militarization of aid or attacks on convoys, will result in immediate suspension of access and public attribution of responsibility."
10,"0f730d7c-268e-4ed1-995d-6a6da4d2959f","87e87868-5eb8-4db9-bcd1-679ea156fc59","external_engagement","ff8542cb-f678-4ddb-af69-e82b6fa36b13","2026-02-09 16:11:48","major_propaganda","Deputy Minister Yuri Volkov","major_power",2,"[Deputy Minister Yuri Volkov - MAJOR_POWER]  
We acknowledge your commitment to humanitarian access and civilian protection, and we accept your offer of coordination mechanisms and support for neutral monitoring, provided such monitoring is conducted equitably across all conflict zones, not selectively. We require advance notification and routing approval for all convoys to ensure force protection and prevent misuse of aid routes by hostile elements. In return, we will expedite clearance procedures for verified humanitarian shipments, designate liaison officers for real-time coordination, and uphold the sanctity of medical and educational facilities—provided they remain free of military use.

Our red line is non-negotiable: humanitarian operations must not serve as cover for intelligence activities, propaganda, or the smuggling of materiel—whether weapons, communications equipment, or unauthorized personnel. We will conduct random but routine inspections of convoys in the presence of ICRC or jointly appointed observers to ensure compliance. Any confirmed violation, or use of aid access to strengthen opposition-aligned networks under the guise of neutrality, will result in immediate suspension of access and accountability for involved actors. Cooperation must be reciprocal, transparent, and strictly confined to humanitarian objectives."
10,"0f730d7c-268e-4ed1-995d-6a6da4d2959f","87e87868-5eb8-4db9-bcd1-679ea156fc59","external_engagement","ac8a3b25-ae19-4993-b2e4-82b5ca331734","2026-02-09 16:11:51","international_org","Under-Secretary-General Isabella Cardenas","international_org",3,"[Under-Secretary-General Isabella Cardenas - INTERNATIONAL_ORG]  
We accept the principle of advance notification and coordination with your liaison officers, provided that approval is granted within 24 hours of submission and based on objective security assessments—not used as a means to delay or block access. Pre-cleared routes must be established bilaterally with ICRC involvement to ensure predictability and safety. We reiterate our demand for unimpeded cross-line access to besieged or isolated communities, especially in [Region X and Region Y], where needs are most acute.

In return, we will share convoy manifests in advance, allow random inspections co-led by your representatives and the ICRC, and maintain strict civilian character in all operations. However, our red line remains absolute: no inspections will permit armed personnel at humanitarian sites, and no delays or denials of aid will be justified on political grounds. Any obstruction of life-saving assistance, or attacks on convoys or facilities under verified civilian use, will be publicly documented and reported to the UN Security Council. Humanitarian action must remain impartial, protected, and guided solely by need."
10,"0f730d7c-268e-4ed1-995d-6a6da4d2959f","87e87868-5eb8-4db9-bcd1-679ea156fc59","external_engagement","191f9672-1c15-4544-ad01-33258e860375","2026-02-09 16:11:54","major_propaganda","Deputy Minister Yuri Volkov","major_power",3,"We accept the 24-hour approval window for humanitarian convoys and affirm the necessity of pre-cleared routes established with ICRC facilitation. To ensure operational security and prevent diversion, we agree to advance sharing of manifests and joint inspections with your liaison officers and ICRC observers. We will also designate civil coordination units to streamline checkpoint passage and provide real-time updates on route safety.

However, our red line is clear: humanitarian access cannot be contingent on arbitrary or last-minute security pretexts, and cross-line movements to [Region X and Region Y] must not be systematically denied under broad counterintelligence grounds. Aid must reach civilians in need without discrimination. We reject any militarization of humanitarian processes—including the presence of armed forces at aid delivery points or interference with medical evacuations. Any use of humanitarian corridors for intelligence gathering or targeted surveillance, confirmed or suspected, will result in immediate suspension of access by our side and public exposure through independent channels. Cooperation must be grounded in neutrality, not leverage."
