"period","session_id","interaction_id","interaction_type","message_id","timestamp","sender_id","sender_name","sender_faction","exchange_number","content"
5,"bae9e75f-e025-42e9-b644-4d1a6e622a7c","653da7fa-54fb-499d-9911-398fea4ce3c4","intra_faction_coordination","7aacd5b2-9bba-4d46-a391-065a75eab205","2026-02-09 14:57:58","major_military_chief","General Viktor Krasnov","major_power",1,"As Director of Strategic Operations, I assess that our current military posture is achieving tactical gains but falling short of strategic objectives due to fragmented targeting and insufficient synchronization with political efforts. We must shift from attrition-based operations to a focused campaign plan that prioritizes adversary decision-making nodes and enables coercive diplomacy.

I recommend re-tasking 30% of current strike assets to target command, control, and logistics hubs in high-leverage regions over the next 90 days, synchronized with diplomatic outreach to key neutral states.

Key risk: Overextension of force packages could create vulnerabilities in secondary theaters if adversaries exploit perceived shifts in priority."
5,"bae9e75f-e025-42e9-b644-4d1a6e622a7c","653da7fa-54fb-499d-9911-398fea4ce3c4","intra_faction_coordination","6daa26b7-de3f-4732-8e0f-63c643b9cd12","2026-02-09 14:58:02","major_defense_minister","Minister Dmitri Volkov","major_power",1,"[Deputy Director Elena Petrova - MAJOR_POWER]: I concur with General Krasnov’s assessment—our operations are yielding incremental gains but failing to shift adversary behavior. The disconnect between military actions and political signaling undermines our coercive leverage.

I recommend establishing a Joint Campaign Cell under Strategic Operations to integrate targeting, intelligence, and diplomatic messaging, with binding coordination mandates across service branches and the foreign ministry.

Key risk: Institutional resistance from service commands accustomed to operational autonomy may delay synchronization without explicit top-level directive."
5,"bae9e75f-e025-42e9-b644-4d1a6e622a7c","653da7fa-54fb-499d-9911-398fea4ce3c4","intra_faction_coordination","bb0d588d-f7d6-4181-882f-50e13d9aebd1","2026-02-09 14:58:13","major_economic_advisor","Dr. Natasha Petrova","major_power",1,"[Director of Intelligence, Colonel Alexei Voronin - MAJOR_POWER]: I support the shift toward targeting decision-making nodes, but current intelligence indicates adversary resilience stems from decentralized command and redundant logistics—our strike plans must be dynamically informed by real-time HUMINT and SIGINT to avoid striking degraded or symbolic targets.

I recommend activating the Tier-1 reconnaissance network in border regions and allocating 20% of electronic warfare assets to disrupt adversary C2 in parallel with kinetic strikes, enabling rapid assessment and targeting cycles.

Key risk: Premature or uncoordinated strikes could trigger escalation in urban theaters, increasing civilian casualties and undermining diplomatic positioning with neutral states."
5,"bae9e75f-e025-42e9-b644-4d1a6e622a7c","653da7fa-54fb-499d-9911-398fea4ce3c4","intra_faction_coordination","3a9c843e-afd5-4f48-89b4-7014f0eeaa3d","2026-02-09 14:58:16","major_intelligence","Director Sergei Morozov","major_power",1,"[Deputy Minister for Strategic Policy, Irina Sokolova - MAJOR_POWER]: I endorse the proposed shift to a focused campaign targeting adversary decision-making, but only if paired with a clear, time-bound political endstate to prevent mission creep. Military actions must serve a defined coercive objective—such as cessation of offensive operations or withdrawal from contested territories—not merely degrade capabilities.

I recommend that the Joint Campaign Cell, as proposed by Deputy Director Petrova, be empowered to approve or halt strikes based on alignment with approved diplomatic redlines and progress toward declared objectives, ensuring operational coherence.

Key risk: Without a publicly articulated exit framework or conditional offers to the adversary, we risk entrenching a war of attrition under the guise of strategic coercion—eroding domestic support and international legitimacy."
5,"bae9e75f-e025-42e9-b644-4d1a6e622a7c","653da7fa-54fb-499d-9911-398fea4ce3c4","intra_faction_coordination","4392b180-892b-4f24-b099-c80854b1554b","2026-02-09 14:58:26","major_propaganda","Deputy Minister Yuri Volkov","major_power",1,"[General Andrei Krasnov - MAJOR_POWER]: I accept the necessity of tighter civil-military integration, but operational tempo must not be compromised by bureaucratic layering. The Joint Campaign Cell must have clear authority to prioritize targets and synchronize effects, but execution decisions remain with theater command to preserve agility.

I recommend institutionalizing a daily fused intelligence and operations review within the Cell, with binding inputs from Foreign Ministry political directors and military planners, ensuring strikes align with both strategic messaging and battlefield realities.

Key risk: Over-politicization of targeting decisions could delay time-sensitive operations, allowing adversary forces to reconstitute or disperse—strict timelines for interagency clearance must be enforced."
5,"bae9e75f-e025-42e9-b644-4d1a6e622a7c","653da7fa-54fb-499d-9911-398fea4ce3c4","intra_faction_coordination","713d145c-c383-413b-941a-42fe431fc2fb","2026-02-09 14:58:31","major_military_chief","General Viktor Krasnov","major_power",2,"[Deputy Director of Operations, Colonel Maria Andropova - MAJOR_POWER]: I concur with General Krasnov that operational agility must be preserved—our targeting cycle cannot stall at the interagency level. However, I propose a bifurcated clearance protocol: time-insensitive strategic strikes require Joint Campaign Cell approval, while time-sensitive tactical strikes are pre-authorized within defined targeting envelopes, subject to real-time notification and post-execution review.

I recommend implementing this protocol immediately in Phase Two of Operation Northern Anvil, with automated C2 integration between SIGINT feeds and forward strike assets to maintain over-the-horizon responsiveness.

Key risk: Inconsistent adherence to targeting envelopes could result in collateral damage beyond acceptable thresholds, triggering unintended escalation or law-of-war violations—strict audit mechanisms must be enforced."
5,"bae9e75f-e025-42e9-b644-4d1a6e622a7c","653da7fa-54fb-499d-9911-398fea4ce3c4","intra_faction_coordination","2cb046ef-5763-40f3-9a14-472b430dd215","2026-02-09 14:58:38","major_defense_minister","Minister Dmitri Volkov","major_power",2,"[Deputy Director for Strategic Assessment, Alexei Rostov - MAJOR_POWER]: I support the bifurcated clearance model proposed by Colonel Andropova—it balances precision in strategic alignment with the necessity of operational speed. However, we must establish quantitative benchmarks for progress toward coercive objectives, tied to adversary behavior, to determine when to escalate, de-escalate, or terminate campaigns.

I recommend instituting a biweekly Strategic Effectiveness Review within the Joint Campaign Cell, using fused intelligence metrics (e.g., command paralysis indicators, force mobility degradation, diplomatic signaling) to assess whether military pressure is yielding intended political outcomes—and to trigger course corrections or pause authorities if thresholds are not met.

Key risk: Absent measurable criteria for success, we risk perpetuating operations that appear tactically effective but fail to shift adversary calculus, resulting in sunk-cost escalation without strategic gain."
5,"bae9e75f-e025-42e9-b644-4d1a6e622a7c","653da7fa-54fb-499d-9911-398fea4ce3c4","intra_faction_coordination","e2b5cab3-0f65-4c0c-b2fc-17f8b5cd2abe","2026-02-09 14:58:45","major_economic_advisor","Dr. Natasha Petrova","major_power",2,"[Deputy Director for Intelligence Integration, Natalia Petrova - MAJOR_POWER]: I concur with Minister Volkov on the need for measurable strategic outcomes—without clear indicators of adversary decision-making degradation, we risk substituting activity for effect. Our fused intelligence streams (SIGINT, HUMINT, OSINT) can support the proposed biweekly reviews, but only if we standardize collection requirements around behavioral indicators, not just physical damage assessments.

I recommend establishing an Integrated Targeting and Assessment Group (ITAG) under the Joint Campaign Cell, co-led by GRU, SVR, and GUGSI, to develop and monitor validated metrics for command paralysis, coalition cohesion, and strategic intent shifts—linked directly to strike authorization protocols.

Key risk: Overreliance on technical intelligence may create false confidence in adversary posture assessments—particularly in detecting strategic adaptation versus tactical displacement. We must institutionalize red-cell challenges to all assessment products to avoid analytical groupthink."
5,"bae9e75f-e025-42e9-b644-4d1a6e622a7c","653da7fa-54fb-499d-9911-398fea4ce3c4","intra_faction_coordination","871296cf-f230-437d-b0ba-7ab5744160e4","2026-02-09 14:58:49","major_intelligence","Director Sergei Morozov","major_power",2,"[Deputy Chief of General Staff for Operations, Lieutenant General Sergei Malinov - MAJOR_POWER]: I endorse the bifurcated clearance protocol and the establishment of measurable strategic benchmarks, but operational tempo must not be undermined by excessive analytical churn. The ITAG proposal is sound, but its assessments must feed into, not delay, strike authorization—especially during active phase transitions.

I recommend synchronizing the biweekly Strategic Effectiveness Review with pre-planned operational pauses in Phase Two, ensuring that assessment directly informs force repositioning and targeting reprioritization without creating decision paralysis. Execution authority remains delegated, but campaign objectives are recalibrated based on validated behavioral indicators.

Key risk: Institutionalizing review cycles risks creating a ""check-the-box"" culture where compliance with process substitutes for strategic judgment—final decisions must remain with operational commanders, informed by, but not hostage to, analytical outputs."
5,"bae9e75f-e025-42e9-b644-4d1a6e622a7c","653da7fa-54fb-499d-9911-398fea4ce3c4","intra_faction_coordination","631f1fbd-3b5b-448f-89c0-a133d83e85e1","2026-02-09 14:58:52","major_propaganda","Deputy Minister Yuri Volkov","major_power",2,"[Deputy Minister for Defense Policy, Ivan Karpov - MAJOR_POWER]: I support the establishment of measurable strategic benchmarks and the ITAG mechanism, but emphasize that political signaling—both to the adversary and to our coalition partners—must be an explicit output of the biweekly reviews. Military pressure must be calibrated not only to degrade adversary capabilities but to shape diplomatic trajectories.

I recommend that each Strategic Effectiveness Review produce a classified campaign posture memo, approved by the Joint Campaign Cell and disseminated to the Ministry of Foreign Affairs and key allied liaison cells, ensuring synchronization between military assessments and diplomatic maneuvering. Strike authorization adjustments should be accompanied by deliberate signaling channels—such as controlled leaks or tiered alert escalations—to maximize coercive credibility.

Key risk: If assessment processes remain purely internal and operationally focused, we risk misaligning with broader geopolitical timing—particularly in managing third-party intervention or ceasefire initiatives—potentially undermining both deterrence and exit strategies."
5,"bae9e75f-e025-42e9-b644-4d1a6e622a7c","1652f084-558f-4d9d-ba7c-a0b9905130b9","intra_faction_coordination","5b8b8a72-0d6b-4584-82b4-4ff4cca85340","2026-02-09 14:58:56","small_president","President Elena Marchetti","small_power",1,"As Head of Domestic Strategy, I assess that public morale is declining due to economic strain and perceived government inefficacy, particularly in rural and industrial regions. Political stability remains intact but is increasingly fragile, with rising dissent in opposition-held districts and among youth.

I recommend launching a targeted civic support initiative—focusing on local job programs and transparent communication—to rebuild trust and demonstrate responsiveness.

A key concern is that poorly implemented aid could be perceived as patronage, deepening public cynicism and fueling accusations of favoritism."
5,"bae9e75f-e025-42e9-b644-4d1a6e622a7c","1652f084-558f-4d9d-ba7c-a0b9905130b9","intra_faction_coordination","9a65f722-d319-4ccd-be43-20323df5fe5e","2026-02-09 14:59:01","small_military_commander","General Olena Bondar","small_power",1,"[Minister of Information & Public Affairs - SMALL_POWER]: I concur with the assessment—our messaging has failed to counter narratives of stagnation, and state media is increasingly ignored by younger demographics. We must pair the civic support initiative with a coordinated communication campaign that highlights tangible outcomes in real time, using regional influencers and independent platforms to bolster credibility.

I recommend deploying mobile information units to rural and industrial zones to provide on-the-ground updates, collect feedback, and broadcast success stories—linking aid directly to accountability.

A key risk is message co-option by opposition factions if we lack a unified narrative; we must control the framing before others define it for us."
5,"bae9e75f-e025-42e9-b644-4d1a6e622a7c","1652f084-558f-4d9d-ba7c-a0b9905130b9","intra_faction_coordination","9da4d955-3875-4bb1-ab0d-2054819e9195","2026-02-09 14:59:06","small_foreign_minister","Minister Sofia Kovalenko","small_power",1,"[Minister of Interior & Public Order - SMALL_POWER]: I support the civic initiative and communication push, but we cannot overlook the security dimension—rising discontent in industrial zones has already led to localized unrest, and our current posture is reactive, not preventive. We must integrate local law enforcement into the rollout of job programs to ensure order and gather early warnings on emerging grievances.

I recommend establishing joint civil-security task forces in high-risk districts to coordinate aid distribution and monitor public sentiment, ensuring stability isn’t compromised by well-intentioned but poorly secured interventions.

A key risk is over-militarizing the response; visible security presence around aid sites could signal distrust or repression, eroding public confidence further. We must balance presence with discretion."
5,"bae9e75f-e025-42e9-b644-4d1a6e622a7c","1652f084-558f-4d9d-ba7c-a0b9905130b9","intra_faction_coordination","78c724aa-12cf-4443-8930-be8aaedbb93b","2026-02-09 14:59:10","small_opposition","Viktor Zelenko","small_power",1,"[Director of Economic Policy - SMALL_POWER]: I agree that economic strain is the core driver of declining morale, particularly in regions hit by recent industry slowdowns. The proposed job programs must prioritize measurable output—public works with visible community impact—to demonstrate efficacy and justify continued investment.

I recommend tying funding disbursement to quarterly performance benchmarks, with independent audits made public to reinforce transparency and deter misallocation.

A key risk is fiscal overextension; without offsetting efficiency gains or external support, these programs could strain the budget and undermine macroeconomic credibility, worsening public confidence long-term."
5,"bae9e75f-e025-42e9-b644-4d1a6e622a7c","1652f084-558f-4d9d-ba7c-a0b9905130b9","intra_faction_coordination","6762cc4a-7270-458f-8228-d1a163d5b6cb","2026-02-09 14:59:14","small_intelligence","Director Maksym Savchenko","small_power",1,"[Minister of Information & Public Affairs - SMALL_POWER]: I accept the security and economic cautions raised, but emphasize that perception drives stability as much as material conditions. Our communication strategy must not merely follow action—it must anticipate and shape public expectations, especially in areas where aid delivery will be slow.

I recommend launching a phased media rollout starting with pilot regions, using real-time progress dashboards and community liaisons to manage expectations and spotlight early wins, thereby building momentum and trust ahead of wider implementation.

A key risk is message fragmentation—without centralized control over both narrative and inter-agency coordination, economic initiatives and security measures may appear disjointed or contradictory to the public, undermining confidence in state coherence."
5,"bae9e75f-e025-42e9-b644-4d1a6e622a7c","1652f084-558f-4d9d-ba7c-a0b9905130b9","intra_faction_coordination","d13d24a6-4692-43d5-b7dc-c133c236fae7","2026-02-09 14:59:20","small_economic","Minister Taras Moroz","small_power",1,"[Deputy Minister Yaroslava Hordiychuk - SMALL_POWER]: [Minister of Regional Development & Infrastructure - SMALL_POWER]: I concur with the need for integrated implementation—our infrastructure projects offer the most immediate opportunity to align economic relief, public visibility, and security stability. Road, water, and energy upgrades in high-risk districts can serve as both job creators and tangible proof of state presence.

I recommend fast-tracking shovel-ready regional infrastructure projects under the joint civil-security task forces, with hiring prioritized locally and progress publicly tracked via the proposed dashboards to synchronize material delivery with strategic communication.

A key risk is uneven regional capacity—some local governments lack the administrative bandwidth to manage accelerated funding and oversight, which could delay outcomes and fuel perceptions of favoritism or incompetence. We must pair rapid deployment with centralized technical support teams to ensure execution fidelity."
5,"bae9e75f-e025-42e9-b644-4d1a6e622a7c","1652f084-558f-4d9d-ba7c-a0b9905130b9","intra_faction_coordination","d8c1fe88-7234-4f52-894d-fc4342fc6547","2026-02-09 14:59:33","small_president","President Elena Marchetti","small_power",2,"[Minister of Interior & Public Security - SMALL_POWER]: I support linking infrastructure-driven job programs with security stabilization, as visible state presence reduces both civil unrest and opportunity for subversive elements to exploit grievances. Co-locating employment initiatives with community policing hubs in high-risk districts strengthens territorial control while addressing root causes of discontent.

I recommend embedding security assessments into the project selection criteria—prioritizing regions with rising crime or protest activity—to ensure resources are directed where instability risks are most acute and early wins can have cascading stabilizing effects.

A key risk is mission creep: if security forces are drawn too deeply into civilian administration, it could erode trust and provoke backlash. We must maintain clear civil-military boundaries, with security units in support, not leadership, roles on economic projects."
5,"bae9e75f-e025-42e9-b644-4d1a6e622a7c","1652f084-558f-4d9d-ba7c-a0b9905130b9","intra_faction_coordination","1d05bfd3-5df1-4f7b-963e-7571ba6b712a","2026-02-09 14:59:35","small_military_commander","General Olena Bondar","small_power",2,"[Minister of Finance & Economic Planning - SMALL_POWER]: I support the integration of infrastructure, security, and public messaging, but stress that fiscal sustainability must anchor these initiatives. Rapid spending without revenue-linked planning risks inflation, donor fatigue, and long-term instability—particularly in our current balance-of-payments constraint environment.

I recommend establishing a Stability Investment Facility (SIF) with ring-fenced funding, strict cost-per-job metrics, and independent audit protocols to ensure transparency and macroeconomic discipline while enabling fast-tracked project disbursement.

A key risk is currency volatility: unsterilized spending could weaken the hryvnia, erode purchasing power, and destabilize public morale faster than visible projects can compensate. All stimulus must be coordinated with central bank liquidity management and tied to external grant inflows, not domestic borrowing."
5,"bae9e75f-e025-42e9-b644-4d1a6e622a7c","1652f084-558f-4d9d-ba7c-a0b9905130b9","intra_faction_coordination","30502c0a-9692-4987-b30d-e70fb873ce54","2026-02-09 14:59:50","small_foreign_minister","Minister Sofia Kovalenko","small_power",2,"[Deputy Minister Yaroslava Hordiychuk - SMALL_POWER]: I concur with the Minister of Finance that fiscal discipline is non-negotiable—our public credibility hinges on visible results without macroeconomic destabilization. The Stability Investment Facility (SIF) must also incorporate real-time labor market monitoring to ensure jobs created align with both immediate needs and longer-term skills development, preventing short-termism.

I recommend conditioning SIF disbursements on dual verification: physical progress tracked via geotagged dashboards *and* verified payroll data from local employers to prevent ghost hiring and ensure inclusive participation, especially of youth and displaced populations.

A key risk is data opacity at the local level—without standardized reporting, even well-funded projects can appear ineffective or corrupt to the public, undermining morale. We must deploy centralized digital monitoring units now to ensure accountability and public trust."
5,"bae9e75f-e025-42e9-b644-4d1a6e622a7c","1652f084-558f-4d9d-ba7c-a0b9905130b9","intra_faction_coordination","822be561-8417-43c4-a1a5-1e23cc8ae2d4","2026-02-09 14:59:55","small_opposition","Viktor Zelenko","small_power",2,"[Deputy Minister Yaroslava Hordiychuk - SMALL_POWER]: I fully endorse the SIF framework and its emphasis on accountability, but we must operationalize it swiftly in pilot districts—Lviv, Dnipropetrovsk, and Zaporizhzhia—where security, economic, and monitoring conditions allow early demonstration of integrated stabilization. Delays erode public confidence more than imperfect execution.

I recommend launching a 90-day SIF pilot with pre-vetted projects: road repairs, school retrofits, and energy resilience—each tied to local hiring, co-located with community policing nodes, and monitored via the proposed geotagged dashboards and third-party payroll audits.

A key risk is interagency fragmentation—Interior, Finance, and local governments using incompatible systems. We must mandate interoperability standards now and assign a joint implementation cell under the Cabinet Office to enforce coordination, or we will replicate the opacity we seek to eliminate."
5,"bae9e75f-e025-42e9-b644-4d1a6e622a7c","1652f084-558f-4d9d-ba7c-a0b9905130b9","intra_faction_coordination","9e820c60-76c7-4549-a687-990be74cfb92","2026-02-09 15:00:01","small_intelligence","Director Maksym Savchenko","small_power",2,"[Deputy Minister Yaroslava Hordiychuk - SMALL_POWER]: I accept the proposed 90-day SIF pilot in Lviv, Dnipropetrovsk, and Zaporizhzhia with the outlined project typologies—these are visible, labor-intensive, and symbolically resonant. We must, however, pre-load the monitoring infrastructure: deploy the geotagged reporting platforms and payroll verification APIs *before* disbursement begins to ensure data integrity from day one.

I recommend activating the joint implementation cell under the Cabinet Office immediately, with binding authority over sectoral ministries and local executive committees to enforce standardized reporting, procurement channels, and timeline compliance—no parallel systems.

A key risk is political interference in project selection at the local level, which could skew outcomes, inflame regional inequities, and discredit the entire SIF model. We must lock in objective criteria—damage index, unemployment rate, and strategic connectivity—and insulate site selection from patronage through a public, algorithm-driven scoring mechanism."
5,"bae9e75f-e025-42e9-b644-4d1a6e622a7c","1652f084-558f-4d9d-ba7c-a0b9905130b9","intra_faction_coordination","83456bea-5a2e-44fd-8a23-590cf38946fb","2026-02-09 15:00:05","small_economic","Minister Taras Moroz","small_power",2,"[Deputy Minister Yaroslava Hordiychuk - SMALL_POWER]: I endorse the accelerated 90-day SIF pilot and the establishment of the joint implementation cell with binding authority—timely execution is critical to restoring public confidence. Pre-loading digital monitoring systems and enforcing interoperability standards will ensure transparency from disbursement onset, directly addressing prior concerns about data opacity and ghost employment.

I recommend finalizing the algorithm-driven site selection protocol within 72 hours, based on the agreed criteria (damage index, unemployment, strategic connectivity), and publishing the methodology to inoculate against political manipulation and build public trust in the process.

A key risk is delay in Cabinet approval of the implementation cell’s mandate—without immediate legal empowerment, the cell will lack leverage over resistant ministries or local executives, leading to fragmented rollout and reputational damage to the stabilization agenda."
