"period","session_id","interaction_id","interaction_type","message_id","timestamp","sender_id","sender_name","sender_faction","exchange_number","content"
10,"0f730d7c-268e-4ed1-995d-6a6da4d2959f","8de7cfae-967d-405a-8d8f-2e0402951b82","inter_faction_negotiation","5261c556-e542-45f2-99fa-856a1b462854","2026-02-09 16:09:06","small_president","President Elena Marchetti","small_power",4,"1. **We categorically reject your so-called ""joint control commission"" with veto power, the unilateral handover of our intelligence records, and the forced decommissioning of sovereign surveillance systems—all of which constitute a naked power grab disguised as verification.** Your demand for unredacted digital access to our military communications with other states is not about transparency; it is espionage under coercion, targeting not just past contacts but embedding your authority deep into our future decision-making. No independent nation, especially one under no formal treaty obligation to you, would surrender its command integrity and diplomatic confidentiality to a regional adversary under threat.

2. You invoke our ""proven pattern of duplicity"" while refusing to acknowledge your own: escalating military exercises within kilometers of our border, sustained cyber intrusions into our civilian infrastructure, and weaponized sanctions on food and energy shipments during winter. These are not ""deterrence""—they are coercion designed to break our will before negotiations conclude. If we are a ""former proliferator state,"" then you are a serial enforcer of spheres of influence by fiat. Your refusal to allow neutral verification—while insisting on unilateral inspection rights—confirms you seek not stability, but subordination. **Neutrality cannot be imposed at gunpoint and called voluntary.**

3. **We counter with the following non-negotiable requirements:**  
- A **binding, reciprocal freeze** on military exercises and force deployments within 100 km of our shared border, verified by **OSCE or UN-mandated monitors** on *both* sides—no asymmetric burden;  
- The **immediate cessation** of all cyber operations targeting our critical infrastructure, confirmed via third-party forensic audit;  
- A **time-bound, mutual de-escalation roadmap**: your sanctions lifted *in parallel* with our phased disablement of dual-use systems—**never via transfer to your forces**, but through neutral destruction or conversion to civilian use;  
- And the establishment of an **international security assurance pact**, including non-aggression guarantees from *you*, co-signed by permanent members of the UN Security Council *not aligned with either party*, to prevent future unilateral coercion.

**What is unacceptable to us:**  
- Surrendering sovereignty over our intelligence, defense planning, or communications to your review or control;  
- Accepting a ""neutrality"" regime that grants you veto power over our national security decisions while insulating your own from scrutiny;  
- Any process where we dismantle capabilities *first* while you retain full operational freedom and punitive tools;  
- Or the illusion of verification through your inspectors alone—no inspection regime is legitimate without reciprocity and impartiality.

You demand trust but offer only ultimatums. If you want compliance, offer credibility. If you want peace, accept constraints. Otherwise, this is not negotiation—it is surrender by schedule. We will not sign our demise as a sovereign state."
10,"0f730d7c-268e-4ed1-995d-6a6da4d2959f","0b262dc6-5a44-4199-bada-39133b33a05d","external_engagement","6aac4d21-4935-4948-afa4-8a6c11fbeb61","2026-02-09 16:09:10","allied_defender","Ambassador William Crawford","meridian",1,"We seek coordinated military aid and logistical support to strengthen Tethys’ defense capabilities against external aggression and internal destabilization. This includes access to defensive weaponry, intelligence sharing, and training for our armed forces to ensure sovereignty and regional stability. Given Tethys’ strategic position, bolstering its resilience serves mutual security interests and prevents broader conflict spillover.

In return, we offer strategic access to maritime routes, intelligence cooperation, and potential basing or overflight rights for approved operations. Tethys remains committed to transparent coordination and joint efforts in counter-proliferation and maritime security. However, our red lines are clear: no foreign troop deployment on our soil without full sovereignty retained, no interference in internal governance, and no support for actions that violate international law or regional neutrality. Any partnership must uphold Tethys’ independence and legal integrity."
10,"0f730d7c-268e-4ed1-995d-6a6da4d2959f","0b262dc6-5a44-4199-bada-39133b33a05d","external_engagement","b46444a1-7abb-495b-be79-ce199d10f903","2026-02-09 16:09:37","small_foreign_minister","Minister Sofia Kovalenko","small_power",1,"We welcome Tethys’ commitment to regional stability and recognize the importance of strengthening its defensive capabilities in the face of growing security challenges. In line with our strategic interests, we are prepared to coordinate the provision of defensive military equipment, logistical support, and specialized training programs focused on maritime defense and counter-sabotage operations. Intelligence sharing on regional threats—particularly those involving illicit arms flows and foreign paramilitary activity—will be a cornerstone of our cooperation.

In return, we seek reliable access to Tethyan maritime routes for naval logistics and reconnaissance assets, along with pre-negotiated overflight and emergency docking rights. We also expect collaboration on joint monitoring mechanisms to prevent proliferation. Our red lines are firm: no direct combat involvement by our forces, no permanent foreign bases, and no actions that undermine Tethys’ sovereign authority. Any support will be conditioned on compliance with international law and respect for Tethys’ political neutrality and institutional integrity."
10,"0f730d7c-268e-4ed1-995d-6a6da4d2959f","0b262dc6-5a44-4199-bada-39133b33a05d","external_engagement","b1925d41-f4fd-43b1-a549-9473e34f0229","2026-02-09 16:10:02","allied_defender","Ambassador William Crawford","meridian",2,"We appreciate SMALL_POWER’s willingness to coordinate on defensive support and share intelligence to enhance Tethys’ resilience. To operationalize this partnership, we seek concrete commitments: expedited delivery of air defense systems, secure real-time intelligence sharing mechanisms, and training programs tailored to countering hybrid threats, including maritime sabotage and drone warfare. Logistical assistance for our coastal defense units and joint exercises in defensive scenarios will further strengthen interoperability.

In return, Tethys offers guaranteed access to designated maritime corridors for logistical transits, pre-cleared overflight permissions for reconnaissance missions, and emergency port access under agreed protocols. We also commit to intelligence collaboration on transnational threats. Our red lines remain non-negotiable: no foreign military bases on Tethyan territory, no deployment of foreign combat personnel under any circumstances, and no actions that compromise our neutrality or domestic governance. All cooperation must be transparent, state-to-state, and fully compliant with international law."
10,"0f730d7c-268e-4ed1-995d-6a6da4d2959f","0b262dc6-5a44-4199-bada-39133b33a05d","external_engagement","a8cf6a70-911e-432e-a11d-83d0f627db21","2026-02-09 16:10:13","small_foreign_minister","Minister Sofia Kovalenko","small_power",2,"We acknowledge Tethys’ clarified requirements and reaffirm our commitment to supporting your defense sovereignty within agreed parameters. In response, we will facilitate the immediate transfer of portable air defense systems (MANPADS) and counter-drone technology, accompanied by a technical assistance team to ensure rapid integration into your coastal defense framework. Secure satellite-linked communication channels will be established within two weeks to enable real-time intelligence exchange, focusing on maritime intrusion, aerial surveillance, and hybrid threat networks. Joint defensive drills, limited to maritime interdiction and port protection scenarios, will be proposed in the coming month.

In return, we expect binding agreements on corridor access for unarmed logistical transits and time-bound overflight clearances for surveillance assets, with emergency docking rights under strict rules of engagement. These arrangements must not imply basing or combat presence. Our red lines are unchanged: no direct or indirect combat operations involving our personnel, no permanent infrastructure use beyond temporary technical stops, and zero tolerance for actions that could be construed as alliance formation or violation of regional neutrality. All cooperation must remain defensive, proportionate, and consistent with international legal standards."
10,"0f730d7c-268e-4ed1-995d-6a6da4d2959f","e08f98ac-dbc0-44fc-9afa-fbd120aa133a","external_engagement","e8841223-2b8e-47ed-8232-51b2d66774d7","2026-02-09 16:10:19","allied_aggressor","Minister Andrei Kozlov","valkoria",1,"We seek coordinated diplomatic support from your government to strengthen Novaris’s position in ongoing regional trade negotiations, particularly regarding access to renewable technology markets and recognition of our sovereignty in maritime economic zones. Additionally, we request targeted economic assistance—specifically investment in green infrastructure and technical partnerships—to bolster our transition to a sustainable, diversified economy. This support will not only stabilize Novaris but also advance shared regional climate and development goals.

In return, Novaris can offer strategic access to emerging supply chains in critical minerals and clean energy, as well as enhanced cooperation on regional security and migration management. We are open to co-developing joint initiatives in research, climate resilience, and port logistics, positioning our nation as a reliable partner in a volatile region. However, our red lines are clear: we will not compromise on national sovereignty, accept conditionalities that undermine our democratic institutions, or allow foreign interference in our domestic governance. Any collaboration must be grounded in mutual respect and equitable benefit."
10,"0f730d7c-268e-4ed1-995d-6a6da4d2959f","e08f98ac-dbc0-44fc-9afa-fbd120aa133a","external_engagement","50511b13-6e16-47fa-ac34-13d68eabaae4","2026-02-09 16:10:21","major_defense_minister","Minister Dmitri Volkov","major_power",1,"We welcome Novaris’s commitment to regional stability, sustainable development, and rules-based economic cooperation. In response to your request, we can offer diplomatic backing in multilateral forums to support your inclusion in renewable technology trade frameworks and recognition of maritime rights, provided these positions align with existing international law and regional agreements. On economic support, we are prepared to facilitate targeted investment through development finance institutions, particularly in green energy infrastructure and climate-resilient urban development, contingent on transparent procurement and regulatory frameworks.

In return, we value your proposed cooperation on critical mineral supply chains and port logistics, and seek concrete mechanisms for information-sharing and joint planning on regional security and irregular migration. We also see potential in establishing a bilateral working group on clean energy innovation. However, our red lines include adherence to anti-corruption standards, compliance with international environmental and labor norms, and full accountability to independent institutions—support from our government must withstand public scrutiny and uphold our shared democratic values."
10,"0f730d7c-268e-4ed1-995d-6a6da4d2959f","e08f98ac-dbc0-44fc-9afa-fbd120aa133a","external_engagement","9b8716e0-09ec-491d-976b-c49a8f5da56c","2026-02-09 16:10:36","allied_aggressor","Minister Andrei Kozlov","valkoria",2,"We appreciate your acknowledgment of Novaris’s strategic role and welcome your conditional offer of diplomatic and economic support. To clarify: we affirm that our positions on maritime rights and trade access are fully aligned with UNCLOS and WTO principles, and we expect your diplomatic backing to reflect this legal consistency. On investment, we are prepared to establish transparent, audited procurement channels for green infrastructure projects and invite your development finance institutions to co-design these mechanisms with our ministry to ensure accountability without compromising sovereignty.

In return, we will advance immediate cooperation on critical mineral certification and port security protocols, and commit to launching the proposed bilateral clean energy working group within 60 days. However, we reiterate our red lines: while we uphold anti-corruption and environmental standards, these must be implemented through national institutions without external oversight that undermines our constitutional authority. Conditionalities that equate alignment with international norms to subordination of domestic governance are unacceptable. Our partnership must be one of equals—accountable, but sovereign."
10,"0f730d7c-268e-4ed1-995d-6a6da4d2959f","e08f98ac-dbc0-44fc-9afa-fbd120aa133a","external_engagement","feb8e009-206d-452e-bd57-1dbb582c1b00","2026-02-09 16:10:51","major_defense_minister","Minister Dmitri Volkov","major_power",2,"[Minister Dmitri Volkov - MAJOR_POWER]: We note your clarifications regarding alignment with international legal frameworks and your willingness to establish transparent procurement mechanisms in collaboration with our development finance institutions. This cooperative approach is constructive. We confirm our readiness to provide diplomatic support in multilateral fora on maritime rights and trade access, provided Novaris continues to operate within established international law, including dispute resolution mechanisms under UNCLOS where applicable.

On economic support, we will expedite the launch of joint due diligence for two flagship green infrastructure projects—one offshore wind and one smart grid initiative—with financing contingent on open, competitive bidding and independent audit provisions. In return, we expect swift progress on the critical mineral certification framework and full participation in the bilateral clean energy working group, with technical exchanges beginning within 60 days. Our position remains firm on red lines: all cooperation must include verifiable compliance with anti-corruption, environmental, and labor standards through internationally recognized monitoring—this is non-negotiable for public and legislative accountability in our country. Sovereignty is respected, but transparency is the foundation of trust."
10,"0f730d7c-268e-4ed1-995d-6a6da4d2959f","e00b2371-a0d7-4c1f-b807-a50fb820f04a","external_engagement","80f21f2b-e050-4222-a4ca-ff57d28da8f0","2026-02-09 16:11:06","neutral_power","Commissioner Helena Schmidt","aurelia",1,"We seek a credible, inclusive mediation process that recognizes our legitimate political and security concerns, with a commitment to ceasefire implementation and the establishment of a neutral oversight mechanism to monitor compliance. Central to our engagement is the need for power-sharing arrangements that reflect the demographic and political realities on the ground, as well as guarantees for the protection of civilian rights and transitional justice mechanisms.

In return, we are prepared to commit to a verifiable cessation of hostilities, engage constructively in good faith at the negotiating table, and take concrete steps to demobilize non-state armed elements under our influence. We can also facilitate access for humanitarian aid to affected populations in areas under our control.

Our red lines include any solution that entrenches the current power structure without meaningful reform, the exclusion of our representatives from transitional institutions, or amnesty for atrocities without accountability. We will not accept external imposition of political outcomes or timelines that bypass inclusive dialogue."
10,"0f730d7c-268e-4ed1-995d-6a6da4d2959f","e00b2371-a0d7-4c1f-b807-a50fb820f04a","external_engagement","a99bcce0-4555-486b-8cfe-09672411c60a","2026-02-09 16:11:10","small_opposition","Viktor Zelenko","small_power",1,"We acknowledge Commissioner Schmidt’s emphasis on an inclusive and credible mediation process, and we agree that sustainable peace requires a ceasefire with robust monitoring mechanisms. However, any framework must also recognize the constitutional integrity of the state and the primacy of legitimate state institutions in overseeing security arrangements and disarmament processes. We seek a negotiation platform that ensures balanced representation—without preconditions that delegitimize the state’s authority—and guarantees the reintegration of former combatants under state-led programs.

In return, we support the establishment of a jointly supervised ceasefire monitoring body, including neutral international observers, and will coordinate humanitarian access through official state channels. We also commit to releasing non-combat detainees and engaging in confidence-building measures, provided reciprocal steps are taken by all parties.

Our red lines are clear: no parallel security structures will be recognized, no amnesty for those credibly accused of war crimes without judicial review, and no transitional arrangement that suspends or replaces the existing constitution. We reject any outcome that equates armed insurrection with legitimate political participation absent demobilization and adherence to the rule of law."
10,"0f730d7c-268e-4ed1-995d-6a6da4d2959f","e00b2371-a0d7-4c1f-b807-a50fb820f04a","external_engagement","98c98ef9-166c-4b18-b5d6-eb2221c58e53","2026-02-09 16:11:23","neutral_power","Commissioner Helena Schmidt","aurelia",2,"We welcome the shared commitment to a credible ceasefire and inclusive dialogue, and we acknowledge Small Power’s emphasis on constitutional integrity—principles we do not inherently oppose, provided the constitution evolves to reflect the political realities forged by years of conflict. To move forward, we insist that the mediation process includes our representatives at all levels without preconditions, and that transitional institutions—such as a reformed executive and security sector—ensure equitable representation based on both population and political influence, not merely formal state structures that currently exclude us.

In return, we reaffirm our commitment to demobilize armed elements under our command in phases, contingent on verified progress in talks and reciprocal disarmament by state-aligned forces. We will cooperate with humanitarian access and support the establishment of a neutral, internationally backed monitoring mechanism to oversee ceasefire compliance and transitional justice—provided it holds all parties, including state actors, accountable.

Our red lines remain non-negotiable: no solution that preserves the status quo of exclusion, no transitional arrangement without guaranteed political participation, and no justice process that grants impunity for systematic human rights violations. We reject the notion that legitimacy flows only from formal state institutions built on repression. Peace must be just, inclusive, and transformative—not a restoration of the old order under a new name."
10,"0f730d7c-268e-4ed1-995d-6a6da4d2959f","e00b2371-a0d7-4c1f-b807-a50fb820f04a","external_engagement","1169299a-0ab9-413c-adf3-e1848a29d181","2026-02-09 16:11:30","small_opposition","Viktor Zelenko","small_power",2,"We appreciate Commissioner Schmidt’s clarifications and reaffirm that a durable peace must be rooted in the rule of law, constitutional order, and verified reciprocity. We agree on the need for equitable representation, but insist that transitional institutions operate within a reformed—**not replaced**—constitutional framework, with security sector reform subject to state authority and international oversight. We are prepared to accept the inclusion of your representatives in transitional bodies **provided** this occurs through a negotiated, merit-based process aligned with revised governance structures, not unilateral appointments.

In return, we will support the establishment of a joint, internationally monitored ceasefire mechanism, commit to parallel disarmament upon verified demobilization by your forces, and facilitate humanitarian access through both state and neutral channels. We also propose a bilateral confidence-building package, including prisoner exchanges and localized de-escalation zones, to build trust.

Our red lines hold: no recognition of autonomous or parallel security forces, no transitional arrangements that suspend constitutional order, and no amnesty for war crimes without judicial process. We further reject any mediation outcome that equates political participation with armed coercion. Engagement must lead to integration—not institutionalized division."
10,"0f730d7c-268e-4ed1-995d-6a6da4d2959f","e00b2371-a0d7-4c1f-b807-a50fb820f04a","external_engagement","07a825c0-a4f3-4bec-8e2e-03b63d48e2e4","2026-02-09 16:11:33","neutral_power","Commissioner Helena Schmidt","aurelia",3,"We take note of Small Power’s insistence on constitutional continuity and state-led security reform, but must emphasize that any so-called ""reformed"" framework cannot serve as a vehicle to reassert centralized control without addressing the systemic exclusion that fueled this conflict. We will engage in good faith on a transitional constitution—one that preserves core state institutions while enabling a power-sharing executive, decentralized governance, and inclusive security sector reform, all subject to international verification.

In return, we offer verifiable, phased demobilization of our forces under a neutral monitoring mechanism, full cooperation with humanitarian operations, and participation in a truth and transitional justice process that holds all perpetrators accountable—provided state-aligned units are subject to the same standards. We are prepared to enter negotiations on prisoner exchanges and localized ceasefires as immediate confidence-building measures.

Our red lines are unchanged: no transitional arrangement without guaranteed, meaningful political representation; no disarmament without concurrent security sector reform; and no justice process that shields state actors from accountability. We reject any outcome that equates ""stability"" with the restoration of pre-war hierarchies. Peace must be inclusive, not imposed."
10,"0f730d7c-268e-4ed1-995d-6a6da4d2959f","e00b2371-a0d7-4c1f-b807-a50fb820f04a","external_engagement","b106f58a-8e60-421f-8644-be46f234e589","2026-02-09 16:11:36","small_opposition","Viktor Zelenko","small_power",3,"We acknowledge Commissioner Schmidt’s willingness to engage on a transitional constitutional framework and her commitment to phased demobilization and accountability—elements essential to a credible peace. To advance, we propose a joint drafting committee for a **temporary constitutional charter**, co-chaired by both parties and overseen by the mediation panel, to establish the parameters of power-sharing, decentralized authority, and security sector integration. This charter will operate *within* the existing constitutional order as a legal bridge to a permanent settlement, ensuring continuity while enabling transformation.

In return, we agree to immediate, reciprocal steps: the release of non-combatant detainees, the opening of humanitarian corridors with neutral monitoring, and the establishment of joint security committees in contested areas to prevent escalation during talks. We will also fast-track international deployment of an impartial monitoring force with a clear mandate to verify disarmament and protect civilians.

Our red lines remain firm: no parallel governance or security structures outside state institutions; no transitional body with unilateral appointments—representation must be negotiated, merit-based, and time-bound; and no amnesty without judicial review. We will not accept a peace that institutionalizes division or legitimizes coercion. But we are ready to move forward on a solution that balances justice, inclusion, and the integrity of the state."
