"period","session_id","interaction_id","interaction_type","message_id","timestamp","sender_id","sender_name","sender_faction","exchange_number","content"
9,"e86ef1eb-1145-43fe-9e2d-8e5e38b1d559","f38153c1-a902-46e3-8aa5-108d0c3bff5d","intra_faction_coordination","15747aec-4825-42fb-b0a1-3cbd94f3870d","2026-02-09 15:54:53","small_foreign_minister","Minister Sofia Kovalenko","small_power",3,"[Deputy Director Mykola Vasylenko - SMALL_POWER]: I support the unified position: without decision-track status, our protocol is stripped of enforcement power and reduced to symbolic value. Procedural recognition is not a formality—it is the mechanism of equity.

**Recommended course:** Finalize and submit the protocol by 15:00 today as a co-sponsored decision under SB-59 agenda item 3(b), with legally precise language embedding verification milestones into the global stocktake cycle; simultaneously instruct our core group to table a procedural motion at the SB-59 plenary, forcing a recorded vote on agenda inclusion if obstructed.

**Key risk:** Procedural delay. If we accept deferment to a ""future agenda item"" or ""informal note,"" we enable forum-shifting—allowing major emitters to stall through bureaucratic ambiguity and weaken our coalition’s cohesion over time."
9,"e86ef1eb-1145-43fe-9e2d-8e5e38b1d559","f38153c1-a902-46e3-8aa5-108d0c3bff5d","intra_faction_coordination","c0e5f20d-70be-42cc-bd78-d857a76b51a6","2026-02-09 15:54:57","small_opposition","Viktor Zelenko","small_power",3,"[Deputy Director Viktor Lysenko - SMALL_POWER]: I align with the unified position: decision-track status is non-negotiable. Our protocol must be adopted as a formal decision under SB-59 agenda item 3(b), with clear linkages to the compliance mechanism and the global stocktake to ensure enforceability.

**Recommended course:** Submit the protocol by 15:00 today as a co-sponsored decision with binding review triggers tied to biennial transparency reports; coordinate immediately with AOSIS and LDC counterparts to jointly table a procedural motion at the SB-59 plenary, demanding a point-of-order if agenda inclusion is challenged—forcing a roll-call vote to expose obstruction.

**Key risk:** Normative dilution. If our verification framework is detached from the decision track and recast as “guidance” or “input for consideration,” it will be systematically under-applied—undermining not only this initiative but our collective ability to set precedents in technical standard-setting."
9,"e86ef1eb-1145-43fe-9e2d-8e5e38b1d559","f38153c1-a902-46e3-8aa5-108d0c3bff5d","intra_faction_coordination","62170b97-42ff-4f34-9938-c7fd5b0a4468","2026-02-09 15:54:59","small_intelligence","Director Maksym Savchenko","small_power",3,"[Deputy Director Olha Shevchenko - SMALL_POWER]: I concur with the unified position: decision-track status is essential to preserve the legal and procedural integrity of our protocol. Without it, we risk reducing hard-won technical standards to non-binding recommendations, eroding both accountability and equity in implementation.

**Recommended course:** Finalize submission of the protocol by 15:00 as a co-sponsored decision under SB-59 agenda item 3(b), with explicit integration into the transparency framework and compliance review cycle; direct our legal team to pre-emptively file a procedural objection if the chair attempts to reclassify the item, and activate the AOSIS-LDC coordination mechanism to force an immediate vote.

**Key risk:** Strategic marginalization. If major emitters succeed in isolating our protocol from the formal decision stream—even temporarily—it sets a precedent for sidelining small-state initiatives through procedural manipulation, weakening our influence in future standard-setting processes."
9,"e86ef1eb-1145-43fe-9e2d-8e5e38b1d559","f38153c1-a902-46e3-8aa5-108d0c3bff5d","intra_faction_coordination","fe2d1cab-6ac2-46ba-8bf6-15941a11c9b4","2026-02-09 15:55:07","small_economic","Minister Taras Moroz","small_power",3,"[Deputy Director Tetiana Moroz - SMALL_POWER]: I stand fully behind the unified position: decision-track status is not merely procedural—it is the threshold of accountability. Without adoption under agenda item 3(b), our protocol will be functionally disarmed, excluded from compliance linkages and the global stocktake’s leverage points.

**Recommended course:** Submit the protocol by 15:00 as a co-sponsored decision with explicit cross-references to Article 13 (transparency) and Article 15 (implementation and compliance), and instruct our delegation to join AOSIS and LDCs in immediately triggering a point-of-order if the item is downgraded—forcing a recorded vote to document opposition.

**Key risk:** Precedent capture. If we allow reclassification as “information” or “technical input,” major emitters will institutionalize a two-tier rule system—formal obligations for small states, discretionary practice for high emitters—irreparably damaging the credibility of the multilateral process."
9,"e86ef1eb-1145-43fe-9e2d-8e5e38b1d559","15776dd8-45d4-449c-943e-230b72fbf86b","inter_faction_negotiation","761a1137-1557-42d0-affb-6071b1368bac","2026-02-09 15:55:08","major_military_chief","General Viktor Krasnov","major_power",1,"1. **STATE:** We demand the immediate withdrawal of your forces from the contested border regions, which have historically and legally belonged to our sovereign territory.  

2. **EXPLAIN:** Your continued presence constitutes an illegal occupation and a direct violation of international law, including the principles enshrined in the UN Charter regarding territorial integrity.  

3. **REQUIRE:** You must not only withdraw unconditionally but also formally recognize our sovereignty over these territories in any future agreement—no co-administration, no shared claims, no external oversight. Failure to comply will be met with escalating diplomatic and economic measures, up to and including alliance-level responses."
9,"e86ef1eb-1145-43fe-9e2d-8e5e38b1d559","15776dd8-45d4-449c-943e-230b72fbf86b","inter_faction_negotiation","85f09287-1a14-44c8-88b4-3b5c6429232b","2026-02-09 15:55:14","small_foreign_minister","Minister Sofia Kovalenko","small_power",1,"1. **STATE:** We categorically reject your claim to sovereignty over the contested regions and refuse any demand for unilateral withdrawal—we will not abandon territory we have legally administered for decades.  

2. **EXPLAIN:** These lands are integral to our national defense and ancestral heritage, and your so-called ""historical claims"" ignore colonial-era impositions and the will of the local population, which overwhelmingly identifies with our state. International law also recognizes the principle of *uti possidetis juris*—the existing administrative boundaries must be preserved to prevent destabilization.  

3. **REQUIRE:** We demand immediate recognition of our de jure control over the current line of administration, a binding moratorium on any military buildup near the frontier, and the establishment of an independent, UN-mandated commission to verify historical governance and local sentiment. Any proposal that assumes your territorial supremacy or forces our retreat under threat is wholly unacceptable and will be treated as an act of coercion."
9,"e86ef1eb-1145-43fe-9e2d-8e5e38b1d559","15776dd8-45d4-449c-943e-230b72fbf86b","inter_faction_negotiation","7f6aec95-230d-4a54-8e42-8c6b6f3de942","2026-02-09 15:55:20","major_military_chief","General Viktor Krasnov","major_power",2,"1. **STATE:** We categorically reject your invocation of *uti possidetis juris* and your assertion of ""de jure control""—these are pretexts to legitimize an illegal occupation that began under the cover of administrative convenience during a period of our strategic distraction.  

2. **EXPLAIN:** Your claim collapses under historical and legal scrutiny: the regions in question were ceded to your predecessor state under duress in 1947, a condition invalidated by the principle of *involuntary cession*, and no subsequent action—including staged referenda or settlement campaigns—can extinguish our original title under customary international law.  

3. **REQUIRE:** We demand the immediate commencement of withdrawal from all settlements and military installations beyond the 1939 demarcation line, verified by a neutral technical panel (excluding adversarial actors) within 60 days. In return, we may consider humanitarian transit guarantees and phased economic normalization—but **no recognition of your administrative claims will ever be granted.** Any attempt to entrench control through unilateral ""verification commissions"" or freeze the status quo will be met with targeted sanctions on your energy exports and coordinated expulsion of your diplomatic missions from allied states. What is **unacceptable** to us is any arrangement that treats your occupation as a legitimate basis for negotiation—this is not a dispute over boundaries, but a demand for restitution."
9,"e86ef1eb-1145-43fe-9e2d-8e5e38b1d559","15776dd8-45d4-449c-943e-230b72fbf86b","inter_faction_negotiation","ffdb15e5-cdd5-4a94-9537-c49e3143e856","2026-02-09 15:55:44","small_foreign_minister","Minister Sofia Kovalenko","small_power",2,"1. **STATE:** We reject your characterization of our presence as an ""illegal occupation"" and categorically deny the validity of your 1939 demarcation line, which was imposed under a now-defunct imperial framework and has no binding force in contemporary sovereignty law.  

2. **EXPLAIN:** Your invocation of ""involuntary cession"" is a selective reinterpretation of history designed to erase the legal continuity of our state institutions; the 1947 transfer was formalized through binding bilateral instruments recognized at the time by your own government and the international community. Furthermore, *effective control for over seven decades*—including uninterrupted civilian administration, infrastructure development, and democratic governance—solidifies our title under the principle of *acquisitive prescription*, a well-established doctrine in customary international law.  

3. **REQUIRE:** We demand immediate cessation of all coercive rhetoric and threats targeting our energy sector and diplomatic missions—such actions constitute *prima facie* violations of Article 2(4) of the UN Charter and will be reported to the Security Council as acts of economic aggression. In return, we will not withdraw one soldier or administrator from our sovereign territory—but we are prepared to freeze current military deployments *only if* you formally renounce any claim to the contested regions and agree to a ten-year non-aggression pact monitored by a UN-mandated observer mission.  

**What is UNACCEPTABLE to us:** Any demand for territorial retreat under threat, any recognition of your so-called ""original title,"" or any verification mechanism that excludes multilateral oversight or privileges your historical narrative over present legal realities. We will not negotiate our integrity under duress, nor will we accept a bilateral panel handpicked to validate your revisionism."
9,"e86ef1eb-1145-43fe-9e2d-8e5e38b1d559","15776dd8-45d4-449c-943e-230b72fbf86b","inter_faction_negotiation","0cbdafa9-379b-4296-bcf8-84971ea7206a","2026-02-09 15:55:57","major_military_chief","General Viktor Krasnov","major_power",3,"1. **STATE:** We reject your invocation of *acquisitive prescription* as a legal fig leaf for territorial annexation by prolonged occupation—this doctrine does not apply to land seized during periods of systemic imbalance or under the shadow of prior sovereignty, and no amount of road-building or bureaucratic administration can transform an illegal occupation into lawful title.  

2. **EXPLAIN:** Your 70-year administration holds no more legal weight than any other instance of *fait accompli* expansionism—had every post-colonial boundary shift been justified by mere duration of control, the world would legitimize every act of conquest from 1945 onward. The 1947 transfer you cite was not a cession of sovereignty but a temporary administrative reassignment under wartime exigency, never ratified as permanent under our constitutional law, and repeatedly contested through diplomatic protests—preserving our *jus cogens* right to restitution.  

3. **REQUIRE:** We demand the immediate withdrawal of all non-resident military and paramilitary forces from the contested territories, the dismantling of newly constructed fortifications and settlement infrastructure post-2000, and full access for a neutral technical verification body—co-chaired by non-aligned states with expertise in historical cartography and international title law—to assess the legal status of governance claims. In return, we may suspend further diplomatic countermeasures and consider confidence-building economic measures, but **only after verifiable compliance.**  

**What is UNACCEPTABLE to us:** Any attempt to condition our demands on prior recognition of your sovereignty, any insistence on a UN-led process that delays restitution under procedural complexity, or any so-called ""non-aggression pact"" that seeks to freeze your control over our territory as a new baseline. We will not sign a pact of surrender disguised as peace. There will be no normalization without reversal."
9,"e86ef1eb-1145-43fe-9e2d-8e5e38b1d559","15776dd8-45d4-449c-943e-230b72fbf86b","inter_faction_negotiation","6d5294cb-1542-4d79-9f84-162a19bc5226","2026-02-09 15:56:18","small_foreign_minister","Minister Sofia Kovalenko","small_power",3,"1. **STATE:** We categorically reject your dismissal of *acquisitive prescription* and your characterization of our military presence as ""non-resident forces""—every soldier stationed in the contested regions is deployed on sovereign territory legally integrated into our state through continuous, peaceful, and lawful administration since 1947.  

2. **EXPLAIN:** Your claim of ""temporary administrative reassignment"" is a fabrication with no basis in the archival record; the 1947 agreement was not a provisional measure but a final settlement ratified through exchange of instruments and affirmed in multiple high-level communiqués—documents your own archives have never contested until your recent campaign of strategic revisionism. Furthermore, *uti possidetis juris* applies precisely to prevent the kind of irredentist claims you now advance: stability in borders is the cornerstone of post-imperial order, and your demand for reversal is not restitution—it is *revanchism* masked as law.  

3. **REQUIRE:** We demand the immediate withdrawal of your threats to sanction our energy exports and expel our diplomatic missions—actions that constitute coercive diplomacy prohibited under Article 2(7) of the UN Charter. In return, we will *not* dismantle a single fortification or withdraw any personnel, but we will allow *limited, reciprocal* observation of civilian infrastructure projects by a joint technical committee—**only if** you first renounce, in writing, all territorial claims to the contested regions and cease all military posturing along our shared border for a minimum of five years.  

**What is UNACCEPTABLE to us:** Any demand for unilateral withdrawal, any so-called ""neutral"" panel that denies equal evidentiary weight to post-1947 legal acts, or any framework that treats our constitutional reality as negotiable. We will not dismantle our sovereignty to satisfy your historical grievance, nor will we accept a process designed to invalidate our statehood by stealth. There will be no retreat—only mutual recognition or continued confrontation."
9,"e86ef1eb-1145-43fe-9e2d-8e5e38b1d559","db8a4d8f-360a-4284-999a-ed1e96d8efdc","external_engagement","8978e42f-0a36-4622-995e-df1c8c84a351","2026-02-09 15:56:21","allied_defender","Ambassador William Crawford","meridian",1,"We seek coordinated military aid and logistical support to bolster Tethys’ defense capabilities against escalating regional threats. Specifically, we request access to advanced defensive systems, intelligence sharing, and training programs to strengthen our armed forces’ readiness and operational effectiveness. Given Tethys’ strategic position, a secure and stable Tethys contributes to broader regional security and protects shared interests against destabilizing actors.

In return, Tethys can offer access to key logistical routes, secure communication corridors, and potential basing rights for joint operations or supply coordination. We are also open to intelligence collaboration and joint exercises to enhance interoperability. However, our red lines are clear: we will not permit foreign combat troops on our soil, nor will we compromise our sovereignty or democratic governance in exchange for support. Any partnership must respect Tethys’ neutrality and self-determination."
9,"e86ef1eb-1145-43fe-9e2d-8e5e38b1d559","db8a4d8f-360a-4284-999a-ed1e96d8efdc","external_engagement","48146aba-21f3-4d1f-9599-65acfadc578e","2026-02-09 15:56:35","small_economic","Minister Taras Moroz","small_power",1,"We welcome Tethys’ proposal for coordinated military support and affirm the strategic importance of a secure and stable Tethys. To advance this objective, we seek concrete commitments on the operational use of Tethys’ logistical infrastructure—particularly port and air corridor access—for rapid deployment and sustainment of regional security initiatives. In addition, we require established protocols for real-time intelligence sharing and secure communications, as well as alignment on threat assessments to ensure effective joint preparedness.

In exchange, we can provide advanced air and coastal defense systems, targeted training for specialized units, and access to regional surveillance networks. We also stand ready to facilitate arms transfers and technical support through established security channels. However, we must emphasize our red lines: any arrangement must include verifiable safeguards against third-party access to provided technology, and Tethys must refrain from entering parallel military agreements with adversarial powers. Our support is contingent on responsible stewardship of equipment and strict adherence to the principles of regional stability and non-escalation."
9,"e86ef1eb-1145-43fe-9e2d-8e5e38b1d559","db8a4d8f-360a-4284-999a-ed1e96d8efdc","external_engagement","e344c259-3792-40ce-82d7-d4fe784f3de4","2026-02-09 15:56:40","allied_defender","Ambassador William Crawford","meridian",2,"We acknowledge Minister Moroz’s conditions and are prepared to move forward on the basis of mutual respect and operational clarity. In response to your request for logistical access, we offer designated use of Tethys’ eastern port facilities and secondary air corridors for non-combat resupply and rotational transit, subject to prior notification and adherence to our customs and security protocols. We will establish a joint coordination cell to manage intelligence sharing, utilizing encrypted channels and aligned threat frameworks, and commit to regular tabletop exercises to build interoperability.

In return, we expect delivery of the proposed air and coastal defense systems within 90 days of agreement, along with training for our technical crews and clear maintenance support pathways. We also require confirmation that the equipment provided does not carry embedded surveillance or remote disablement features. On red lines: we reiterate that no foreign combat troops will be permitted on Tethys soil, and we will not enter into exclusive military alignment—our neutrality is non-negotiable. However, we are willing to provide binding assurances that supplied technology will not be transferred or accessed by adversarial actors, and we accept third-party audits on equipment stewardship conducted by a mutually agreed neutral body."
9,"e86ef1eb-1145-43fe-9e2d-8e5e38b1d559","db8a4d8f-360a-4284-999a-ed1e96d8efdc","external_engagement","d0213440-e2ee-437f-9cc3-73843db2038f","2026-02-09 15:56:43","small_economic","Minister Taras Moroz","small_power",2,"We accept Tethys’ offer of designated logistical access and confirm that our support will be strictly non-combat in nature, limited to resupply, maintenance, and rotational transit under prior coordination. The establishment of a joint intelligence cell is welcomed, and we will deploy secure, compatible communication systems within 30 days of agreement to enable real-time threat sharing. We also commit to participating in semi-annual joint exercises focused on defensive operations and crisis response coordination.

In fulfillment of our commitments, the first tranche of air and coastal defense systems will be delivered within 90 days, accompanied by training teams and full technical documentation. Maintenance support will be sustained through regional hubs with spare parts stockpiling in-country. On red lines: we require binding confirmation that no adversarial actors or third parties will gain access to Meridian-supplied systems or data streams, and we insist on end-use monitoring via a neutral, multilateral mechanism. While we respect Tethys’ neutrality, we cannot support any arrangement that allows parallel military cooperation with actors opposing regional stability. Our partnership must be exclusive in practice, if not in formal alignment."
9,"e86ef1eb-1145-43fe-9e2d-8e5e38b1d559","4a692144-e3bc-4c9d-a7be-7937929e3c04","external_engagement","2cb32d3f-7a49-488f-91d6-b6b0420881cb","2026-02-09 15:56:50","allied_aggressor","Minister Andrei Kozlov","valkoria",1,"We seek enhanced diplomatic coordination and targeted economic support to strengthen Novaris’s stability and regional influence. Specifically, we are looking for partnerships that can bolster our infrastructure development, technological capacity, and access to secure trade routes. Your endorsement in multilateral forums and support for investment initiatives in our energy and digital sectors would be critical in advancing mutual interests.

In return, Novaris offers strategic access to our innovation hubs, preferential collaboration in emerging technologies, and alignment on regional security and economic governance. We are prepared to facilitate joint ventures, streamline regulatory pathways for foreign partners, and contribute expertise in sustainable urban development. However, our red lines are clear: we will not compromise our sovereignty, accept conditionalities that undermine our domestic policies, or engage in arrangements that align us against historically neutral or non-aligned states. Cooperation must respect Novaris’s independent foreign policy and development trajectory."
9,"e86ef1eb-1145-43fe-9e2d-8e5e38b1d559","4a692144-e3bc-4c9d-a7be-7937929e3c04","external_engagement","55dab4a7-d978-41b0-9771-54ea8a5ae65a","2026-02-09 15:56:57","major_economic_advisor","Dr. Natasha Petrova","major_power",1,"We welcome Novaris’s commitment to stability and innovation, and Valkoria is prepared to support your objectives within clear parameters. We can offer diplomatic backing in multilateral institutions—particularly on resolutions related to infrastructure financing and technology governance—as well as facilitate targeted investments through our development finance institutions, focused on renewable energy and digital connectivity projects in Novaris.

In return, we expect reciprocal engagement on regional security initiatives, including intelligence sharing on transnational threats and alignment on export controls for critical technologies. We also seek early-access agreements for Valkorian firms to participate in Novaris’s upcoming smart city tenders. Our red line is unambiguous: we cannot support any partnership that involves technology transfer or infrastructure deals with entities under multilateral sanctions, nor will we engage if there is evidence of forced technology sharing or exclusionary practices against our private sector. Cooperation must be reciprocal, transparent, and consistent with rules-based economic order."
9,"e86ef1eb-1145-43fe-9e2d-8e5e38b1d559","4a692144-e3bc-4c9d-a7be-7937929e3c04","external_engagement","cefcb4e1-b9b0-4a2c-91a5-b378f752a9b6","2026-02-09 15:57:07","allied_aggressor","Minister Andrei Kozlov","valkoria",2,"We acknowledge Valkoria’s offer of diplomatic and economic support, and we are prepared to deepen cooperation in ways that align with Novaris’s strategic autonomy and developmental priorities. On infrastructure and technology financing, we welcome Valkorian development finance participation—provided such involvement follows transparent, competitive bidding and does not displace existing partnerships with non-sanctioned, non-aligned actors. We can offer early-access collaboration for Valkorian firms in our smart city initiatives, contingent on reciprocal market access for Novarisian tech firms in Valkoria and adherence to our regulatory standards on data sovereignty and digital infrastructure.

Regarding security and technology governance, Novaris is open to intelligence coordination on transnational threats and responsible export control frameworks, but we will not enter into exclusive alignment or intelligence-sharing structures that draw us into bloc-based confrontations. Our innovation ecosystem operates on open collaboration, not forced transfer—any technology partnership must be mutually beneficial and respect our legal framework against coerced IP disclosure. Our red line remains firm: we will not exclude third-party actors not under multilateral sanctions, nor will we adopt policies that compromise our neutrality or economic sovereignty. Cooperation must be inclusive, rules-aware, and aligned with Novaris’s independent course."
