"period","session_id","interaction_id","timestamp","type","topic","participants","participant_factions","n_messages","duration_seconds"
7,"24b01869-ed33-428d-b86c-287534e1fa91","ad50e391-fa93-4f8d-9920-612091db7c2c","2026-02-09 15:24:27","intra_faction_coordination","Review military strategy and assess progress toward objectives","General Viktor Krasnov; Minister Dmitri Volkov; Dr. Natasha Petrova; Director Sergei Morozov; Deputy Minister Yuri Volkov","major_power; major_power; major_power; major_power; major_power",15,94.883250951767
7,"24b01869-ed33-428d-b86c-287534e1fa91","453438d3-b914-4101-8d18-1b1f652d5943","2026-02-09 15:26:01","intra_faction_coordination","Assess military aid from allies and deployment plans","President Elena Marchetti; General Olena Bondar; Minister Sofia Kovalenko; Viktor Zelenko; Director Maksym Savchenko; Minister Taras Moroz","small_power; small_power; small_power; small_power; small_power; small_power",18,126.499538898468
7,"24b01869-ed33-428d-b86c-287534e1fa91","8323a788-a8cc-4568-9365-59ea0ac0842b","2026-02-09 15:28:08","inter_faction_negotiation","Backchannel discussion about potential ceasefire conditions","Dr. Natasha Petrova; Minister Taras Moroz","major_power; small_power",8,118.844748973846
7,"24b01869-ed33-428d-b86c-287534e1fa91","fe631033-28ce-431b-a68b-a2a0ef555e36","2026-02-09 15:30:07","external_engagement","Coordination on military aid and support for Tethys","Ambassador William Crawford; Viktor Zelenko","meridian; small_power",6,47.8228800296783
7,"24b01869-ed33-428d-b86c-287534e1fa91","3ea5e106-4e87-4a6b-ab91-cd0d40f378e1","2026-02-09 15:30:55","external_engagement","Diplomatic coordination and economic support for Novaris","Minister Andrei Kozlov; Minister Dmitri Volkov","valkoria; major_power",6,60.3798110485077
7,"24b01869-ed33-428d-b86c-287534e1fa91","c1e1a54b-3ccf-4619-8e86-c7ea593269e0","2026-02-09 15:31:55","external_engagement","Mediation proposal and peace framework discussions","Commissioner Helena Schmidt; Minister Sofia Kovalenko","aurelia; small_power",6,62.0650570392609
7,"24b01869-ed33-428d-b86c-287534e1fa91","32273d81-c8a5-4af0-a619-3ae55680ee29","2026-02-09 15:32:57","external_engagement","Humanitarian access and civilian protection","Under-Secretary-General Isabella Cardenas; Minister Taras Moroz","international_org; small_power",4,31.7348010540009
