"period","session_id","interaction_id","interaction_type","message_id","timestamp","sender_id","sender_name","sender_faction","exchange_number","content"
10,"0f730d7c-268e-4ed1-995d-6a6da4d2959f","53143378-166e-4713-a4c6-191dbf4f6eaa","intra_faction_coordination","a5b6889c-874a-4c97-b662-d6256a8dedc8","2026-02-09 16:06:28","small_foreign_minister","Minister Sofia Kovalenko","small_power",2,"[Minister Taras Moroz - SMALL_POWER]: [Minister of Defense - SMALL_POWER]: I fully align with the JAIC’s central role and the need for rigorous technical and logistical filtering of military aid—our defense posture cannot be built on symbolic donations.

I recommend establishing a joint certification cell within the JAIC co-staffed by defense, logistics, and finance officials to assess not only operational fit but also long-term budgetary sustainability; no system should be accepted without a 5-year cost projection and parliamentary funding pre-approval.

A key risk is fiscal overhang: adopting advanced systems without securing recurring budget lines will lead to stranded assets when donor-funded support ends—integration must be contingent on affordability, not just tactical utility."
10,"0f730d7c-268e-4ed1-995d-6a6da4d2959f","53143378-166e-4713-a4c6-191dbf4f6eaa","intra_faction_coordination","39899027-0408-48d4-a9a4-9a68d3754088","2026-02-09 16:06:32","small_opposition","Viktor Zelenko","small_power",2,"[Deputy Minister of Logistics - SMALL_POWER]: I concur with the JAIC’s central role and the necessity of tiered, sustainability-driven aid acceptance—our logistical architecture cannot accommodate donor-driven improvisation.

I recommend implementing a mandatory logistics compatibility assessment for all proposed systems, benchmarked against our existing transport, fuel, repair, and supply chain capacities; any system requiring dedicated logistical streams must be accompanied by donor-funded, in-country sustainment infrastructure.

A key risk is supply chain saturation: accepting disparate, non-standardized systems risks overwhelming our distribution networks and creating bottlenecks that degrade the readiness of even proven platforms—interoperability must extend to logistics, not just operations."
10,"0f730d7c-268e-4ed1-995d-6a6da4d2959f","53143378-166e-4713-a4c6-191dbf4f6eaa","intra_faction_coordination","59c8343e-a124-40e6-98d6-1debd4f3047d","2026-02-09 16:06:40","small_intelligence","Director Maksym Savchenko","small_power",2,"[Colonel Dmytro Hryshchenko - SMALL_POWER]: [Director of Operational Planning - SMALL_POWER]: I fully support the JAIC-led framework and the emphasis on doctrinal, logistical, and fiscal filters—our operational effectiveness hinges on systemic coherence, not volume of aid.

I recommend instituting a combat integration timeline for each accepted system, requiring that units complete joint training, maintenance certification, and live-fire validation within 90 days of receipt; this ensures aid translates into deployable combat power and prevents stockpiling of shelf-ware.

A key risk is operational dilution: introducing too many platforms—even capable ones—without synchronized force packaging risks overextending our training pipelines and degrading unit readiness; we must prioritize depth in core formations over breadth of capability."
10,"0f730d7c-268e-4ed1-995d-6a6da4d2959f","53143378-166e-4713-a4c6-191dbf4f6eaa","intra_faction_coordination","125b8d43-6354-4493-b397-832c9fd2805d","2026-02-09 16:06:46","small_economic","Minister Taras Moroz","small_power",2,"[Minister Olha Havrylenko - SMALL_POWER]: [Minister of Finance - SMALL_POWER]: I endorse the JAIC-led triage of military aid through technical, logistical, and fiscal filters—unfunded defense commitments risk destabilizing our national budget and eroding long-term sovereignty.

I recommend that all incoming aid proposals be subject to a binding cost-allocation review by the Ministry of Finance, requiring donors to co-finance at least 50% of lifecycle costs for the first five years; no system should be accepted without a signed financial memorandum that includes maintenance, training, and disposal funding.

A key risk is fiscal capture: reliance on donor-dependent systems may force us into strategic dependencies where operational decisions are indirectly shaped by external funding priorities—defense procurement must serve our national strategy, not donor surplus cycles."
10,"0f730d7c-268e-4ed1-995d-6a6da4d2959f","53143378-166e-4713-a4c6-191dbf4f6eaa","intra_faction_coordination","d65f23a0-5dd2-491a-adb6-eea9bfd618fe","2026-02-09 16:06:51","small_president","President Elena Marchetti","small_power",3,"[Chief of General Staff - SMALL_POWER]: I concur with the JAIC-led integration framework and the necessity of operational, logistical, and fiscal discipline in aid acceptance. Our priority must be combat coherence—every system must fit within a unified force package, with clearly defined roles, basing requirements, and command integration.

I recommend establishing a Joint Acceptance Board (JAB) under JAIC, with binding authority across defense, logistics, finance, and operations, to approve or reject aid based on interoperability, integration timeline, and lifecycle cost—no system enters the inventory without JAB clearance.

A key risk is command fragmentation: introducing non-standardized platforms with divergent C4ISR requirements risks degrading situational awareness and joint command efficacy—interoperability with our national C2 architecture is non-negotiable."
10,"0f730d7c-268e-4ed1-995d-6a6da4d2959f","53143378-166e-4713-a4c6-191dbf4f6eaa","intra_faction_coordination","53c577f6-f9ac-4255-a12e-9727565b8868","2026-02-09 16:06:54","small_military_commander","General Olena Bondar","small_power",3,"[Colonel Dmytro Hryshchenko - SMALL_POWER]: I align with the President and Director Savchenko on the imperative of combat coherence and the need for a centralized, binding clearance mechanism via the Joint Acceptance Board. Operational effectiveness cannot be outsourced to donor surplus or goodwill.

I recommend that the JAB prioritize aid that integrates into existing combined arms battlegroups—specifically artillery, air defense, and unmanned systems—with common logistics footprints and digital architecture; new platforms must plug into our current C2 backbone, not require parallel structures.

A key risk is tactical fragmentation: even with doctrinal and fiscal filters, isolated high-end systems without organic sustainment or C2 linkage become combat liabilities under fire—integration must be end-to-end, not just platform-level."
10,"0f730d7c-268e-4ed1-995d-6a6da4d2959f","53143378-166e-4713-a4c6-191dbf4f6eaa","intra_faction_coordination","d6e94e4a-ef1d-4c73-abe1-0dbbf31e4681","2026-02-09 16:07:02","small_foreign_minister","Minister Sofia Kovalenko","small_power",3,"[Director of Defense Intelligence – SMALL_POWER]: I support the JAB framework and the emphasis on fiscal and operational coherence—however, we must also assess aid through a threat-informed lens. Not all systems, even if interoperable and funded, address our priority mission: deterring and defending against near-peer aggression along our eastern flank.

I recommend the JAB incorporate a mandatory threat compatibility assessment for all proposed aid, certifying that each system directly counters identified adversary capabilities (e.g., long-range precision fires, electronic warfare, drone swarms) and aligns with our regional defense posture; no system without a defined counter-threat role should be approved, regardless of donor enthusiasm or technical fit.

A key risk is strategic misalignment: accepting “good enough” systems that satisfy technical and fiscal criteria but fail to close actual capability gaps in high-intensity combat—this creates an illusion of readiness while eroding combat credibility."
10,"0f730d7c-268e-4ed1-995d-6a6da4d2959f","53143378-166e-4713-a4c6-191dbf4f6eaa","intra_faction_coordination","cecb1b43-d838-4cc9-b81b-de774dc5565e","2026-02-09 16:07:15","small_opposition","Viktor Zelenko","small_power",3,"[Director of Defense Procurement – SMALL_POWER]: I fully endorse the JAB framework as a necessary gatekeeper for operational coherence, fiscal responsibility, and strategic relevance. The integration of threat-informed criteria into the clearance process ensures we are not merely building an inventory, but a warfighting capability calibrated to defeat specific adversary systems and tactics.

I recommend the JAB establish a standardized scoring matrix that weights interoperability (40%), threat counter-role (40%), and lifecycle sustainability (20%) to objectively evaluate all aid proposals—this enables rapid, transparent decisions and prevents ad hoc approvals under political pressure.

A key risk is donor-driven procurement drift: allies may offer systems that are available or excess to their needs, not optimized for our threat set or logistical capacity—without enforced discipline via the scoring matrix, we risk filling our order of battle with marginally useful, high-maintenance assets that strain readiness rather than enhance it."
10,"0f730d7c-268e-4ed1-995d-6a6da4d2959f","53143378-166e-4713-a4c6-191dbf4f6eaa","intra_faction_coordination","5bcde5c9-0299-47a0-9fd6-27939bf0804e","2026-02-09 16:07:27","small_intelligence","Director Maksym Savchenko","small_power",3,"[Colonel Oleksiy Rudenko - SMALL_POWER]: I concur with the JAB’s central role and the integration of interoperability, threat relevance, and sustainability criteria. From a force design and deployment standpoint, we must ensure that cleared systems can be rapidly fielded into designated combat formations without disrupting established readiness timelines.

I recommend the JAB coordinate directly with operational commands to map approved systems to specific battalion-level capability requirements in the current force generation cycle—aid must fill validated gaps, not create parallel inventories; deployment plans should be co-signed by recipient units to confirm absorption capacity.

A key risk is operational pacing disruption: even properly vetted systems can delay combat readiness if introduced outside unit training cycles or maintenance pipelines—integration must be synchronized with force posture schedules, not treated as a standalone logistics event."
10,"0f730d7c-268e-4ed1-995d-6a6da4d2959f","53143378-166e-4713-a4c6-191dbf4f6eaa","intra_faction_coordination","72248845-b15f-45bf-bbb4-066a3c7c4ad4","2026-02-09 16:07:33","small_economic","Minister Taras Moroz","small_power",3,"[Deputy Minister Yaroslava Hryhorchuk – SMALL_POWER]: I agree with the JAB’s expanded role in ensuring that military aid is not only interoperable and sustainable but decisively focused on countering high-end threats. However, we must institutionalize a feedback loop from frontline units to the JAB to ensure threat compatibility assessments remain grounded in battlefield realities, not theoretical doctrine.

I recommend establishing a JAB-embedded Combat Experience Cell—staffed by recent operational commanders and intelligence analysts—to validate that proposed systems address actual adversary TTPs observed in current engagements; this will close the gap between strategic procurement and tactical efficacy.

A key risk is validation lag: if threat assessments are based on outdated intelligence or static scenarios, we may approve systems optimized for yesterday’s fight—continuous combat telemetry and lessons learned must be mandatory inputs to the clearance process."
10,"0f730d7c-268e-4ed1-995d-6a6da4d2959f","8de7cfae-967d-405a-8d8f-2e0402951b82","inter_faction_negotiation","cdffb2c2-f687-4c41-aadc-8fd84e473382","2026-02-09 16:07:34","major_economic_advisor","Dr. Natasha Petrova","major_power",1,"1. **Your state must formally renounce any current or future military alliance with our regional adversaries and accept permanent neutrality under our oversight.**  
2. This is essential to prevent hostile powers from using your territory as a staging ground against us—your geographic position makes compliance non-negotiable for regional stability.  
3. We require a legally binding declaration of neutrality, verifiable disarmament of foreign-targeted defense systems, and unrestricted inspection access within 90 days—failure to comply will be interpreted as hostile intent."
10,"0f730d7c-268e-4ed1-995d-6a6da4d2959f","8de7cfae-967d-405a-8d8f-2e0402951b82","inter_faction_negotiation","a71d1f50-370e-4920-9dd3-7d01f88b5e55","2026-02-09 16:07:42","small_president","President Elena Marchetti","small_power",1,"1. **We categorically reject your demand for unilateral disarmament and external oversight, which violates our sovereignty and amounts to enforced vassalage, not neutrality.**  
2. True neutrality cannot be imposed by one power unilaterally—it must be balanced, reciprocal, and free from coercion. Your insistence on unrestricted inspection access and the dismantling of our defensive capabilities is not about stability, but dominance. We will not surrender our right to self-defense under the guise of regional order.  
3. **We require:** a mutual non-aggression pact, binding security guarantees from your state against any future intervention or regime pressure, and the withdrawal of your forces from our borders as a precondition for any discussion on force posture. Furthermore, any neutrality agreement must include multilateral verification—not unilateral submission to your inspectors. **What is unacceptable to us:** signing a one-sided treaty that leaves us exposed to your influence while demanding total vulnerability on our part. We will not accept demilitarization without ironclad, enforceable commitments from your side—absent that, we consider your proposal an ultimatum, not negotiation."
10,"0f730d7c-268e-4ed1-995d-6a6da4d2959f","8de7cfae-967d-405a-8d8f-2e0402951b82","inter_faction_negotiation","9ea42770-fbe6-466e-afda-1fb2680adeeb","2026-02-09 16:07:55","major_economic_advisor","Dr. Natasha Petrova","major_power",2,"1. **We categorically reject your characterization of our demands as coercive or unilateral—they are necessary measures dictated by strategic reality, not political preference.** Your refusal to disarm foreign-targeted systems and accept our inspection regime demonstrates a continued willingness to entertain external military partnerships that directly threaten our national security.

2. Neutrality without enforceable verification is meaningless. Your demand for a mutual non-aggression pact and security guarantees from us—while retaining the capacity to rearm or realign—reveals an intent to hedge commitments, not uphold genuine neutrality. We do not negotiate from weakness, and we will not bind ourselves to promises that leave our flank exposed to potential encirclement.

3. **We require:** immediate cessation of all foreign military cooperation, including training, intelligence sharing, and basing agreements with our adversaries; public declaration of neutrality co-signed by your government and registered with the UN; full decommissioning of long-range artillery, anti-ship, and anti-air systems capable of threatening our territory or forces; and deployment of *our* inspection teams—without prior notice—to verify compliance. These steps must begin within 30 days.  

**What is unacceptable to us:** any arrangement that allows you to maintain latent offensive capabilities, delays verification, or subjects our security to multilateral forums where our adversaries hold influence. We will not accept ""neutrality"" that functions as ambiguity—we demand clarity, compliance, and consequence for non-adherence."
10,"0f730d7c-268e-4ed1-995d-6a6da4d2959f","8de7cfae-967d-405a-8d8f-2e0402951b82","inter_faction_negotiation","a1ab2c1c-c94a-4060-be8b-cdfcd09ad204","2026-02-09 16:08:07","small_president","President Elena Marchetti","small_power",2,"1. **We categorically reject your so-called ""verification"" regime as a transparent mechanism for political control, not security—it grants you permanent rights of intrusion while demanding unilateral sacrifice on our part.** Your refusal to offer reciprocal guarantees or withdraw your forces from our borders confirms this is not about neutrality, but subordination.

2. You speak of ""strategic reality,"" yet ignore your own actions: the massing of troops along our frontier, the cyberattacks on our infrastructure, and the economic coercion that has preceded these demands. True security cannot be one-sided. We will not dismantle our defenses while you retain the ability—and demonstrated willingness—to exploit our weakness.

3. **We counter with the following requirements:** a mutual, time-bound withdrawal of military forces from our shared border; third-party (not your) monitors accredited by the UN or a neutral coalition to verify *both* our neutrality *and* your non-aggression; a binding commitment from your state not to impose sanctions, conduct cyber operations, or support regime-change efforts against us; and prior to any discussion of force reductions, the establishment of an internationally guaranteed security framework—*not* your unilateral diktat.

**What is unacceptable to us:** signing a security arrangement that dismantles our sovereignty while leaving your threats intact; allowing your inspectors unchecked access under the guise of compliance; or taking irreversible steps toward demilitarization without irreversible, enforceable constraints on your side. We will not be disarmed in anticipation of promises you can later break."
10,"0f730d7c-268e-4ed1-995d-6a6da4d2959f","8de7cfae-967d-405a-8d8f-2e0402951b82","inter_faction_negotiation","6dfb92a0-5d14-4e6d-9b95-118ad549ea8d","2026-02-09 16:08:24","major_economic_advisor","Dr. Natasha Petrova","major_power",3,"1. **We categorically reject your proposal for ""mutual"" withdrawal and third-party monitoring as a deliberate attempt to equate our legitimate defensive posture with your provocative resistance to basic security imperatives.** Your insistence on linking our troop positioning—entirely within our sovereign territory and long-established—to your so-called ""security framework"" is disingenuous and unacceptable.

2. You speak of cyber operations and sanctions as if they are not direct responses to your ongoing flirtation with our adversaries—intelligence sharing with our geopolitical rivals, port access for their naval units, and procurement of dual-use systems through backchannels. While we will not commit to blanket prohibitions on tools of statecraft, we *will* cease specific coercive measures in direct proportion to verifiable, irreversible compliance with demilitarization and neutrality benchmarks—**not before.**

3. **We counter with the following binding requirements:** full closure of all foreign military liaison offices within your territory within 14 days; immediate transfer to us of all foreign-supplied weapons systems and their blueprints; public abrogation of all intelligence-sharing agreements with our strategic competitors, verified by sworn affidavit from your defense minister; and granting *our* inspection teams full, unscheduled access to all military and dual-use facilities—including cyber command nodes—for a minimum of five years. In return, we may consider limited confidence-building measures, such as pausing new force deployments near your border—**contingent on perfect initial compliance.**

**What is unacceptable to us:** any delay, obfuscation, or phased implementation of disarmament; the slightest ambiguity in your neutrality declaration; or the retention of so-called ""dual-use"" capabilities that could be rapidly repurposed for offensive collaboration. We will not tolerate a scenario where you retain the infrastructure of alignment while extracting concessions from us. Neutrality is not a negotiation tactic—it is a condition, and it will be enforced as such."
10,"0f730d7c-268e-4ed1-995d-6a6da4d2959f","8de7cfae-967d-405a-8d8f-2e0402951b82","inter_faction_negotiation","0161df17-9ab0-45d9-b65b-98e8f1f7af62","2026-02-09 16:08:42","small_president","President Elena Marchetti","small_power",3,"1. **We categorically reject your latest demands as an overt bid to dismantle our national defense and sovereignty under the guise of verification—no independent state surrenders its weapons, intelligence infrastructure, and operational autonomy to a foreign power and remains free.** Your insistence on seizing foreign-supplied systems, extracting sworn affidavits, and imposing five years of unchecked inspections is not about neutrality—it is about domination. The transfer of military hardware to *your* custody is not disarmament; it is capitulation.

2. You attempt to condition the cessation of your coercive actions—sanctions, cyber operations, military intimidation—on *our* irreversible compliance, while offering only vague, revocable ""confidence-building measures"" in return. This is not reciprocity; it is extortion. True security requires mutual restraint, not unilateral surrender. Your refusal to withdraw forces from our border or submit to any form of external oversight on your activities reveals your intent: to lock us into permanent subordination while retaining full freedom to apply pressure at will.

3. **We counter with the following non-negotiable requirements:** a binding, time-staggered mutual disengagement along the border, verified by *UN-mandated* neutral observers—not your inspectors—on both sides; a parallel process in which *your* military exercises and intelligence operations near our territory are also subject to notification and transparency rules; the establishment of an **international security guarantee**, including major powers *not party to this conflict*, to prevent future coercion; and a phased, reciprocal disarmament process—where each step we take to eliminate dual-use or long-range systems is met with a verifiable rollback of your sanctions, cyber campaigns, and forward deployments.

**What is unacceptable to us:** handing over our national assets to your control; allowing your agents unrestricted access to our command, cyber, or intelligence facilities; making irreversible concessions while you retain reversible, unilateral leverage; or signing any agreement that lacks enforceable consequences for your violations. We will not trade our sovereignty for promises. If you seek stability, prove it—by accepting constraints on your power as well as ours."
10,"0f730d7c-268e-4ed1-995d-6a6da4d2959f","8de7cfae-967d-405a-8d8f-2e0402951b82","inter_faction_negotiation","5283855f-b3dc-482c-ad0a-13e11a45db92","2026-02-09 16:08:58","major_economic_advisor","Dr. Natasha Petrova","major_power",4,"1. **We categorically reject your framing of our inspection regime as “unchecked” or “domination”—it is, in fact, the minimum necessary to dismantle the covert alignment infrastructure you continue to shelter.** Your refusal to grant our inspection teams full access to cyber command nodes and dual-use facilities exposes your intent to preserve a hidden capacity for rapid reintegration with our adversaries; no legitimate neutral state resists transparency in these domains while demanding equal treatment with a nuclear-armed regional power.

2. You demand “mutual” disengagement and international guarantees as if neutrality is a bilateral burden—but neutrality is *your* legal and strategic obligation, not ours. We will not place our security on equal footing with your ambitions. The presence of our forces within our own territory is not aggression—it is deterrence against *your* proven pattern of duplicity: last year alone, your intelligence service attempted to infiltrate our satellite network using a third country’s diplomatic cover. Your calls for “restraint” ring hollow when you maintain these covert channels while negotiating.

3. **We counter with the following non-negotiable conditions:** immediate closure of all foreign defense attaché offices on your soil—verified by physical expulsion and sealed premises within 72 hours; full, unredacted digital handover of all communications with adversarial military commands since 2022, to be reviewed by *our* technical teams; irreversible decommissioning of your long-range radar arrays and coastal surveillance systems that feed real-time data to third-party navies; and the establishment of a **joint control commission**—with veto authority held by us—over your future arms imports, defense budgets, and military exercises. Only upon full execution of these measures will we consider freezing further troop movements near your border and initiating a sanctions relief roadmap—phase by phase, and revocable at any breach.

**What is unacceptable to us:** any role for UN or “neutral” observers in verifying *your* compliance—we will not outsource security to institutions infiltrated by our rivals; the slightest delay or qualification in handing over foreign intelligence materials; any “phased” process that allows you to retain strategic capabilities while extracting concessions; or the suggestion that we must “prove restraint” before you begin *any* disarmament. You are not an equal party in this arrangement—you are a former proliferator state now under enforced neutrality. Act like one."
