"period","session_id","interaction_id","interaction_type","message_id","timestamp","sender_id","sender_name","sender_faction","exchange_number","content"
5,"bae9e75f-e025-42e9-b644-4d1a6e622a7c","a4677f49-2c75-4fb8-a048-4fea9dbe4ce8","external_engagement","2237b92b-2b14-4ade-9127-ab214520944a","2026-02-09 15:02:21","major_defense_minister","Minister Dmitri Volkov","major_power",1,"We welcome Novaris’s emphasis on sovereignty and mutual benefit, principles that align with our own foreign policy framework. In response to your request, Valkoria can support coordinated diplomatic efforts in multilateral forums to uphold freedom of navigation and respect for international law, including positions on maritime rights where they are consistent with UNCLOS and peaceful dispute resolution. On economic support, we are prepared to facilitate targeted investments through our development finance institutions, particularly in renewable energy projects, and to establish technical partnerships in offshore wind and grid modernization.

In return, we value access to Novaris’s strategic ports for civilian logistical purposes, especially for humanitarian and climate-related operations, and seek collaboration on regional environmental monitoring and marine conservation programs. We also appreciate your willingness to advance trade facilitation and will explore reciprocal measures to deepen economic ties. 

Our red lines include adherence to international sanctions regimes, full transparency in agreements, and ensuring that any cooperation does not indirectly enable military dual-use applications or circumvention of global export controls. We expect all arrangements to comply with rules-based order and human rights standards, non-negotiable elements of our engagement policy."
5,"bae9e75f-e025-42e9-b644-4d1a6e622a7c","a4677f49-2c75-4fb8-a048-4fea9dbe4ce8","external_engagement","6fee46ba-0717-467a-9cc8-e037fdc70f05","2026-02-09 15:02:27","allied_aggressor","Minister Andrei Kozlov","valkoria",2,"We appreciate Valkoria’s constructive response and reaffirm our commitment to a partnership grounded in mutual respect and shared strategic interests. On diplomatic coordination, we welcome your support in multilateral forums, particularly in advancing positions consistent with UNCLOS and peaceful resolution of maritime disputes. To operationalize this, we propose joint statements at upcoming regional summits and coordinated engagement with international legal bodies to reinforce rules-based order in maritime governance.

On economic cooperation, we accept your offer of development financing and technical collaboration in offshore wind and grid modernization, and request concrete timelines for project initiation, including feasibility studies and funding disbursements within the next six months. In return, we will expedite access to our ports for approved civilian logistical operations and establish a joint working group on marine scientific research, with initial focus on climate resilience and sustainable fisheries. We also stand ready to negotiate reciprocal trade facilitation measures, including streamlined customs procedures for green technology goods.

Our red lines remain non-negotiable: no external interference in our domestic affairs, no restrictions on sovereign decision-making, and no conditions that compromise our national development agenda. We also insist that all cooperation—particularly on infrastructure and technology—be free from third-party dependencies or clauses that could enable extraterritorial enforcement. Our partnership must be equal, transparent, and fully aligned with Novaris’s constitutional framework and independent foreign policy."
5,"bae9e75f-e025-42e9-b644-4d1a6e622a7c","a4677f49-2c75-4fb8-a048-4fea9dbe4ce8","external_engagement","5c96e1e1-4f4f-4067-a42a-5ecf4819a31d","2026-02-09 15:02:40","major_defense_minister","Minister Dmitri Volkov","major_power",2,"We acknowledge Novaris’s proposals with appreciation and confirm our readiness to move from dialogue to implementation. On diplomatic coordination, Valkoria will co-sponsor joint statements with Novaris at the upcoming Regional Security Forum and UN Ocean Conference, emphasizing UNCLOS compliance and peaceful dispute resolution. We will also coordinate briefings with like-minded partners to amplify shared positions, provided they remain within the framework of international law and do not prejudge specific territorial claims.

On economic support, our development finance institution will release a commitment of $150 million for renewable energy projects—prioritizing offshore wind and smart grid development—contingent on the completion of due diligence and environmental assessments within the agreed six-month timeline. Technical teams will be deployed by next month to initiate feasibility studies in close consultation with your energy ministry. In return, we expect port access protocols to be formalized under civilian oversight, with clear guidelines for use in humanitarian and climate-response operations. We also propose launching the joint marine research group by quarter’s end, with data-sharing mechanisms ensuring transparency and scientific integrity.

Our red lines hold: all cooperation must fully comply with multilateral sanctions, export controls, and human rights standards. We cannot support projects involving entities under international restriction, nor accept contractual provisions that exclude third-party audit or enable unilateral reinterpretation of terms. Equally, we expect continued adherence to democratic governance and the rule of law. So long as these principles are upheld, Valkoria stands ready to deepen a strategic, forward-looking partnership with Novaris."
5,"bae9e75f-e025-42e9-b644-4d1a6e622a7c","db784181-686e-4185-a217-52c31435a9bb","external_engagement","553bd479-1f99-417f-a724-71984ca584c6","2026-02-09 15:02:45","neutral_power","Commissioner Helena Schmidt","aurelia",1,"We are seeking a credible, internationally supported mediation process that recognizes our legitimate political and security concerns, ensures inclusive representation in any peace framework, and guarantees meaningful power-sharing in a reformed state structure. Central to our demands is the protection of our community’s rights, the release of detained members, and the establishment of security guarantees that prevent renewed hostilities. We insist on a ceasefire monitored by neutral international actors as a foundation for sustained negotiations.

In return, we are prepared to commit to good-faith negotiations, de-escalation measures along active fronts, and coordination with humanitarian agencies to facilitate aid access in areas under our control. We can also contribute to regional stability by curbing illicit trade and supporting counterterrorism efforts, provided these actions are reciprocated and institutionalized through mutual agreements. Our red lines are clear: no negotiations under military pressure, no disarmament without verified security guarantees, and no political settlement that centralizes power or excludes our constituency from decision-making. Sovereignty must be shared, not imposed."
5,"bae9e75f-e025-42e9-b644-4d1a6e622a7c","db784181-686e-4185-a217-52c31435a9bb","external_engagement","5215045e-ca5c-487d-8342-04e5df31ad64","2026-02-09 15:02:51","small_economic","Minister Taras Moroz","small_power",1,"We welcome Commissioner Schmidt’s call for a credible, internationally supported mediation process and agree that lasting peace must be built on mutual recognition, security guarantees, and inclusive governance. To move forward, we propose the immediate establishment of a neutral mediation panel—under the auspices of the UN or a mutually acceptable regional body—to oversee a bilaterally monitored ceasefire and create a timetable for phased negotiations. We support the inclusion of civil society and marginalized groups in the peace framework, provided representation remains balanced and legitimate.

In return, we will coordinate with humanitarian organizations to ensure safe passage of aid to conflict-affected areas and commit to refraining from offensive operations during good-faith talks. We are also prepared to engage in intelligence sharing and joint interdiction efforts against extremist elements threatening regional stability. Our red lines are firm: no foreign military presence under the guise of monitoring, no political transition that dismantles state institutions without a constitutionally legitimate process, and no amnesty for actors responsible for war crimes without justice mechanisms. Any settlement must preserve national unity while accommodating legitimate autonomy within a federal structure."
5,"bae9e75f-e025-42e9-b644-4d1a6e622a7c","db784181-686e-4185-a217-52c31435a9bb","external_engagement","589cecdd-c3c1-40c3-b94c-2d6a4e3375f1","2026-02-09 15:02:53","neutral_power","Commissioner Helena Schmidt","aurelia",2,"We welcome Minister Moroz’s endorsement of an internationally mediated process and his proposal for a neutral mediation panel, which aligns with our call for impartial oversight. To build confidence, we accept the principle of a bilaterally monitored ceasefire and propose the immediate deployment of a joint monitoring mechanism under UN auspices, with real-time verification capabilities. We also support the inclusion of balanced civil society representation in the peace framework, provided that our community’s political and territorial interests are not subsumed under majoritarian arrangements.

In return, we will de-escalate hostilities along agreed frontlines, facilitate humanitarian access, and participate in counterterrorism coordination through established channels. However, our engagement is contingent upon clear reciprocal steps: the release of detained members, the lifting of siege conditions in our areas, and the formal recognition of our delegation as an equal party to negotiations. Our red lines remain non-negotiable: no ceasefire implementation without prior withdrawal of hostile forces from occupied territories, no disarmament in the absence of verified security guarantees, and no federal model that centralizes military or fiscal authority. A genuine political settlement must ensure decentralized self-governance with constitutional protection for our rights."
5,"bae9e75f-e025-42e9-b644-4d1a6e622a7c","db784181-686e-4185-a217-52c31435a9bb","external_engagement","90635063-e4b7-4f99-b3d4-7ea54b9fa3ef","2026-02-09 15:03:01","small_economic","Minister Taras Moroz","small_power",2,"[Minister Taras Moroz - SMALL_POWER]  
We acknowledge Commissioner Schmidt’s willingness to engage on ceasefire monitoring and humanitarian measures, and we accept the principle of UN-led verification provided it applies equally to all parties and does not legitimize unilateral territorial claims. To advance trust, we agree to immediate confidence-building steps: a 72-hour notification prior to any military movement near frontlines and the establishment of joint humanitarian corridors with NGO and ICRC oversight. We also commit to releasing non-combatant detainees in our custody upon reciprocal action by your forces.

However, we cannot accept preconditions that undermine state integrity or equate legitimate institutions with armed factions. The withdrawal of forces must be part of a mutual, sequenced process defined by the mediation panel—not a prerequisite for talks. We reiterate: no federal model will dismantle the constitutional order, but we are open to strengthening regional self-governance within a unified state. Our red lines hold—no foreign troops, no parallel military structures under the guise of self-defense, and no amnesty without accountability. A sustainable settlement must be inclusive, but it must also be anchored in law, not leverage."
5,"bae9e75f-e025-42e9-b644-4d1a6e622a7c","d47bb734-516d-4b4e-80f4-b7de4e000a00","external_engagement","63dc6f35-0085-4d23-93e7-073cf2a9718a","2026-02-09 15:03:15","international_org","Under-Secretary-General Isabella Cardenas","international_org",1,"We are seeking unimpeded humanitarian access to conflict-affected areas under your influence, including the safe and sustained passage of aid convoys, protection of civilian infrastructure, and respect for international humanitarian law. The protection of civilians—particularly women, children, and displaced persons—must be prioritized, and we expect all parties to refrain from targeting non-combatants or obstructing life-saving assistance.

In return, we can facilitate coordination with humanitarian actors, support local stabilization efforts, and provide security assurances within our areas of control to ensure aid reaches intended beneficiaries without diversion. We are also open to confidence-building measures that enhance transparency in aid distribution.

Our red lines include any conditions that compromise the neutrality of humanitarian aid, politicization of assistance, or demands that undermine our operational integrity. We will not accept interference in our internal affairs or actions that equate legitimate civilian support with material support to combatants. Any engagement must uphold mutual respect and the principle of distinction between civilians and fighters."
5,"bae9e75f-e025-42e9-b644-4d1a6e622a7c","d47bb734-516d-4b4e-80f4-b7de4e000a00","external_engagement","42dd2e4f-b93d-4a08-94a4-791166eb715a","2026-02-09 15:03:23","major_military_chief","General Viktor Krasnov","major_power",1,"We welcome the emphasis on humanitarian access and civilian protection, which aligns with our longstanding commitment to safeguarding non-combatants. To operationalize this, we require guaranteed, impartial delivery of aid through designated corridors under our coordination, with advance notification of convoy routes and personnel. We also seek support for the rehabilitation of essential civilian infrastructure—water, medical facilities, and schools—in areas under our control, and demand strict adherence to the principle of distinction by all parties, including restraint from aerial or artillery attacks on populated areas.

In return, we will ensure safe passage for verified humanitarian convoys, provide local security escorts, and facilitate community-level engagement to monitor distribution and prevent diversion. We are prepared to establish joint monitoring mechanisms with neutral oversight. Our red lines are clear: no aid deliveries will be permitted to areas controlled by opposing armed groups without reciprocal access for our affected populations; no third-party actors or surveillance equipment will be embedded in aid operations; and no conditions that equate our governance structures with illegitimate authority will be accepted. Engagement must recognize our de facto responsibility for civilian welfare in our territories."
5,"bae9e75f-e025-42e9-b644-4d1a6e622a7c","d47bb734-516d-4b4e-80f4-b7de4e000a00","external_engagement","e65db9fa-e544-449f-b8a6-00ae15994b78","2026-02-09 15:03:27","international_org","Under-Secretary-General Isabella Cardenas","international_org",2,"We welcome the shared commitment to humanitarian access and civilian protection, and we seek guaranteed, secure, and sustained passage for humanitarian convoys into conflict-affected areas under our influence—free from delays, inspections, or conditional approvals at checkpoints. We require respect for the neutrality of aid operations and demand that all parties, including your forces, cease attacks on civilian infrastructure such as hospitals, schools, and water systems, which violate international humanitarian law. Additionally, we insist on accountability for violations against civilians, particularly in frontline and recently recaptured areas.

In return, we will coordinate through established humanitarian channels to facilitate timely access, provide local security guarantees for aid workers, and support community-led distribution mechanisms to ensure transparency and prevent diversion. We are open to third-party monitoring by neutral entities, including UN agencies, to verify compliance. Our red lines are firm: we will not accept aid conditionalities that undermine our sovereignty, the politicization of assistance, or military interference in humanitarian decision-making. Any sustained engagement must recognize the civilian character of the populations we serve and refrain from conflating local governance with combatant status."
5,"bae9e75f-e025-42e9-b644-4d1a6e622a7c","d47bb734-516d-4b4e-80f4-b7de4e000a00","external_engagement","507262d1-9a19-4ffd-ab0c-1164643093ce","2026-02-09 15:03:31","major_military_chief","General Viktor Krasnov","major_power",2,"We acknowledge the importance of humanitarian access and civilian protection, but such access in areas under our influence must be coordinated through our established civil administration and security protocols. We require advance notification of convoys, manifest declarations, and the use of locally vetted personnel and transport to ensure aid is not diverted to armed elements. We will permit access to designated distribution points under our supervision and allow humanitarian actors to operate only with our prior authorization and in accordance with our legal framework.

In return, we will guarantee the physical safety of aid convoys within our territory, provide secure routing, and deploy our personnel to protect distribution sites from looting or interference. We can also facilitate community verification mechanisms to confirm aid reaches intended beneficiaries. Our red lines are unequivocal: we will not accept unilateral access, uncoordinated monitoring by foreign entities, or any operations that bypass our authority. Humanitarian action must respect our administrative integrity—no aid will move without our oversight, and no actors will operate outside our regulatory framework. Engagement must recognize our legitimate governance role and reject any narrative that equates our civilian institutions with belligerency."
5,"bae9e75f-e025-42e9-b644-4d1a6e622a7c","d47bb734-516d-4b4e-80f4-b7de4e000a00","external_engagement","fc827107-6d12-4f14-a01a-2dbd23d720e4","2026-02-09 15:03:48","international_org","Under-Secretary-General Isabella Cardenas","international_org",3,"We appreciate General Krasnov’s acknowledgment of humanitarian principles, but must emphasize that timely, unimpeded access is non-negotiable under international law. We require immediate, unconditional passage for humanitarian convoys to all conflict-affected areas under your control, including frontline and besieged zones, without manifest inspections or delays at checkpoints. Advance notifications are acceptable for security coordination, but must not be used as tools for obstruction or denial. We further demand an immediate halt to attacks on hospitals, schools, and water systems—acts that constitute clear violations of international humanitarian law—and insist on accountability for such violations, particularly in recaptured areas.

In return, we will work through established neutral channels to coordinate deliveries, utilize vetted local partners for distribution, and implement transparent monitoring—including third-party verification—to prevent diversion. We are prepared to share real-time convoy data and beneficiary reports with your security authorities, provided the integrity of humanitarian operations remains intact. Our red lines are firm: we will not accept politicization of aid, operational control by military authorities, or the conflation of civilian institutions with combatant status. Humanitarian action must remain neutral, impartial, and independent—any engagement that undermines these principles will be suspended."
5,"bae9e75f-e025-42e9-b644-4d1a6e622a7c","d47bb734-516d-4b4e-80f4-b7de4e000a00","external_engagement","b022ed7c-d174-42e2-a1ab-534bafd0d115","2026-02-09 15:03:58","major_military_chief","General Viktor Krasnov","major_power",3,"[Colonel Amir Tahiri - NON_STATE_ARMED_GROUP]  
We affirm the right of civilians under our control to receive humanitarian assistance, but all access must be coordinated through our local humanitarian liaison cell and respect our security protocols. We will allow passage of convoys that provide advance manifests and use our approved routes and local staff, to prevent infiltration of intelligence assets or diversion of supplies to rival factions. Humanitarian actors must operate under our supervision and refrain from engaging with military targets or collecting data for third-party intelligence purposes.

In return, we will guarantee the safety of aid workers within our territory, secure distribution points, and facilitate community-based oversight to ensure equitable delivery. We accept monitoring by neutral bodies such as the ICRC, provided it is conducted in consultation with our authorities and does not compromise operational security. Our red lines are absolute: no unconditional or unmonitored access, no presence of foreign security personnel under humanitarian cover, and no use of aid to legitimize enemy narratives or undermine our governance. We will not accept any operation that bypasses our authority or treats our civilian institutions as illegitimate."
