"period","session_id","interaction_id","timestamp","type","topic","participants","participant_factions","n_messages","duration_seconds"
9,"e86ef1eb-1145-43fe-9e2d-8e5e38b1d559","64f6afae-fae5-43be-987a-31f54cf4b7f9","2026-02-09 15:52:04","intra_faction_coordination","Review military strategy and assess progress toward objectives","General Viktor Krasnov; Minister Dmitri Volkov; Dr. Natasha Petrova; Director Sergei Morozov; Deputy Minister Yuri Volkov","major_power; major_power; major_power; major_power; major_power",10,76.787670135498
9,"e86ef1eb-1145-43fe-9e2d-8e5e38b1d559","f38153c1-a902-46e3-8aa5-108d0c3bff5d","2026-02-09 15:53:21","intra_faction_coordination","Debate negotiation positions vs continued resistance","President Elena Marchetti; General Olena Bondar; Minister Sofia Kovalenko; Viktor Zelenko; Director Maksym Savchenko; Minister Taras Moroz","small_power; small_power; small_power; small_power; small_power; small_power",18,105.914796113968
9,"e86ef1eb-1145-43fe-9e2d-8e5e38b1d559","15776dd8-45d4-449c-943e-230b72fbf86b","2026-02-09 15:55:07","inter_faction_negotiation","Territorial concessions vs sovereignty preservation debate","General Viktor Krasnov; Minister Sofia Kovalenko","major_power; small_power",6,70.7512049674988
9,"e86ef1eb-1145-43fe-9e2d-8e5e38b1d559","db8a4d8f-360a-4284-999a-ed1e96d8efdc","2026-02-09 15:56:18","external_engagement","Coordination on military aid and support for Tethys","Ambassador William Crawford; Minister Taras Moroz","meridian; small_power",4,25.0153110027313
9,"e86ef1eb-1145-43fe-9e2d-8e5e38b1d559","4a692144-e3bc-4c9d-a7be-7937929e3c04","2026-02-09 15:56:43","external_engagement","Diplomatic coordination and economic support for Novaris","Minister Andrei Kozlov; Dr. Natasha Petrova","valkoria; major_power",4,31.7628650665283
9,"e86ef1eb-1145-43fe-9e2d-8e5e38b1d559","b60d77bb-d830-4a6d-b2e6-50c83995cc56","2026-02-09 15:57:14","external_engagement","Mediation proposal and peace framework discussions","Commissioner Helena Schmidt; Minister Taras Moroz","aurelia; small_power",6,45.9014551639557
9,"e86ef1eb-1145-43fe-9e2d-8e5e38b1d559","11f96f27-c5e9-436e-beb8-cf63ba282107","2026-02-09 15:58:00","external_engagement","Humanitarian access and civilian protection","Under-Secretary-General Isabella Cardenas; Minister Sofia Kovalenko","international_org; small_power",6,52.0706970691681
