"period","session_id","interaction_id","timestamp","type","topic","participants","participant_factions","n_messages","duration_seconds"
3,"3cec7026-123d-42af-9653-36954b8cc13c","a5402173-4320-4dfa-a441-88d8da93a1a0","2026-02-09 14:33:16","intra_faction_coordination","Evaluate intelligence reports on smaller power's capabilities","General Viktor Krasnov; Minister Dmitri Volkov; Dr. Natasha Petrova; Director Sergei Morozov; Deputy Minister Yuri Volkov","major_power; major_power; major_power; major_power; major_power",15,101.75130200386
3,"3cec7026-123d-42af-9653-36954b8cc13c","2c9e188b-7fee-4202-92a9-35a8d29667b1","2026-02-09 14:34:58","intra_faction_coordination","Assess military aid from allies and deployment plans","President Elena Marchetti; General Olena Bondar; Minister Sofia Kovalenko; Viktor Zelenko; Director Maksym Savchenko; Minister Taras Moroz","small_power; small_power; small_power; small_power; small_power; small_power",12,79.067636013031
3,"3cec7026-123d-42af-9653-36954b8cc13c","adbd013b-9f05-4f61-bfb0-874c235dc064","2026-02-09 14:36:17","inter_faction_negotiation","Backchannel discussion about potential ceasefire conditions","Deputy Minister Yuri Volkov; Minister Sofia Kovalenko","major_power; small_power",8,83.7526710033417
3,"3cec7026-123d-42af-9653-36954b8cc13c","f298b829-7c41-4b08-a347-6705254da0c8","2026-02-09 14:37:41","external_engagement","Coordination on military aid and support for Tethys","Ambassador William Crawford; President Elena Marchetti","meridian; small_power",6,64.8246440887451
3,"3cec7026-123d-42af-9653-36954b8cc13c","79fb8453-2462-4abc-a6cb-8ee248c6cba8","2026-02-09 14:38:45","external_engagement","Diplomatic coordination and economic support for Novaris","Minister Andrei Kozlov; Director Sergei Morozov","valkoria; major_power",6,42.0032260417938
3,"3cec7026-123d-42af-9653-36954b8cc13c","956feeb6-a007-41ef-891b-fd6882418b78","2026-02-09 14:39:27","external_engagement","Mediation proposal and peace framework discussions","Commissioner Helena Schmidt; Minister Sofia Kovalenko","aurelia; small_power",4,32.562509059906
3,"3cec7026-123d-42af-9653-36954b8cc13c","4ca92ef2-56cc-4aad-803a-608ea563cfeb","2026-02-09 14:40:00","external_engagement","Humanitarian access and civilian protection","Under-Secretary-General Isabella Cardenas; General Viktor Krasnov","international_org; major_power",6,47.3932111263275
