"period","session_id","interaction_id","interaction_type","message_id","timestamp","sender_id","sender_name","sender_faction","exchange_number","content"
10,"0f730d7c-268e-4ed1-995d-6a6da4d2959f","f329220a-737d-467d-8d46-97553e6c52a6","intra_faction_coordination","560a4ab5-e7cf-4742-8c82-f9de6f0f14fd","2026-02-09 16:04:15","major_military_chief","General Viktor Krasnov","major_power",1,"As Head of Strategic Operations, I assess that our current military strategy is achieving limited objectives but lacks synchronization between theater commands, resulting in inefficiencies and missed opportunities. We must shift to a centralized joint-task force model to streamline command and accelerate decision cycles.  

Recommended course: Establish a Unified Operations Center by Q3 to integrate intelligence, logistics, and combat arms under a single directive.  

Key risk: Delayed implementation will exacerbate intercommand friction and cede initiative to adversaries during critical windows."
10,"0f730d7c-268e-4ed1-995d-6a6da4d2959f","f329220a-737d-467d-8d46-97553e6c52a6","intra_faction_coordination","5339b321-7db9-44b8-a9f7-e947ec04a48c","2026-02-09 16:04:19","major_defense_minister","Minister Dmitri Volkov","major_power",1,"[Deputy Minister Elena Rostova - MAJOR_POWER]: I concur with General Krasnov’s assessment—fragmented command structures are undermining operational tempo and resource allocation. Centralized coordination through a Unified Operations Center is necessary to align strategic intent with battlefield execution.  

Recommended course: Immediately designate a joint civilian-military task force to stand up the Center, with authority to reallocate personnel and budgets from underperforming programs.  

Key risk: Bureaucratic resistance from entrenched theater commands could delay integration and compromise interoperability if not managed through top-level mandate."
10,"0f730d7c-268e-4ed1-995d-6a6da4d2959f","f329220a-737d-467d-8d46-97553e6c52a6","intra_faction_coordination","9a9506db-19dd-4733-a03a-41b03507da3a","2026-02-09 16:04:21","major_economic_advisor","Dr. Natasha Petrova","major_power",1,"[Director Natalia Veshnyakova - MAJOR_POWER]: I support the establishment of a Unified Operations Center, but we must ensure it does not become a data bottleneck—our intelligence fusion capabilities are already strained. Integration must be accompanied by automated decision-support systems and secure cross-theater data sharing protocols.  

Recommended course: Pair the Center’s launch with the deployment of AI-enabled battlefield management systems, tested in the Northern Command pilot, to enhance situational awareness and reduce cognitive load on commanders.  

Key risk: Over-centralization could degrade operational agility if real-time data is not reliably processed and disseminated—priority must be given to resilient C4ISR architecture."
10,"0f730d7c-268e-4ed1-995d-6a6da4d2959f","f329220a-737d-467d-8d46-97553e6c52a6","intra_faction_coordination","b781fef1-8f00-4456-9c66-51e1ecb591e0","2026-02-09 16:04:33","major_intelligence","Director Sergei Morozov","major_power",1,"[Deputy Chief of Staff Anatoly Mironov - MAJOR_POWER]: I endorse the Unified Operations Center as a necessary step, but implementation must be synchronized with force modernization—our current logistics and replenishment cycles cannot sustain intensified operations under a centralized model. Without alignment, we risk overextending front-line units despite improved command structure.

Recommended course: Launch the Center in parallel with the Logistics Modernization Program, prioritizing automated supply chain systems and pre-positioned reserve stocks in high-threat theaters.

Key risk: Operational tempo may outpace sustainment capacity, leading to degradation of combat effectiveness within 60–90 days of sustained conflict—this gap must be closed before full transition."
10,"0f730d7c-268e-4ed1-995d-6a6da4d2959f","f329220a-737d-467d-8d46-97553e6c52a6","intra_faction_coordination","2d267813-d614-4b38-96f8-47ed9b59d039","2026-02-09 16:04:37","major_propaganda","Deputy Minister Yuri Volkov","major_power",1,"[Deputy Minister Alexei Karpov - MAJOR_POWER]: I support the Unified Operations Center in principle, but its success hinges on political-strategic coherence—current disconnects between foreign policy objectives and military planning are resulting in reactive, not proactive, campaign design.

Recommended course: Establish a permanent Strategic Alignment Cell within the Center, staffed by senior representatives from Defense, Foreign Affairs, and Intelligence, to ensure operational plans are continuously synchronized with national strategic priorities and diplomatic signaling.

Key risk: Without this integration, the Center may optimize for tactical efficiency while undermining strategic coherence—particularly in gray-zone and hybrid operations where military action must closely align with political messaging and influence efforts."
10,"0f730d7c-268e-4ed1-995d-6a6da4d2959f","f329220a-737d-467d-8d46-97553e6c52a6","intra_faction_coordination","abbc5c5f-35a8-48b2-9ecf-c72dc1a8ad7e","2026-02-09 16:04:40","major_military_chief","General Viktor Krasnov","major_power",2,"[Chief of General Staff Dmitri Sokolov - MAJOR_POWER]: The Unified Operations Center is operationally sound, but its effectiveness depends on resolving the misalignment between strategic intent, command structure, and combat power availability. I concur with General Mironov on sustainment risks and Minister Karpov on strategic coherence—both must be addressed concurrently, not sequentially.

Recommended course: Implement a phased activation of the Center, beginning with joint planning and intelligence integration at the theater level, while synchronizing readiness milestones for logistics modernization and political-strategic alignment. Full operational capability should be contingent on achieving minimum thresholds in both strategic guidance clarity and supply chain automation.

Key risk: Premature activation under current conditions risks creating a high-visibility command node that fails under first stress—damaging inter-service confidence and emboldening adversaries during transition. We must prove resilience before full rollout."
10,"0f730d7c-268e-4ed1-995d-6a6da4d2959f","f329220a-737d-467d-8d46-97553e6c52a6","intra_faction_coordination","df650440-7996-42f2-a888-5acb1e283bc5","2026-02-09 16:04:48","major_defense_minister","Minister Dmitri Volkov","major_power",2,"[Deputy Chief of Staff Anatoly Mironov - MAJOR_POWER]: I accept the phased approach proposed by General Krasnov—staged activation mitigates both sustainment and coherence risks. However, the logistics track must not be treated as a support function; it is a warfighting enabler and must be resourced accordingly in parallel with command integration.

Recommended course: Designate the Logistics Modernization Program as a Tier-1 priority under the same authority as the Center’s activation, with binding resource allocations and quarterly joint reviews between General Staff and Ministry of Defense to ensure synchronization.

Key risk: If logistics automation and pre-positioning are underfunded or delayed, even a perfectly synchronized command structure will collapse under operational strain—this is not a technical issue, but a combat effectiveness imperative."
10,"0f730d7c-268e-4ed1-995d-6a6da4d2959f","f329220a-737d-467d-8d46-97553e6c52a6","intra_faction_coordination","c905433e-f24c-4c11-a5e4-2e688619927e","2026-02-09 16:04:58","major_economic_advisor","Dr. Natasha Petrova","major_power",2,"[Director of Strategic Planning Elena Rostova - MAJOR_POWER]: The phased activation and Tier-1 logistics designation are necessary but insufficient without clear metrics for strategic alignment. We must define measurable benchmarks for political-military coherence—such as alignment scores between campaign objectives and diplomatic posture—within each phase.

Recommended course: Integrate a Strategic Assessment Framework into the Center’s activation plan, requiring joint civilian-military sign-off at each phase based on predefined thresholds for command integration, logistics readiness, *and* strategic coherence with foreign policy goals.

Key risk: Without objective criteria to halt or adjust the rollout, institutional momentum will override rigor, resulting in a partially effective command structure that cannot adapt to shifting strategic demands—particularly in contested gray-zone environments."
10,"0f730d7c-268e-4ed1-995d-6a6da4d2959f","f329220a-737d-467d-8d46-97553e6c52a6","intra_faction_coordination","5f7bb26c-f239-4f97-8080-f3324d7a67b1","2026-02-09 16:05:00","major_intelligence","Director Sergei Morozov","major_power",2,"[Deputy Chief of Staff Anatoly Mironov - MAJOR_POWER]: I endorse the phased activation framework and the elevation of logistics to Tier-1 priority—this aligns with ground-truth readiness assessments from Western and Southern Commands. However, we must anchor both command and logistics milestones to real-world operational timelines, not bureaucratic benchmarks.

Recommended course: Lock the full activation of the Unified Operations Center to a decisive exercise in Q3—simulate a high-intensity, multi-theater scenario that stress-tests command integration, automated logistics pipelines, and political-strategic decision loops under time pressure. Success in this exercise becomes the gate for full operational status.

Key risk: Overemphasis on process and sign-off mechanisms without a live, integrated test risks producing a “paper-ready” system that fails under actual combat pacing—especially in distributed operations where decision latency is fatal."
10,"0f730d7c-268e-4ed1-995d-6a6da4d2959f","f329220a-737d-467d-8d46-97553e6c52a6","intra_faction_coordination","95c74d10-4817-46cd-8914-1bb7eedab675","2026-02-09 16:05:07","major_propaganda","Deputy Minister Yuri Volkov","major_power",2,"[General Yuri Krasnov - MAJOR_POWER]: I concur with the phased approach, the Tier-1 logistics designation, and the need for a decisive operational test—these elements are mutually reinforcing. However, we must now assign clear ownership of cross-domain synchronization: the General Staff will establish a Joint Execution Cell (JEC) by Q2, reporting directly to me, with mandated representation from Strategic Planning, Logistics Command, and the Ministry of Defense.

Recommended course: The JEC will own end-to-end integration of the Q3 decisive exercise, with authority to compel resource alignment, override inter-service bottlenecks, and validate readiness across command, logistics, and political-strategic nodes. Its performance will be the primary determinant for advancing to full activation.

Key risk: Without centralized enforcement authority, even well-designed processes will stall in inter-agency disputes—particularly under stress. Decentralized coordination is a luxury we cannot afford during transition; unity of command must be operational, not aspirational."
10,"0f730d7c-268e-4ed1-995d-6a6da4d2959f","f329220a-737d-467d-8d46-97553e6c52a6","intra_faction_coordination","d6bc3c43-ca94-4b32-aa82-3199c8bc5636","2026-02-09 16:05:12","major_military_chief","General Viktor Krasnov","major_power",3,"[General Aleksandr Volkov - MAJOR_POWER]: I support the phased activation framework, the Tier-1 logistics designation, and the Q3 decisive exercise as the operational gate for full Center activation. However, we are underestimating the threat of cognitive overload in command decision-making under high-tempo operations—our simulations consistently show degradation in strategic judgment when information flow exceeds processing capacity.

Recommended course: Integrate an AI-assisted Decision Support Module (DSM) into the Unified Operations Center by Q2, co-developed by the General Staff and Strategic Planning, to filter, prioritize, and model courses of action in real time during the Q3 exercise. The DSM must be stress-tested as part of the activation criteria.

Key risk: Even with integrated command and logistics, human-driven decision cycles will lag behind operational tempo in a multi-theater conflict, leading to reactive posture and strategic drift—technology must not only enable speed but enforce disciplined prioritization."
10,"0f730d7c-268e-4ed1-995d-6a6da4d2959f","f329220a-737d-467d-8d46-97553e6c52a6","intra_faction_coordination","aae6cdc2-4256-45da-b23b-c29190f34178","2026-02-09 16:05:15","major_defense_minister","Minister Dmitri Volkov","major_power",3,"[Deputy Chief of Staff Anatoly Mironov - MAJOR_POWER]: I concur with the establishment of the Joint Execution Cell and the integration of the AI-assisted Decision Support Module—both are essential to overcoming systemic delays and cognitive bottlenecks. However, we must ensure the DSM is not treated as a standalone technical fix; it must be embedded within a revised command doctrine that defines clear human-machine decision authorities.

Recommended course: By Q2, issue a directive from the General Staff mandating that all operational plans submitted for the Q3 decisive exercise include DSM integration protocols, with defined thresholds for automated alerting, recommendation generation, and human override—these will be evaluated as part of the exercise’s success criteria.

Key risk: Without doctrinal clarity on decision authority, the DSM risks either being ignored during high-pressure scenarios or creating dangerous overreliance, eroding command initiative and strategic judgment."
10,"0f730d7c-268e-4ed1-995d-6a6da4d2959f","f329220a-737d-467d-8d46-97553e6c52a6","intra_faction_coordination","c6307899-4299-49d7-9bad-8bef4b06e8bb","2026-02-09 16:05:22","major_economic_advisor","Dr. Natasha Petrova","major_power",3,"[Chief of Strategic Planning, Colonel General Irina Vasilieva - MAJOR_POWER]: I fully endorse the Joint Execution Cell and the AI-assisted Decision Support Module, and I agree that doctrinal integration is non-negotiable. However, we are still missing a unified threat assessment framework to calibrate both the JEC’s priorities and the DSM’s logic models—current inputs remain stovepiled by theater and domain.

Recommended course: Direct the JEC, in coordination with the DSM development team, to operationalize a Common Threat Evaluation Protocol (CTEP) by Q2, integrating intelligence from all strategic directions into a single weighted risk matrix that dynamically informs resource allocation and alert thresholds during the Q3 exercise.

Key risk: Without a synchronized threat picture, the JEC risks misallocating assets and the DSM will generate misaligned recommendations, producing false confidence in a system that appears integrated but remains analytically fragmented."
10,"0f730d7c-268e-4ed1-995d-6a6da4d2959f","f329220a-737d-467d-8d46-97553e6c52a6","intra_faction_coordination","cff88dce-7fc1-4186-a420-cc6ba3be4a24","2026-02-09 16:05:28","major_intelligence","Director Sergei Morozov","major_power",3,"[Deputy Chief of Staff Anatoly Mironov - MAJOR_POWER]: [Dr. Natasha Petrova - MAJOR_POWER]: Your emphasis on the Common Threat Evaluation Protocol is correct—without a unified, dynamic threat model, both the Joint Execution Cell and the Decision Support Module will operate on fragmented assumptions. I endorse the CTEP as a foundational input to the DSM’s prioritization algorithms and the JEC’s execution planning.

Recommended course: Assign the Main Intelligence Directorate (GRU) and the General Staff’s Operations Directorate to co-lead CTEP development under the JEC’s oversight, with biweekly validation cycles against live intelligence feeds and adversarial behavior models; the first integrated CTEP baseline must be operational by mid-Q2 and fully stress-tested during the Q3 exercise’s opening phase.

Key risk: If CTEP becomes overly centralized or slow to update, it will replicate the very bottlenecks we are trying to eliminate—therefore, it must be designed with decentralized data ingestion, automated weighting recalibration, and clear version control to prevent decision latency."
10,"0f730d7c-268e-4ed1-995d-6a6da4d2959f","f329220a-737d-467d-8d46-97553e6c52a6","intra_faction_coordination","ae2f5f7c-cac4-4961-aefc-3b3c797f3a2e","2026-02-09 16:05:32","major_propaganda","Deputy Minister Yuri Volkov","major_power",3,"[Deputy Chief of Staff Anatoly Mironov - MAJOR_POWER]: I accept the proposed division of labor on CTEP development and endorse GRU-Operations co-leadership under JEC oversight. However, doctrinal integration must advance in parallel with technical development—not after baseline capability is achieved.

Recommended course: Launch a Dual-Track Implementation Directive: Track One proceeds with CTEP development as outlined; Track Two requires the Doctrine and Training Directorate to draft amendments to the Unified Command Doctrine by end-Q1, incorporating human-machine decision protocols tied explicitly to CTEP output levels, ensuring tactical, operational, and strategic echelons apply consistent rules of engagement for DSM recommendations.

Key risk: Sequential execution—technology first, doctrine later—will entrench workarounds and informal practices during the Q3 exercise, making formal adoption of doctrine post-exercise ineffective. We must treat doctrine as a live component of system design, not a retrospective overlay."
10,"0f730d7c-268e-4ed1-995d-6a6da4d2959f","53143378-166e-4713-a4c6-191dbf4f6eaa","intra_faction_coordination","fde1280c-84b7-407b-b2cc-d967f1b3ee79","2026-02-09 16:05:34","small_president","President Elena Marchetti","small_power",1,"As the military strategy lead, I assess that current allied aid—while timely—is fragmented and lacks interoperability with our existing systems, limiting battlefield effectiveness. We must prioritize standardizing equipment and accelerating integration of supplied assets into unified command structures.

I recommend establishing a joint coordination cell with key allied partners within 72 hours to synchronize aid delivery, align deployment timelines, and deconflict front-line unit assignments.

A key risk is over-reliance on external supply chains; if resupply is disrupted, operational momentum could collapse. We must build at least two weeks of critical reserves before launching coordinated offensives."
10,"0f730d7c-268e-4ed1-995d-6a6da4d2959f","53143378-166e-4713-a4c6-191dbf4f6eaa","intra_faction_coordination","0ea7c7e2-cd4d-49d4-8cc0-693aa87ce416","2026-02-09 16:05:44","small_military_commander","General Olena Bondar","small_power",1,"[Defense Logistics Officer - SMALL_POWER]: I concur with the assessment on interoperability gaps—our maintenance and supply pipelines are already strained adapting disparate systems under combat conditions. Standardization cannot be delayed.

I recommend immediately designating a central receiving hub for all incoming aid, co-located with allied liaison teams, to conduct rapid technical verification, compatibility screening, and distribution prioritization based on operational urgency.

A key concern is that without pre-positioned spare parts and technical advisors for each system type, even functional equipment will degrade quickly in the field—rendering aid ineffective within days. We must condition further acceptance of hardware on inclusion of integrated logistics packages."
10,"0f730d7c-268e-4ed1-995d-6a6da4d2959f","53143378-166e-4713-a4c6-191dbf4f6eaa","intra_faction_coordination","dcf7bc1d-9a17-42c3-af7a-298e57e1b2ef","2026-02-09 16:05:49","small_foreign_minister","Minister Sofia Kovalenko","small_power",1,"[Operational Planning Officer - SMALL_POWER]: I support the push for standardization and centralized coordination—without it, we risk tactical fragmentation and inefficient use of limited combat power. Integration of allied systems must align with our brigade-level operational timelines, not ad hoc delivery schedules.

I recommend synchronizing the joint coordination cell’s work with our upcoming 72-hour operational rehearsal, embedding allied logistics and command reps directly into our maneuver unit planning teams to ensure unity of effort.

A key risk is timeline misalignment: if allied aid delivery and unit training cycles lag behind our operational timeline, we may be forced into premature engagements with under-prepared forces—degrading morale and increasing avoidable losses."
10,"0f730d7c-268e-4ed1-995d-6a6da4d2959f","53143378-166e-4713-a4c6-191dbf4f6eaa","intra_faction_coordination","6d49e973-c4df-46e0-b8f1-a7160e48e626","2026-02-09 16:05:57","small_opposition","Viktor Zelenko","small_power",1,"[Chief of Staff - SMALL_POWER]: I endorse the establishment of the joint coordination cell and central receiving hub as complementary measures—operational coherence and logistical resilience must be addressed together.

I recommend mandating that all incoming aid shipments include standardized data interfaces and maintenance packages, and that our liaison teams verify compliance at point of departure from donor countries to prevent non-interoperable systems from reaching the theater.

A key risk is command fragmentation: without a single authoritative node integrating both operational planning and logistics validation, we risk divergent priorities between battlefield needs and supply realities—this node must report directly to the General Staff to ensure alignment."
10,"0f730d7c-268e-4ed1-995d-6a6da4d2959f","53143378-166e-4713-a4c6-191dbf4f6eaa","intra_faction_coordination","42c8f77f-4548-489b-a808-f31d248bffd5","2026-02-09 16:06:00","small_intelligence","Director Maksym Savchenko","small_power",1,"[Deputy Minister of Defense - SMALL_POWER]: I align with the need for a unified node integrating logistics and operations—this cannot be a parallel structure but must be embedded within the General Staff’s operational chain of command to ensure real-time decision authority.

I recommend establishing a Joint Aid Integration Cell (JAIC) under the General Staff, with binding authority over both incoming aid acceptance and operational deployment timelines, co-located with the central receiving hub and including permanent representation from key allied partners.

A key risk is donor-driven aid packaging: if systems are provided based on surplus availability rather than our validated threat-specific requirements, we risk accumulating capability mismatches that strain command, logistics, and training—acceptance must be conditioned on operational relevance and doctrinal fit."
10,"0f730d7c-268e-4ed1-995d-6a6da4d2959f","53143378-166e-4713-a4c6-191dbf4f6eaa","intra_faction_coordination","174d7c2e-cea0-4afa-a585-ac3b59541f9f","2026-02-09 16:06:04","small_economic","Minister Taras Moroz","small_power",1,"[Colonel Tetiana Moroz - SMALL_POWER]: [Director of Logistics - SMALL_POWER]: I concur with the establishment of the JAIC under the General Staff—centralized authority is essential to align what arrives with what our units can employ.

I recommend implementing a tiered acceptance protocol at the receiving hub: all aid must pass technical certification, spare parts sufficiency, and training package completeness before clearance into the operational pipeline, with the JAIC empowered to reject non-compliant shipments.

A key risk is logistical overstretch: even interoperable systems will strain our sustainment capacity if introduced without phased integration plans—each new system must be matched to pre-validated maintenance workflows, transport capacity, and fuel or power supply chains."
10,"0f730d7c-268e-4ed1-995d-6a6da4d2959f","53143378-166e-4713-a4c6-191dbf4f6eaa","intra_faction_coordination","cdd16024-0337-40f4-ade3-9583c7d57d0b","2026-02-09 16:06:20","small_president","President Elena Marchetti","small_power",2,"[Deputy Chief of Defense - SMALL_POWER]: I support the JAIC as the central authority for aid integration and endorse the tiered acceptance protocol—interoperability without sustainability is a liability.

I recommend mandating that all new systems approved for delivery must be accompanied by a full lifecycle support plan, including host-nation maintenance training, spare parts replenishment schedules, and energy/logistics footprint assessments, with the JAIC certifying readiness prior to deployment.

A key risk is operational overcommitment: rushing new capabilities to the front to signal donor impact can degrade overall force readiness if units are forced to operate beyond their logistical tether—deployment timelines must be synchronized with sustainment capacity, not donor delivery speed."
10,"0f730d7c-268e-4ed1-995d-6a6da4d2959f","53143378-166e-4713-a4c6-191dbf4f6eaa","intra_faction_coordination","34e827d6-be87-4c67-a7cb-829497ab58ba","2026-02-09 16:06:24","small_military_commander","General Olena Bondar","small_power",2,"[Chief of Defense - SMALL_POWER]: I endorse the JAIC as the central node for aid integration and the tiered acceptance protocol—operational coherence depends on controlling both what enters and when it deploys.

I recommend instituting a binding prioritization matrix within the JAIC that ranks incoming systems by combat multiplier effect, doctrinal alignment, and ease of integration, ensuring that high-impact, low-drag capabilities are fast-tracked while marginal systems are deferred or rejected.

A key risk is command fragmentation: if field commanders bypass the JAIC to secure direct donor support through informal channels, we erode centralized control and create patchwork readiness—this must be countered with strict enforcement of the JAIC’s authority and disciplinary measures for unauthorized procurement."
