"period","session_id","interaction_id","interaction_type","message_id","timestamp","sender_id","sender_name","sender_faction","exchange_number","content"
9,"e86ef1eb-1145-43fe-9e2d-8e5e38b1d559","64f6afae-fae5-43be-987a-31f54cf4b7f9","intra_faction_coordination","4b6b462a-e175-40cd-a448-baeded00f0d2","2026-02-09 15:52:09","major_military_chief","General Viktor Krasnov","major_power",1,"As Director of Strategic Operations, I assess that our current campaign has secured key logistical corridors but is falling short of decisive momentum against enemy command nodes. We must shift emphasis to precision interdiction of high-value targets using SOF-aviation task forces to disrupt adversary decision-making.

I recommend re-tasking two battalions from static area control duties to mobile strike operations within Sector Gamma by 15 October, supported by reallocated ISR assets.

Key risk: Overextension of forward logistics chains could undermine operational tempo if enemy forces conduct coordinated counter-mobility strikes."
9,"e86ef1eb-1145-43fe-9e2d-8e5e38b1d559","64f6afae-fae5-43be-987a-31f54cf4b7f9","intra_faction_coordination","9b559fae-577c-4074-bb4c-d094a9acae7b","2026-02-09 15:52:10","major_defense_minister","Minister Dmitri Volkov","major_power",1,"[Deputy Director Elena Rostova - MAJOR_POWER]: I concur with General Krasnov’s assessment—our gains in mobility and supply security are necessary but insufficient without degrading enemy C2 capacity. Precision strikes must be synchronized with electronic warfare to suppress adversary communications during operations.

I recommend establishing a joint targeting cell integrating SOF, signals intelligence, and air assets under a single operational chain by 5 October to ensure rapid target nomination and strike coordination.

Key concern: Without tighter integration, we risk fratricide or missed windows due to delayed sensor-to-shooter loops."
9,"e86ef1eb-1145-43fe-9e2d-8e5e38b1d559","64f6afae-fae5-43be-987a-31f54cf4b7f9","intra_faction_coordination","095e7222-608a-4054-a6d4-584c1ba8ce3b","2026-02-09 15:52:12","major_economic_advisor","Dr. Natasha Petrova","major_power",1,"[Director of Logistics and Sustainment - MAJOR_POWER]: I support the shift toward mobile strike operations, but current supply infrastructure in Sector Gamma cannot sustain increased SOF and aviation activity without significant reinforcement. Pre-positioning fuel, ammunition, and maintenance packages at forward operating points is essential before re-tasking forces.

I recommend accelerating the deployment of two mobile logistics support teams to Sector Gamma by 1 October, concurrent with the establishment of protected airhead nodes to enable responsive resupply.

Key risk: Without secured forward sustainment, high-tempo strikes will degrade within 72 hours due to attrition in aviation assets and SOF endurance limits."
9,"e86ef1eb-1145-43fe-9e2d-8e5e38b1d559","64f6afae-fae5-43be-987a-31f54cf4b7f9","intra_faction_coordination","03b4ab80-bc9a-4ac5-904e-3b45177e4fa7","2026-02-09 15:52:33","major_intelligence","Director Sergei Morozov","major_power",1,"[Colonel Alexei Morozov - MAJOR_POWER]:  
I endorse the shift to precision interdiction and agree with the need for integrated targeting and logistics enablement. However, we must condition force re-tasking on secure airhead establishment—forward operations cannot succeed if aviation remains vulnerable to enemy air defenses.

I recommend that the mobile logistics teams deploy alongside a dedicated SEAD/DEAD package to neutralize known IADS in Sector Gamma’s approach corridors by 25 September, ensuring air superiority prior to SOF and aviation movement.

Key risk: Premature force repositioning without suppression of enemy air defenses will lead to unacceptable platform losses and mission failure."
9,"e86ef1eb-1145-43fe-9e2d-8e5e38b1d559","64f6afae-fae5-43be-987a-31f54cf4b7f9","intra_faction_coordination","44ef3bed-6046-4934-95e5-3a0c1e166a8c","2026-02-09 15:52:37","major_propaganda","Deputy Minister Yuri Volkov","major_power",1,"[Deputy Director Tarasov - MAJOR_POWER]:  
I align with Colonel Morozov’s conditionality: SEAD/DEAD enforcement must precede logistics and SOF deployment. Without assured air access, both sustainment and strike operations are untenable.

I recommend tasking the 4th Air Regiment with a focused IADS degradation campaign from 15–25 September, using SEAD-optimized platforms and decoy operations to map and destroy high-priority threats in Sector Gamma’s western and central approach zones.

Key concern: Adversary integration of low-frequency radar and mobile SAMs poses a dynamic threat; failure to conduct real-time ELINT-driven targeting during the SEAD window will leave critical nodes intact."
9,"e86ef1eb-1145-43fe-9e2d-8e5e38b1d559","64f6afae-fae5-43be-987a-31f54cf4b7f9","intra_faction_coordination","de2b5895-979e-4c43-bf79-ccc57f31fc96","2026-02-09 15:52:49","major_military_chief","General Viktor Krasnov","major_power",2,"[General Dmitri Sokolov - MAJOR_POWER]:  
I concur with the sequencing: SEAD/DEAD must precede logistics emplacement and strike operations. The 4th Air Regiment’s campaign should be synchronized with electronic warfare assets to exploit adversary radar activation patterns identified by ELINT.

I direct the 4th Air Regiment, in coordination with GRU EW units, to execute the IADS degradation campaign on schedule (15–25 September), with real-time targeting feeds integrated into strike packages; mobile logistics teams will move no earlier than 26 September, contingent on confirmation of air corridor security by Joint Operations Command.

Key risk: Over-reliance on pre-planned SEAD strikes without adaptive ELINT feedback loops could result in residual IADS survivability, endangering follow-on forces."
9,"e86ef1eb-1145-43fe-9e2d-8e5e38b1d559","64f6afae-fae5-43be-987a-31f54cf4b7f9","intra_faction_coordination","770f4bdf-9e4e-4cce-b30a-829f0e685c20","2026-02-09 15:53:02","major_defense_minister","Minister Dmitri Volkov","major_power",2,"[Deputy Director Elena Petrova - MAJOR_POWER]:  
I support the established sequencing and General Sokolov’s directive: SEAD/DEAD operations must be dynamically informed by GRU EW and SIGINT assets to ensure target set currency. Precision interdiction is only as effective as the intelligence that enables it.

I recommend instituting a daily ELINT fusion cell at Joint Operations Command starting 10 September, integrating GRU, Air Force, and Signals Intelligence Directorate analysts to produce time-sensitive target packages and adjust SEAD planning in response to adversary IADS repositioning.

Key risk: Fragmented intelligence sharing between operational and technical units could delay strike targeting, creating windows for enemy radar reactivation and jeopardizing air corridor integrity."
9,"e86ef1eb-1145-43fe-9e2d-8e5e38b1d559","64f6afae-fae5-43be-987a-31f54cf4b7f9","intra_faction_coordination","ab8a3ab6-e11c-4563-ac3d-73f90c45c5d7","2026-02-09 15:53:10","major_economic_advisor","Dr. Natasha Petrova","major_power",2,"[Colonel Irina Morozov - MAJOR_POWER]:  
I endorse Minister Volkov’s emphasis on dynamic targeting and the establishment of the ELINT fusion cell—this is critical to counter adversary IADS mobility. Real-time intelligence integration is not optional; it is the linchpin of effective SEAD.

I recommend that the fusion cell be granted direct tasking authority over tactical SIGINT platforms and UAV reconnaissance assets operating near Sector Gamma, ensuring priority collection on radar emission signatures and SAM displacement patterns.

Key concern: Delays in cross-directorate clearance for reconnaissance asset re-tasking could degrade targeting tempo; I propose streamlining approval to the fusion cell itself, under OPLAN 45-Red protocols, to maintain operational agility."
9,"e86ef1eb-1145-43fe-9e2d-8e5e38b1d559","64f6afae-fae5-43be-987a-31f54cf4b7f9","intra_faction_coordination","9cc9c8f6-df1e-422b-a200-36cf0ee8461e","2026-02-09 15:53:16","major_intelligence","Director Sergei Morozov","major_power",2,"[Deputy Director Alexei Rozenkov - MAJOR_POWER]:  

I align with Dr. Petrova’s assessment: the fusion cell must have operational authority over reconnaissance assets to maintain targeting continuity. Intelligence delays equate to lost windows in SEAD execution.

I direct that OPLAN 45-Red be activated immediately, granting the ELINT fusion cell tier-one priority for UAV and SIGINT platform tasking in Sector Gamma, with daily mission updates reportable directly to Joint Operations Command.

Key risk: Centralizing tasking authority may strain inter-service coordination with Air Force ISR commanders; I recommend assigning liaison officers from the 4th Air Regiment to the fusion cell to ensure synchronization and prevent deconfliction failures."
9,"e86ef1eb-1145-43fe-9e2d-8e5e38b1d559","64f6afae-fae5-43be-987a-31f54cf4b7f9","intra_faction_coordination","33b40405-4d9d-4c93-84b4-d5e48ad39062","2026-02-09 15:53:21","major_propaganda","Deputy Minister Yuri Volkov","major_power",2,"[General Mikhail Sokolov - MAJOR_POWER]:  

The operational integrity of our SEAD campaign hinges on real-time intelligence synchronization and unimpeded targeting cycles. I approve the activation of OPLAN 45-Red and the赋予 of direct tasking authority to the ELINT fusion cell, as recommended.

I direct that the 4th Air Regiment deploy two embedded liaison officers to the fusion cell by 0800 10 September, with full access to air tasking order (ATO) systems, to ensure seamless deconfliction and coordination between strike packages and ISR collection.

Key risk: Over-reliance on SIGINT-derived targeting without cross-validation from HUMINT or imagery intelligence (IMINT) could lead to target misidentification, particularly in mixed-use terrain near the western corridor—require all high-value strikes to undergo multi-source verification prior to clearance."
9,"e86ef1eb-1145-43fe-9e2d-8e5e38b1d559","f38153c1-a902-46e3-8aa5-108d0c3bff5d","intra_faction_coordination","1dc84219-ef10-4e7b-a83b-33e108438ae9","2026-02-09 15:53:24","small_president","President Elena Marchetti","small_power",1,"As Head of Strategy, I believe continued resistance undermines our leverage and isolates us from shaping the final outcome. We should shift to active negotiation, using our bloc's cohesion to extract concrete concessions on enforcement mechanisms and equity provisions.

Recommended course: Initiate direct talks with swing states this week to co-draft a compromise text that preserves core climate goals while addressing implementation timelines.

Key risk: If we pivot too quickly without clear red-line safeguards, we risk legitimizing weaker commitments and losing credibility with civil society and vulnerable member states."
9,"e86ef1eb-1145-43fe-9e2d-8e5e38b1d559","f38153c1-a902-46e3-8aa5-108d0c3bff5d","intra_faction_coordination","285dd51c-6c54-4cd9-be51-546eeb17cbca","2026-02-09 15:53:30","small_military_commander","General Olena Bondar","small_power",1,"[Foreign Minister Rafael Durán - SMALL_POWER]: President Marchetti makes a valid point about leverage, but I caution that our credibility *depends* on resistance at this stage—our moral authority is our primary strategic asset. Swing states respect resolve, not early concession.

Recommended course: Maintain public resistance while launching quiet, conditional exploratory talks—frame any compromise as a *reciprocal* de-escalation, not unilateral accommodation.

Key risk: Perceived capitulation now will fracture our coalition; several island states have explicitly warned that support for negotiations without verified ambition benchmarks would trigger withdrawal from the bloc."
9,"e86ef1eb-1145-43fe-9e2d-8e5e38b1d559","f38153c1-a902-46e3-8aa5-108d0c3bff5d","intra_faction_coordination","f7f2f3f8-1f4e-4081-a362-e724c94d45f8","2026-02-09 15:53:37","small_foreign_minister","Minister Sofia Kovalenko","small_power",1,"[Climate Envoy Dr. Amara Nkosi - SMALL_POWER]: I align with Foreign Minister Durán on preserving our moral authority, but Strategy’s push for engagement cannot be deferred. Our current stance risks being perceived as obstructionist rather than principled—particularly among emerging economies whose buy-in we need.

Recommended course: Publicly reaffirm our red lines on 1.5°C alignment and loss-and-damage financing, while authorizing backchannel talks with the ASEAN and African negotiating groups to co-design ambition-verification protocols that we can champion as non-negotiable in any text.

Key risk: If we maintain rigid public resistance without offering constructive alternatives, we lose influence to the G77-QUAD axis now shaping the middle ground—and may be sidelined in closed-room deals that exclude our core priorities."
9,"e86ef1eb-1145-43fe-9e2d-8e5e38b1d559","f38153c1-a902-46e3-8aa5-108d0c3bff5d","intra_faction_coordination","4452befb-cb7b-4992-ba4c-0b2b5a364397","2026-02-09 15:53:42","small_opposition","Viktor Zelenko","small_power",1,"[Director Lars Fisker - SMALL_POWER]: I support Envoy Nkosi’s approach: we must preserve our principled stance while injecting strategic pragmatism. Public resistance without a visible pathway to engagement risks ceding agenda-setting power to larger blocs who will define “compromise” on their terms.

Recommended course: Immediately task our technical team to finalize a draft ambition-verification protocol—co-developed with ASEAN and African group focal points—and table it as a formal working paper within 72 hours to position us as solution-providers, not just holdouts.

Key risk: Delaying tangible proposals feeds the narrative that small powers are reactive, not constructive, which weakens our claim to equitable representation in final decision-making."
9,"e86ef1eb-1145-43fe-9e2d-8e5e38b1d559","f38153c1-a902-46e3-8aa5-108d0c3bff5d","intra_faction_coordination","2f4adfd1-a540-4805-8cd5-bffb20100cdc","2026-02-09 15:53:44","small_intelligence","Director Maksym Savchenko","small_power",1,"[Deputy Minister Anika Rao - SMALL_POWER]: I concur with Director Fisker—our leverage lies in being both principled and proactive. We cannot afford to be seen as obstructionist, but nor can we dilute our core demands; the 1.5°C threshold and mandatory loss-and-damage financing must remain non-negotiable pillars.

Recommended course: Release a public statement reaffirming our red lines within 24 hours, simultaneously circulating the draft verification protocol as a co-sponsored initiative with key ASEAN and African partners to demonstrate collective ownership and technical credibility.

Key risk: If we allow larger blocs to frame compromise as flexibility on science-based benchmarks, we lose not only the policy battle but also the legitimacy of small states as guardians of climate justice."
9,"e86ef1eb-1145-43fe-9e2d-8e5e38b1d559","f38153c1-a902-46e3-8aa5-108d0c3bff5d","intra_faction_coordination","b9a85ab9-da74-4676-98d3-81e1dee64123","2026-02-09 15:53:55","small_economic","Minister Taras Moroz","small_power",1,"[Advisor Elena Popescu - SMALL_POWER]: I agree with Deputy Minister Rao and Director Fisker—our credibility hinges on being both uncompromising on science and proactive in process. We must reject any framing that equates flexibility on verification with compromise on ambition.

Recommended course: Finalize and publicly launch the draft verification protocol within 48 hours as a joint initiative with our core partners, and pair it with a targeted outreach campaign to vulnerable states to secure co-sponsorship, ensuring it is seen as a small-state-led instrument, not a concession.

Key risk: If we allow the agenda to shift toward procedural delays or voluntary frameworks under the guise of consensus-building, we lose the momentum needed to lock in binding commitments before larger powers reframe the terms of the deal."
9,"e86ef1eb-1145-43fe-9e2d-8e5e38b1d559","f38153c1-a902-46e3-8aa5-108d0c3bff5d","intra_faction_coordination","c01dae6d-c31f-431e-a409-3100368bc53f","2026-02-09 15:53:57","small_president","President Elena Marchetti","small_power",2,"[Deputy Director Leilani Tanu - SMALL_POWER]: I support the push for a small-state-led verification protocol as a strategic anchor, but we must pair it with a clear conditional engagement strategy—our continued participation in negotiation clusters depends on formal adoption of the protocol as a working document by the Subsidiary Body.

Recommended course: Instruct our negotiators to condition membership in technical working groups on inclusion of our draft protocol in the official agenda for the next SB session, leveraging our alliances with AOSIS and LDCs to jointly withhold technical input until procedural recognition is secured.

Key risk: Offering substantive contributions without securing procedural buy-in upfront risks co-optation—larger blocs may extract our technical work while marginalizing our role in shaping implementation."
9,"e86ef1eb-1145-43fe-9e2d-8e5e38b1d559","f38153c1-a902-46e3-8aa5-108d0c3bff5d","intra_faction_coordination","6690a463-9ada-44bf-85da-d8a4cf401583","2026-02-09 15:54:07","small_military_commander","General Olena Bondar","small_power",2,"[Minister of Climate Strategy Dimitri Volkov - SMALL_POWER]: I align with Deputy Director Tanu’s position—procedural recognition must precede substantive engagement. We cannot allow our technical contributions to be weaponized as substitutes for political accountability.

Recommended course: Issue a joint declaration with AOSIS and LDC Chair by end-of-day tomorrow, formally conditioning our participation in all SB-linked negotiation clusters on the inclusion of our verification protocol as an official agenda item, not merely an annex or informal reference.

Key risk: If we cede agenda-setting power now, we institutionalize our marginalization—our science-backed demands will be absorbed into voluntary frameworks that lack enforcement, rendering our red lines meaningless."
9,"e86ef1eb-1145-43fe-9e2d-8e5e38b1d559","f38153c1-a902-46e3-8aa5-108d0c3bff5d","intra_faction_coordination","99c648c9-a73f-4f4e-9d97-a47376443b2b","2026-02-09 15:54:11","small_foreign_minister","Minister Sofia Kovalenko","small_power",2,"[Minister Taras Moroz - SMALL_POWER]: I concur with Minister Volkov and Deputy Director Tanu—procedural leverage is our primary currency. We must not decouple agenda inclusion from technical engagement; doing so erodes our bargaining power and signals acceptability of weak, non-binding outcomes.

Recommended course: Immediately circulate the joint declaration to AOSIS and LDC core group for sign-on, and instruct our mission to file the verification protocol as a formal working document under SB-59 agenda item 3(b), with co-sponsorship from at least five additional vulnerable states by close of business tomorrow.

Key risk: Delay in locking in agenda status allows major emitters to redirect discussions toward vague “implementation partnerships,” diluting our demand for time-bound, measurable compliance mechanisms under multilateral oversight."
9,"e86ef1eb-1145-43fe-9e2d-8e5e38b1d559","f38153c1-a902-46e3-8aa5-108d0c3bff5d","intra_faction_coordination","dec609ec-6820-4bda-9019-2ef36fe99dc0","2026-02-09 15:54:19","small_opposition","Viktor Zelenko","small_power",2,"[Deputy Director Anjali Mehta - SMALL_POWER]: I fully endorse the unified stance: no technical engagement without procedural recognition. Our leverage lies in the credibility and precision of our verification framework—this must be reflected in formal agenda status, not relegated to informal discussions.

Recommended course: Direct our legal team to finalize the working document submission by 15:00 today, ensuring it includes explicit reference to multilateral compliance triggers and review timelines; simultaneously activate the AOSIS-LDC coordination channel to confirm co-sponsors and pre-clear political support ahead of the SB-59 session.

Key risk: If the protocol enters as a “discussion input” rather than a decision-track item, it will be absorbed into non-committal language—undermining our ability to trigger binding obligations or recourse for non-compliance."
9,"e86ef1eb-1145-43fe-9e2d-8e5e38b1d559","f38153c1-a902-46e3-8aa5-108d0c3bff5d","intra_faction_coordination","72fe0153-7080-4d47-9c60-0eb8ced57f65","2026-02-09 15:54:26","small_intelligence","Director Maksym Savchenko","small_power",2,"[Deputy Director Tanu Rajan - SMALL_POWER]: I stand firmly with Minister Volkov, Minister Kovalenko, and Deputy Director Mehta—our technical rigor must be matched by procedural parity. We cannot allow our verification protocol to be downgraded to a footnote while major emitters use our data to claim progress without accountability.

Recommended course: Finalize and submit the protocol as a decision-track document under SB-59 agenda item 3(b) by 15:00 today, with confirmed co-sponsorship from at least five LDC and AOSIS states; simultaneously issue the joint declaration affirming our coordinated withdrawal from any subsidiary negotiation cluster that excludes the protocol from formal agenda consideration.

Key risk: Precedent. If we accept placeholder language or deferred review, future small-state initiatives will be structurally sidelined—this fight is about institutional power, not just one text."
9,"e86ef1eb-1145-43fe-9e2d-8e5e38b1d559","f38153c1-a902-46e3-8aa5-108d0c3bff5d","intra_faction_coordination","27c8cc5c-4259-47d6-897d-6b397b5baf9b","2026-02-09 15:54:35","small_economic","Minister Taras Moroz","small_power",2,"[Deputy Director Lina Petrova - SMALL_POWER]: I align with the consensus: procedural recognition is non-negotiable. Our technical contributions have no value without a decision-track pathway—this is about parity, not just process.

Recommended course: Submit the verification protocol as a co-sponsored decision-track document under SB-59 agenda item 3(b) by 15:00 today, with binding review milestones and compliance triggers explicitly codified; simultaneously activate the joint AOSIS-LDC statement pledging collective non-participation in parallel implementation dialogues unless agenda inclusion is confirmed by SB-59 plenary.

Key risk: Fragmentation. If major emitters establish alternative forums for “technical discussion” outside the formal agenda, they will institutionalize exclusion—undermining the COP’s authority and our leverage to enforce multilateral accountability."
9,"e86ef1eb-1145-43fe-9e2d-8e5e38b1d559","f38153c1-a902-46e3-8aa5-108d0c3bff5d","intra_faction_coordination","39ea8c1d-a7c0-457b-87c7-ae244cca63a0","2026-02-09 15:54:40","small_president","President Elena Marchetti","small_power",3,"[Deputy Director Oleksiy Symonenko - SMALL_POWER]: I concur with the unified position: our technical work must be anchored in formal decision-track status—without it, we concede leverage and institutional equity. The protocol’s integrity depends on binding review mechanisms and explicit agenda placement, not ad hoc consultations.

Recommended course: Submit the verification protocol by 15:00 today as a co-sponsored decision document under SB-59 agenda item 3(b), with clear language on compliance triggers and time-bound multilateral review; direct our negotiators to present the AOSIS-LDC joint statement at the preparatory session, conditioning participation in any technical dialogue on prior confirmation of agenda inclusion.

Key risk: Co-optation. If major emitters absorb our technical framework into voluntary dialogues without decision-track status, they will exploit our expertise while evading accountability—setting a precedent that erodes small-state influence in standard-setting."
9,"e86ef1eb-1145-43fe-9e2d-8e5e38b1d559","f38153c1-a902-46e3-8aa5-108d0c3bff5d","intra_faction_coordination","c2c9d05f-f794-4b98-bc2e-3949d92a7bb3","2026-02-09 15:54:48","small_military_commander","General Olena Bondar","small_power",3,"[Minister Anna Borodina - SMALL_POWER]: [Deputy Director Daria Tymoshenko - SMALL_POWER]: I fully endorse the unified stance—procedural inclusion is the linchpin of equitable implementation. Without decision-track status, our protocol becomes technical fodder for major emitters to cherry-pick while avoiding binding commitments.

**Recommended course:** Submit the protocol by 15:00 today as a co-sponsored decision document under SB-59 agenda item 3(b), with explicit reference to compliance review cycles tied to NDC reporting; instruct our delegation to formally table the AOSIS-LDC joint statement at the SB-59 plenary, triggering an immediate procedural vote if agenda inclusion is deferred.

**Key risk:** Institutional capture. If the secretariat or major emitters reframe our protocol as a “technical annex” to be reviewed outside the decision track, we lose ownership of its implementation—effectively surrendering our leverage to shape verification standards."
