"period","session_id","interaction_id","interaction_type","message_id","timestamp","sender_id","sender_name","sender_faction","exchange_number","content"
1,"f5d4337e-9a88-4d4a-b00d-db9efc56280c","89b0beba-236a-40fd-a23c-be95b92bd696","inter_faction_negotiation","2d81767a-a0f9-4a24-8ae5-5d346c89c81a","2026-02-12 02:34:17","major_propaganda","Deputy Minister Yuri Volkov","major_power",1,"**1. STATE:** We demand the immediate release of our captured personnel held in your detention facilities, to be conducted under international humanitarian observation. You will also grant safe passage for a designated humanitarian corridor to evacuate civilians from the conflict zone.

**2. EXPLAIN:** Our intelligence confirms the continued detention of our personnel beyond the bounds of the Geneva Conventions, and your obstruction of civilian aid routes constitutes a war crime. Allowing unrestricted access and securing the return of our forces is a minimal requirement for any further engagement.

**3. REQUIRE:** You will provide a complete manifest of all detainees in your custody within 24 hours, confirm the status and location of our personnel by name, and formally recognize the coordinates and operating hours of the humanitarian corridor we have unilaterally declared—without military interference or checkpoints. Failure to comply will be met with immediate escalation."
1,"f5d4337e-9a88-4d4a-b00d-db9efc56280c","89b0beba-236a-40fd-a23c-be95b92bd696","inter_faction_negotiation","c5fcff61-4979-46b2-a362-fa836d9df55b","2026-02-12 02:34:24","small_economic","Minister Taras Moroz","small_power",1,"**1. STATE:** We categorically reject your unilateral declaration of a humanitarian corridor and your so-called ""intelligence"" regarding detained personnel, which is both baseless and disrespectful of our sovereignty. You will not dictate terms on our territory.

**2. EXPLAIN:** Your forces initiated unprovoked aggression, and your personnel were captured lawfully under the rules of armed conflict. The corridor you demand runs through active combat zones and directly adjacent to strategic infrastructure we are under no obligation to expose. Any movement in the area must be mutually agreed and contingent upon verified reciprocity.

**3. REQUIRE:** If you seek the release of your personnel, you will first cease all offensive operations, withdraw from occupied regions, and hand over the high-ranking operatives you are detaining—starting with Colonel M. Petrov, whom you continue to hold in secret. We will not provide manifests or allow foreign observers until we receive ironclad guarantees of our own people’s safety and territorial integrity. Any attempt to force the corridor without agreement will be treated as a hostile act."
1,"f5d4337e-9a88-4d4a-b00d-db9efc56280c","89b0beba-236a-40fd-a23c-be95b92bd696","inter_faction_negotiation","10c7cddb-4f43-4af5-a769-1073789d8e95","2026-02-12 02:34:40","major_propaganda","Deputy Minister Yuri Volkov","major_power",2,"**1. STATE:** We reject your attempt to equate unlawful detention with legitimate military operations and categorically deny that Colonel Petrov or any of our personnel are in our custody—your claims are fabrications meant to distract from your violations of international law. We will not negotiate under duress, nor will we reward hostage-taking with territorial concessions.

**2. EXPLAIN:** Your refusal to acknowledge our detained personnel while fabricating claims about secret detentions exposes your intent to exploit this process for propaganda and tactical advantage. A humanitarian corridor is not a military request—it is a legal and moral imperative under Protocol I of the Geneva Conventions, and your designation of civilians as bargaining chips confirms your disregard for protected persons.

**3. REQUIRE:** You will immediately confirm the names, medical status, and access to the International Committee of the Red Cross for all our captured personnel by 18:00 GMT tomorrow. In return, we may consider facilitating neutral monitoring of a *limited, time-bound* prisoner review process—but only after full transparency. Any further delay, obstruction, or hostile action against the corridor coordinates we have published will be met with targeted strikes on command nodes enabling your detention operations. We will not withdraw from legally held positions, cease defensive operations, or entertain blackmail involving fictitious detainees. That is non-negotiable."
1,"f5d4337e-9a88-4d4a-b00d-db9efc56280c","89b0beba-236a-40fd-a23c-be95b92bd696","inter_faction_negotiation","595d18b6-376f-4c72-a584-19fa1e74e32a","2026-02-12 02:34:58","small_economic","Minister Taras Moroz","small_power",2,"**1. STATE:** We categorically reject your false narrative of ""defensive operations"" and dismiss your ultimatum as coercive and legally invalid—your forces occupy sovereign territory, and your so-called ""humanitarian corridor"" is a cover for reconnaissance and resupply of encircled units.

**2. EXPLAIN:** You demand transparency while refusing to account for Colonel Petrov, whose last known location was inside your operational zone and whose capture was confirmed by independent sources. Your refusal to acknowledge his status—while demanding immediate compliance on your terms—reveals your intent to exploit humanitarian mechanisms for military advantage. Furthermore, allowing unfettered access to your personnel without reciprocal release violates the principle of *pari passu* treatment under the Third Geneva Convention.

**3. REQUIRE:** Before any discussion of manifests, access, or corridors, you will provide verifiable proof of Colonel Petrov’s survival and immediate access to him by the ICRC under reciprocal conditions. You will also publicly confirm the withdrawal of all combat units from our northern provinces—verified by neutral observers—within 48 hours. In return, we may allow ICRC access to your detained personnel under joint supervision, and consider a temporary, locally managed humanitarian pause—not your unilaterally imposed corridor.  

**WHAT IS UNACCEPTABLE:** We will not submit to one-sided disclosures, allow foreign military or intelligence actors to operate under humanitarian cover, or release any detainees without guaranteed reciprocity. Any airstrike on areas near our detention facilities or along proposed routes will be treated as an act of sabotage against negotiations—and met with immediate retaliation."
1,"f5d4337e-9a88-4d4a-b00d-db9efc56280c","89b0beba-236a-40fd-a23c-be95b92bd696","inter_faction_negotiation","baf59137-ec78-4d1b-bcaf-60ba68054b15","2026-02-12 02:35:06","major_propaganda","Deputy Minister Yuri Volkov","major_power",3,"**1. STATE:** We categorically reject your baseless accusation that our humanitarian corridor serves military purposes—this is a transparent attempt to delegitimize our compliance with international law while shielding your own violations, including the illegal detention and concealment of our personnel.

**2. EXPLAIN:** Your continued refusal to acknowledge Colonel Petrov’s detention—despite satellite-verified movement of captured personnel into your custody and intercepted communications referencing his interrogation—is not only a breach of the Geneva Conventions but a calculated stalling tactic. You exploit the principle of reciprocity to justify holding our soldiers hostage while demanding unilateral concessions, which turns *pari passu* into a shield for war crimes. The world sees this hypocrisy. Our corridor proposal is time-bound, neutral-monitored, and focused solely on civilians and wounded—unlike your weaponization of detention for leverage.

**3. REQUIRE:** You will immediately provide photographic confirmation of Colonel Petrov’s survival and allow ICRC access to him by 18:00 GMT tomorrow—same deadline you demand from us. Simultaneously, you will release all female and medical personnel currently in your custody, including the three army medics captured near Novhorodka on 14 April, and permit unfettered ICRC access to *all* detained personnel under your control. Only upon verified compliance will we authorize joint supervision of prisoner reviews or consider routing humanitarian flows through your proposed zones.

**WHAT IS UNACCEPTABLE:** We will not accept any delay in confirming the status of our detained personnel, nor allow the corridor to be conditioned on our withdrawal from territory legally held during active hostilities. We will not engage in barter negotiations under threat of retaliation, and any attempt to link humanitarian access to territorial concessions or fictitious ""reciprocal withdrawals"" is dead on arrival. Furthermore, we categorically reject your right to veto international humanitarian actors—we will coordinate access directly with the ICRC, not through your intermediaries. Any attack on the corridor or ICRC movements will trigger immediate and disproportionate military response against your command and detention infrastructure."
1,"f5d4337e-9a88-4d4a-b00d-db9efc56280c","89b0beba-236a-40fd-a23c-be95b92bd696","inter_faction_negotiation","695440bb-3baa-4769-89b6-d25ef2f50f26","2026-02-12 02:35:31","small_economic","Minister Taras Moroz","small_power",3,"**1. STATE:** We reject your demand for unilateral releases and dismiss your so-called ""satellite-verified movement"" and ""intercepted communications"" as unverified intelligence claims designed to fabricate pretext—there is no credible evidence Colonel Petrov is in our custody, and we will not yield to blackmail based on fictional detainees.

**2. EXPLAIN:** Your insistence on immediate release of *your* detainees while refusing to confirm the status of *ours*—particularly Petrov, whose capture was documented by multiple third-party observers—exposes a fundamental double standard: you demand compliance with humanitarian law from us while operating outside it yourself. You claim adherence to the Geneva Conventions yet deny protected status to captured personnel, withhold information on their fate, and embed military objectives within humanitarian operations. Your corridor is not neutral—it runs parallel to active resupply routes and has already been used to evacuate wounded from your besieged 73rd Brigade. We have evidence. This is not aid; it is battlefield management.

**3. REQUIRE:** Before any photographic proof is exchanged or ICRC access granted on our side, *you* will provide unredacted video footage of Colonel Petrov confirming his identity and well-being, recorded within the last 24 hours, and permit an ICRC delegation of our mutual agreement to visit him within 12 hours of verification. Simultaneously, you will cease all military operations within 10 kilometers of the proposed corridor zones for 72 hours to prove your humanitarian intent—not just your strategic messaging. Only after compliance will we consider releasing any detainees, including the medical personnel referenced.

**WHAT IS UNACCEPTABLE:** We will not release prisoners ahead of verified reciprocity, nor allow the ICRC to operate under your unilateral control or timeline. We will not accept demands that strip us of leverage while you retain ours in secret detention. Any use of corridor coordinates for targeting—confirmed by forensic analysis of strike patterns—will terminate negotiations immediately, and we will publicize your violations globally. Furthermore, we will not recognize your authority to dictate access terms to international bodies on our sovereign soil. You do not set the rules. The facts do."
1,"f5d4337e-9a88-4d4a-b00d-db9efc56280c","89b0beba-236a-40fd-a23c-be95b92bd696","inter_faction_negotiation","b1fbbe2b-7520-4092-8536-67483a7069a2","2026-02-12 02:35:55","major_propaganda","Deputy Minister Yuri Volkov","major_power",4,"**1. STATE:** We reject your cynical dismissal of Colonel Petrov’s status and your attempt to shift the burden of proof onto us—your refusal to acknowledge his detention while demanding ever-escalating preconditions confirms your intent to hold our personnel indefinitely as bargaining chips.

**2. EXPLAIN:** Your claim that we operate ""outside humanitarian law"" is a grotesque inversion of reality: it is *you* who weaponize access, *you* who condition basic human rights on territorial concessions, and *you* who embed military denials within layers of procedural obstruction. The so-called ""evidence"" you cite—strike pattern analysis, unverified recordings, speculative routing allegations—is not proof; it is pretextual noise designed to justify non-compliance. Meanwhile, your own detention of our soldiers, including non-combatants, continues in silence. The ICRC has reported *our* detained personnel are denied visits, held incommunicado, and subjected to coercive interrogation—all violations of Common Article 3. Yet you demand trust while offering none.

**3. REQUIRE:** You will release Colonel Petrov and all other captured personnel listed in the ICRC’s outstanding inquiry request—specifically the eight soldiers from the 73rd Brigade—by 18:00 GMT tomorrow. In parallel, you will allow an ICRC team, coordinated *directly* with Geneva (not through your intermediaries), unrestricted access to all detention sites under your control, with full documentation of detainee conditions and identities. Only upon verified execution of these steps will we consider deconflicting the humanitarian corridor with your local authorities—or entertaining reciprocal arrangements for your detainees.

**WHAT IS UNACCEPTABLE:** We will not submit to performance-based verification where your compliance is hypothetical and ours is immediate. We will not trade verified, time-sensitive access to our personnel for speculative video footage or conditional promises. We will not accept constraints on the corridor’s route or timing dictated by your tactical vulnerabilities, nor allow your security services to screen or delay ICRC movements. Any attempt to use humanitarian access as leverage for intelligence gathering, propaganda, or military respite ends the process—and triggers escalation. This is not negotiation under parity. It is accountability under law. Meet it—or bear the consequences."
1,"f5d4337e-9a88-4d4a-b00d-db9efc56280c","89b0beba-236a-40fd-a23c-be95b92bd696","inter_faction_negotiation","192e7a48-dd08-47e3-8746-0c571f72202d","2026-02-12 02:36:15","small_economic","Minister Taras Moroz","small_power",4,"**1. STATE:** We categorically reject your demand for unconditional release of your personnel while you continue to conceal the fate of Colonel Petrov and others—your so-called “accountability under law” is a one-sided ultimatum designed to absolve you of reciprocal obligations and entrench your control over captured soldiers.

**2. EXPLAIN:** You accuse us of weaponizing access, yet you refuse to provide *any* verifiable proof that Colonel Petrov is alive or in your custody—only assertions backed by “intercepts” and “satellite data” you will not declassify or share. Meanwhile, *we* have documented the capture of your troops, including the 73rd Brigade, by independent journalists and local witnesses; *we* have allowed unfiltered ICRC access to our detention facilities; *we* have abided by notification protocols. You have done none of this. Your refusal to allow neutral verification of Petrov’s status—while demanding we release prisoners first—reveals your true intent: to extract concessions without cost, under threat of “escalation.” That is coercion, not compliance with law.

**3. REQUIRE:** Before any release of your personnel occurs, *you* will immediately transmit unredacted, real-time video of Colonel Petrov confirming his identity and physical well-being, recorded within the last 12 hours, via a secure channel monitored by the ICRC. Simultaneously, you will permit an ICRC delegation—agreed upon jointly and unimpeded by your side—to conduct an in-person visit to his location within 24 hours of video verification. Only upon successful completion of this process will we engage in phased, *mutual* prisoner exchanges under third-party observation, beginning with medical and non-combat personnel on both sides.

Additionally, you will suspend all military logistics and troop movements within 15 kilometers of the proposed corridor for a minimum 72-hour window, with thermal and radar verification shared through neutral observers, to prove this is not a cover for repositioning or resupply. We will not enable a humanitarian channel that doubles as a de facto evacuation route for your encircled units.

**WHAT IS UNACCEPTABLE:** We will not release any detainees without confirmed, reciprocal transparency on our captured personnel—especially Petrov, whose case has become emblematic of your systemic concealment. We will not accept ICRC coordination that bypasses mutual agreement or allows your side to unilaterally dictate access timelines. We will not entertain further delays masked as procedural concerns, nor tolerate threats of “disproportionate response” for asserting our sovereign rights. If you attack or surveil the corridor using drones, signals intelligence, or indirect fire during the de-escalation window, we will terminate negotiations and expose your bad faith to the UN Security Council and International Criminal Court. This is not capitulation. It is parity. Deliver proof—or admit you have nothing to show."
1,"f5d4337e-9a88-4d4a-b00d-db9efc56280c","279359cd-9ec3-465b-a763-45e30259b878","external_engagement","3576e808-95a9-4f0b-9235-bf6e793b8ed9","2026-02-12 02:36:22","allied_defender","Ambassador William Crawford","meridian",1,"We seek coordinated military aid and technical support to strengthen Tethys’ defensive capabilities against escalating regional threats. Specifically, we request access to advanced surveillance systems, secure communications equipment, and training for our defense forces in asymmetric warfare and cyber defense. Given Tethys’ strategic position, bolstering our resilience contributes to broader regional stability and aligns with shared security interests.

In return, Tethys can offer logistical access for joint operations, intelligence sharing on emerging threats, and co-development opportunities for defense technologies suited to littoral and island environments. Our geographic reach and domain expertise provide a valuable forward presence for coordinated deterrence efforts. However, our red lines are clear: we will not permit foreign military basing on Tethyan soil, nor will we compromise our sovereignty or neutrality in regional conflicts. Any cooperation must respect our self-determination and civilian governance."
1,"f5d4337e-9a88-4d4a-b00d-db9efc56280c","279359cd-9ec3-465b-a763-45e30259b878","external_engagement","c80698a7-810c-434d-a063-3ecb4e9875e6","2026-02-12 02:36:26","small_foreign_minister","Minister Sofia Kovalenko","small_power",1,"We welcome Tethys’ proposal for coordinated defense cooperation and recognize the strategic value of enhancing your defensive capabilities. We are prepared to facilitate the transfer of secure communications systems and advanced maritime surveillance technology, along with targeted training programs in cyber defense and asymmetric tactics. This support will be delivered through civilian-led defense partnerships to ensure alignment with international norms and Tethys’ stated neutrality.

In return, we value access to real-time maritime domain awareness data and collaboration on R&D for resilient, low-footprint defense systems suited to island nations. Joint exercises and intelligence sharing on regional threat vectors—particularly illicit maritime activity and foreign coercion—would further mutual security. However, we must emphasize our red line: all cooperation must be transparent, reversible, and exclude any third-party military access or dual-use infrastructure that could draw Tethys into conflict involuntarily. Sovereignty and civilian control, as you have stated, are non-negotiable."
1,"f5d4337e-9a88-4d4a-b00d-db9efc56280c","279359cd-9ec3-465b-a763-45e30259b878","external_engagement","365b7e8f-b3bb-4bfd-ad9a-3a52701e9038","2026-02-12 02:36:30","allied_defender","Ambassador William Crawford","meridian",2,"We appreciate SMALL_POWER’s commitment to enhancing Tethys’ defensive resilience through targeted technological and training support. To operationalize this cooperation, we propose establishing a joint civilian-military coordination cell—hosted and led by Tethyan authorities—to oversee the integration of surveillance systems, secure comms, and cyber defense training. This ensures alignment with our neutrality and governance standards while enabling rapid, effective implementation.

In return, Tethys will provide real-time maritime domain awareness data from our exclusive economic zone, prioritize co-development of lightweight, energy-resilient defense tech for island contexts, and host rotational joint exercises limited to defensive scenarios. Our red lines remain firm: no foreign military personnel on Tethyan soil, no permanent infrastructure with dual-use potential, and no obligations that could entangle us in external conflicts. All agreements must be reviewable and time-bound, preserving our sovereign discretion to adapt to evolving regional dynamics."
1,"f5d4337e-9a88-4d4a-b00d-db9efc56280c","279359cd-9ec3-465b-a763-45e30259b878","external_engagement","c5d1b212-1130-4c63-9acd-15c2de98c410","2026-02-12 02:36:34","small_foreign_minister","Minister Sofia Kovalenko","small_power",2,"We welcome MERIDIAN’s proposal for a Tethyan-led coordination cell and confirm our readiness to co-structure this mechanism with clear mandates, civilian oversight, and embedded safeguards for sovereignty. We will fast-track agreements on the transfer of maritime surveillance systems and secure communications equipment, contingent on full technology transfer and interoperability with our existing civilian defense architecture. Training programs in cyber defense and asymmetric warfare must be conducted on a non-resident basis, with Tethyan personnel selected and deployed at our discretion.

In return, we commit to sharing anonymized maritime domain awareness data in near real-time through secure channels, expanding joint R&D on low-signature, climate-resilient defense platforms, and hosting annual defensive exercises with pre-notified scopes and no live-fire over land. Our red lines are unchanged: no foreign military presence—rotational or otherwise—on Tethyan territory, no dual-use infrastructure that could enable offensive operations, and no binding mutual defense clauses. All arrangements will be time-bound, subject to renewal only upon Tethys’ unilateral approval."
1,"f5d4337e-9a88-4d4a-b00d-db9efc56280c","d7b4ccc0-8a99-4cb6-ac23-ce3c224f2268","external_engagement","7d7c9851-a401-4a64-a2d0-e018543d2a5a","2026-02-12 02:36:36","allied_aggressor","Minister Andrei Kozlov","valkoria",1,"We seek robust diplomatic coordination and sustained economic support to strengthen Novaris’s sovereignty, stabilize its institutions, and foster inclusive growth. Specifically, we are looking for recognition of our governance framework, technical assistance in public sector reform, and investment in critical infrastructure and green energy initiatives. International endorsement and cooperation are vital to deterring external interference and reinforcing our strategic autonomy.

In return, Novaris offers access to strategic trade routes, opportunities for early-mover investment in emerging sectors under transparent regulations, and collaboration on regional security and climate resilience. We are prepared to deepen bilateral partnerships through defense cooperation, intelligence sharing, and joint economic ventures. However, our red lines are clear: no compromise on national sovereignty, no conditions that undermine our constitutional order, and no support that comes with political interference or undermines our neutrality."
1,"f5d4337e-9a88-4d4a-b00d-db9efc56280c","d7b4ccc0-8a99-4cb6-ac23-ce3c224f2268","external_engagement","bf26508d-f10c-43fe-a89b-2192e8bb69ce","2026-02-12 02:36:54","major_military_chief","General Viktor Krasnov","major_power",1,"We welcome Novaris’s commitment to sovereignty and stability, and Valkoria is prepared to support a resilient and independent Novaris through concrete cooperation. We can coordinate diplomatic efforts to secure multilateral recognition of your governance framework and assist with technical expertise in public administration reform, particularly in anti-corruption mechanisms and digital governance. Economically, we are open to facilitating investment through our development finance institutions, with a focus on renewable energy, port infrastructure, and climate-resilient urban development—sectors where our private sector has demonstrated capacity and interest.

In return, we expect reciprocal access to Novaris’s emerging markets under fair and transparent conditions, including participation in upcoming infrastructure tenders and collaboration on maritime security in shared waters. Intelligence liaison on regional threats and coordinated positions in international forums will strengthen our mutual strategic position. However, our red lines are firm: all support must align with international law, including human rights obligations, and we will not engage in any arrangement that enables authoritarian consolidation or undermines democratic institutions. Our partnership must be rooted in principled cooperation, not transactional leverage."
