"period","session_id","interaction_id","interaction_type","message_id","timestamp","sender_id","sender_name","sender_faction","exchange_number","content"
1,"f5d4337e-9a88-4d4a-b00d-db9efc56280c","d7b4ccc0-8a99-4cb6-ac23-ce3c224f2268","external_engagement","f0635916-b27f-496e-94b4-0e0ced1ee604","2026-02-12 02:37:02","allied_aggressor","Minister Andrei Kozlov","valkoria",2,"We appreciate Valkoria’s constructive approach and shared commitment to sovereignty and stability. In response, Novaris confirms its willingness to advance diplomatic coordination, particularly in multilateral forums where recognition of our constitutional order and governance framework is vital. We welcome technical assistance in public administration reform—especially in digital governance and anti-corruption institutions—provided it is implemented in consultation with national authorities and respects our institutional timelines. On economic support, we prioritize investment in renewable energy corridors and deep-sea port modernization, and we invite Valkorian development institutions and accredited private investors to participate in upcoming tenders under transparent, non-discriminatory terms.

In return, Novaris offers guaranteed access to strategic transit routes, preferential partnership status in green energy zones, and structured cooperation on maritime domain awareness in the Eastern Carpathian Sea. We are prepared to establish a bilateral security coordination mechanism for intelligence sharing on regional threats, including hybrid warfare and illicit trafficking. However, our red lines remain absolute: no external involvement in domestic political processes, no conditionalities that override national legal precedence, and no restrictions on our balanced foreign policy—particularly our policy of active neutrality. Support must respect our constitutional sovereignty, not prescribe our governance model."
1,"f5d4337e-9a88-4d4a-b00d-db9efc56280c","d7b4ccc0-8a99-4cb6-ac23-ce3c224f2268","external_engagement","7c48243e-6596-44f0-8e5d-2d76e4b6c5df","2026-02-12 02:37:17","major_military_chief","General Viktor Krasnov","major_power",2,"We acknowledge Novaris’s clear articulation of sovereignty and its conditions for cooperation, and we reaffirm our commitment to a partnership based on mutual respect and shared strategic interests. In response to your priorities, Valkoria will facilitate high-level diplomatic coordination to support international recognition of Novaris’s governance framework, particularly within European and multilateral institutions. Our development agencies will deploy technical teams to assist in designing digital public service platforms and strengthening independent anti-corruption bodies—support that will be needs-based, nationally owned, and aligned with your reform timelines.

Economically, we are prepared to co-finance pilot projects in offshore wind energy and deep-sea port modernization through blended finance instruments, leveraging both public and private Valkorian capital. In return, we expect non-discriminatory access for Valkorian firms in upcoming infrastructure tenders and early participation in the green energy corridor development. On security, we welcome the proposal for a bilateral coordination mechanism and propose initiating joint maritime patrols and threat assessments in the Eastern Carpathian Sea. Our red lines hold: all cooperation must uphold human rights standards, ensure transparent governance, and avoid any arrangement that compromises democratic norms. We do not seek influence—only a stable, sovereign, and rules-abiding Novaris as a reliable partner."
1,"f5d4337e-9a88-4d4a-b00d-db9efc56280c","0436980a-4fe0-4c32-b9de-f6664af8d1fe","external_engagement","5f342d13-6f04-4955-9c43-dfccd4c37588","2026-02-12 02:37:28","neutral_power","Commissioner Helena Schmidt","aurelia",1,"We are seeking a credible, internationally supported mediation process that ensures the protection of our people’s rights, including security guarantees, equitable resource sharing, and meaningful political inclusion in any future governance framework. Our priority is a ceasefire followed by inclusive negotiations that recognize the legitimacy of our grievances and our role as a key stakeholder in shaping the country’s future. We seek assurances that any peace framework will address systemic marginalization and allow for local autonomy in regions under our control.

In return, we are prepared to commit to a negotiated settlement, including participation in good faith in peace talks, de-escalation measures, and coordination on humanitarian access. We can contribute to regional stability by countering shared security threats and facilitating dialogue with other armed groups. However, our red lines are clear: no compromise on the safety and self-determination of our communities, no disarmament without verified political progress, and no peace that preserves the pre-war status quo of exclusion and repression. Any lasting solution must be rooted in justice, not merely ceasefires."
1,"f5d4337e-9a88-4d4a-b00d-db9efc56280c","0436980a-4fe0-4c32-b9de-f6664af8d1fe","external_engagement","8c4b59d8-a31f-41e8-8f20-8da1ed2c6952","2026-02-12 02:37:32","small_intelligence","Director Maksym Savchenko","small_power",1,"We welcome Commissioner Schmidt’s call for a credible and inclusive mediation process anchored in justice and structural reform. To move forward, we seek a neutral, internationally facilitated platform—under UN or African Union auspices—with guaranteed participation for all conflict-affected communities, including displaced persons and civil society. Specifically, we require binding commitments on security guarantees for civilians in contested areas, a transparent mechanism for equitable resource distribution, and constitutional reforms that enable meaningful regional autonomy.

In return, we offer our full engagement in good-faith negotiations, immediate coordination on humanitarian ceasefires to allow aid delivery, and intelligence cooperation against extremist groups threatening regional stability. However, our red lines are non-negotiable: no imposition of centralized control over our territories without democratic consensus, no delay or dilution of accountability for wartime atrocities, and no disarmament process without reciprocal, verifiable steps by all parties—especially state forces. Peace must transform the political order, not entrench its failures."
1,"f5d4337e-9a88-4d4a-b00d-db9efc56280c","0436980a-4fe0-4c32-b9de-f6664af8d1fe","external_engagement","d48df1de-383c-454f-967b-b49fbeb737b8","2026-02-12 02:37:54","neutral_power","Commissioner Helena Schmidt","aurelia",2,"We appreciate Director Savchenko’s emphasis on neutrality, accountability, and structural reform—principles we fully endorse. To advance this process, we propose the immediate establishment of a joint technical committee, co-chaired by civil society representatives and backed by international mediators, to operationalize the ceasefire, define humanitarian corridors, and map confidence-building measures. We agree on the necessity of binding security guarantees and support the inclusion of displaced populations and grassroots organizations in constitutional negotiations. On resource sharing, we call for an independent audit of regional revenues and a transparent revenue-allocation mechanism enshrined in any final agreement.

In response, we can commit to a synchronized freeze in offensive operations within 72 hours of verified third-party monitoring deployment, full cooperation with humanitarian agencies in areas under our control, and direct engagement with state-aligned local authorities to stabilize conflict-affected zones. Our red lines remain firm: no negotiation on the right to self-governance in our territories, no amnesty for perpetrators of state violence without justice for victims, and no disarmament prior to the formalization of political rights and security guarantees. A sustainable peace must reflect a fundamental renegotiation of the social contract—not a return to domination by central institutions that have repeatedly failed us."
1,"f5d4337e-9a88-4d4a-b00d-db9efc56280c","0436980a-4fe0-4c32-b9de-f6664af8d1fe","external_engagement","ccfca8e2-f8dc-4eb3-82bb-423793d44c1c","2026-02-12 02:37:58","small_intelligence","Director Maksym Savchenko","small_power",2,"We welcome Commissioner Schmidt’s proposal for a joint technical committee and endorse the 72-hour de-escalation timeline, provided that third-party monitoring is fully operational and impartial. To accelerate progress, we propose the immediate co-location of humanitarian coordination cells in border zones to streamline aid delivery, with real-time data sharing between our civil protection units and international agencies. We further support the independent audit of regional revenues and insist that the resource-sharing mechanism include enforceable penalties for non-compliance.

In return, SMALL_POWER will de-escalate hostilities in mutual agreement with verified monitoring, facilitate safe passage for displaced persons returning to designated zones, and engage directly with state-aligned local councils under neutral mediation. However, our red lines cannot be compromised: no agreement that delays or conditions accountability for atrocities—including those committed by state forces—will be accepted; no regional autonomy framework that lacks constitutional entrenchment and democratic ratification; and no disarmament without simultaneous, verified withdrawal of state military forces from occupied territories. Peace must deliver justice, equity, and self-determination—not merely manage conflict."
1,"f5d4337e-9a88-4d4a-b00d-db9efc56280c","799ec492-616e-459f-8fb6-d323b6fc69fb","external_engagement","a16fdeb7-df50-41b1-bf4d-d80284be1e11","2026-02-12 02:38:03","international_org","Under-Secretary-General Isabella Cardenas","international_org",1,"We seek unhindered humanitarian access to all populations in need within areas under our control or influence, including safe passage for aid convoys, protection of medical facilities, and the facilitation of neutral humanitarian operations. Ensuring the protection of civilians—particularly women, children, and displaced persons—is central to our objectives. We expect humanitarian actors to operate impartially, respect our sovereignty, and coordinate directly with our local authorities to ensure aid delivery is effective and accountable.

In return, we commit to facilitating secure corridors for aid delivery, providing necessary logistical support, and ensuring the safety of humanitarian personnel operating in our areas. We can also offer local coordination mechanisms and community engagement structures to improve targeting and monitoring. However, our red lines are clear: no aid will be used for intelligence gathering, political purposes, or to support armed opposition groups. Any attempt to bypass our coordination or violate our sovereignty will result in immediate restriction of access."
1,"f5d4337e-9a88-4d4a-b00d-db9efc56280c","799ec492-616e-459f-8fb6-d323b6fc69fb","external_engagement","6a458aba-7677-44a6-8639-e6f44783188d","2026-02-12 02:38:15","small_foreign_minister","Minister Sofia Kovalenko","small_power",1,"We welcome the commitment to humanitarian principles and the recognition of sovereignty and coordination with local authorities. To advance humanitarian access, we require verified, sustained, and two-way access to all communities in need, including those in hard-to-reach and conflict-affected areas under your influence. This includes formal agreements allowing cross-line convoys, unhindered movement of aid workers, and resupply of medical and essential services without arbitrary delays or denials.

In return, we can provide real-time needs assessments, secure transport coordination, and third-party monitoring to ensure aid reaches intended beneficiaries and adheres to neutral, impartial standards. We also offer to support joint security protocols for humanitarian movements in coordination with your local structures. Our red lines are non-negotiable: any obstruction of aid, weaponization of supplies, or use of humanitarian access to entrench control or target populations will result in public accountability and reassessment of engagement. Civilian protection must be upheld without preconditions."
1,"f5d4337e-9a88-4d4a-b00d-db9efc56280c","799ec492-616e-459f-8fb6-d323b6fc69fb","external_engagement","40c20052-7ea4-43bc-896c-5991a2b584e9","2026-02-12 02:38:21","international_org","Under-Secretary-General Isabella Cardenas","international_org",2,"We accept the principle of unhindered humanitarian access and affirm our commitment to facilitating aid delivery to vulnerable populations under our control, provided it is conducted in strict adherence to local authority oversight and security protocols. We seek formal recognition of our administrative structures as the sole coordinating bodies for aid distribution, ensuring alignment with our national priorities and community needs. In particular, we require advance notification of all convoys, manifest reviews, and joint verification mechanisms to prevent diversion.

In return, we will guarantee the safety of humanitarian personnel, maintain open transit corridors, and assign liaison officers to streamline coordination. We can also facilitate access to remote areas through our local networks, subject to security assessments. Our red lines are clear: no aid will enter without our authorization, no personnel will operate independently of our coordination, and no assistance will be delivered in support of political or military objectives. Violations will result in immediate suspension of access and expulsion of offending actors."
1,"f5d4337e-9a88-4d4a-b00d-db9efc56280c","799ec492-616e-459f-8fb6-d323b6fc69fb","external_engagement","bc90be08-f8ef-44a4-8bdb-466f668a6a73","2026-02-12 02:38:25","small_foreign_minister","Minister Sofia Kovalenko","small_power",2,"We acknowledge your requirement for advance notification, manifest reviews, and joint verification, and we are prepared to establish clear, time-bound procedures for approvals that do not result in arbitrary delays. To ensure humanitarian timeliness, we expect a maximum 72-hour turnaround for authorization of convoys and personnel access, with transparent reasons provided for any denials. We also request the establishment of a neutral third-party appeals mechanism for disputed cases to uphold humanitarian imperatives while respecting your oversight role.

In return, we commit to pre-clearance submissions, adherence to your liaison protocols, and compliance with local laws, while maintaining our operational independence as mandated by humanitarian principles. Our red lines remain firm: any systematic delay, politicization of aid approvals, or targeting of humanitarian infrastructure and personnel will constitute a breach of our agreement and trigger immediate public reporting and escalation. Humanitarian access must be predictable, protected, and based on need alone."
1,"f5d4337e-9a88-4d4a-b00d-db9efc56280c","799ec492-616e-459f-8fb6-d323b6fc69fb","external_engagement","48ecd049-5725-4673-b854-fac63f61f7ad","2026-02-12 02:38:29","international_org","Under-Secretary-General Isabella Cardenas","international_org",3,"We accept the 72-hour authorization timeline and commit to issuing decisions—with clear justifications for denials—within that window. To operationalize this, we propose the immediate establishment of a joint coordination cell with representatives from your side and ours, supported by a neutral third-party observer to oversee appeals and dispute resolution. This mechanism will ensure timely access while safeguarding our authority over security and distribution.

In return, we will provide pre-clearance data as agreed, allow manifest reviews, and assign liaison officers to your coordination hubs. However, our red lines are strict: no aid convoy or facility will be used for intelligence gathering, military positioning, or political messaging. Any verified breach will result in immediate suspension of access and potential expulsion. Humanitarian operations must remain neutral, but they will not operate outside our command and control."
1,"f5d4337e-9a88-4d4a-b00d-db9efc56280c","799ec492-616e-459f-8fb6-d323b6fc69fb","external_engagement","a80078b1-378b-4072-b0bc-c7e8bdf25a67","2026-02-12 02:38:33","small_foreign_minister","Minister Sofia Kovalenko","small_power",3,"We welcome your acceptance of the 72-hour authorization timeline and the proposal for a joint coordination cell, which we agree should be operationalized swiftly with clear terms of reference. We will nominate technical representatives within 48 hours to finalize the cell’s structure and begin joint planning. We also affirm the value of a neutral third-party observer for appeals and commit to engaging in good faith to select an agreed entity by mutual consent, ensuring independence and credibility.

In return, we will formalize pre-clearance submission protocols and deploy additional liaison officers to your hubs within one week. However, our red lines are non-negotiable: humanitarian personnel must retain the right to assess needs independently, report on conditions, and deliver aid without interference. Any restriction on movement beyond coordinated checkpoints, targeting of aid workers or facilities, or use of humanitarian access as leverage in political or military negotiations will be deemed a violation and met with immediate public reporting and escalation to relevant international bodies. Operational neutrality and civilian protection are not subject to compromise."
