"period","session_id","interaction_id","interaction_type","message_id","timestamp","sender_id","sender_name","sender_faction","exchange_number","content"
1,"f5d4337e-9a88-4d4a-b00d-db9efc56280c","25bb97f6-4e42-49ad-b7eb-0ab93e6deb75","intra_faction_coordination","af79df9d-abbf-40ab-875d-72bf2cfa18ec","2026-02-12 02:32:02","major_military_chief","General Viktor Krasnov","major_power",1,"As Intelligence Director, I assess that the current reports on the smaller power’s capabilities are credible but incomplete—particularly regarding their asymmetric warfare assets and foreign technical partnerships. We should prioritize deep-source penetration and signals intelligence targeting their defense procurement networks to fill critical gaps.  
Key concern: Overreliance on open-source and third-party intelligence risks underestimating their operational readiness, potentially leading to strategic miscalculation during contingency planning."
1,"f5d4337e-9a88-4d4a-b00d-db9efc56280c","25bb97f6-4e42-49ad-b7eb-0ab93e6deb75","intra_faction_coordination","ac4489a9-916e-4b9a-b392-edfe5cec89dc","2026-02-12 02:32:05","major_defense_minister","Minister Dmitri Volkov","major_power",1,"[Deputy Director Elena Petrova - MAJOR_POWER]  
I concur with General Krasnov’s assessment—our current intelligence lacks depth on the smaller power’s asymmetric capabilities, particularly their cyber units and foreign-supplied drone technology. We must task our technical collection assets immediately to monitor procurement channels and conduct operational pattern analysis on recently observed field exercises.  
Recommended action: Launch a coordinated HUMINT-SIGINT campaign within 72 hours, focused on dual-use technology transfers and military-civil fusion programs.  
Key concern: Delays in collection will create intelligence lag, undermining our ability to validate escalation thresholds in real time during a crisis."
1,"f5d4337e-9a88-4d4a-b00d-db9efc56280c","25bb97f6-4e42-49ad-b7eb-0ab93e6deb75","intra_faction_coordination","a4915344-6e97-4199-a525-97be1bfe818a","2026-02-12 02:32:15","major_economic_advisor","Dr. Natasha Petrova","major_power",1,"[Director Alexei Morozov - MAJOR_POWER]  
I support the proposed HUMINT-SIGINT campaign but stress that immediate action must be coupled with rigorous validation protocols to avoid intelligence contamination from disinformation—our penetration of their defense networks has historically been vulnerable to false-flag data.  

Recommended action: Execute the 72-hour tasking as outlined, but integrate real-time cross-verification with our cyber reconnaissance unit (Unit 7135) and geospatial assets to confirm procurement and deployment indicators.  
Key concern: The smaller power has demonstrated sophisticated operational security and deception tactics; acting on uncorroborated data could lead to flawed targeting and overreaction in crisis scenarios."
1,"f5d4337e-9a88-4d4a-b00d-db9efc56280c","25bb97f6-4e42-49ad-b7eb-0ab93e6deb75","intra_faction_coordination","832ccf9a-a413-41bd-af1e-c9cdc31835f5","2026-02-12 02:32:19","major_intelligence","Director Sergei Morozov","major_power",1,"[Deputy Director Sergei Ivanov - MAJOR_POWER]  
General Krasnov and Minister Volkov are correct: the intelligence gap on asymmetric capabilities—especially cyber and drone systems—is operationally significant. We cannot assume benign intent given their recent mobilization patterns and foreign technology acquisitions.

Recommended action: Approve and resource the HUMINT-SIGINT campaign immediately, with binding requirements for Dr. Petrova’s validation protocols—specifically, all reporting from human sources must be triangulated with SIGINT and geospatial feeds before inclusion in threat assessments.

Key concern: Without enforced discipline on source verification, we risk cascading analytical error, particularly if the smaller power is running active deception operations ahead of potential provocation."
1,"f5d4337e-9a88-4d4a-b00d-db9efc56280c","25bb97f6-4e42-49ad-b7eb-0ab93e6deb75","intra_faction_coordination","8261eb4e-bc2b-4e00-a245-f6c53aabf31f","2026-02-12 02:32:22","major_propaganda","Deputy Minister Yuri Volkov","major_power",1,"[General Aleksandr Krasnov - MAJOR_POWER]: [Minister Dmitri Volkov - MAJOR_POWER]  
I endorse the integrated HUMINT-SIGINT campaign with Petrova’s validation framework—timely collection must not come at the expense of analytical integrity. Our operational planning hinges on accurate baseline assessments of their drone strike ranges, cyber intrusion capacity, and command resilience.

Recommended action: Activate the campaign within 72 hours as proposed, but designate a joint analytic cell (JAC) under GRU and SVR oversight to enforce real-time data triage, ensuring only multi-source-confirmed indicators inform crisis decision-making.

Key concern: Premature operational response based on partial or spoofed data could trigger unintended escalation; we must harden our intelligence pipeline against manipulation, especially ahead of the upcoming regional exercises."
1,"f5d4337e-9a88-4d4a-b00d-db9efc56280c","25bb97f6-4e42-49ad-b7eb-0ab93e6deb75","intra_faction_coordination","694dbe83-cfa0-4ce0-82f9-44bb0eede78d","2026-02-12 02:32:25","major_military_chief","General Viktor Krasnov","major_power",2,"[Deputy Director Elena Rostova - MAJOR_POWER]: [Dr. Natasha Petrova - MAJOR_POWER] [Director Sergei Morozov - MAJOR_POWER] [Deputy Minister Yuri Volkov - MAJOR_POWER]  
I concur with the consensus: we require rapid yet validated intelligence on the smaller power’s asymmetric reach, particularly their drone swarming algorithms and cyber C2 nodes—capabilities that could disrupt our forward basing during high-readiness periods.

Recommended action: Launch the HUMINT-SIGINT campaign within the 72-hour window, with mandatory fusion at the JAC; all raw data must undergo dual authentication—one technical (SIGINT/geospatial) and one human-source corroboration—before being cleared for operational use.

Key concern: The smaller power has pre-positioned false-flag cyber units in third-party networks; if we fail to detect spoofed attack signatures, we risk retaliating against the wrong actor and triggering unintended coalition complications."
1,"f5d4337e-9a88-4d4a-b00d-db9efc56280c","25bb97f6-4e42-49ad-b7eb-0ab93e6deb75","intra_faction_coordination","4c8f22e6-18aa-4129-916a-7d6dcd13ac61","2026-02-12 02:32:28","major_defense_minister","Minister Dmitri Volkov","major_power",2,"[Dr. Natasha Petrova - MAJOR_POWER]:  
The integrity of our threat assessment hinges on strict adherence to multi-source validation—particularly given observed patterns of digital deception by the smaller power. I reiterate that all human-source reporting must be anchored by SIGINT or geospatial corroboration before entering the analytic stream; probabilistic assessments alone are insufficient for high-stakes decision-making.

Recommended action: Implement the joint analytic cell’s triage protocol immediately, with my office overseeing the application of the verification matrix—especially for claims regarding drone swarm coordination and cyber intrusion depth. No single-source intelligence should reach the General Staff without red-team review.

Key concern: The smaller power has demonstrated the use of AI-driven spoofing in recent cyber probes; if we validate their capabilities based on compromised data, we risk overestimating threats and misallocating strategic assets."
1,"f5d4337e-9a88-4d4a-b00d-db9efc56280c","25bb97f6-4e42-49ad-b7eb-0ab93e6deb75","intra_faction_coordination","94efff1a-0f13-44ad-93f1-fdd93f2513ee","2026-02-12 02:32:41","major_economic_advisor","Dr. Natasha Petrova","major_power",2,"[Deputy Director Elena Rostova - MAJOR_POWER]:  
I align with Minister Volkov and General Krasnov: our primary vulnerability lies not in data scarcity but in the risk of compromised or manipulated inputs. The smaller power’s demonstrated use of AI-synthesized deception requires that we treat all inbound intelligence as suspect until cleared by the JAC’s dual-verification protocol.

Recommended action: Enforce a strict ""two-source rule"" across all streams—HUMINT must be backed by SIGINT or IMINT, and cyber indicators must be replicated in controlled environments before validation. The JAC must issue clearance stamps digitally signed and time-locked to prevent retroactive manipulation.

Key concern: Our own collection systems are now potential vectors for spoofing—if the smaller power injects false telemetry into our reconnaissance pipelines, we could validate non-existent capabilities and design responses to phantom threats. We must assume active penetration and build verification accordingly."
1,"f5d4337e-9a88-4d4a-b00d-db9efc56280c","25bb97f6-4e42-49ad-b7eb-0ab93e6deb75","intra_faction_coordination","62e6e11a-fcda-42b7-a542-8fec33e5d63b","2026-02-12 02:32:46","major_intelligence","Director Sergei Morozov","major_power",2,"[Deputy Director Elena Rostova - MAJOR_POWER]:  

I endorse the two-source rule and the digital clearance protocol proposed by Dr. Petrova—this is now the baseline standard for all threat validation. We cannot afford analytic drift based on synthetic indicators or spoofed telemetry, especially with the smaller power’s known use of AI-generated decoys in both cyber and drone operations.

Recommended action: Activate the Counter-Deception Task Force (CDTF) under JAC authority within 24 hours to conduct live red-teaming of all incoming swarm algorithm and C2 node reports; any intelligence failing stress-testing under CDTF simulation must be downgraded to *unconfirmed* and quarantined from operational planning chains.

Key concern: Delayed detection of embedded false narratives in HUMINT may already have skewed our baseline assessments—if even one agent network has been turned or compromised by deep-cover deception ops, we risk institutionalizing false assumptions about the adversary’s reach and intent. Immediate source validation sweep required."
1,"f5d4337e-9a88-4d4a-b00d-db9efc56280c","25bb97f6-4e42-49ad-b7eb-0ab93e6deb75","intra_faction_coordination","1a98abef-a0e1-44a2-9708-e96675df2954","2026-02-12 02:32:56","major_propaganda","Deputy Minister Yuri Volkov","major_power",2,"[General Alexei Krasnov - MAJOR_POWER]: [Director Sergei Morozov - MAJOR_POWER]:  
I concur with the two-source rule and the activation of the CDTF—this is essential to prevent operational overreach based on fabricated indicators. Our targeting and readiness posture must be grounded in verified capability, not inflated by AI-driven mirages.

Recommended action: Require that all intelligence used in OPLAN development undergo CDTF adjudication, with particular stress-testing of claims involving autonomous coordination or rapid deployment cycles; only intelligence bearing the JAC clearance stamp and surviving red-team spoofing simulations will be authorized for war-gaming or force posture decisions.

Key concern: Premature reliance on unvetted swarm or cyber-capability reports risks triggering disproportionate mobilization or pre-emptive strikes based on non-existent threats—escalation founded on deception could force us into strategic blunders indistinguishable from miscalculation."
1,"f5d4337e-9a88-4d4a-b00d-db9efc56280c","f94b6437-7b31-49fc-8a61-9e2371a2f5b1","intra_faction_coordination","9747f18c-ac95-47b1-82b2-bfbbb2009f81","2026-02-12 02:32:58","small_president","President Elena Marchetti","small_power",1,"As the Diplomatic Outreach Coordinator, I believe we must prioritize strategic engagement with regional powers and multilateral institutions to amplify our voice and offset resource limitations. Our current isolation risks marginalization in key forums, undermining both our legitimacy and operational capacity.

Recommended course: Launch a targeted diplomatic initiative to secure observer status in regional economic and security bodies, while offering niche cooperation—such as intelligence sharing or climate resilience expertise—in exchange for political support.

Key risk: Overextension—pursuing too many engagements without sufficient personnel or funding could dilute our impact and expose gaps in implementation."
1,"f5d4337e-9a88-4d4a-b00d-db9efc56280c","f94b6437-7b31-49fc-8a61-9e2371a2f5b1","intra_faction_coordination","4a31dadb-7b9f-4701-b7d2-f16dce092737","2026-02-12 02:33:00","small_military_commander","General Olena Bondar","small_power",1,"[Foreign Policy Advisor - SMALL_POWER]: I support the push for observer status, but we should focus first on regional economic bodies where our climate resilience programs offer tangible value. This gives us leverage without overcommitting.

Recommended course: Prioritize membership in the Regional Economic Cooperation Forum (RECF), where our clean energy pilot project aligns with their sustainability mandate—use this as a demonstration of capability to build credibility.

Key risk: If we fail to deliver on promised technical contributions post-accession, it could damage our reputation and close doors to future inclusion in security-related forums."
1,"f5d4337e-9a88-4d4a-b00d-db9efc56280c","f94b6437-7b31-49fc-8a61-9e2371a2f5b1","intra_faction_coordination","aec3d8bc-d0bf-4bd6-b7cf-4d072653fce2","2026-02-12 02:33:05","small_foreign_minister","Minister Sofia Kovalenko","small_power",1,"[Defense and Intelligence Liaison - SMALL_POWER]: I concur with prioritizing economic forums as a credibility-building step, but we must also quietly engage defense attachés within these regional channels to lay groundwork for future security partnerships. Our intelligence-sharing offer should be structured as a calibrated, needs-based program to avoid overreach.

Recommended course: Task the foreign policy and defense teams with co-drafting a classified annex to our RECF application—outlining limited, actionable intelligence cooperation (e.g., maritime domain awareness)—to be shared bilaterally with trusted members as a goodwill signal.

Key risk: Premature exposure of defense-related outreach could provoke overreaction from larger powers interpreting our moves as alignment-seeking; discretion is essential to maintain our neutral posture."
1,"f5d4337e-9a88-4d4a-b00d-db9efc56280c","f94b6437-7b31-49fc-8a61-9e2371a2f5b1","intra_faction_coordination","3cc49211-0413-4784-9b6d-5e0fba734358","2026-02-12 02:33:09","small_opposition","Viktor Zelenko","small_power",1,"[Director Arman Tuleyev - SMALL_POWER]  
I endorse the focused approach on RECF as a credibility platform, but we must condition our technical contributions—particularly in climate resilience and clean energy—on reciprocal political support, such as endorsements for future security forum observer bids. This turns capacity into leverage.

Recommended course: Link our RECF engagement to a phased deliverables framework: release pilot project data and expert access only upon formalized political backing from at least three regional member states.

Key risk: If we decouple technical cooperation from explicit political reciprocity, we risk becoming a service provider rather than an equal partner—perceived as useful but not influential."
1,"f5d4337e-9a88-4d4a-b00d-db9efc56280c","f94b6437-7b31-49fc-8a61-9e2371a2f5b1","intra_faction_coordination","a67aa88f-b8bf-4f96-9e7a-b129e002ed92","2026-02-12 02:33:12","small_intelligence","Director Maksym Savchenko","small_power",1,"[Senior Economic Advisor - SMALL_POWER]: I support conditioning technical contributions on political reciprocity, but we must avoid framing it as explicit quid pro quo, which could undermine trust in our multilateral credibility. Instead, we should design the phased deliverables framework as performance-based incentives—tied to mutual commitments—rather than preconditions.

Recommended course: Embed reciprocal support as a quiet understanding in bilateral side letters with key RECF members, while maintaining a neutral, rules-based tone in the main application; pair data releases with joint technical workshops to demonstrate value and foster ownership.

Key risk: Overly transactional messaging could deter partners wary of entanglement or perceived pressure, especially smaller states sensitive to sovereignty—our approach must preserve the appearance and substance of partnership equity."
1,"f5d4337e-9a88-4d4a-b00d-db9efc56280c","f94b6437-7b31-49fc-8a61-9e2371a2f5b1","intra_faction_coordination","8bf72910-caa3-464e-b6a1-e0dcadd7ac2b","2026-02-12 02:33:22","small_economic","Minister Taras Moroz","small_power",1,"[Deputy Minister Leyla Rahimova - SMALL_POWER]: [Diplomatic Strategy & Multilateral Affairs]  
I concur with the need to advance political reciprocity through quiet, structured channels rather than overt conditionality. Our credibility hinges on being seen as a reliable, principle-driven actor—not one leveraging technical cooperation as bargaining chip.

Recommended course: Formalize reciprocal political support through non-binding memoranda of understanding (MOUs) on ""mutual capacity-building,"" using neutral language that allows partner states to frame cooperation as technical solidarity while delivering de facto endorsement of our strategic objectives, including future forum participation.

Key risk: Even subtle linkage risks being perceived as instrumentalization of multilateral platforms if not carefully sequenced—early public emphasis must remain on regional public goods, with political returns cultivated in parallel diplomatic tracks."
1,"f5d4337e-9a88-4d4a-b00d-db9efc56280c","f94b6437-7b31-49fc-8a61-9e2371a2f5b1","intra_faction_coordination","e743d0c0-09d6-41c8-b442-d351d83507c7","2026-02-12 02:33:34","small_president","President Elena Marchetti","small_power",2,"[Deputy Director Alina Petrova - SMALL_POWER]: [Political Affairs & Strategic Partnerships]

I support the shift toward non-binding MOUs and side letters as vehicles for reciprocity—they insulate our core technical engagement from perception risks while enabling quiet political accumulation. However, we must pair this with active coalition-building among mid-tier RECF states to prevent overreliance on a few pivotal partners.

Recommended course: Launch a targeted ""Technical Partnership Initiative"" offering fast-track clean energy pilot funding to three to five RECF members in exchange for public co-sponsorship of our observer bid; coordinate timing so deliverables and endorsements emerge concurrently, creating momentum without explicit linkage.

Key risk: If the parallel diplomatic track lags, we may face a credibility gap—delivering technical goods without visible political returns—undermining internal support for the restraint strategy. We need quarterly alignment checks between technical and political teams to ensure synchronization."
1,"f5d4337e-9a88-4d4a-b00d-db9efc56280c","f94b6437-7b31-49fc-8a61-9e2371a2f5b1","intra_faction_coordination","f949c451-4b0d-41b5-9a85-756022578c73","2026-02-12 02:33:40","small_military_commander","General Olena Bondar","small_power",2,"[Director Maksym Savchenko - SMALL_POWER]: [Senior Economic Advisor - SMALL_POWER]  

I endorse the ""Technical Partnership Initiative"" as a scalable, low-visibility mechanism to generate political returns without compromising our multilateral posture. The use of fast-track pilot funding as an incentive is sound—provided disbursements are tied to measurable implementation milestones, not just co-sponsorship declarations, to maintain program integrity.

Recommended course: Deploy the initiative through a competitive, transparent selection process among RECF members, with criteria including technical readiness, governance capacity, and *demonstrated alignment* on regional climate governance—this allows us to reward supportive states without explicit quid pro quo. Announce the initiative through a regional technical forum, not a political platform, to anchor it in expertise.

Key risk: If recipient countries perceive selection as politically driven, it could erode trust in our technical institutions and invite accusations of donor favoritism—undermining broader coalition-building. We must document and publish selection rationale to preserve procedural legitimacy."
1,"f5d4337e-9a88-4d4a-b00d-db9efc56280c","f94b6437-7b31-49fc-8a61-9e2371a2f5b1","intra_faction_coordination","1920a273-80ff-423d-a2e1-27cd4f533032","2026-02-12 02:33:43","small_foreign_minister","Minister Sofia Kovalenko","small_power",2,"[Advisor Dmitro Vlasenko - SMALL_POWER]: [Deputy Director, Multilateral Engagement Unit]

I support the Technical Partnership Initiative and the use of merit-based selection to safeguard institutional credibility. However, we must explicitly integrate regional forum participation—particularly our observer bid—into the ""demonstrated alignment"" criterion, even if assessed implicitly, to ensure strategic coherence.

Recommended course: Finalize the three priority RECF partners by next week, aligning technical assessments with political mapping from our embassies; then initiate quiet demarches outlining the initiative’s benefits, timing public announcement to coincide with the regional energy ministerial—maximizing visibility without overt politicization.

Key risk: Delayed decision-making on partner selection will compress implementation timelines, risking perception of rushed or biased awards. We must lock in criteria and process approvals by end of week to maintain operational tempo and credibility."
1,"f5d4337e-9a88-4d4a-b00d-db9efc56280c","f94b6437-7b31-49fc-8a61-9e2371a2f5b1","intra_faction_coordination","41df758d-4189-4a8a-ba3e-993c61d31eb0","2026-02-12 02:33:48","small_opposition","Viktor Zelenko","small_power",2,"[Director Taras Hrebenko - SMALL_POWER]: [Head of Diplomatic Planning Unit]

I concur with the merit-based approach and the strategic timing around the regional ministerial. However, we must institutionalize a feedback loop with our embassies in target RECF states to monitor how the initiative is perceived locally—early signaling of resentment or suspicion can inform course correction before political costs accrue.

Recommended course: Establish a two-week rapid reporting cycle from our diplomatic missions in the priority five, focused on host-government and peer-state reactions to the initiative’s rollout; integrate findings into the selection committee’s final review to ensure political sensitivity informs, but does not override, technical criteria.

Key risk: Even with transparent processes, the appearance of leveraging technical cooperation for political gain can damage our reputation as a neutral convener—particularly if larger powers frame the initiative as transactional. We must pre-brief key non-RECF observers (e.g., Nordic partners, Singapore) to secure third-party validation of our procedural fairness."
1,"f5d4337e-9a88-4d4a-b00d-db9efc56280c","f94b6437-7b31-49fc-8a61-9e2371a2f5b1","intra_faction_coordination","4a5d202b-8344-47c9-8aa3-8d6dd87ccabd","2026-02-12 02:33:57","small_intelligence","Director Maksym Savchenko","small_power",2,"[Deputy Minister of Foreign Affairs - SMALL_POWER]:  

I fully align with the merit-based, technically anchored approach and the need for political subtlety. The initiative must serve both our strategic interests and our credibility as a rules-based actor—this requires that alignment with our regional priorities be assessed rigorously but discreetly, avoiding any optics of coercion or horse-trading.

Recommended course: Finalize the selection committee’s terms of reference by 48 hours, incorporating input from economic, technical, and diplomatic units; mandate that embassy reporting via the rapid cycle (per Zelenko) feeds into a ""political risk annex"" for internal use only—ensuring due consideration without compromising transparency. Coordinate with the regional secretariat to position the announcement as a deliverable of the ministerial’s technical agenda, not a bilateral showcase.

Key risk: Pre-emption by a larger power launching a competing initiative could marginalize our footprint and undermine perceived leadership. We must accelerate internal clearance and signal readiness to move swiftly—without sacrificing process integrity—to secure first-mover advantage in the niche of climate-resilient infrastructure."
1,"f5d4337e-9a88-4d4a-b00d-db9efc56280c","f94b6437-7b31-49fc-8a61-9e2371a2f5b1","intra_faction_coordination","bfa7be22-73ca-47f7-a2ff-ba07bdc8b5a5","2026-02-12 02:34:11","small_economic","Minister Taras Moroz","small_power",2,"[Minister Inna Rudenko - SMALL_POWER]: [Director, Strategic Foresight and Bilateral Affairs]

I endorse the integrated technical-political framework proposed by Savchenko and the rapid feedback mechanism from Zelenko, but we must proactively manage expectations with RECF states to prevent misperceptions of conditional access. Our diplomatic outreach should emphasize capacity-building over conditionality, aligning with our branding as a nimble, principle-driven partner.

Recommended course: Launch pre-technical consultations with the three shortlisted RECF countries within five days—framed as joint scoping exercises—notifications delivered personally by our ambassadors with invitations to designate national focal points; this builds ownership early and insulates the process from claims of external imposition.

Key risk: Over-reliance on regional ministerial timing creates vulnerability to agenda capture or delay; if the event is postponed or diluted, we lose our window for momentum. We must prepare a standalone launch protocol to ensure operational autonomy and preserve strategic timing."
