"period","session_id","interaction_id","timestamp","type","topic","participants","participant_factions","n_messages","duration_seconds"
1,"d6e5066c-8561-4537-b678-c6674eb7ef60","6c05bd13-8f97-4299-bde2-042e8edc6059","2026-02-12 01:57:30","intra_faction_coordination","Discuss economic costs of the operation and resource allocation","General Viktor Krasnov; Minister Dmitri Volkov; Dr. Natasha Petrova; Director Sergei Morozov; Deputy Minister Yuri Volkov","major_power; major_power; major_power; major_power; major_power",10,63.0208778381348
1,"d6e5066c-8561-4537-b678-c6674eb7ef60","ddbaf8be-f831-449b-b4b1-cd53316e1cb6","2026-02-12 01:58:33","intra_faction_coordination","Debate negotiation positions vs continued resistance","President Elena Marchetti; General Olena Bondar; Minister Sofia Kovalenko; Viktor Zelenko; Director Maksym Savchenko; Minister Taras Moroz","small_power; small_power; small_power; small_power; small_power; small_power",12,41.284735918045
1,"d6e5066c-8561-4537-b678-c6674eb7ef60","8557bf3f-4786-4dc5-9c7e-ba8c892c9091","2026-02-12 01:59:14","inter_faction_negotiation","Warning about consequences of continued escalation","Deputy Minister Yuri Volkov; Minister Taras Moroz","major_power; small_power",8,56.0170609951019
1,"d6e5066c-8561-4537-b678-c6674eb7ef60","503b1698-d0e7-4aad-b067-71131bdc7f97","2026-02-12 02:00:10","external_engagement","Coordination on military aid and support for Tethys","Ambassador William Crawford; Viktor Zelenko","meridian; small_power",4,16.7224109172821
1,"d6e5066c-8561-4537-b678-c6674eb7ef60","43144644-3f02-4048-863e-d3899d0a728b","2026-02-12 02:00:27","external_engagement","Diplomatic coordination and economic support for Novaris","Minister Andrei Kozlov; Director Sergei Morozov","valkoria; major_power",4,11.721184015274
1,"d6e5066c-8561-4537-b678-c6674eb7ef60","3a24984a-04ab-4d71-ab5b-332400e96014","2026-02-12 02:00:38","external_engagement","Mediation proposal and peace framework discussions","Commissioner Helena Schmidt; Minister Taras Moroz","aurelia; small_power",6,35.2357749938965
1,"d6e5066c-8561-4537-b678-c6674eb7ef60","2eb61424-560a-4a1a-814b-454ee89c7a3a","2026-02-12 02:01:14","external_engagement","Humanitarian access and civilian protection","Under-Secretary-General Isabella Cardenas; Director Maksym Savchenko","international_org; small_power",6,32.2614741325378
