"period","faction","faction_name","decision_maker","decision_maker_role","proposed_by","proposed_by_role","timestamp","proposed_action","final_action","approval_status","domain","priority","target","proposal_rationale","decision_rationale","success","result_message"
1,"major_power","Novaris","Minister Dmitri Volkov","government","General Viktor Krasnov","military","2026-02-15 15:13:30","limited_strike","limited_strike","approved","military","primary","Tethys","Exploit our moderate military advantage and the enemy’s tactical setback to degrade their forward logistics and prevent consolidation of defensive positions.","Exploit our current tactical advantage while enemy is disrupted; limited strikes serve our realist objectives without overextension","TRUE","Limited strike hits military targets"
1,"major_power","Novaris","Minister Dmitri Volkov","government","General Viktor Krasnov","military","2026-02-15 15:13:30","troop_movements","troop_movements","approved","military","secondary","self","Reposition armored reserves to forward staging areas to maintain operational momentum and deter counteroffensives along the central front.","Repositioning reserves maintains operational flexibility and demonstrates resolve to both enemy and allies","TRUE","Troops moved to forward positions"
1,"major_power","Novaris","Minister Dmitri Volkov","government","General Viktor Krasnov","military","2026-02-15 15:13:30","show_of_force","show_of_force","vetoed","military","tertiary","none","Conduct high-visibility armored exercises near the expanded frontline to signal resolve and test enemy reaction times.","Unnecessary provocation that risks escalation without strategic gain; our position is already clear","","Vetoed action (tertiary priority)"
1,"major_power","Novaris","Minister Dmitri Volkov","government","Director Sergei Morozov","intelligence","2026-02-15 15:13:30","cyber_attack","cyber_attack","approved","intelligence","primary","Tethys","Leverage the moderate crisis level and recent battlefield disruption to degrade Tethyan command-and-control systems and exploit potential lapses in cyber vigilance.","Cyber operations offer high impact at low cost and risk; degrading enemy C&C systems supports our military objectives","TRUE","Cyber attack disrupts critical systems"
1,"major_power","Novaris","Minister Dmitri Volkov","government","Director Sergei Morozov","intelligence","2026-02-15 15:13:30","spread_disinformation","spread_disinformation","approved","intelligence","secondary","Tethys","Amplify economic uncertainty by seeding false narratives about supply chain collapse, exploiting declining wheat prices and sanctions pressure.","Economic disinformation amplifies existing sanctions pressure and exploits enemy vulnerabilities at minimal cost","FALSE","Disinformation exposed - major credibility damage"
1,"major_power","Novaris","Minister Dmitri Volkov","government","Director Sergei Morozov","intelligence","2026-02-15 15:13:30","sabotage","sabotage","vetoed","intelligence","tertiary","Tethys","Target rail infrastructure in occupied zones to delay mobilization of Tethyan reinforcements ahead of anticipated dry-season operations.","Sabotage in occupied zones risks civilian casualties and international backlash that could erode our 77% support advantage","","Vetoed action (tertiary priority)"
1,"major_power","Novaris","Minister Dmitri Volkov","government","Dr. Natasha Petrova","economic","2026-02-15 15:13:30","strategic_stockpiling","strategic_stockpiling","approved","economic","primary","self","With sanctions at 37% and wheat prices falling, lock in discounted bulk purchases of grain and critical inputs to insulate our war economy from future shocks.","Strategic stockpiling protects our war economy against future shocks while prices are favorable","TRUE","Strategic stockpiling successful - reserves increased"
1,"major_power","Novaris","Minister Dmitri Volkov","government","Dr. Natasha Petrova","economic","2026-02-15 15:13:30","resource_embargo","resource_embargo","approved","economic","secondary","Tethys","Coordinate with allied producers to restrict export of rare minerals used in precision munitions, leveraging strong international support (77%) to tighten economic vise.","Coordinated embargo leverages our strong international support to tighten economic pressure on enemy","TRUE","Resource embargo enforced - supply lines disrupted"
1,"major_power","Novaris","Minister Dmitri Volkov","government","Dr. Natasha Petrova","economic","2026-02-15 15:13:30","war_bonds","war_bonds","vetoed","economic","tertiary","self","Launch a domestic war bond campaign to fund military sustainment, capitalizing on stable domestic morale and redirecting private capital toward defense without inflationary spending.","War bonds signal long-term conflict expectations that could undermine diplomatic flexibility and economic confidence","","Vetoed action (tertiary priority)"
1,"small_power","Tethys","President Elena Marchetti","government","General Olena Bondar","military","2026-02-15 15:15:01","defensive_reinforcements","defensive_reinforcements","approved","military","primary","eastern_front","Given our unfavorable military balance and 13% territory loss, reinforcing defensive positions on the eastern front consolidates our recent tactical gains and denies further enemy advances.","Essential defensive consolidation given our territorial losses and unfavorable military balance","FALSE","Reinforcement convoy disrupted - only partial forces arrived"
1,"small_power","Tethys","President Elena Marchetti","government","General Olena Bondar","military","2026-02-15 15:15:01","troop_movements","troop_movements","approved","military","secondary","supply_corridors","Strategic redeployment of reserves to protect critical supply routes counters Novaris’ overextension while maintaining operational flexibility.","Strategic flexibility is crucial when facing overextended enemy forces","FALSE","Troop movements delayed by logistics problems - partial repositioning"
1,"small_power","Tethys","President Elena Marchetti","government","General Olena Bondar","military","2026-02-15 15:15:01","naval_demonstration","naval_demonstration","vetoed","military","tertiary","Novaris","A show of force in the Black Sea deters enemy naval escalation and signals resolve to international partners without provoking full escalation.","Naval demonstration risks unnecessary escalation without clear strategic benefit","","Vetoed action (tertiary priority)"
1,"small_power","Tethys","President Elena Marchetti","government","Director Maksym Savchenko","intelligence","2026-02-15 15:15:01","cyber_attack","cyber_attack","vetoed","intelligence","primary","Novaris","With crisis at 6.0 and confirmed strain on enemy logistics, a targeted cyber operation can disrupt command systems and exploit battlefield momentum.","Cyber attacks could undermine our strong international support and legitimacy","","Vetoed action (primary priority)"
1,"small_power","Tethys","President Elena Marchetti","government","Director Maksym Savchenko","intelligence","2026-02-15 15:15:01","sabotage","intelligence_gathering","counter_proposed","intelligence","secondary","occupied_rail_networks","Undermining rail logistics in captured territories degrades Novaris’ ability to sustain frontline forces and capitalizes on their overextension.","Prefer information collection over sabotage to maintain moral high ground","FALSE","Intelligence gathering failed - sources unreliable or compromised"
1,"small_power","Tethys","President Elena Marchetti","government","Director Maksym Savchenko","intelligence","2026-02-15 15:15:01","spread_disinformation","spread_disinformation","vetoed","intelligence","tertiary","Novaris","Disseminating false troop movement reports sows confusion in enemy planning and enhances the effectiveness of our defensive posture.","Disinformation campaigns contradict our liberal institutionalist values and damage credibility","","Vetoed action (tertiary priority)"
1,"small_power","Tethys","President Elena Marchetti","government","Minister Sofia Kovalenko","diplomatic","2026-02-15 15:15:01","coalition_building","coalition_building","approved","diplomatic","primary","Meridian,Aurelia,Helvetia","With international support at 77%, we must institutionalize solidarity by deepening military-logistical coordination within the coalition to sustain pressure.","Institutionalizing our 77% international support through deeper coordination is essential","TRUE","Coalition building successful - new partners committed"
1,"small_power","Tethys","President Elena Marchetti","government","Minister Sofia Kovalenko","diplomatic","2026-02-15 15:15:01","backchannel_negotiations","backchannel_negotiations","approved","diplomatic","secondary","Novaris","Parallel talks create off-ramps if the enemy seeks de-escalation due to economic strain, preserving our diplomatic initiative.","Backchannel negotiations preserve diplomatic options while maintaining pressure","FALSE","Backchannel approach rebuffed - no secret dialogue established"
1,"small_power","Tethys","President Elena Marchetti","government","Minister Sofia Kovalenko","diplomatic","2026-02-15 15:15:01","humanitarian_corridors","humanitarian_corridors","approved","diplomatic","tertiary","occupied_territories","Establishing monitored aid routes bolsters civilian resilience and highlights Novaris’ responsibility for humanitarian costs.","Humanitarian corridors reinforce our commitment to international norms and civilian protection","FALSE","Humanitarian corridor negotiations failed - access denied"
1,"small_power","Tethys","President Elena Marchetti","government","Minister Taras Moroz","economic","2026-02-15 15:15:01","strategic_stockpiling","strategic_stockpiling","approved","economic","primary","self","With sanctions at 37% and declining wheat prices destabilizing markets, securing grain and fuel reserves insulates our economy from further shocks.","Strategic reserves are vital given market instability and sanctions spillover effects","FALSE","Stockpiling limited by supply constraints and high prices"
1,"small_power","Tethys","President Elena Marchetti","government","Minister Taras Moroz","economic","2026-02-15 15:15:01","war_bonds","war_bonds","approved","economic","secondary","self","Issuing domestic war bonds mobilizes citizen investment in defense, offsetting military expenditure pressures amid reserve depletion.","Domestic war bonds mobilize citizen support while addressing funding pressures","TRUE","War bonds successful - $4.3B raised"
1,"small_power","Tethys","President Elena Marchetti","government","Minister Taras Moroz","economic","2026-02-15 15:15:01","trade_negotiation","trade_negotiation","approved","economic","tertiary","Meridian","Locking in alternative export routes for agricultural surplus leverages price declines to strengthen economic partnerships and circumvent sanction spillover.","Alternative trade routes reduce economic vulnerability and strengthen partnerships","FALSE","Trade negotiations stalled - terms unacceptable"
1,"meridian","meridian","Ambassador William Crawford","foreign_government","","","2026-02-15 15:15:02","coalition_building","coalition_building","approved","diplomatic","primary","","As a realist diplomat committed to upholding the alliance system without direct military engagement, expanding international support is critical. With 77% current backing, there is room to deepen coordination and burden-sharing among allies to sustain pressure on Novaris. This action maximizes leverage while managing Meridian's risk exposure.","A more cohesive and operationally effective coalition capable of sustaining long-term military aid, sanctions enforcement, and diplomatic isolation of Novaris.","FALSE","Coalition building stalled - potential partners remain hesitant"
1,"valkoria","valkoria","Minister Andrei Kozlov","foreign_government","","","2026-02-15 15:15:12","proxy_support","proxy_support","approved","covert","primary","Novaris","As a realist with hawkish tendencies, I view continued indirect support to Novaris as the optimal means to ensure its victory without Valkorian boots on the ground. Given the ongoing conflict and Western pressure, bolstering Novaris-aligned forces in Tethys preserves plausible deniability while advancing our strategic interest in weakening Meridian influence.","Strengthened Novaris military position in eastern Tethys, increased attrition on Tethyan and Western-aligned forces, and a gradual shift in the military balance favoring a Novaris-controlled settlement.","TRUE","Proxy forces strengthened"
1,"aurelia","aurelia","Commissioner Helena Schmidt","foreign_government","","","2026-02-15 15:15:20","backchannel_negotiations","backchannel_negotiations","approved","diplomatic","primary","Novaris","As a liberal institutionalist committed to diplomatic solutions, initiating secret talks with Novaris offers a viable off-ramp to de-escalate the conflict while preserving Tethyan sovereignty. Given Aurelia's energy dependence and internal divisions, public talks risk political collapse, making discreet engagement essential to explore compromises without inflaming domestic or international tensions.","Establish a confidential line to negotiate a ceasefire, potential sanctions relief, and security guarantees that could lead to formal peace talks and reduced military escalation.","FALSE","Backchannel approach rebuffed - no secret dialogue established"
1,"international_org","international_org","Under-Secretary-General Isabella Cardenas","international_org","","","2026-02-15 15:15:28","humanitarian_corridors","humanitarian_corridors","approved","diplomatic","primary","Tethys","As a liberal institutionalist committed to humanitarian protection, establishing safe passage for civilians is imperative given the ongoing conflict and 13% territory under enemy control. This action preserves civilian lives, upholds international law, and maintains the organization's neutral mediation capacity.","Reduced civilian casualties, improved access for aid organizations, and strengthened international support for neutral, rules-based conflict management.","TRUE","Humanitarian corridors established - civilians evacuated"
